,question,answer,ground_truth,contexts,answer_relevancy,faithfulness,context_relevancy,answer_similarity,answer_correctness
0,"No episódio 'imundo', o que a Luciana descobriu sobre seu marido durante a lua de mel?","A Luciana descobriu que seu marido era muito desorganizado e bagunçado, jogando a roupa suja em cima da cama e esperando que ela mesma a pegasse e levasse para o banheiro, e também que ele era muito dependente dela, esticando o braço para que ela lhe passasse a mochila.",Um lado preguiçoso e desleal do marido.,"['Era um lado do marido que a Luciana não conhecia. Por exemplo, eles voltavam da praia com aquela roupa suja, cheia de areia e aí ele tirava a roupa, assim… Se ele está na frente da cama, ele tirava a roupa e jogava em cima da cama… E aí ela que tinha que pegar a roupa dele e levar no banheiro, que ela estava botando tipo em sacolinha a roupa que já está suja, que você vai lavar só quando você voltar, né? — E, gente, isso na lua de mel. —'
 'E aí ele só pegava na mochila quando ele ia beber água ou comer alguma coisa e já esticava o braço e dava a mochila pra ela. Aí uma hora ela meio que fingia que, pô, não tá vendo que ele está esticando ali pra pegar a mochila, ele botava a mochila no pé dela… [suspiro] Ai, nem dez minutos de história e eu já odeio esse cara. — Era um lado do marido que a Luciana não conhecia. Por exemplo, eles voltavam da praia com aquela roupa suja, cheia de areia e aí ele tirava a roupa, assim… Se ele está na frente da cama, ele tirava a roupa e jogava em cima da cama… E aí ela que tinha que pegar a roupa dele e levar no banheiro, que ela estava botando tipo em sacolinha a roupa que já está suja, que você vai lavar só quando você voltar, né? — E, gente, isso na lua de mel. —'
 'Pê, eles estavam em férias, lua de mel… Luciana falou: “ah, quando a gente voltar para casa, o ritmo é outro”. E aí a lua de mel foi nesse naipe assim, né? Desse jeito… Com ela tendo que fazer tudo, enfim… E aí quando eles voltaram, que eles chegaram, pô, muita roupa pra lavar, né? E coisas que, assim, o vestido dela estava lá, que ela ainda tinha que devolver, que foi um vestido de primeiro aluguel… Então ela tinha que ver se não estava sujo, enfim… Ela voltou com muita coisa para fazer. Tinha que… — Como é que é? —'
 'E o cara também queria casar, ele queria a festa, ele queria a Luciana de noiva e tudo isso custa dinheiro, né? — Então eles acabaram casando com dívidas…  Mas também a Luciana falou que não era nenhuma dívida assim, como é que vou dizer, que não dava para pagar… Estava dentro do orçamento deles. Então, — assim, não é que “ah, casou e ficou cheia de dívida e o casamento virou uma merda”, não. Só que aí eles casaram e eles iam para a lua de mel no dia seguinte. Então passaram ali a noite… — No clássico, né? —']",0.36983462618799595,1.0,0.2727272727272727,0.6277424185575107,0.15693560463937767
1,"No episódio 'imundo', por que a Luciana decidiu pedir o divórcio?","A Luciana decidiu pedir o divórcio porque o marido era muito negligente e fazia muitas coisas ruins, e ela não aguentava mais.",Porque ele não ajudava em nada em casa e a tratava mal.,"['Então isso revolta realmente. E aí com dois meses e uma semana a Luciana resolveu aí que ela ia pedir o divórcio. E aí todo mundo ficou chocado… A família dela, a família deles, os amigos… Todos os amigos, o pessoal da escola dela… E como ele era um cara muito bacana, ele começou com um discurso que: “ai, nossa eu não fiz nada, gente, eu não fiz nada”, tipo, que era tudo muito injusto com ele, que ele estava abalado e ela falando para todo mundo as coisas que ele fazia, o tanto de negligência, enfim… Porque não era só isso, era muita coisa mesmo.'
 'o dia todo. — O tanto de câimbra que eu tive na batata da perna por ser uma trabalhadora da classe C não tenho nem como contar, o tanto de vezes. — Então isso revolta realmente. E aí com dois meses e uma semana a Luciana resolveu aí que ela ia pedir o divórcio. E aí todo mundo ficou chocado… A família dela, a família deles, os amigos… Todos os amigos, o pessoal da escola dela… E como ele era um cara muito bacana, ele começou com um discurso que: “ai, nossa eu não fiz nada, gente, eu não fiz nada”, tipo, que era tudo muito injusto com ele, que ele estava abalado e ela falando para todo mundo as coisas que ele fazia, o tanto de negligência, enfim… Porque não era só isso, era muita coisa mesmo.'
 'Assinante 1: Oi, gente, aqui é a Luciana, chara da amiga da história Imundo. Para ilustrar essa história, tem um ditado popular que a minha avó sempre fala quando alguém se separa que é: “pra se conhecer uma pessoa, é preciso comer um quilo de sal com ela, e às vezes é pouco”. Então, é muito fácil esses amigos, né? Falarem: “Ah, mas poxa vida, ele é tão legal e por que você fez isso e não sei o que” e, no fim das contas, precisou uma outra pessoa conviver com ele pra eles verem que você tava certa. Te taxaram de doida e você ainda pensa se tem que perdoar?'
 'E a Luciana, na época, não tinha conseguido se expressar tão bem para poder explicar tudo o que tinha acontecido. E aí ela escreveu para a gente, porque ela disse que ela não conseguiu perdoar esses amigos, porque ela passou uma fase muito ruim. aí com o Imundo. E ela queria saber de vocês, o que vocês acham que, sei lá, ela devia se reaproximar desses amigos? Eu vou dar minha opinião: eu acho que não, porque esses amigos eles vieram pedir desculpa pra Luciana, mas ao mesmo tempo eles têm um discursinho assim: “ah, mas, pô, o cara pode aprender, o cara não sei o que lá, nã nã nã”, eles não romperam com o cara.']",0.6137107478065401,1.0,0.2222222222222222,0.5210667227636747,
2,"No episódio 'imundo', como os amigos comuns reagiram ao divórcio de Luciana?","Os amigos comuns ficaram chocados e não acreditaram que o marido de Luciana havia feito algo errado, eles achavam que ele era uma pessoa bacana e que Luciana estava sendo injusta com ele.",Romperam com ela ou ficaram calados.,"['Então isso revolta realmente. E aí com dois meses e uma semana a Luciana resolveu aí que ela ia pedir o divórcio. E aí todo mundo ficou chocado… A família dela, a família deles, os amigos… Todos os amigos, o pessoal da escola dela… E como ele era um cara muito bacana, ele começou com um discurso que: “ai, nossa eu não fiz nada, gente, eu não fiz nada”, tipo, que era tudo muito injusto com ele, que ele estava abalado e ela falando para todo mundo as coisas que ele fazia, o tanto de negligência, enfim… Porque não era só isso, era muita coisa mesmo.'
 'Assinante 1: Oi, gente, aqui é a Luciana, chara da amiga da história Imundo. Para ilustrar essa história, tem um ditado popular que a minha avó sempre fala quando alguém se separa que é: “pra se conhecer uma pessoa, é preciso comer um quilo de sal com ela, e às vezes é pouco”. Então, é muito fácil esses amigos, né? Falarem: “Ah, mas poxa vida, ele é tão legal e por que você fez isso e não sei o que” e, no fim das contas, precisou uma outra pessoa conviver com ele pra eles verem que você tava certa. Te taxaram de doida e você ainda pensa se tem que perdoar?'
 'o dia todo. — O tanto de câimbra que eu tive na batata da perna por ser uma trabalhadora da classe C não tenho nem como contar, o tanto de vezes. — Então isso revolta realmente. E aí com dois meses e uma semana a Luciana resolveu aí que ela ia pedir o divórcio. E aí todo mundo ficou chocado… A família dela, a família deles, os amigos… Todos os amigos, o pessoal da escola dela… E como ele era um cara muito bacana, ele começou com um discurso que: “ai, nossa eu não fiz nada, gente, eu não fiz nada”, tipo, que era tudo muito injusto com ele, que ele estava abalado e ela falando para todo mundo as coisas que ele fazia, o tanto de negligência, enfim… Porque não era só isso, era muita coisa mesmo.'
 'E a Luciana, na época, não tinha conseguido se expressar tão bem para poder explicar tudo o que tinha acontecido. E aí ela escreveu para a gente, porque ela disse que ela não conseguiu perdoar esses amigos, porque ela passou uma fase muito ruim. aí com o Imundo. E ela queria saber de vocês, o que vocês acham que, sei lá, ela devia se reaproximar desses amigos? Eu vou dar minha opinião: eu acho que não, porque esses amigos eles vieram pedir desculpa pra Luciana, mas ao mesmo tempo eles têm um discursinho assim: “ah, mas, pô, o cara pode aprender, o cara não sei o que lá, nã nã nã”, eles não romperam com o cara.']",0.40172434086386793,0.75,0.2777777777777778,0.4875619443264484,
3,"No episódio 'analu', quem é Ana Luísa?","Ana Luísa é uma moça muito simpática, mãe solo de uma bebezinha maravilhosa, que é a Maria Flor. Ela estudava para se formar em Direito, mas não havia perspectiva de ter um estágio na área, até que mudou de carreira após conhecer e participar do projeto Cloud Girls.",Ana Luísa é uma mãe solo que mudou de carreira após participar do projeto Cloud Girls.,"['A história da Ana Luísa é uma entre as histórias de cem mulheres em sete turmas aí que já passaram pela Cloud Girls em cinco anos de história. — Então, quem é Ana Luísa? — Ana Luísa é uma moça muito simpática, mãe solo. — de uma bebezinha maravilhosa, que é a Maria Flor. — Há um tempo atrás, ela estava desanimada, ela vinha aí estudando para se formar em Direito e, ali, na cidade dela, ela não havia nem perspectiva de ter um estágio na área.'
 'Ana Luísa é uma moça muito simpática, mãe solo. — de uma bebezinha maravilhosa, que é a Maria Flor. — Há um tempo atrás, ela estava desanimada, ela vinha aí estudando para se formar em Direito e, ali, na cidade dela, ela não havia nem perspectiva de ter um estágio na área. E algumas primas da Ana Luísa já tinham feito aí essa transição de carreira, saído de outras áreas e ido para a área da tecnologia. E sempre ali falando pra ela: [efeito de voz mais fina] “Por que você não tenta, Ana?'
 'Que foi uma história que deixou ela, assim, super empolgada e tal. E é isso que eu vim contar hoje para vocês, a história da Ana Luísa, que é uma mãe solo de uma bebezinha linda e que mudou totalmente de carreira depois que ela conheceu e participou do projeto Cloud Girls. Então vamos lá, vamos de história.'
 'Ela dá suporte por meio de mentoria… E é isso que a Bárbara Toledo faz. E aí foi ela que trouxe pra mim a história da Ana Luísa, né? Que foi uma história que deixou ela, assim, super empolgada e tal. E é isso que eu vim contar hoje para vocês, a história da Ana Luísa, que é uma mãe solo de uma bebezinha linda e que mudou totalmente de carreira depois que ela conheceu e participou do projeto Cloud Girls. Então vamos lá, vamos de história.']",0.6140529946005596,1.0,0.2777777777777778,0.8522561136479585,0.5880640284119896
4,"No episódio 'analu', o que é o projeto Cloud Girls?","O projeto Cloud Girls é um projeto que proporciona para as mulheres a possibilidade de se aperfeiçoar, de se recolocar no mercado de trabalho, de fazer networking e dar cursos… Tudo isso na área de tecnologia.","O projeto Cloud Girls é uma iniciativa que proporciona oportunidades para mulheres se aperfeiçoarem, se recolocarem no mercado de trabalho e fazem networking e cursos na área de tecnologia.","['Em três episódios eu vou contar histórias sobre iniciativas parceiras da Intel que impactaram a vida de pessoas que não tinha  aí, até então, nenhuma familiaridade com coisinhas tecnológicas. E hoje a gente vai conhecer a história da Ana Luísa Bandeira, de Campina Grande na Paraíba. O projeto Cloud Girls nasceu da iniciativa de dois caras, o Francisco Edilton e o Danilo Alves. — E por quê? — Esses caras ali na comunidade de tecnologia e nos eventos que eles faziam, eles perceberam que, assim, o público feminino era muito, muito, muito, muito pouco, assim, era muito pequeno.'
 'E o que é essa iniciativa? O projeto Cloud Girls é um projeto que proporciona para as mulheres a possibilidade de se aperfeiçoar, de se recolocar no mercado de trabalho, de fazer networking e dar cursos… Tudo isso na área de tecnologia. — Um beijo aí para as famosas mulheres de T.I. Amo. [ efeito sonoro de estalo de beijo] —'
 'E a conclusão que eles chegaram é que eles deviam criar algo exclusivo para mulheres. E assim nasceu a Cloud Girls em 2017. E o que é essa iniciativa? O projeto Cloud Girls é um projeto que proporciona para as mulheres a possibilidade de se aperfeiçoar, de se recolocar no mercado de trabalho, de fazer networking e dar cursos… Tudo isso na área de tecnologia. — Um beijo aí para as famosas mulheres de T.I. Amo. ['
 'O papel da Intel dentro do projeto Cloud Girls é, justamente, acelerar o ingresso de mulheres brasileiras na área de tecnologia. — E como que a Intel faz isso? — Ela dá suporte por meio de mentoria… E é isso que a Bárbara Toledo faz. E aí foi ela que trouxe pra mim a história da Ana Luísa, né? Que foi uma história que deixou ela, assim, super empolgada e tal.']",0.5661115550212092,1.0,0.2,0.9720700627038074,
5,"No episódio 'analu', qual é o papel da Intel no projeto Cloud Girls?","O papel da Intel dentro do projeto Cloud Girls é acelerar o ingresso de mulheres brasileiras na área de tecnologia, dando suporte por meio de mentoria.","O papel da Intel é acelerar o ingresso de mulheres brasileiras na área de tecnologia, dando suporte por meio de mentoria.","['O papel da Intel dentro do projeto Cloud Girls é, justamente, acelerar o ingresso de mulheres brasileiras na área de tecnologia. — E como que a Intel faz isso? — Ela dá suporte por meio de mentoria… E é isso que a Bárbara Toledo faz. E aí foi ela que trouxe pra mim a história da Ana Luísa, né? Que foi uma história que deixou ela, assim, super empolgada e tal.'
 'E aí a Intel se tornou parceira do projeto Cloud Girls em 2020. E quem me falou sobre tudo isso foi a Bárbara Toledo, que é gerente de consumo e varejo da Intel e é uma das voluntárias no projeto. O papel da Intel dentro do projeto Cloud Girls é, justamente, acelerar o ingresso de mulheres brasileiras na área de tecnologia. — E como que a Intel faz isso? — Ela dá suporte por meio de mentoria… E é isso que a Bárbara Toledo faz.'
 'Em três episódios eu vou contar histórias sobre iniciativas parceiras da Intel que impactaram a vida de pessoas que não tinha  aí, até então, nenhuma familiaridade com coisinhas tecnológicas. E hoje a gente vai conhecer a história da Ana Luísa Bandeira, de Campina Grande na Paraíba. O projeto Cloud Girls nasceu da iniciativa de dois caras, o Francisco Edilton e o Danilo Alves. — E por quê? — Esses caras ali na comunidade de tecnologia e nos eventos que eles faziam, eles perceberam que, assim, o público feminino era muito, muito, muito, muito pouco, assim, era muito pequeno.'
 'E com esse apoio — da Intel e do projeto Cloud Girls — a Ana Luísa conseguiu se formar e conseguiu tirar o máximo proveito dessa mentoria. E hoje ela é uma professora de programação, né?']",0.509916917339704,1.0,0.23529411764705882,0.7728714385600035,0.9432178596400009
6,"No episódio 'mamador', quem é o personagem principal da história?",O personagem principal da história é o Valdir.,Danilo,"['Com certeza mamou”. Aí eu falei: “Danilo, você está com um pouco de ciúmes, né?”, ele falou: “Andréia, não é ciúmes… É que se ele não tá me mamando, ele está mamando outro cara e não vai sobrar pra mim… Porque, assim, não dá para ele passar o período todo do trabalho mamando rola… Acho que se desse ele passava”, e aí eu falei: “Poxa, até seu amigo casado lá, hetéro…”, ele falou: “Andréia, ele é o que mais fica atrás do Valdir. O Valdir não dá abertura, ele fica atrás numas de: “Tô por aqui… Se você quiser, estou por aqui, sabe? [ risos] Minha rola tá aqui”.'
 'Mamou o vigia, mamou o cara o valet, mamou todo mundo…  Ele é um cara focado. Ele é focado no trabalho dele de engenharia e ele é focado em mamar rola. E mama bem, hein? Ele tem uma técnica que eu não sei dizer, que é perfeito entre a punheta e o tanto que ele suga e, assim, ele mama até você gozar e ele engole tudo, você não vê uma gota, a rola fica limpa… Perfeita para a próxima e ele sempre mama duas vezes. — Danilo acho que ele se excita mais em ver que ali, que depois que você gozou, ele consegue te fazer ficar de pau duro de novo e gozar de novo.'
 'Mama tudo… —'
 'ele falou: “Andréia, não é ciúmes… É que se ele não tá me mamando, ele está mamando outro cara e não vai sobrar pra mim… Porque, assim, não dá para ele passar o período todo do trabalho mamando rola… Acho que se desse ele passava”, e aí eu falei: “Poxa, até seu amigo casado lá, hetéro…”, ele falou: “Andréia, ele é o que mais fica atrás do Valdir. O Valdir não dá abertura, ele fica atrás numas de: “Tô por aqui… Se você quiser, estou por aqui, sabe? [ risos] Minha rola tá aqui”. E o gatilho é ele trancando a porta. Então, quando ele tranca a porta na sala dele ou ele vai na sua sala, é para te mamar…']",0.34690351466633373,0.0,0.36363636363636365,0.21285523484111582,0.053213808710278955
7,"No episódio 'mamador', o que Valdir faz em seu horário de trabalho?",Valdir mama em seu horário de trabalho.,Mama rola,"['Quando ele tá mamando a rola, você percebe que ele parece que ele tá, sei lá, comendo a comida mais gostosa desse mundo. Ele fica guloso… Então é isso aí, Valdir, parabéns aí em suas mamadas aí patrocinadas pela Pônei Engenharia S.A, porque ele só mama em horário de serviço. Nem horário de almoço ele não mama, não… Mas se você for olhar produtividade, se você for olhar o trabalho do Valdir, Danilo falou que é impecável. O cara é focado… — Tanto no trabalho quanto em mamar rola, então acho que não está prejudicando nada. Tá atrapalhando o corporativo?'
 'E o lance do Valdir é a mamada remunerada, [risos] que ele tá ali mamando em horário de trabalho. — Depois de umas quatro, cinco mamadas, o Danilo falou: “Você entra naquela fase que você precisa comentar com alguém… Você precisa comentar. Você precisa falar o quanto o cara é excepcional, quanto a boca dele é maravilhosa e eu comentei com meu amigo gays que eu convivo no dia a dia, assim, mas eu eu precisava contar para alguém da firma, um amigo meu da firma para saber… Pra quando a gente olhar para o Valdir, os dois ali sabem que Valdir me mamou, entendeu? Precisava contar para alguém. Desculpa”. ['
 'E aí eu falei: “Mas Danilo, e aí? Vocês não marcavam nada fora?”, ele falou: “Andréia, ele não dá abertura para você saber nem o que ele faz nas horas vagas. O que eu sei é que ele é solteiro… Não sei se ele diz que ele é hétero, se ele é gay, o que ele fala… Ele é um cara discreto”. — E o lance do Valdir é a mamada remunerada, [risos] que ele tá ali mamando em horário de trabalho. —'
 'ele falou: “Andréia, ele não dá abertura para você saber nem o que ele faz nas horas vagas. O que eu sei é que ele é solteiro… Não sei se ele diz que ele é hétero, se ele é gay, o que ele fala… Ele é um cara discreto”. — E o lance do Valdir é a mamada remunerada, [risos] que ele tá ali mamando em horário de trabalho. — Depois de umas quatro, cinco mamadas, o Danilo falou: “Você entra naquela fase que você precisa comentar com alguém… Você precisa comentar. Você precisa falar o quanto o cara é excepcional, quanto a boca dele é maravilhosa e eu comentei com meu amigo gays que eu convivo no dia a dia, assim, mas eu eu precisava contar para alguém da firma, um amigo meu da firma para saber… Pra quando a gente olhar para o Valdir, os dois ali sabem que Valdir me mamou, entendeu?']",0.1677674225519404,1.0,0.26666666666666666,0.5514414459041037,0.13786036147602593
8,"No episódio 'mamador', por que Danilo ficou viciado em Valdir?",Danilo ficou viciado em Valdir porque ele gostava de ser masturbado por ele e queria que ele fizesse isso todos os dias.,Porque Valdir tem uma técnica de mamada muito gostosa e sabe chupar uma rola de forma perfeita,"['risos] Eu estava viciado, queria que o Valdir mamasse minha rola todo dia”. Quando tinha alguma coisa que era só os dois para resolver, o Danilo falou: “Andréia, eu tinha que me controlar, porque às vezes era só trampo mesmo e eu ficava de pau duro, porque eu já pensava: “Meu Deus, lá vem o Valdir com a boquinha de veludo dele”.'
 'Não soltou a rola, se masturbou ali e continuou até o Danilo gozar de novo. E aí, nesse ponto, o Danilo falou: “Eu não tinha sentimento nenhum, mas eu estava viciado. [ risos] Eu estava viciado, queria que o Valdir mamasse minha rola todo dia”. Quando tinha alguma coisa que era só os dois para resolver, o Danilo falou: “Andréia, eu tinha que me controlar, porque às vezes era só trampo mesmo e eu ficava de pau duro, porque eu já pensava: “Meu Deus, lá vem o Valdir com a boquinha de veludo dele”.'
 'Danilo acho que ele se excita mais em ver que ali, que depois que você gozou, ele consegue te fazer ficar de pau duro de novo e gozar de novo. Então é isso que deve dar o tesão nele, porque é aí que ele goza. — Ele já mamou todo mundo e tá todo mundo viciado.. .É aquela coisa da rádio peão, todo mundo fala bem da mamada do Valdir, então até quem talvez não quisesse tá querendo saber, tá querendo aproveitar essa mamada, está querendo ver como é. Todo mundo viciado,  Valdir não te dá abertura nem para fazer piada, nada, não comenta sobre o assunto, ele simplesmente mama rola… — Mama rola, mama bola, mama cu. Mama tudo… —'
 'Gente, o Valdir mamou metade da firma… E aí o Danilo ficou meio puto, porque ele falou: “Ah, então é por isso que ele não me mama todo dia, porque ele tá todo dia mamando… Todo dia ele mama alguém da firma”. Mama hétero solteiro, hétero casado, gay… — Mama, mama rola. — Mamou o vigia, mamou o cara o valet, mamou todo mundo…  Ele é um cara focado. Ele é focado no trabalho dele de engenharia e ele é focado em mamar rola. E mama bem, hein?']",0.38209470558859243,1.0,0.29411764705882354,0.46741719110242186,0.11685429777560546
9,"No episódio 'hortifruti', quem era o Reginaldo para a Débora?","O Reginaldo era o pai do filho da Débora e um homem homofóbico que não queria que o filho dele ficasse perto do tio, Marcos.",Namorado da Débora e pai do bebê,"['Eu acho o fim da picada, ainda mais assim, gente que tem dinheiro, e… A Débora fez a escolha certa, ela ficou com a família dela, ficou com o irmão dela que é um cara maravilhoso, um cara decente, né? Uma pessoa sensacional e do outro lado tem aí esse resto de carne que fala, que é o Reginaldo.'
 'Esse cretino do Reginaldo foi lá e falou para o Marcos: “Olha, você tá atrapalhando o meu relacionamento com a Débora. Eu não quero o meu filho perto de você porque você…”, me falou várias coisas que eu não vou repetir aqui.'
 'E aí o Marcos, que é o irmão da Débora, pra não ter briga e um cara que ganha bem, ele falou: “Eu pago a escola do meu sobrinho”. — Não se preocupa com isso que eu pago a escola do meu sobrinho”. E aí colocaram na escolinha e quem pagava a escolinha era o Marcos, inclusive, o Reginaldo ficou puto porque o Marcos pagava uma escolinha para o filho dele melhor do que ele mesmo pagava para o outro filho que ele teve lá com a nova esposa, então ele ficou no veneno. — Mas ele não podia fazer nada, ele não queria pagar, não é? — Quem pagava era o Marcos e, assim, era o Marcos, a Débora e o bebezinho na casa e tudo perfeito, tudo maravilhoso.'
 'E a Débora — Ainda bem — lúcida, se tocou disso, tipo, eu não quero criar o meu filho do lado de um homofóbico, e aí eles começaram a ter muitas brigas por causa disso, né? Aí numa das brigas, esse cretino desse Reginaldo, porque assim, a Débora não contava essas coisas para o Marcos pra não magoar o Marcos, né? Esse cretino do Reginaldo foi lá e falou para o Marcos: “Olha, você tá atrapalhando o meu relacionamento com a Débora. Eu não quero o meu filho perto de você porque você…”, me falou várias coisas que eu não vou repetir aqui.']",0.3255420223182246,1.0,0.36363636363636365,0.4678176516670478,0.11695441291676195
10,"No episódio 'hortifruti', por que o Reginaldo não queria que o filho convivesse com o Marcos?",O Reginaldo não queria que o filho convivesse com o Marcos porque ele é homofóbico e temia que o Marcos influenciasse o filho a se tornar gay.,Porque o Marcos é gay e o Reginaldo acreditava que isso poderia influenciar o filho,"['E aí o tempo foi passando, a gravidez correu tudo bem, nasceu o menininho, o bebezinho nasceu, tudo lindo e eles iam retomar os planos ali de casamento, quando o Reginaldo começou com uma idiotice, mais conhecida como homofobia. O Marcos é um cara gay e, para o Reginaldo agora que ele tinha um filho homem, ele não queria a criança convivendo com um cara gay porque ia influenciar o filho dele. O filho dele, imagina, o filho dele poderia se tornar futuramente um gay, palavras de Reginaldo… — E gente, né? Olha o discurso desse homem, já não presta pra casar, né? — E a Débora — Ainda bem — lúcida, se tocou disso, tipo, eu não quero criar o meu filho do lado de um homofóbico, e aí eles começaram a ter muitas brigas por causa disso, né?'
 'Esse cretino do Reginaldo foi lá e falou para o Marcos: “Olha, você tá atrapalhando o meu relacionamento com a Débora. Eu não quero o meu filho perto de você porque você…”, me falou várias coisas que eu não vou repetir aqui.'
 'E a Débora — Ainda bem — lúcida, se tocou disso, tipo, eu não quero criar o meu filho do lado de um homofóbico, e aí eles começaram a ter muitas brigas por causa disso, né? Aí numa das brigas, esse cretino desse Reginaldo, porque assim, a Débora não contava essas coisas para o Marcos pra não magoar o Marcos, né? Esse cretino do Reginaldo foi lá e falou para o Marcos: “Olha, você tá atrapalhando o meu relacionamento com a Débora. Eu não quero o meu filho perto de você porque você…”, me falou várias coisas que eu não vou repetir aqui.'
 'E aí colocaram na escolinha e quem pagava a escolinha era o Marcos, inclusive, o Reginaldo ficou puto porque o Marcos pagava uma escolinha para o filho dele melhor do que ele mesmo pagava para o outro filho que ele teve lá com a nova esposa, então ele ficou no veneno. — Mas ele não podia fazer nada, ele não queria pagar, não é? — Quem pagava era o Marcos e, assim, era o Marcos, a Débora e o bebezinho na casa e tudo perfeito, tudo maravilhoso.']",0.5198536755800555,1.0,0.3333333333333333,0.8887113918016848,0.5221778479504212
11,"No episódio 'hortifruti', o que o Reginaldo ofereceu para pagar em vez de dinheiro para o convênio médico do filho?",O Reginaldo ofereceu pagar o convênio médico do filho em frutas e legumes.,Fruta e legume,"['E aí como ele infernizou tanto, tanto, tanto, que a Débora trocou o valor em dinheiro por ele pagar o convênio médico do bebê, então ela queria dar um bom convênio pra criança e aí ficou combinado que ele pagaria só o convênio. E o cara tem três hortifrutis, sabe? O cara não é pobre, tá super bem de vida e podia pagar mais alguma coisa, né? A criança tinha direito, mas a Débora falou: “Olha, pagando o convênio médico dele, tá ótimo” e assim foi feito. Mas a juíza fez um adendo lá que, tipo, se tivesse despesas extras ou alguma outra coisa, ele tinha que comparecer.'
 'Então o Reginaldo tá puto. E aí a única maneira que ele tem de atingir de alguma forma a família é falar que não vai pagar o convênio… — E aí também já é desaforo, né? — Aí a advogada da Débora falou pra ela: “Ah, ele quer mandar fruta? Quer mandar legume? Pode aceitar, porque o que conta é o boleto do convênio pago, né?”.'
 'A gente vai dividir a escolinha, eu pago metade e você paga metade?”, ele falou: “Não, eu só pago o convênio, não vou pagar mais nada”. E aí o Marcos, que é o irmão da Débora, pra não ter briga e um cara que ganha bem, ele falou: “Eu pago a escola do meu sobrinho”. — Não se preocupa com isso que eu pago a escola do meu sobrinho”. E aí colocaram na escolinha e quem pagava a escolinha era o Marcos, inclusive, o Reginaldo ficou puto porque o Marcos pagava uma escolinha para o filho dele melhor do que ele mesmo pagava para o outro filho que ele teve lá com a nova esposa, então ele ficou no veneno. —'
 'E no caso dele, melhorou, era nítido que tinha melhorado, e aí ele falou que ele não ia mais pagar o convênio da criança, não ia dar mais nada… — Só que não é assim que funciona, né? — Aí eles brigaram lá por telefone e ele falou: “Tá bom então, eu vou pagar o valor do convênio em fruta e legume” — Gente, sério? Em fruta e legume… — E o cara com um carro — É… como que é o nome do carro que ela falou? — Captiva, um negócio assim, que é um carro que ela falou que é muito caro, que ele tem um carro desse, a mulher dele tem um carro desse que ele deu e que ele mora num puta apartamento assim, que vale muito, muito, muito. — E não quer pagar o convênio do filho, sabe?']",0.37953215511349964,1.0,0.21052631578947367,0.6981361746034919,0.17453404365087297
12,"No episódio 'desaparecida', quem era o personagem principal da história?",A personagem principal da história era a Marlene.,"O senhor Gutiérrez, um policial militar aposentado","['efeito sonoro de carro dando partida e sirenes de policia] Chegando lá, ele viu que se tratava de uma briga familiar e que era uma mãe, uma senhora já de idade, brigando com o genro… Dizendo que o genro tinha sumido com a filha dela. — Que seria a esposa do cara. — O cara alegava que a esposa tinha ido embora e a mãe dizia que ela jamais faria isso, né? Que eles tinham acabado de ter um bebezinho. — Inclusive era ela que estava cuidando do bebezinho e que ela jamais iria embora sem o filho e nã nã nã. —'
 'Inclusive era ela que estava cuidando do bebezinho e que ela jamais iria embora sem o filho e nã nã nã. —'
 'Assinante 2: Oi, gente, meu nome é Carol, eu sou de São Paulo e eu tenho tantas coisas pra falar sobre esse caso que eu nem sei por onde começar… Mas a primeira é que a Déia perguntou: “Ah, como só o seu Gutierrez via a moça, né?”, provavelmente ele tinha uma mediunidade não desenvolvida e a moça percebeu… E aí viu, né? Nele uma forma de explicar e de solucionar o caso dela, né? De dar uma paz pra mãe e pro filho sobre onde ela estava, né? E ela poder descansar em paz também.'
 'Da mãe da Marlene. — Que a gente pode chamar de dona Maria… Na porta da dona Maria. — E aí nisso, o cara que era o marido, ele vinha vindo… Porque eles moravam no fundo da casa e, conforme ele chegou e ele viu a polícia, ele parou ali para perguntar se alguém tinha achado, encontrado ela por aí, “bebendo com algum cara”, ele falou assim…']",0.23063902435067418,0.0,0.4,0.29288581560512084,0.07322145390128021
13,"No episódio 'desaparecida', o que aconteceu com a filha da senhora que chamou a polícia?","A filha da senhora que chamou a polícia foi encontrada, pois a senhora fez um boletim de ocorrência do desaparecimento da filha e convidou o policial para tomar um café e comer uma fatia de bolo em sua casa.",Ela foi morta pelo seu marido e jogada em uma represa,"['E aí eles estavam brigando, né? E chamaram a polícia porque ela tinha ido para cima dele, enfim… E aí o seu Gutierrez ali e o parceiro tentaram apaziguar as coisas, né? — O que eles chamam de desinteligência. — E se prontificaram a levar a senhora pra fazer um boletim de ocorrência do desaparecimento da filha, porque já tinha mais de dez dias, então ela já poderia fazer esse boletim. E ali o seu Gutiérrez ficou um pouco intrigado, porque, assim, o marido não fez o boletim de ocorrência de desaparecimento da esposa.'
 'O que eles chamam de desinteligência. — E se prontificaram a levar a senhora pra fazer um boletim de ocorrência do desaparecimento da filha, porque já tinha mais de dez dias, então ela já poderia fazer esse boletim. E ali o seu Gutiérrez ficou um pouco intrigado, porque, assim, o marido não fez o boletim de ocorrência de desaparecimento da esposa. Ficou combinado ali que ninguém ia prestar queixa contra ninguém e eles levaram essa senhora muito aflita até a delegacia e deixaram ela lá, porque, assim, nada mais tinha a ser feito ali pela Polícia Militar, né? Somente agora a investigação com a Polícia Civil, então o trabalho do seu Gutiérrez terminava ali.'
 'e passou… Nesse dia desse turno que ele estava estranho, tinha pouquíssimas ocorrências, né? E eles faziam uma determinada área e o seu Gutierrez falou pro parceiro dele assim: “Vamos passar na casa daquela senhora?”. — Deu uma vontade nele que ele não sabe de onde é e porque, nada… E ele queria passar na casa lá daquela senhora que estava com a filha desaparecida, mas até então ele não tinha ligado uma coisa a outra, né? —'
 'E aí o colega dele ainda brincou falou: “Ué, você está caçando ocorrência? Vamos passar lá por quê, né?” e tal, ele falou: “Não, vamos dar um pulo lá”… E eles foram, o colega dele ficou no carro ali, meio que descansando… — Já não querendo treta… — E ele foi, bateu palmas, a mulher saiu e aí ele perguntou, né? Se tinha encontrado a filha, o que tinha acontecido… Ela falou que fez B.O, passou tudo lá para o investigador nã nã nã e ela convidou o seu Gutierrez pra tomar um café, comer uma fatia de bolo. Aí o outro — o parceiro dele, quando ouviu a palavra bolo [risos] — desceu e eles entraram.']",0.10407881291014716,0.3333333333333333,0.29411764705882354,0.4060099261063039,0.10150248152657597
14,"No episódio 'desaparecida', por que o seu Gutiérrez começou a ter sonhos estranhos com a Marlene?","Ele começou a ter sonhos estranhos com a Marlene porque, quando pegou a foto dela, ele viu uma visão paranormal da moça morta, o que o assustou e fez com que ele começasse a ter sonhos estranhos.",Ele começou a ter sonhos estranhos com a Marlene após ter contato com a sua mãe e a história de desaparecimento,"['e o cara começou a chorar… O investigador mentiu, jogou verde, assim, tipo, falando do sonho do Gutiérrez e o cara começou a chorar e ele confessou. Confessou que a Marlene queria realmente ir embora, mas queria levar o filho e tal e que aí num dia ele matou e botou a Marlene no carro… Dona Maria não tinha nem acordado ainda, — ele fez isso de madrugada — saiu, voltou e falou que ela tinha ido embora… E ele não jogou só o corpo da Marlene, ele jogou uma mala junto e, quando acharam o corpo dela, estava muito já, assim, decomposta e acharam a mala também que ele tinha jogado, que era para fingir que, tipo, ela tinha ido embora.'
 'e ela falou: “Claro, tenho sim” e foi lá e pegou uma foto… O nome da moça era Marlene. E quando ele pegou na foto, que ele segurou a foto, na hora ele viu essa moça… [efeito sonoro de suspense] — E, assim, seu Gutiérrez nunca teve nenhuma visão paranormal, nunca foi médium, nada… Nem antes e nem depois desse fato. — Na hora que ele pegou na foto dela, ele viu essa moça como se fosse numa represa assim, enroscado em algum galho, em alguma coisa, assim, morta… E aí deu aquele susto nele, ele pegou a foto, falou: “ah, obrigado e tal”.'
 'Então ele foi, participou de outras ocorrências e tal, passou o dia, terminou o turno dele e ele foi para casa. Assim que o seu Gutiérrez pegou no sono, ele começou a sonhar com uma moça que estava na beira de o que parecia um lago ou uma represa, e ela estava muito, muito, muito inchada e, quando ele chegava mais perto, ela olhava pra a cara dele… Ela virava, olhava para a cara dele assim e parecia que ia engolir ele. [ efeito sonoro de tensão e alguém se assustando] E aí ele acordou assustado… Ele falou: “Nossa, né? Que coisa… Que coisa horrível”. Ele estava de folga, ele só ia trabalhar depois de dois dias ali, né?'
 'E aí o seu Gutiérrez, até então, não tinha visto uma foto da filha dessa senhora. E quando eles estavam pra sair, o seu Gutiérrez falou: “Você tem uma foto dessa moça para me dar?” e ela falou: “Claro, tenho sim” e foi lá e pegou uma foto… O nome da moça era Marlene. E quando ele pegou na foto, que ele segurou a foto, na hora ele viu essa moça… [efeito sonoro de suspense] — E, assim, seu Gutiérrez nunca teve nenhuma visão paranormal, nunca foi médium, nada… Nem antes e nem depois desse fato. — Na hora que ele pegou na foto dela, ele viu essa moça como se fosse numa represa assim, enroscado em algum galho, em alguma coisa, assim, morta… E aí deu aquele susto nele, ele pegou a foto, falou: “ah, obrigado e tal”.']",0.52928841706961,0.3333333333333333,0.38461538461538464,0.7983674615902454,0.19959186539756135
15,"No episódio 'voltei', quem era o pai da Celina?",O pai da Celina era o homem agressivo com quem ela e a mãe moravam.,Um homem agressivo e violento que foi assassinado em um bar,"['Celine e a mãe moravam com este homem, né? — Com o pai de Celina. — E ele era um cara muito agressivo. Muito áspero com elas e tal —por exemplo — quando ele estava em casa, a Celina não podia brincar, não podia falar… Era silêncio total. Ela tinha que ficar em silêncio, a mãe tinha que ficar em silêncio… E, enfim, ela teve uma infância péssima, até que ele morreu.'
 'Ele falou: [efeito de voz grossa] “Eu voltei”. E aí a Celina ficou apavorada. Ela não sabe se dali foi um sonho, o que foi… Ela levantou, deu um pulo da cama, acordou a filha… A filha estava dormindo, tranquila assim, sem nada. E ela pediu pra a filha fazer uma oração, elas fizeram, enfim, passou… Só que a partir daí, ela agora sempre vê o pai dentro da casa dela, sempre perto da filha dela. Nada mais aconteceu, ela não vê nada cair… Nada.'
 'Celina, filha única… A mãe dela mora numa outra cidade, longe de Celina, e o pai da Celina faleceu quando a Celina tinha oito anos. Então, gente, é muito, muito, muito tempo, assim… Ela nem pensa mais no pai, enfim… E como era essa infância de Celina? Celine e a mãe moravam com este homem, né? — Com o pai de Celina. — E ele era um cara muito agressivo.'
 'E Celina começou a achar que o pai dela tinha reencarnado na menininha… E aí ela ficou em pânico. Falou: “Meu Deus do céu, eu não quero conviver com esse homem”. Deu uma pirada, entrou na terapia e colocou a menininha também com uma terapeuta infantil ali, uma psicóloga, pra ver o que estava acontecendo. Então, ali dos quatro até os oito, ela falava sempre de coisas dessa vida dela passada. Quando essa menininha fez oito anos… — A gente pode chamar essa menininha de Jéssica. —']",0.3140777267964127,1.0,0.23809523809523808,0.44163528165605503,0.41040882041401383
16,"No episódio 'voltei', o que a filha de Celina disse sobre a sua vida passada?","A filha de Celina disse que não foi ela quem viveu a outra vida, mas que estava contando as coisas que lhe contaram.",Que ela estava em um lugar cheio de mesas e garrafas e sentiu espetar as costas,"['Ele falou: [efeito de voz grossa] “Eu voltei”. E aí a Celina ficou apavorada. Ela não sabe se dali foi um sonho, o que foi… Ela levantou, deu um pulo da cama, acordou a filha… A filha estava dormindo, tranquila assim, sem nada. E ela pediu pra a filha fazer uma oração, elas fizeram, enfim, passou… Só que a partir daí, ela agora sempre vê o pai dentro da casa dela, sempre perto da filha dela. Nada mais aconteceu, ela não vê nada cair… Nada.'
 'Quando Jéssica fez oito anos, ela virou pra a mãe e Falou: “Bom, agora eu não preciso mais te contar nada da minha outra vida”. E aí a Celina foi ali conversando com ela e ela deu a entender que as coisas que ela estava falando ali eram coisas que falaram pra ela. A Celina falou: “Mas foi você que viveu essa outra vida?”. Ela falou: “Não, eu tô te contando as coisas que me contaram”. E aí a Celina ficou na dúvida se a filha seria uma reencarnação do pai ou seu pai estava falando com a filha dela.'
 'A Celina falou: “Mas foi você que viveu essa outra vida?”. Ela falou: “Não, eu tô te contando as coisas que me contaram”. E aí a Celina ficou na dúvida se a filha seria uma reencarnação do pai ou seu pai estava falando com a filha dela. E Celina cada vez mais achando que estava enlouquecendo… Até que um dia, a Celina durante a madrugada, ouviu um barulho no quarto dela… [efeito sonoro de porta abrindo] Ela e a filha dormiam no mesmo quarto. Ela ouviu um barulho no quarto dela, ela numa cama de solteiro, a menininha na outra cama e, quando ela abriu os olhos, ainda no escuro, ela conseguiu ver a figura do pai dela na beirada da cama da filha dela… [efeito sonoro de tensão] Parado, olhando.'
 'efeito sonoro de tensão] Celina falou: “Nossa, não, imagina… Isso é um bebê, de dias… Não tem como ser a cara daquele senhor, né?”. [ efeito sonoro de tensão]E aí a mãe da Celina falou: “Não, é a cara do seu pai”. E aí passou, o tempo foi passando, essa criança foi crescendo… Quando essa menininha estava com quatro anos, foi a primeira vez que ela disse pra Celina como ela tinha morrido… Uma criança de quatro anos, filha de Celina, virou pra Celina e falou: “Olha… Mamãe, quando era outra vida, eu estava num lugar cheio de mesas e garrafas e eu senti espetar as minhas costas”. — Uma criança de quatro anos… —']",0.24131148756431517,1.0,0.3157894736842105,0.5889611227394232,0.1472402806848558
17,"No episódio 'voltei', o que o pai da Celina disse à Celina na figura que ela viu na beirada da cama da filha?","O pai da Celina disse à Celina: ""Eu voltei"".",“Eu voltei”,"['A Celina falou: “Mas foi você que viveu essa outra vida?”. Ela falou: “Não, eu tô te contando as coisas que me contaram”. E aí a Celina ficou na dúvida se a filha seria uma reencarnação do pai ou seu pai estava falando com a filha dela. E Celina cada vez mais achando que estava enlouquecendo… Até que um dia, a Celina durante a madrugada, ouviu um barulho no quarto dela… [efeito sonoro de porta abrindo] Ela e a filha dormiam no mesmo quarto. Ela ouviu um barulho no quarto dela, ela numa cama de solteiro, a menininha na outra cama e, quando ela abriu os olhos, ainda no escuro, ela conseguiu ver a figura do pai dela na beirada da cama da filha dela… [efeito sonoro de tensão] Parado, olhando.'
 'Ele falou: [efeito de voz grossa] “Eu voltei”. E aí a Celina ficou apavorada. Ela não sabe se dali foi um sonho, o que foi… Ela levantou, deu um pulo da cama, acordou a filha… A filha estava dormindo, tranquila assim, sem nada. E ela pediu pra a filha fazer uma oração, elas fizeram, enfim, passou… Só que a partir daí, ela agora sempre vê o pai dentro da casa dela, sempre perto da filha dela. Nada mais aconteceu, ela não vê nada cair… Nada.'
 'E aí a Celina ficou na dúvida se a filha seria uma reencarnação do pai ou seu pai estava falando com a filha dela. E Celina cada vez mais achando que estava enlouquecendo… Até que um dia, a Celina durante a madrugada, ouviu um barulho no quarto dela… [efeito sonoro de porta abrindo] Ela e a filha dormiam no mesmo quarto. Ela ouviu um barulho no quarto dela, ela numa cama de solteiro, a menininha na outra cama e, quando ela abriu os olhos, ainda no escuro, ela conseguiu ver a figura do pai dela na beirada da cama da filha dela… [efeito sonoro de tensão] Parado, olhando.'
 'E aí a Celina começou a respirar mais fundo e tentando ficar imóvel, mas ela não conseguiu e ela sentou na cama e olhou direto pra ele. E, quando ela olhou pra ele, ela falou que era sem som, mas ela conseguiu ouvir a voz dele na cabeça, dentro da cabeça dela. Ele falou: [efeito de voz grossa] “Eu voltei”. E aí a Celina ficou apavorada. Ela não sabe se dali foi um sonho, o que foi… Ela levantou, deu um pulo da cama, acordou a filha… A filha estava dormindo, tranquila assim, sem nada.']",0.3554882744913536,0.5,0.2222222222222222,0.7391283059523037,0.18478207648807593
18,"No episódio 'vestido', quem é a protagonista da história?",A protagonista da história é Yara.,Yara,"['Assinante 1: Oi, gente, tudo bem? Sou Carol Rodrigues, de Fortaleza, Ceará. Cara, que coincidência… Eu tava reouvindo aqui uns episódios antigos essa semana e ouvi o “Vestido Florido”, que também é um Luz Acesa. Nesse episódio não teve um desfecho mesmo assim, mas esse aqui da história da Yara eu fiquei feliz que tenha tido. Achei bacana a Yara devolver o vestido, achei interessante a família cumprir ali o que a moça tinha solicitado e devolver o vestido ali no túmulo e tal.'
 'Cara, que coincidência… Eu tava reouvindo aqui uns episódios antigos essa semana e ouvi o “Vestido Florido”, que também é um Luz Acesa. Nesse episódio não teve um desfecho mesmo assim, mas esse aqui da história da Yara eu fiquei feliz que tenha tido. Achei bacana a Yara devolver o vestido, achei interessante a família cumprir ali o que a moça tinha solicitado e devolver o vestido ali no túmulo e tal. É meio complicado, é uma situação bem delicada? É, mas é importante que tenha acontecido porque essa pessoa faleceu apegada a esse bem material, então ela está presa, sabe?'
 'E aí depois como é que ela ia falar não e tal… Mas ela falou: “Sim” e falou: “Bom, qualquer coisa eu dou uma reformada, sai mais barato, né?”. E aí a professora, — que a gente pode chamar aqui de “professora Mirtes” — a professora Mirtes trouxe o vestido no dia seguinte pra Yara. E era um vestido lindo, gente… Lindo, lindo, lindo…'
 'Que a gente pode chamar, sei lá, de “Helena”. — Sobre os ossos da Helena, irmã de Mirtes. Segundo Mirtes, falou pra Yara que as aparições acabaram, ela parou de aparecer… Ela realmente queria o vestido dela. Agora, um detalhe é que a Helena, mesmo depois do vestido ter sido colocado em cima dos ossos dela, ela continuava aparecendo para o noivo. Esse noivo, depois de uns cinco anos ali, ele se casou, só que depois de um ano de casamento, esse noivo ficou doente e morreu.']",0.3424287836671804,1.0,0.2777777777777778,0.5552785123183879,0.888819628079597
19,"No episódio 'vestido', o que aconteceu com o vestido de noiva?",O vestido de noiva caiu no chão quando a caixa onde estava guardado caiu da mesinha no quarto da Yara.,O vestido de noiva era assombrado pela irmã da professora Mirtes,"['O vestido ficou numa caixa no quarto da Yara… No primeiro dia foi tudo perfeito, nada aconteceu. No segundo dia que o vestido estava ali, quando a Yara foi dormir, ela reparou que a caixa estava um pouco aberta e falou: “Ah, acho que minha mãe mexeu, né? Sei lá”. E aí ela deitou e foi dormir ali, nem pensou muito no vestido, mas tava feliz com as coisas do casamento e tal. Quando durante a madrugada, a Yara escutou um barulho… O barulho era da caixa do vestido caindo no chão. —'
 'Cara, que coincidência… Eu tava reouvindo aqui uns episódios antigos essa semana e ouvi o “Vestido Florido”, que também é um Luz Acesa. Nesse episódio não teve um desfecho mesmo assim, mas esse aqui da história da Yara eu fiquei feliz que tenha tido. Achei bacana a Yara devolver o vestido, achei interessante a família cumprir ali o que a moça tinha solicitado e devolver o vestido ali no túmulo e tal. É meio complicado, é uma situação bem delicada? É, mas é importante que tenha acontecido porque essa pessoa faleceu apegada a esse bem material, então ela está presa, sabe?'
 'E aí, no dia seguinte, ela levou o vestido pra Mirtes, Mirtes não estava surpresa e falou: “Ah, eu achei que dando o vestido para alguém que tivesse muito amor e fosse casar, isso ia passar, mas pelo jeito não vai passar nunca. Eu tinha uma irmã que ficou muito doente e morreu faltando uma semana para se casar… E ela queria ser enterrada com o vestido de noiva, porque ela ficou muito doente e, quando ela estava para morrer, ela falou isso… Só que a minha mãe não quis enterrar a minha irmã com o vestido de noiva e a gente guardou o vestido de noiva e a minha irmã, desde então, começa a aparecer na minha casa de vez em quando, assim, e atormentar a mim e a minha mãe”.'
 'Sei lá”. E aí ela deitou e foi dormir ali, nem pensou muito no vestido, mas tava feliz com as coisas do casamento e tal. Quando durante a madrugada, a Yara escutou um barulho… O barulho era da caixa do vestido caindo no chão. — Ela tinha uma mesinha ali, como se fosse uma escrivaninha, uma mesinha no quarto… A caixa do vestido estava ali, em cima da mesinha. — A caixa caiu no chão, então era para o vestido cair ali perto da caixa.']",0.07572852267048523,0.75,0.25,0.5837980133800978,0.14594950334502446
20,"No episódio 'vestido', quem era a irmã da professora Mirtes?",A irmã da professora Mirtes se chama Helena.,Helena,"['Que a gente pode chamar, sei lá, de “Helena”. — Sobre os ossos da Helena, irmã de Mirtes. Segundo Mirtes, falou pra Yara que as aparições acabaram, ela parou de aparecer… Ela realmente queria o vestido dela. Agora, um detalhe é que a Helena, mesmo depois do vestido ter sido colocado em cima dos ossos dela, ela continuava aparecendo para o noivo. Esse noivo, depois de uns cinco anos ali, ele se casou, só que depois de um ano de casamento, esse noivo ficou doente e morreu.'
 'E como a Mirtes agora estava vendo que não, a Mirtes contou pra ela que elas foram até o cemitério… Elas tinham um jazigo próprio e elas combinaram lá na administração do cemitério que elas queriam abrir o jazigo e colocar o vestido estendido em cima dos ossos da irmã da Mirtes. E assim foi feito… O vestido foi levado no cemitério, foi aberto esse jazigo, foi aberto o caixão e o vestido foi colocado sobre os ossos…. — Que a gente pode chamar, sei lá, de “Helena”. — Sobre os ossos da Helena, irmã de Mirtes. Segundo Mirtes, falou pra Yara que as aparições acabaram, ela parou de aparecer… Ela realmente queria o vestido dela.'
 'E aí depois como é que ela ia falar não e tal… Mas ela falou: “Sim” e falou: “Bom, qualquer coisa eu dou uma reformada, sai mais barato, né?”. E aí a professora, — que a gente pode chamar aqui de “professora Mirtes” — a professora Mirtes trouxe o vestido no dia seguinte pra Yara. E era um vestido lindo, gente… Lindo, lindo, lindo…'
 'E a mãe da Mirtes tinha concordado em dar o vestido para ver se isso passava, né? Se a mocinha parava de aparecer na casa, porque ela sempre buscava o vestido. E como a Mirtes agora estava vendo que não, a Mirtes contou pra ela que elas foram até o cemitério… Elas tinham um jazigo próprio e elas combinaram lá na administração do cemitério que elas queriam abrir o jazigo e colocar o vestido estendido em cima dos ossos da irmã da Mirtes. E assim foi feito… O vestido foi levado no cemitério, foi aberto esse jazigo, foi aberto o caixão e o vestido foi colocado sobre os ossos…. — Que a gente pode chamar, sei lá, de “Helena”. —']",0.37759241499613244,1.0,0.2631578947368421,0.45431636428850375,0.8635790910721259
21,"No episódio 'desodorante', quem são os personagens principais da história?",Os personagens principais da história são o Daniel e a Karina.,Karina e Daniel,"['Nessas questões aí… E é uma história de amor, gente. É uma história de amor que deu certo e deu muito certo, eles estão bem, eles estão felizes e se acertaram, inclusive, sexualmente ali e tudo rolou. — Agora pensa, né? — Qualquer pessoa ali no lugar da Karina, talvez tivesse cortado contato de vez assim, né? Porque o cara tá ali, sei lá, com um desodorante no ânus…'
 'E aí o choque, gente… O Daniel estava com um tubo de desodorante, desses pequenos, tipo rollon, dentro do ânus… Ele colocou ali o desodorante e o desodorante entrou. E aí a Karina muito em choque, né? Muito em choque mesmo. O cara do SAMU saiu do banheiro, né? Falou: “Bom, já sei o que é, vamos remover.'
 'Porque o cara tá ali, sei lá, com um desodorante no ânus…'
 'Agora pensa, né? — Qualquer pessoa ali no lugar da Karina, talvez tivesse cortado contato de vez assim, né? Porque o cara tá ali, sei lá, com um desodorante no ânus…']",0.14914264060894802,1.0,0.35714285714285715,0.5852359596304129,0.8963089899076032
22,"No episódio 'desodorante', o que aconteceu no motel que causou um choque na Karina?","No motel, o Daniel colocou um tubo de desodorante no ânus, o que causou um choque na Karina.",Daniel colocou um tubo de desodorante no ânus,"['E aí o choque, gente… O Daniel estava com um tubo de desodorante, desses pequenos, tipo rollon, dentro do ânus… Ele colocou ali o desodorante e o desodorante entrou. E aí a Karina muito em choque, né? Muito em choque mesmo. O cara do SAMU saiu do banheiro, né? Falou: “Bom, já sei o que é, vamos remover.'
 'Muito em choque mesmo. O cara do SAMU saiu do banheiro, né? Falou: “Bom, já sei o que é, vamos remover. Pega a maca pra ele não se mexer tanto tal”. E aí levaram o Daniel, a Karina foi junto… O carro ficou lá no motel, o gerente tirou lá da vaga, acho que eles iam usar o quarto, sei lá, para outro casal e estacionou lá dentro do motel em outro lugar e ela foi com ele.'
 'E aí o Daniel explicou para Karina que, antes de qualquer relação sexual que ele tenha, ele precisa de uma estimulação anal. E aí ela ficou mais chocada ainda, porque era muito formação, muita intimidade para um namoro de dois meses e aí ela ficou sem saber o que falar no telefone ali. E ele explicou para ela que era isso, que ele não sentia atração por homens, ele não tinha desejo por homens, mas ele precisava de uma estimulação anal, era uma coisa que ele gostava para ter ereção. E a Karina ouviu tudo e ficou naquelas… Era uma coisa que talvez ele tivesse que falar antes, — Mas como ele ia falar isso também, né? “ Olha, então, a gente vai para o motel, mas eu preciso de coisinhas… [risos] Não tinha muito clima para falar. —'
 'E aí levaram o Daniel, a Karina foi junto… O carro ficou lá no motel, o gerente tirou lá da vaga, acho que eles iam usar o quarto, sei lá, para outro casal e estacionou lá dentro do motel em outro lugar e ela foi com ele. E, assim, gente, ela não sabia o que pensar, né? Porque ele tava com muita dor, ele tava muito constrangido, assim… Poxa, o cara estava com um tubo de desodorante no ânus, né?']",0.3559254748181427,1.0,0.2777777777777778,0.7458621792608406,0.6864655448152102
23,"No episódio 'desodorante', como terminou a história de amor entre Karina e Daniel?","A história de amor entre Karina e Daniel não terminou bem, mas eles continuaram a se relacionar como amigos.",Eles se casaram e tiveram dois filhos,"['A Karina e o Daniel se conheceram num aplicativo de relacionamento, então eles conversaram por vários meses assim, super apaixonados e resolveram se encontrar. — A gente está falando de uma história bem antes da pandemia. — E aí nesse primeiro encontro o Daniel levou a Karina para jantar, foi tudo lindo, maravilhoso. O Daniel muito tímido… — Ex garoto de igreja, sabe? — Ex garoto de igreja, os dois se deram muito bem e o namoro foi ali caminhando.'
 'E a questão do Daniel era mais a estimulação anal mesmo, não a penetração… E ele acabou usando o desodorante ali porque ele não tinha noção, nem queria pesquisar porque achava que “ah, como que homem faz isso?” Tem muito machismo também, um pouco de homofobia, né? Nessas questões aí… E é uma história de amor, gente. É uma história de amor que deu certo e deu muito certo, eles estão bem, eles estão felizes e se acertaram, inclusive, sexualmente ali e tudo rolou. — Agora pensa, né? —'
 'E aí o choque, gente… O Daniel estava com um tubo de desodorante, desses pequenos, tipo rollon, dentro do ânus… Ele colocou ali o desodorante e o desodorante entrou. E aí a Karina muito em choque, né? Muito em choque mesmo. O cara do SAMU saiu do banheiro, né? Falou: “Bom, já sei o que é, vamos remover.'
 'Ele ficou mal, ela ficou mal, mas era uma coisa que não dava ainda pra Karina absorver, tudo de uma vez. E aí eles continuaram ali o relacionamento deles de amizade, eles tinham se conhecido num site de relacionamento, então eles não tinham nada assim como lugares em comum, mas às vezes eles faziam coisas juntos, tipo, ir no cinema ou “vamos comer uma batata?”, sabe assim? E o Daniel gostando ainda da Karina, mas a Karina já meio desencanada por causa dessa questão.']",0.588365520089592,0.5,0.3684210526315789,0.39623862854351444,0.09905965713587861
24,"No episódio 'pneu', quem foi o responsável pelo furto das rodas do carro do Fernando?",O irmão da Helen foi o responsável pelo furto das rodas do carro do Fernando.,O irmão da Helen que mora na chácara,"['risos] — Ai, meu Deus. — Roubaram — Furtaram, né? — as rodas do carro do Fernando. E tinha outros carros lá e só o dele estava sem roda, — Como sem roda? — estava com o pneu, mas estava sem a roda… — Eu não sei explicar direito. —'
 'Aí a Helen mandou um áudio de pedido de desculpas dizendo que o irmão dela realmente furtou as rodas do carro do Fernando, e que ela estava muito chateada, que ela descobriu por acaso por uma tia dela, porque depois o pai da Helen quis ver as câmeras e viu que realmente ele tirou, resolveram deixar pra lá, não contar. — O que é errado, né? — E o pai ai parece que brigou com ele… — Mas não fez ele devolver, o correto seria sei lá, né? Fazer ele devolver. — E a Helen mandou esse áudio, pediu perdão, quer voltar e o Fernando tá tão bravo que ele cogita fazer o boletim de ocorrência, porque ele tem esse áudio da Helen, e ele não quer voltar, porque falou que ela acabou com ele, nossa, no negócio do Instagram lá.'
 'Sei lá. — Enfim, gente, roubaram o negócio do carro dele que é um negócio caro e deixaram os pneuzinhos lá, e aí ele falou: “Não, gente, não é possível”, não é possível, ele tinha passado lá que ele falou um negocinho lá, o produtinho nas rodas antes, antes de ir pra lá, né? Então assim, não tinha como ele ter sido furtado em outro lugar, ele chegou lá ele ainda apertou o alarme do carro e, automaticamente, deu uma olhada geral no carro, as rodas estavam lá, o negócio lá… — O enfeite, sei lá, o quê que é da roda. — Estava lá e aí a hora que ele viu, ele falou: “Não, gente, não é possível”.'
 'as rodas do carro do Fernando. E tinha outros carros lá e só o dele estava sem roda, — Como sem roda? — estava com o pneu, mas estava sem a roda… — Eu não sei explicar direito. — Mas assim, ele falou que tirou lá uma parte do pneu, ficou só… — Eu acho que a calota? Sei lá. —']",0.4200268679633074,1.0,0.14285714285714285,0.7448443147388358,0.686211078684709
25,"No episódio 'pneu', por que o Fernando não conseguiu ver as câmeras da chácara?",O Fernando não conseguiu ver as câmeras da chácara porque elas estavam no portão fechado e ele não sabia que estavam lá.,Porque as pessoas no churrasco começaram a se sentir ofendidas e a Helen pediu para ele ir embora,"['Detalhe, a chácara cheia de câmera, então, além do portão fechado as câmeras. Que o Fernando chega lá no carro dele, gente, cadê as rodas? [ risos] — Ai, meu Deus. — Roubaram — Furtaram, né? — as rodas do carro do Fernando.'
 'Eu não sei dizer, gente, eu acho que, sei lá, a pessoa que furta assim na cara larga, não é na frente de todo mundo, mas assim, sabendo que o negócio vai dar problema, porque não tem como ele não ver, né? Eu não sei, e se esse cara for perigoso? Não dá pra saber, né? Acho que ele já tá sem isso daí, já perdeu essa roda, pneu, sei lá o que é isso, já perdeu, fazer B.O.? Não sei, eu não faria, mas eu entendo a raiva do Fernando, eu entendo e de tudo.'
 'Aí a Helen mandou um áudio de pedido de desculpas dizendo que o irmão dela realmente furtou as rodas do carro do Fernando, e que ela estava muito chateada, que ela descobriu por acaso por uma tia dela, porque depois o pai da Helen quis ver as câmeras e viu que realmente ele tirou, resolveram deixar pra lá, não contar. — O que é errado, né? — E o pai ai parece que brigou com ele… — Mas não fez ele devolver, o correto seria sei lá, né? Fazer ele devolver. — E a Helen mandou esse áudio, pediu perdão, quer voltar e o Fernando tá tão bravo que ele cogita fazer o boletim de ocorrência, porque ele tem esse áudio da Helen, e ele não quer voltar, porque falou que ela acabou com ele, nossa, no negócio do Instagram lá.'
 'E aí agora quando foi mês passado que ele tá lá olhando o Instagram do cunhado, o cunhado postou uma foto do carro com as rodas do Fernando. — E, gente, assim… Falar de carro pra mim é uma coisa como falar sei lá de um ET, eu não entendo absolutamente nada, então eu posso estar falando aqui alguma coisa errada, mas enfim… — Ele viu no carro lá, no pneu, sei lá, o que era do carro dele, e ficou passado, possesso, possesso, chamou a Helen, mostrou, pegou foto do carro dele pra mostrar que era igual e a Helen bateu o pé e falou: “Não, isso aí é do carro do meu irmão, se tá no carro dele, ele comprou, você tá chamando o meu irmão de ladrão? De isso, de aquilo?”. E aí, gente, eles terminaram por conta disso, a Helen foi embora pra casa dela, fez textão no Facebook… — Olha, acabou com ele, arrasou o Fernando”. E aí agora tem umas duas semanas, a Helen mandou uma mensagem pra ele que queria conversar com ele, aí ele falou: “Olha, manda áudio, não vou ligar a câmera, não tô afim de falar com você, não”. —']",0.5084254128906447,0.3333333333333333,0.3,0.4152110254720874,0.10380275636802185
26,"No episódio 'pneu', o que o Fernando cogita fazer após receber o áudio de pedido de desculpas da Helen?",O Fernando cogita fazer o boletim de ocorrência.,Fazer o boletim de ocorrência,"['E a Helen mandou esse áudio, pediu perdão, quer voltar e o Fernando tá tão bravo que ele cogita fazer o boletim de ocorrência, porque ele tem esse áudio da Helen, e ele não quer voltar, porque falou que ela acabou com ele, nossa, no negócio do Instagram lá. E ele gostaria de saber de vocês se ele faz ou não esse boletim de ocorrência.'
 'Aí a Helen mandou um áudio de pedido de desculpas dizendo que o irmão dela realmente furtou as rodas do carro do Fernando, e que ela estava muito chateada, que ela descobriu por acaso por uma tia dela, porque depois o pai da Helen quis ver as câmeras e viu que realmente ele tirou, resolveram deixar pra lá, não contar. — O que é errado, né? — E o pai ai parece que brigou com ele… — Mas não fez ele devolver, o correto seria sei lá, né? Fazer ele devolver. — E a Helen mandou esse áudio, pediu perdão, quer voltar e o Fernando tá tão bravo que ele cogita fazer o boletim de ocorrência, porque ele tem esse áudio da Helen, e ele não quer voltar, porque falou que ela acabou com ele, nossa, no negócio do Instagram lá.'
 'E o pai ai parece que brigou com ele… — Mas não fez ele devolver, o correto seria sei lá, né? Fazer ele devolver. — E a Helen mandou esse áudio, pediu perdão, quer voltar e o Fernando tá tão bravo que ele cogita fazer o boletim de ocorrência, porque ele tem esse áudio da Helen, e ele não quer voltar, porque falou que ela acabou com ele, nossa, no negócio do Instagram lá. E ele gostaria de saber de vocês se ele faz ou não esse boletim de ocorrência.'
 'Não sei, eu não faria, mas eu entendo a raiva do Fernando, eu entendo e de tudo. Eu nem vou comentar aqui as coisas que a Helen falou pra ele, mas né, assim, arrasou com ele e ele terminou, não quer mais saber, tá na razão dele. Mas, ai, gente, fazer B.O.? Ele tem esse áudio de prova que é o áudio da Helen explicando exatamente como aconteceu e, não sei, gente, o que vocês acham? Eu, por mim, não faz, deixa pra lá, já foi, sabe?']",0.0,1.0,0.1875,0.8188231838329593,0.7047057959582398
27,"No episódio 'cocada', quem é a protagonista da história contada?",A protagonista da história contada é Dona Nair.,A dona Nair,"['Assinante 2: Bom dia, gente, aqui quem fala é Paula de São Paulo. Eu acabei de ouvir a história “Cocadas” e acho que não tem jeito melhor de começar o dia. Que história maravilhosa ver esse casal podendo curtir a vida, conhecer um monte de coisa, viajar, se divertir… Tudo graças as cocadas e a caipirinha de caju de dona Nair. E essa mulher que é incrível, né? Super correta e ainda pode tirar uma grana extra dando palestras de técnicos de vendas, dando mentoria para outros comerciantes lá, porque cava as oportunidades, vai atrás… Achei muito maravilhosa.'
 'Assinante 1: Oie, Adriele do Rio de Janeiro aqui. E eu amei a história da dona Nair e do seu Jovelino. [ risos] Dona Nair melhor empreendedora que nós temos, viu ali um nicho, [risos] vender cocada para maconheiros. Acertou muito… Acertou muito, dona Nair… [risos] Conseguiu reformar a casa inteira nessa. Perfeita.'
 'Que história maravilhosa ver esse casal podendo curtir a vida, conhecer um monte de coisa, viajar, se divertir… Tudo graças as cocadas e a caipirinha de caju de dona Nair. E essa mulher que é incrível, né? Super correta e ainda pode tirar uma grana extra dando palestras de técnicos de vendas, dando mentoria para outros comerciantes lá, porque cava as oportunidades, vai atrás… Achei muito maravilhosa.'
 'E aí um dia ela foi no mercado comprar mais açúcar e tal, já era noite e ela passou num lugar que ela viu vários jovens… E, pelo cheiro, eles estavam [risos] fumando maconha. E ela não lembra quem tinha falado para ela que pessoas que fumam maconha comem muito doce. E aí, o que que Dona Nair fez? [ risos] Dona Nair voltou correndo pra casa, pegou as cocadas dela, colocou num cesto e foi pra esse lugar onde ela viu os jovens que estavam fumando maconha, oferecer cocada.']",0.6815482514332679,1.0,0.058823529411764705,0.6090495186013449,0.6522623796503362
28,"No episódio 'cocada', qual foi a atividade que a dona Nair escolheu para se sentir útil?",A atividade que a dona Nair escolheu para se sentir útil foi distribuir cocadas entre os vizinhos e familiares.,Fazer cocada,"['Assinante 2: Bom dia, gente, aqui quem fala é Paula de São Paulo. Eu acabei de ouvir a história “Cocadas” e acho que não tem jeito melhor de começar o dia. Que história maravilhosa ver esse casal podendo curtir a vida, conhecer um monte de coisa, viajar, se divertir… Tudo graças as cocadas e a caipirinha de caju de dona Nair. E essa mulher que é incrível, né? Super correta e ainda pode tirar uma grana extra dando palestras de técnicos de vendas, dando mentoria para outros comerciantes lá, porque cava as oportunidades, vai atrás… Achei muito maravilhosa.'
 'E uma coisa que dona Nair gostava muito de fazer era cocada. Ela amava fazer cocada e distribuir ali entre os vizinhos e os familiares. E ela começou a fazer cocada… Cocada é uma coisa que é barata de se fazer, né? Então, na região que dona Nair mora, o coco é barato. Então ela comprava o coco, ralava… — E é coco, açúcar e água. —'
 'E aí, o que que Dona Nair fez? [ risos] Dona Nair voltou correndo pra casa, pegou as cocadas dela, colocou num cesto e foi pra esse lugar onde ela viu os jovens que estavam fumando maconha, oferecer cocada.'
 'Que história maravilhosa ver esse casal podendo curtir a vida, conhecer um monte de coisa, viajar, se divertir… Tudo graças as cocadas e a caipirinha de caju de dona Nair. E essa mulher que é incrível, né? Super correta e ainda pode tirar uma grana extra dando palestras de técnicos de vendas, dando mentoria para outros comerciantes lá, porque cava as oportunidades, vai atrás… Achei muito maravilhosa.']",0.4974691838187637,1.0,0.3125,0.45745980180421886,0.4893649504510547
29,"No episódio 'cocada', o que a dona Nair e o seu Jovelino começaram a vender na praia?",Cocada e caipirinha de caju.,Caipirinha de caju,"['E aí o seu Jovelino aposentou e ficaram os dois em casa… E os dois um olhando pra cara do outro, como diz dona Nair, [risos] você começa a não suportar o outro, né? O dia inteiro em casa… E aí eles moram numa cidade turística, numa cidade de praia e que vai muito estrangeiro, assim. E aí o seu Jovelino falou: “Mulher, vamos aproveitar essa sua habilidade de venda aí”. Eles, com alguns cajueiros em casa, começaram a fazer caipirinha de caju pra vender pra estrangeiro na praia. — Gente… — E aí só de caju não ia suprir, eles começaram a comprar outras frutas e começaram a vender caipirinha na praia.'
 'E aí o seu Jovelino falou: “Mulher, vamos aproveitar essa sua habilidade de venda aí”. Eles, com alguns cajueiros em casa, começaram a fazer caipirinha de caju pra vender pra estrangeiro na praia. — Gente… — E aí só de caju não ia suprir, eles começaram a comprar outras frutas e começaram a vender caipirinha na praia. Só que, assim, o seu Jovelino aposentado, a casa toda reformadinha, eles não tinham onde gastar o dinheiro que eles estavam ganhando ali na praia.'
 'Casinha reformada pelas cocadas, de vez em quando ainda a dona Nair faz cocada também e leva pra praia… Ó como ela é esperta… Bota na embalagem, assim, bota ali uma bandeirinha do Brasil… [risos] — Que ela falou que estrangeiro ama, e aí vende as cocadas. —'
 'E ela começou a fazer cocada… Cocada é uma coisa que é barata de se fazer, né? Então, na região que dona Nair mora, o coco é barato. Então ela comprava o coco, ralava… — E é coco, açúcar e água. — E aí ela foi fazendo cocada, só que, assim, a vizinhança e os familiares [risos] eles não aguentavam mais comer cocada, porque ela fazia muita cocada. E aí uma vizinha dela falou: “Por que você não vende?']",0.44019947126999764,1.0,0.25,0.8220876265726735,0.20552190664316838
30,"No episódio 'pinduca', quem é a roteirista da primeira temporada do podcast “Aliados Pelo Respeito”?",A roteirista da primeira temporada do podcast “Aliados Pelo Respeito” é Déia Freitas.,Déia Freitas,"['Déia Freitas: Oi, gente, cheguei. Cheguei pra mais um Picolé de Limão, mas antes da história eu queria contar uma coisa pra vocês. Vocês lembram que eu comentei que eu estava fazendo uns roteiros de dramatização num projeto e que era algo punk assim, intenso, que foi um trampo foda e tal. Então, eu sou a roteirista da primeira temporada do podcast “Aliados Pelo Respeito” que é um projeto do Bradesco e o objetivo do projeto é promover a diversidade, e ali a gente vai abordar temas de cuidar de gênero, universo LGBTQIA+, puts, várias coisas, questões importantes ali pra pessoas com deficiência, diversidade étnica, enfim. E eu venho nessa primeira temporada roteirizando a história de quatro mulheres, quatro mulheres, assim, incríveis, e são mulheres que sofreram assédio, — São depoimentos assim, gente, fortes pra caramba — e, sabe, muito corajosos, assim, são dramatizações que tem bastante gatilho e tal.'
 'Vocês lembram que eu comentei que eu estava fazendo uns roteiros de dramatização num projeto e que era algo punk assim, intenso, que foi um trampo foda e tal. Então, eu sou a roteirista da primeira temporada do podcast “Aliados Pelo Respeito” que é um projeto do Bradesco e o objetivo do projeto é promover a diversidade, e ali a gente vai abordar temas de cuidar de gênero, universo LGBTQIA+, puts, várias coisas, questões importantes ali pra pessoas com deficiência, diversidade étnica, enfim. E eu venho nessa primeira temporada roteirizando a história de quatro mulheres, quatro mulheres, assim, incríveis, e são mulheres que sofreram assédio, — São depoimentos assim, gente, fortes pra caramba — e, sabe, muito corajosos, assim, são dramatizações que tem bastante gatilho e tal.'
 'E aí tem toda a minha experiência também, minha nova experiência de passar texto com uma atriz bacana, que foi a Naruna Costa e, nossa, foi incrível trocar com ela assim, além de passar o texto a gente conversou sobre, né? As histórias de assédio, e como que acontece, muita coisa que a gente viu ali nas dramatizações são coisas que a gente até passou, uma coisa ou outra, e a gente nem se toca, “Puts, isso é assédio”, sabe? Eu vou deixar aqui na descrição o link do primeiro episódio e eu espero que vocês ouçam, né? Eu acho que é uma bola aí que a gente tem que levantar. Bom, [suspiro] é isso, melhor turma de roteiro, melhor publi, obrigada Bradesco aí pelo convite.'
 'E eu venho nessa primeira temporada roteirizando a história de quatro mulheres, quatro mulheres, assim, incríveis, e são mulheres que sofreram assédio, — São depoimentos assim, gente, fortes pra caramba — e, sabe, muito corajosos, assim, são dramatizações que tem bastante gatilho e tal.']",0.573883436769425,1.0,0.21428571428571427,0.3549830199837499,0.8387457549959375
31,"No episódio 'pinduca', qual é o nome do cachorro que morreu na história contada?",O nome do cachorro que morreu na história contada é Pinduca.,Pinduca,"['Mas se a Amanda perdoou, tá tudo certo, eu coloquei no Picolé de Limão porque não tem como entrar no Amor nas Redes uma história de cachorro no freezer, né? Então foi mais essa questão. Mas então é isso, gente, deixem seus recados pra Amanda lá no grupo, sejam gentis, está tudo resolvido e ninguém machucou o Pinduca. O Pinduca faleceu de causas naturais, e é isso. Um beijo.'
 'Não é uma história de maus-tratos, tá, gente? Fica tranquilo porque eu nem contaria aqui. — A Amanda tinha um cachorrinho de dezesseis anos chamado Pinduca, e o Pinduca ele tinha já problema do coração, já estava velhinho e ela começou a namorar, e ali cuidando do Pinduca e tal. Quando ela estava namorando há uns sete, oito meses, o Pinduquinha faleceu, Pinduquinha levou uma vida ótima, Pinduquinha fez tudo que tinha que fazer como cãozinho, foi muito bem tratado e faleceu. Só que a gente que tem bicho sabe, é um baque, né? —'
 'Ele não fez nada, ela não fez nada, o cachorro faleceu porque ele tinha problemas cardíacos e estava bem idoso. Mas poxa, você embrulhar o cachorro num plástico e botar no freezer da sua mãe, vamos combinar que, né? É quase um filme de terror. Mas no final deu certo, cremaram o Pinduca, o Pinduca está lá no quarto da Amanda e tá tudo certo. Mas eu achei bizarro, porque assim, é uma história… Falei “Poxa, eu não posso pôr no “Patada” porque a gente não vai tá falando de funeral de cachorro em si, a gente tá falando uma sacanagem que um cara fez pra usar o dinheiro, que diz a Amanda que o Reginaldo já devolveu pra mãe dele, então ele mesmo que acabou devolvendo, né?'
 'A Amanda tinha um cachorrinho de dezesseis anos chamado Pinduca, e o Pinduca ele tinha já problema do coração, já estava velhinho e ela começou a namorar, e ali cuidando do Pinduca e tal. Quando ela estava namorando há uns sete, oito meses, o Pinduquinha faleceu, Pinduquinha levou uma vida ótima, Pinduquinha fez tudo que tinha que fazer como cãozinho, foi muito bem tratado e faleceu. Só que a gente que tem bicho sabe, é um baque, né? — É um baque, eu já passei por isso várias vezes, é sempre uma dor enorme, é sempre horrível, mas eu não sou o tipo de pessoa que faz funeral pra cachorro, respeito quem faz, quem acha que tem que fazer, mas eu não sou, eu não faço. —']",0.11083471211073169,1.0,0.19047619047619047,0.48985299187227943,0.8724632479680698
32,"No episódio 'pinduca', o que o Reginaldo fez com o corpo do Pinduca em vez de cremá-lo?","O Reginaldo levou o Pinduca para cremar e, após cerca de 15 a 20 dias, entregou as cinzas para a Amanda em uma urna.",Guardou no freezer da mãe dele,"['Pra cremar Pinduquinha e ela ficar com as cinzas. Só que ela não estava com cabeça, não estava com estrutura, o Pinduca realmente era um ser muito importante pra ela, e ela deu esta função de levar o Pinduquinha até o lugar que crema e depois de um tempo buscar as cinzas do Pinduquinha para o namorado dela, o Reginaldo. E beleza, o Reginaldo, né? Viu que a Amanda não estava bem e falou: “Bom, eu faço, claro”, e aí levou o Pinduca pra cremar e depois ali de uns quinze dias, vinte dias, ele apareceu com uma urna, com o Pinduquinha, as cinzas, os restos mortais de Pinduquinha e entregou pra Amanda. E a Amanda pôs o Pinduquinha ali num lugar no quarto dela, as cinzas do Pinduca e ficou lá no móvel dela, e mais um tempo se passou.'
 'O Reginaldo estava precisando do dinheiro, estava encalacrado de dívida, e aí o quê que ele fez? Ele podia ter jogado o Pinduca no mato, — Diz ele — mas ele queria se estabilizar financeiramente pra poder realmente cremar o Pinduca e trocar a urna que ele tinha dado pra Amanda com cinza de churrasco. Ele queria ter um tempo pra se recuperar financeiramente pra poder cremar o Pinduca, levar pra cremar e pagar, porque ele usou o dinheiro.'
 'E aí cremaram o Pinduca, ela pegou as cinzas do Pinduca e eles ficaram separados alguns meses e ele implorando pra ela perdoar, pra voltar, e aí ela perdoou e voltou com o Reginaldo, e eles estão juntos até hoje e ela perdoou real e tal. Porque ela entendeu que ele tinha a intenção futura de cremar o Pinduca… — Porque ele realmente podia ter jogado o Pinduca em qualquer lugar se ele fosse mais mau caráter, apesar que eu acho que o que ele fez assim, pra mim seria imperdoável. Pra mim seria imperdoável, sabe? É uma coisa que jamais a gente pensou aqui nesse podcast, que até o cadáver do nosso cachorro, a gente tem que a gente mesmo se… Como é que se diz? Se certificar de que realmente ele foi levado pra cremar e que você não tá com uma urna cheia de carvão de churrasqueira, porque seu namorado estava precisando do dinheiro. —'
 'E beleza, o Reginaldo, né? Viu que a Amanda não estava bem e falou: “Bom, eu faço, claro”, e aí levou o Pinduca pra cremar e depois ali de uns quinze dias, vinte dias, ele apareceu com uma urna, com o Pinduquinha, as cinzas, os restos mortais de Pinduquinha e entregou pra Amanda. E a Amanda pôs o Pinduquinha ali num lugar no quarto dela, as cinzas do Pinduca e ficou lá no móvel dela, e mais um tempo se passou. E aí agora a história vai ficar bizarra.']",0.5774850587714828,1.0,0.3888888888888889,0.2515818158709323,0.06289545396773308
33,"No episódio 'bisnaguinha', quem era o namorado controlador do Júlio?",O namorado controlador do Júlio era o Otávio.,Otávio,"['Foi pra casa de Arnaldo e Arnaldo recebeu ele muito bem, ele ficou lá um tempo na casa do Arnaldo e, nesse tempo, eles se conheceram melhor e eles começaram a namorar, Arnaldo e nosso amigo Júlio. E aí era outra coisa, né? Ele podia comer bisnaguinha, [risos] podia comer o que ele quisesse, uma relação normal. Aí sim, né? Uma relação saudável, mesmo que ele comesse batata frita — Sempre — era saudável.'
 'Depois das ofensas em relação ao corpo do Júlio, vieram as ameaças do tipo “Eu não gosto de namorar urso, eu não vou ficar com você se você continuar desse jeito”, depois das ameaças de romper, de ficar com outra pessoa, ele apontava outros caras com corpos mais parecidos com do Otávio que seriam ideais pra namorar com ele e não o Júlio. E aí o Júlio com a autoestima toda cagada foi aguentando isso, foi aguentando e não conseguia sair dessa relação abusiva, né? E chorava e comia bisnaguinha escondido, uma coisa péssima, mas ele gostava desse Otávio aí. E assim, enquanto ele estava namorando com o Otávio, ele conheceu alguns amigos do Otávio, entre os amigos do Otávio tinha um em especial. — Que a gente vai chamar de Arnaldo — Tinha o Arnaldo e o Arnaldo via aquilo e falava: “Júlio, por que você fica com ele?'
 'E aí ele pegou as coisas dele e foi pra onde? — Pra casa de Arnaldo. — Foi pra casa de Arnaldo e Arnaldo recebeu ele muito bem, ele ficou lá um tempo na casa do Arnaldo e, nesse tempo, eles se conheceram melhor e eles começaram a namorar, Arnaldo e nosso amigo Júlio. E aí era outra coisa, né? Ele podia comer bisnaguinha, [risos] podia comer o que ele quisesse, uma relação normal.'
 'E chorava e comia bisnaguinha escondido, uma coisa péssima, mas ele gostava desse Otávio aí. E assim, enquanto ele estava namorando com o Otávio, ele conheceu alguns amigos do Otávio, entre os amigos do Otávio tinha um em especial. — Que a gente vai chamar de Arnaldo — Tinha o Arnaldo e o Arnaldo via aquilo e falava: “Júlio, por que você fica com ele? Eu gosto do Otávio, ele é meu amigo, mas como namorado ele é péssimo, olha o que ele tá fazendo com você, que isso que aquilo”, mas o Júlio ficava quieto e tal.']",0.5033301278955057,1.0,0.2777777777777778,0.5670973844506366,0.6417743461126592
34,"No episódio 'bisnaguinha', por que o Júlio não podia comer bisnaguinha em casa do Otávio?","O Júlio não podia comer bisnaguinha em casa do Otávio porque o Otávio não permitia que ele trouxesse coisas suas para a casa, como um pacote de bisnaguinha.",Porque o Otávio não aceitava que o Júlio comesse alimentos processados e gordurosos,"['Quando Júlio foi morar com o Otávio, ele que foi morar na casa do Otávio, ele já não podia, por exemplo, a casa era do Otávio, mas se ele chamou o Júlio pra morar, poxa, o cara também tem que ter algumas coisas dele, né? Então, por exemplo, se ele quisesse comprar um pacote de bisnaguinha. — [ risos] Ai, gente, eu não aceito isso, sabe? A pessoa não deixar o outro levar um pacote de bisnaguinha pra casa? Sabe, Júlio, você achou que realmente ia ter futuro com um cara que não te deixa levar um pacote de bisnaguinha pra casa?'
 'O Júlio em choque, em choque, aproveitando também pra comer tudo que ele podia, [risos] resolveu que ele não ia enfrentar o Otávio, ia esperar o Otávio voltar, não ia lá no flat esperar o Otávio voltar e falar que sabia. Só que, nesse dia que eles conversaram, ele achou que o Arnaldo olhou pra ele diferente, o Arnaldo falou muito bem dele, o Arnaldo foi muito assim legal com ele, mas não era só isso assim, parecia que tinha mais coisa e aí ele já ficou pensando no Arnaldo… — Ai, meu Deus, ê, Júlio, né? Também precisa trabalhar essa autoestima porque nem saiu do Otávio ainda já tá de paixonite. — E aí ele esperou o Otávio voltar e confrontou… — Detalhe… — Ele comprou um pacote de bisnaguinha e deixou lá. — Eu ia colocar o título dessa história de maromba, mas eu acho que eu vou pôr bisnaguinha, porque bisnaguinha é muito símbolo dessa história? —'
 'E o Otávio inicialmente nunca falou que isso seria um problema, né? E eles estavam se curtindo, estava tudo certo, e o relacionamento foi fluindo até que eles decidiram morar juntos, e aí as coisas começaram a mudar. Quando Júlio foi morar com o Otávio, ele que foi morar na casa do Otávio, ele já não podia, por exemplo, a casa era do Otávio, mas se ele chamou o Júlio pra morar, poxa, o cara também tem que ter algumas coisas dele, né? Então, por exemplo, se ele quisesse comprar um pacote de bisnaguinha. — [ risos] Ai, gente, eu não aceito isso, sabe?'
 'Foi morar lá no quarto de hóspedes e até que estava tudo certo, porque ali não podia falar das bisnaguinhas do Júlio, né? Não podia restringir nada. Um detalhe, como ele estava na casa do Arnaldo, obviamente, todos os comportamentos abusivos que ele tinha com o Júlio ele não apresentava. — Mas na minha opinião, é porque ele estava em outro ambiente, ele não estava no ambiente dele, mas para o Júlio… — Mas para o Júlio ele mudou. E aí vem a pior parte da história, o Júlio [suspiro] está voltando a se apaixonar pelo Otávio. —']",0.6671693878738343,0.6666666666666666,0.18181818181818182,0.5979976199638797,0.3637851192766842
35,"No episódio 'bisnaguinha', por que o Júlio estava reconsiderando voltar com o Otávio?","O Júlio estava reconsiderando voltar com o Otávio porque ele achou que o Arnaldo olhou pra ele diferente e foi muito legal com ele, e aí ele já ficou pensando no Arnaldo, mas acabou voltando a se apaixonar pelo Otávio.",Porque o Otávio estava dando mole para ele e ele se sentia atraído novamente,"['O Júlio em choque, em choque, aproveitando também pra comer tudo que ele podia, [risos] resolveu que ele não ia enfrentar o Otávio, ia esperar o Otávio voltar, não ia lá no flat esperar o Otávio voltar e falar que sabia. Só que, nesse dia que eles conversaram, ele achou que o Arnaldo olhou pra ele diferente, o Arnaldo falou muito bem dele, o Arnaldo foi muito assim legal com ele, mas não era só isso assim, parecia que tinha mais coisa e aí ele já ficou pensando no Arnaldo… — Ai, meu Deus, ê, Júlio, né? Também precisa trabalhar essa autoestima porque nem saiu do Otávio ainda já tá de paixonite. — E aí ele esperou o Otávio voltar e confrontou… — Detalhe… — Ele comprou um pacote de bisnaguinha e deixou lá. — Eu ia colocar o título dessa história de maromba, mas eu acho que eu vou pôr bisnaguinha, porque bisnaguinha é muito símbolo dessa história? —'
 'Foi morar lá no quarto de hóspedes e até que estava tudo certo, porque ali não podia falar das bisnaguinhas do Júlio, né? Não podia restringir nada. Um detalhe, como ele estava na casa do Arnaldo, obviamente, todos os comportamentos abusivos que ele tinha com o Júlio ele não apresentava. — Mas na minha opinião, é porque ele estava em outro ambiente, ele não estava no ambiente dele, mas para o Júlio… — Mas para o Júlio ele mudou. E aí vem a pior parte da história, o Júlio [suspiro] está voltando a se apaixonar pelo Otávio. —'
 'Depois das ofensas em relação ao corpo do Júlio, vieram as ameaças do tipo “Eu não gosto de namorar urso, eu não vou ficar com você se você continuar desse jeito”, depois das ameaças de romper, de ficar com outra pessoa, ele apontava outros caras com corpos mais parecidos com do Otávio que seriam ideais pra namorar com ele e não o Júlio. E aí o Júlio com a autoestima toda cagada foi aguentando isso, foi aguentando e não conseguia sair dessa relação abusiva, né? E chorava e comia bisnaguinha escondido, uma coisa péssima, mas ele gostava desse Otávio aí. E assim, enquanto ele estava namorando com o Otávio, ele conheceu alguns amigos do Otávio, entre os amigos do Otávio tinha um em especial. — Que a gente vai chamar de Arnaldo — Tinha o Arnaldo e o Arnaldo via aquilo e falava: “Júlio, por que você fica com ele?'
 'Um detalhe, como ele estava na casa do Arnaldo, obviamente, todos os comportamentos abusivos que ele tinha com o Júlio ele não apresentava. — Mas na minha opinião, é porque ele estava em outro ambiente, ele não estava no ambiente dele, mas para o Júlio… — Mas para o Júlio ele mudou. E aí vem a pior parte da história, o Júlio [suspiro] está voltando a se apaixonar pelo Otávio. — Gente, eu não consigo entender, não consigo entender — e o Otávio tá dando mole pra ele, tudo isso dentro da casa do Arnaldo. — Que eu acho uma falta de respeito com o cara que abrigou os dois, eu falei isso para o Júlio, falei: “Júlio, eu vou contar a sua história, mas eu acho que você tá errando demais”. —']",0.4951347864715445,1.0,0.17391304347826086,0.5717875372750633,0.3304468843187658
36,"No episódio 'chato', quem era o rapaz que montou a balada em Pôneilópolis?","O rapaz que montou a balada em Pôneilópolis era o dono da balada, um jovem de 23 anos, filho de uma família rica.",Um rapaz lindo e arrogante que veio da cidade grande.,"['Então, na cidade ali da Regiane não tinha um shopping, não tinha balada… Tinha alguns bares e algumas pessoas que faziam festas, assim, em chácaras… E as festas bombavam e tal. E aí, de repente, chegou na cidade uma família pra montar a primeira baladinha de Pôneilópolis. — Imagina a cidade como ficou, né? — [ efeito sonoro de palmas e pessoas gritando felizes] A cidade ficou, assim, empolgada… Todo mundo querendo saber que baladinha era essa. — De Pôneilópolis. —'
 'E aí até dar tudo certo, até implementar ali a balada esse rapaz estava pela cidade. — Então, às vezes de domingo ele aparecia com o carro dele na praça, mas ele evitava muito contato, assim ,como as pessoas da cidade… E todo mundo ficava “ai, nossa, ele é meio insuportável e nã nã nã, que chato, que isso, que aquilo”. Só que, numa das vezes que ele passou pela praça, ele deu uma olhadinha pra Regiane. E aí a Regiane falou: “Não, imagina… Esse cara aí da cidade grande… Todo bonito… Não tá olhando pra mim”. e passou…'
 'Tinha um carro de luxo… Era uma família rica… — E que foi pra lá pra montar essa balada e ficar um tempo. E aí o tio ia ficar cuidando dessa balada e eles iam pra outro lugar, montar outra coisa… Era assim que a família vivia, ia montando negócios assim de balada nas cidades pequenas. E aí até dar tudo certo, até implementar ali a balada esse rapaz estava pela cidade. — Então, às vezes de domingo ele aparecia com o carro dele na praça, mas ele evitava muito contato, assim ,como as pessoas da cidade… E todo mundo ficava “ai, nossa, ele é meio insuportável e nã nã nã, que chato, que isso, que aquilo”. Só que, numa das vezes que ele passou pela praça, ele deu uma olhadinha pra Regiane.'
 'Regiane era uma das moças que estava ali, né? Só de olho ali no bonitão dono da balada. — O rapaz devia ter ali os seus 23 anos. — Mas ele era bem, bem, bem arrogante mesmo. Tinha um carro de luxo… Era uma família rica… — E que foi pra lá pra montar essa balada e ficar um tempo.']",0.2565803275331157,1.0,0.23809523809523808,0.6027364047701763,0.15068410119254408
37,"No episódio 'chato', o que aconteceu com a Regiane após seu encontro com o rapaz?","Após o encontro com o rapaz, Regiane descobriu que havia contraído um piolho chamado Chato, que a fez ficar desesperada e entrar embaixo do chuveiro.",Ela contraiu um bichinho chamado Chato após o encontro.,"['E aí ela começou a ficar desesperada, desesperada, entrou embaixo do chuveiro e aquela calça dela cheia de bichinho também… — Gentes, vocês não vão acreditar… — Esse rapaz bonito, arrogante, esnobe, tinha passado chato… — Um bichinho chamado Chato pra Regiane. —'
 'E aí até dar tudo certo, até implementar ali a balada esse rapaz estava pela cidade. — Então, às vezes de domingo ele aparecia com o carro dele na praça, mas ele evitava muito contato, assim ,como as pessoas da cidade… E todo mundo ficava “ai, nossa, ele é meio insuportável e nã nã nã, que chato, que isso, que aquilo”. Só que, numa das vezes que ele passou pela praça, ele deu uma olhadinha pra Regiane. E aí a Regiane falou: “Não, imagina… Esse cara aí da cidade grande… Todo bonito… Não tá olhando pra mim”. e passou…'
 'Aquela coceira. — Ela estava com uma blusa, assim, estampada de florzinha, calça jeans… E aí quando ela tirou a calça jeans, assim, que ela foi tomar banho, ela olhou dentro da calça jeans e viu como se fosse, assim, uns piolhinhos. — Uns piolhinhos, gente… — E aí ela olhou, assim, dentro da calcinha dela e tava cheio de piolho… E ela nunca tinha visto daquele piolho. — Porque Regiane teve Piolho na infância… — E aquele era diferente, parecia quase que um carrapatinho. E aí ela começou a ficar desesperada, desesperada, entrou embaixo do chuveiro e aquela calça dela cheia de bichinho também… — Gentes, vocês não vão acreditar… — Esse rapaz bonito, arrogante, esnobe, tinha passado chato… — Um bichinho chamado Chato pra Regiane. —'
 'Uns piolhinhos, gente… — E aí ela olhou, assim, dentro da calcinha dela e tava cheio de piolho… E ela nunca tinha visto daquele piolho. — Porque Regiane teve Piolho na infância… — E aquele era diferente, parecia quase que um carrapatinho. E aí ela começou a ficar desesperada, desesperada, entrou embaixo do chuveiro e aquela calça dela cheia de bichinho também… — Gentes, vocês não vão acreditar… — Esse rapaz bonito, arrogante, esnobe, tinha passado chato… — Um bichinho chamado Chato pra Regiane. —']",0.16517467633746097,0.5,0.29411764705882354,0.6311397207851572,0.5327849301962893
38,"No episódio 'chato', por que o rapaz bonito foi embora de Pôneilópolis?","O rapaz bonito, Gersinho, foi embora de Pôneilópolis porque a Cassandra, seu pai, não queria assumir a paternidade e tratou ele e a mãe dele, Leide, muito mal.",Ele não aguentou a pressão da cidade pequena após descobrirem que ele tinha Chato.,"['Só que a Leide não falou nada, Cassandra também seguiu a vida e agora ela estava voltando ali porque o garotinho queria conhecer o pai e, no caso, o pai era Cassandra. Gente, o garotinho é o Gersinho e ele é a coisa mais fofa desse mundo, ele é um garotinho ótimo, assim, ótimo mesmo. E aí Cassandra fica meio sem acreditar assim, puta da vida, ela recebe a Leide e o garotinho bem mal, e aí ela fala que eles precisam ir embora e tal, que ela não quer ser pai de ninguém, que ela não vai assumir nada, enfim. E aí o garotinho olha pra ela e fala assim, — Alguma coisa do tipo assim — “Eu vou deixar o meu endereço com você”, e aí ele faz um desenho na mão da Cassandra e vai embora com a mãe. E aí nesse ponto a gente descobre que a Leide e o Gersinho eles estão morando num carro velho, que era um carro da Leide, o carro tá parado embaixo de um viaduto e é lá que eles moram, então na mão na Cassandra o Gersinho desenhou um carro e colocou o nome da rua.'
 'E aí ele vai, bate lá na porta e a Cassandra trata o Gersinho super mal e fala: “Não, vou te levar pra sua mãe porque não tem lugar pra vocês na minha vida, e nã nã nã”, e leva, pega o Gersinho e leva ele de volta pra Leide.'
 'E aí como a Cassandra não aparece, o Gersinho já sabia o caminho, né? Agora da casa dela e resolve ir atrás dela, sem avisar a Leide. E aí ele vai, bate lá na porta e a Cassandra trata o Gersinho super mal e fala: “Não, vou te levar pra sua mãe porque não tem lugar pra vocês na minha vida, e nã nã nã”, e leva, pega o Gersinho e leva ele de volta pra Leide.'
 'E aí nessa noite a Cassandra não aparece, eles dormem no carro, então eles têm um esquema, eles colocam o celular ali pra despertar, e aí a Leide acorda e o Gersinho dorme, porque um tem que ficar vigiando, porque é super perigoso, né? — E, gente, é muito sofrido, é muito sofrido ver aqueles dois no carro assim, na hora eu já: lágrimas. — E aí como a Cassandra não aparece, o Gersinho já sabia o caminho, né? Agora da casa dela e resolve ir atrás dela, sem avisar a Leide. E aí ele vai, bate lá na porta e a Cassandra trata o Gersinho super mal e fala: “Não, vou te levar pra sua mãe porque não tem lugar pra vocês na minha vida, e nã nã nã”, e leva, pega o Gersinho e leva ele de volta pra Leide.']",0.32208893167155184,0.5714285714285714,0.2857142857142857,0.4470219701279561,0.11175549253198902
39,"No episódio 'pão', quem é a personagem principal da história?",A personagem principal da história é a Ana Clara.,Ana Clara,"['Déia Freitas: Oi, gente… Cheguei. cheguei pra mais uma história do quadro Amor nas Redes. — E hoje eu não tô sozinha, meu publiii. — [ efeito sonoro de crianças contentes] Quem está aqui comigo hoje é a Wickbold. — Sim, é ela… [cantarolando] Quem quer pão?'
 'Então a Ana Clara já sabia que ela não podia estar de esmalte pra fazer ali aquele pão.'
 'Delicinha. — Depois que ouvir a história entrar lá no Tik Tok da Wickbold, é @wickboldoficial. E hoje eu vou contar pra vocês a história da Ana Clara, do seu avô Raul e de um pão que virou uma memória inesquecível, cheia de legado nessa família. Então vamos lá, vamos de história.'
 'E hoje eu não tô sozinha, meu publiii. — [ efeito sonoro de crianças contentes] Quem está aqui comigo hoje é a Wickbold. — Sim, é ela… [cantarolando] Quem quer pão? Quem quer pão? Quem quer pão? [']",0.30636979566874567,1.0,0.1875,0.5578278357097721,0.889456958927443
40,"No episódio 'pão', quem ensinou o avô Raul a fazer o pão?","A Bisavó da Ana Clara, a Dona Catarina, ensinou o avô Raul a fazer o pão.",Dona Catarina,"['A Bisavó da Ana Clara, a Dona Catarina, fazia um pão que era, assim, enrolado, parecia um rocambole salgado assim, de presunto, queijo e tomate. E era, assim, um espetáculo de pão, gente… E Dona Catarina ensinou o avô da Ana Clara, o seu Raul, a fazer esse pão aí. Então, era uma tradição que dona Catarina ali criou, ela ensinou o seu Raul, avô de Ana Clara a fazer esse pão e, um tempo depois, quando Dona Catarina faleceu, o seu Raul, avô da Ana Clara, começou a fazer esse pão para a família toda. Todo ano ali, mais pra perto do Natal, assim, o seu Raul fazia esse pão e distribuía pra família ali, fazia pão pra todo mundo.'
 'Então, era uma tradição que dona Catarina ali criou, ela ensinou o seu Raul, avô de Ana Clara a fazer esse pão e, um tempo depois, quando Dona Catarina faleceu, o seu Raul, avô da Ana Clara, começou a fazer esse pão para a família toda. Todo ano ali, mais pra perto do Natal, assim, o seu Raul fazia esse pão e distribuía pra família ali, fazia pão pra todo mundo.'
 'A bisavó de Ana Clara, Dona Catarina, sempre cozinhou aí muito bem… Ela, mãe aí do seu Raul, — avô de Ana Clara — sempre teve uma vida muito difícil e criou os filhos todos com uma certa dificuldade. — Ela teve três filhos. — A Bisavó da Ana Clara, a Dona Catarina, fazia um pão que era, assim, enrolado, parecia um rocambole salgado assim, de presunto, queijo e tomate. E era, assim, um espetáculo de pão, gente… E Dona Catarina ensinou o avô da Ana Clara, o seu Raul, a fazer esse pão aí. Então, era uma tradição que dona Catarina ali criou, ela ensinou o seu Raul, avô de Ana Clara a fazer esse pão e, um tempo depois, quando Dona Catarina faleceu, o seu Raul, avô da Ana Clara, começou a fazer esse pão para a família toda.'
 'Então o seu Raul ali que teve cinco filhos, ele distribuía para os filhos… Ele teve sete netos, então era filhos, netos, genros, noras, todo mundo ali esperando aquele pão… [efeito sonoro de várias pessoas falando ao mesmo tempo] — Que parecia um rocambole, né? Vamos chamar aqui de pão—rocambole do vovô Raul. — Quando a Ana Clara estava ali com seus 13 anos, — mais ou menos 13 anos — o seu Raul resolveu que ele ia ensinar aquela receita do pão pra ela. Ela ia começar ali a fazer o pão junto com o seu Raul. E a Ana Clara ficou empolgada e totalmente hipnotizada ali, observando o avô fazendo pão.']",0.3067087187528131,1.0,0.25,0.5602442100991741,0.6400610525247935
41,"No episódio 'pão', por que a Ana Clara resolveu manter a tradição do avô e fazer o pão para todo mundo?",A Ana Clara resolveu manter a tradição do avô e fazer o pão para todo mundo porque queria manter viva a memória do seu Raul e dar um pouco de conforto à família em um momento de saudade e tristeza.,Para manter a memória do seu avô e dar um pouco de conforto à família durante o Natal,"['E aí foi chegando a época de Natal e a época de fazer aquele pão, né? De presunto, queijo e tomate que o seu Raul tanto fazia. Ninguém estava animado com nada, mas a Ana Clara resolveu que ela ia manter a tradição do avô e ela ia fazer o pão pra todo mundo. — Aquele pão—rocambole que tinha virado um pão—rocambole natalino. — Ela ia fazer ali para todo mundo.'
 'Ninguém estava animado com nada, mas a Ana Clara resolveu que ela ia manter a tradição do avô e ela ia fazer o pão pra todo mundo. — Aquele pão—rocambole que tinha virado um pão—rocambole natalino. — Ela ia fazer ali para todo mundo. A Ana Clara fazer aquele pão deixou todo mundo um pouco mais… Conformado não era palavra, mas deu um pouco de conforto ali naquela hora, daquela saudade do seu Raul. Era uma maneira de matar um pouquinho a saudade dele e ver que ele estava em alguma coisa, em algum momento ali daquela época natalina, o seu Raul estava presente.'
 'Seu Raul morreu ali no meio de 201 em dali para frente, foi muito difícil pra toda a família, né? Seu Raul unia ali todo mundo. E aí foi chegando a época de Natal e a época de fazer aquele pão, né? De presunto, queijo e tomate que o seu Raul tanto fazia. Ninguém estava animado com nada, mas a Ana Clara resolveu que ela ia manter a tradição do avô e ela ia fazer o pão pra todo mundo. —'
 'A Bisavó da Ana Clara, a Dona Catarina, fazia um pão que era, assim, enrolado, parecia um rocambole salgado assim, de presunto, queijo e tomate. E era, assim, um espetáculo de pão, gente… E Dona Catarina ensinou o avô da Ana Clara, o seu Raul, a fazer esse pão aí. Então, era uma tradição que dona Catarina ali criou, ela ensinou o seu Raul, avô de Ana Clara a fazer esse pão e, um tempo depois, quando Dona Catarina faleceu, o seu Raul, avô da Ana Clara, começou a fazer esse pão para a família toda. Todo ano ali, mais pra perto do Natal, assim, o seu Raul fazia esse pão e distribuía pra família ali, fazia pão pra todo mundo.']",0.23666384297791787,1.0,0.25,0.7411205483336245,
42,"No episódio 'surpresa zen', quem foi o responsável por levar a Thábata para o retiro espiritual?",O Ulisses foi o responsável por levar a Thábata para o retiro espiritual.,Ulisses,"['Já era noite. — Só que estava todo mundo, assim, tinha umas rodas, umas pessoas cantando… E aí a Thábata percebeu ali que ela tinha pensado que a pousada era de um jeito e o Ulisses tinha levado ela para uma surpresa que era um retiro espiritual… — Sim, era um retiro espiritual. — E aí aqui que eu acho que as pessoas vão se dividir… — Porque primeiro… — Ele falou para ela que seria uma surpresa, ele falou que era uma pousada com tudo incluso, — Que ele ia pagar. — que ele queria que ela expandisse os horizontes dela e ele perguntou se ele poderia fazer uma surpresa e ela disse sim. — Então, gente… — Surpresa é surpresa, quando você aceita a roubada surpresa… — Porque para mim surpresa é roubada. —'
 'E aí chegaram… Chegaram, ela reconheceu a entrada, né? Porque tinham umas pedras, assim, bonitas, porque ela tinha visto foto… E já era noite. — Já era noite. — Só que estava todo mundo, assim, tinha umas rodas, umas pessoas cantando… E aí a Thábata percebeu ali que ela tinha pensado que a pousada era de um jeito e o Ulisses tinha levado ela para uma surpresa que era um retiro espiritual… — Sim, era um retiro espiritual. — E aí aqui que eu acho que as pessoas vão se dividir… — Porque primeiro… — Ele falou para ela que seria uma surpresa, ele falou que era uma pousada com tudo incluso, — Que ele ia pagar. —'
 'Então ela olhou para o Ulisses e falou: “Olha, você não me falou que seria um retiro espiritual”, aí ele falou: “Ah, então, eu te falei que era uma surpresa, que eu queria que você expandisse os horizontes e tal. Eu queria que você conhecesse um lugar que é muito importante pra mim e esse é o lugar”. — E ele falou nesse tom baixo e ela já estava gritando. — E aí ela falou: “Você não tinha direito de me trazer para um retiro religioso”, e aí tinham algumas pessoas perto, aí alguns falaram: “Não, calma, a gente tem uma programação, mas você não é obrigada a participar da programação, você pode passear, você pode ler um livro, você pode fazer o que você quiser”. — E ela já brava… — Aí ela falou pro Ulisses assim: — A Thábata — “Vamos para o quarto”. —'
 'O cara errou… Eu acho que ele errou. Primeiro de fazer surpresa e segundo por levar ela em um retiro espiritual que ela jamais iria se soubesse. Ele falou que ia fazer uma surpresa? — Tudo bem, mas não devia. — Mas eu acho que depois, todas as atitudes que ela tomou lá e, tipo assim, meio que atrapalhando a coletividade, uma coisa meio mimada. —']",0.37274957608980247,1.0,0.17391304347826086,0.5952783312515353,0.8988195828128838
43,"No episódio 'surpresa zen', por que a Thábata se sentiu brava com o Ulisses?","A Thábata se sentiu brava com o Ulisses porque ele a levou para um retiro religioso sem contar que era um retiro espiritual, e ela detesta coisas religiosas.",Porque o Ulisses não contou que era um retiro religioso e ela não gostou da surpresa,"['E aí a Thábata começou a dar uma causada ali, o Ulisses ficou morrendo de vergonha, pediu desculpa para as pessoas e eles foram dormir. E aí a Thábata ficava resmungando, enfim… [efeito sonoro de pessoas fazendo “shhh”] tiveram que pedir para ela fazer silêncio, né? — Porque outras pessoas não têm nada a ver com a surpresa que o namorado fez pra você. — E aí o Ulisses mesmo sendo good vibes, ele também ficou meio puto, porque, poxa, não era pra tanto… Na cabeça dele, ele achava que não tinha feito nada errado. — Eu acho que fez errado de não contar que era um retiro religioso. —'
 'Então ela olhou para o Ulisses e falou: “Olha, você não me falou que seria um retiro espiritual”, aí ele falou: “Ah, então, eu te falei que era uma surpresa, que eu queria que você expandisse os horizontes e tal. Eu queria que você conhecesse um lugar que é muito importante pra mim e esse é o lugar”. — E ele falou nesse tom baixo e ela já estava gritando. — E aí ela falou: “Você não tinha direito de me trazer para um retiro religioso”, e aí tinham algumas pessoas perto, aí alguns falaram: “Não, calma, a gente tem uma programação, mas você não é obrigada a participar da programação, você pode passear, você pode ler um livro, você pode fazer o que você quiser”. — E ela já brava… — Aí ela falou pro Ulisses assim: — A Thábata — “Vamos para o quarto”. —'
 'Ele falou que ia fazer uma surpresa? — Tudo bem, mas não devia. — Mas eu acho que depois, todas as atitudes que ela tomou lá e, tipo assim, meio que atrapalhando a coletividade, uma coisa meio mimada. — Isso me irrita extremamente. — Então eu não consegui ter essa empatia e eu falei pra Thábata, falei: “Olha, eu posso contar sua história, eu sei que muita gente vai ter empatia por você e vai entender o seu lado da história, eu entendo também, mas toda a questão de maltratar as pessoas porque você estava chateada, porque você estava brava, não dá para mim, né?”'
 'Então ela aceitou… — Então, eu acho que aí não era hora para ter um, sei lá, um piti, fazer escândalo. — E aí ela já ficou muito brava, muito brava… Porque mesmo os dois ali combinando em tudo, a Thábata não tem religião nenhuma, detesta coisas religiosas e eles nunca tiveram essa conversa do tipo: “Olha, você detesta coisas religiosas?”. — Nunca rolou porque ela sempre respeitou as coisas dele. — Talvez ele devesse perguntar: “Olha, você quer ir para um retiro?” — Eu acho que deveria… Porque você não leva alguém para um retiro surpresa, né?']",0.4553564111767075,0.5,0.2,0.7287804026062649,0.48219510065156623
44,"No episódio 'surpresa zen', como a Thábata se comportou no retiro espiritual?","No episódio 'surpresa zen', a Thábata se comportou de forma descontente e brava no retiro espiritual, pois não sabia que era um retiro religioso e se sentiu surpresa e enganada pelo Ulisses. Ela resmungava e gritava, e pediram para ela fazer silêncio.","De forma mimada, maltratando as pessoas e causando um escândalo","['E aí a Thábata começou a dar uma causada ali, o Ulisses ficou morrendo de vergonha, pediu desculpa para as pessoas e eles foram dormir. E aí a Thábata ficava resmungando, enfim… [efeito sonoro de pessoas fazendo “shhh”] tiveram que pedir para ela fazer silêncio, né? — Porque outras pessoas não têm nada a ver com a surpresa que o namorado fez pra você. — E aí o Ulisses mesmo sendo good vibes, ele também ficou meio puto, porque, poxa, não era pra tanto… Na cabeça dele, ele achava que não tinha feito nada errado. — Eu acho que fez errado de não contar que era um retiro religioso. —'
 'Então ela olhou para o Ulisses e falou: “Olha, você não me falou que seria um retiro espiritual”, aí ele falou: “Ah, então, eu te falei que era uma surpresa, que eu queria que você expandisse os horizontes e tal. Eu queria que você conhecesse um lugar que é muito importante pra mim e esse é o lugar”. — E ele falou nesse tom baixo e ela já estava gritando. — E aí ela falou: “Você não tinha direito de me trazer para um retiro religioso”, e aí tinham algumas pessoas perto, aí alguns falaram: “Não, calma, a gente tem uma programação, mas você não é obrigada a participar da programação, você pode passear, você pode ler um livro, você pode fazer o que você quiser”. — E ela já brava… — Aí ela falou pro Ulisses assim: — A Thábata — “Vamos para o quarto”. —'
 'Já era noite. — Só que estava todo mundo, assim, tinha umas rodas, umas pessoas cantando… E aí a Thábata percebeu ali que ela tinha pensado que a pousada era de um jeito e o Ulisses tinha levado ela para uma surpresa que era um retiro espiritual… — Sim, era um retiro espiritual. — E aí aqui que eu acho que as pessoas vão se dividir… — Porque primeiro… — Ele falou para ela que seria uma surpresa, ele falou que era uma pousada com tudo incluso, — Que ele ia pagar. — que ele queria que ela expandisse os horizontes dela e ele perguntou se ele poderia fazer uma surpresa e ela disse sim. — Então, gente… — Surpresa é surpresa, quando você aceita a roubada surpresa… — Porque para mim surpresa é roubada. —'
 'E aí chegaram… Chegaram, ela reconheceu a entrada, né? Porque tinham umas pedras, assim, bonitas, porque ela tinha visto foto… E já era noite. — Já era noite. — Só que estava todo mundo, assim, tinha umas rodas, umas pessoas cantando… E aí a Thábata percebeu ali que ela tinha pensado que a pousada era de um jeito e o Ulisses tinha levado ela para uma surpresa que era um retiro espiritual… — Sim, era um retiro espiritual. — E aí aqui que eu acho que as pessoas vão se dividir… — Porque primeiro… — Ele falou para ela que seria uma surpresa, ele falou que era uma pousada com tudo incluso, — Que ele ia pagar. —']",0.3864985913329089,0.8,0.17391304347826086,0.40722584251247174,0.10180646062811793
45,"No episódio 'santuário', quem é o personagem principal da história?",A personagem principal da história é Evelyn.,Evelyn,"['Então é tipo outra mulher que está nessa prisão, nesse santuário do cara que não pode fazer nada.'
 'E aí esse bebezinho começou a correr pela casa, que é o que todo bebezinho tem que fazer, esse é o papel do bebezinho no mundo… E começou a segurar nas coisinhas e puxar… O bebezinho vê um fio, o que ele faz? O bebezinho puxa o fio. — Cabe a você, pai, mãe, responsável, tutor, o que seja, ficar esperto ali pro bebezinho não tomar um choque, né? — Então o bebezinho começou a puxar ali uns fios, a correr e fazer umas coisas que esse cara não gostou… — Porque a casa dele é um santuário, né? — Então aí as limitações que eram impostas a Evelyn, agora passaram a ser impostas ao bebezinho.'
 'Então vamos lá, vamos de história.'
 'Então, a casa do cara era um santuário e era um santuário onde a Evelyn era uma visita que não podia tocar em nada, tipo, uma visita com restrições, assim. Então, eu acho que a partir daí você já podia falar: “Pô, será que vai dar certo? Eu aqui eu não posso ver TV na sala… No quarto eu não posso pôr TV porque o cara não gosta. Eu tenho que ver minha TV na cozinha… Eu não posso entrar no escritório…”. Fica difícil, né?']",0.3170970666240374,1.0,0.3,0.49588581681100513,0.8739714542027512
46,"No episódio 'santuário', qual era o problema da casa do namorado de Evelyn?","O problema da casa do namorado de Evelyn era que ele era muito possessivo e tinha muitas restrições, como não poder tocar em nada, e isso se estendia também ao bebezinho, que não podia mexer em certas coisas, como a TV gigante na sala.",A casa era um santuário e Evelyn não podia tocar em nada.,"['Então, a casa do cara era um santuário e era um santuário onde a Evelyn era uma visita que não podia tocar em nada, tipo, uma visita com restrições, assim. Então, eu acho que a partir daí você já podia falar: “Pô, será que vai dar certo? Eu aqui eu não posso ver TV na sala… No quarto eu não posso pôr TV porque o cara não gosta. Eu tenho que ver minha TV na cozinha… Eu não posso entrar no escritório…”. Fica difícil, né?'
 'E com ali um ano e um mês de namoro, esse cara falou: “Evelyn, venha morar comigo… Vem morar comigo, vamos viver aí de casalzinho, vai dar super certo, eu te amo e nã nã nã”. E a Evelyn falou: “Poxa, o cara é show comigo, ele é maravilhoso… Vou lá, vou morar com esse cara”. E esse cara morava num apartamento, — que é dele —  um apartamento muito bom, de três quartos. Só que, assim que ela foi morar com ele, ela já percebeu que teria ali alguns probleminhas. O que seria isso?'
 'E esse cara morava num apartamento, — que é dele —  um apartamento muito bom, de três quartos. Só que, assim que ela foi morar com ele, ela já percebeu que teria ali alguns probleminhas. O que seria isso? Esse cara tinha na sala uma TV gigante, até incompatível meio que com o tamanho da sala, e a Evelyn não poderia mexer nessa televisão. — Gente?'
 'Cabe a você, pai, mãe, responsável, tutor, o que seja, ficar esperto ali pro bebezinho não tomar um choque, né? — Então o bebezinho começou a puxar ali uns fios, a correr e fazer umas coisas que esse cara não gostou… — Porque a casa dele é um santuário, né? — Então aí as limitações que eram impostas a Evelyn, agora passaram a ser impostas ao bebezinho. Então “Ah, isso não pode, ah isso não pode, porque ele não pode entrar ali”. Tudo bem que tem coisa que a gente não deixa o bebezinho perto porque é perigoso, mas poxa, ele, sei lá, tem um espaço dentro de um apartamento grande pra ele correr, você está ali supervisionando, você vai deixar o seu bebezinho correr.']",0.47222502887776036,0.6666666666666666,0.2777777777777778,0.723216447672951,0.18080411191823775
47,"No episódio 'santuário', por que o bebezinho não gosta de ir para a casa do pai?","O bebezinho não gosta de ir para a casa do pai porque ele não pode fazer nada lá, tudo é proibido, e ele se sente mal.",O bebezinho não gosta de ir para a casa do pai porque o pai tem regras rígidas e não deixa o bebezinho fazer nada.,"['Cabe a você, pai, mãe, responsável, tutor, o que seja, ficar esperto ali pro bebezinho não tomar um choque, né? — Então o bebezinho começou a puxar ali uns fios, a correr e fazer umas coisas que esse cara não gostou… — Porque a casa dele é um santuário, né? — Então aí as limitações que eram impostas a Evelyn, agora passaram a ser impostas ao bebezinho. Então “Ah, isso não pode, ah isso não pode, porque ele não pode entrar ali”. Tudo bem que tem coisa que a gente não deixa o bebezinho perto porque é perigoso, mas poxa, ele, sei lá, tem um espaço dentro de um apartamento grande pra ele correr, você está ali supervisionando, você vai deixar o seu bebezinho correr.'
 'E agora ele pega o bebezinho final de semana sim e final de semana não, e o bebezinho não gosta de ir pra lá, porque o bebezinho não pode fazer nada. O bebezinho é proibido de tudo. E aí a Evelyn não tá sabendo como lidar com isso porque ela, óbvio, não quer afastar o pai do filho do filho. Mas ao mesmo tempo ela vê que o menino volta chateado que ele não pode fazer nada, sabe? Ele não pode pegar no controle da televisão… E que criança não gosta de pegar um controle da televisão para pôr na boca e babar todos os números ali?'
 'Só que agora o bebezinho vai pra lá e o bebezinho fica meio mal, assim, né? Então a Evelyn queria saber como ela pode melhorar a situação do bebezinho sem atrapalhar o relacionamento pai e filho? Porque o cara tem direito também de conviver com o filho e tal, só que o cara é esse cara aí… Que tudo o que é dele é dele, você não pode tocar em nada, que a casa dele é um santuário. Só que a gente está falando de um bebê… — Porque pra mim uma criança de quatro, cinco anos é um bebezinho ainda. Se bobear, até 15 anos eu considero bebezinho. —'
 'Porque o cara tem direito também de conviver com o filho e tal, só que o cara é esse cara aí… Que tudo o que é dele é dele, você não pode tocar em nada, que a casa dele é um santuário. Só que a gente está falando de um bebê… — Porque pra mim uma criança de quatro, cinco anos é um bebezinho ainda. Se bobear, até 15 anos eu considero bebezinho. — Então, o que ela pode fazer pra tentar amenizar aí? Porque chega o final de semana com bebezinho tem que ir pra lá, ele já pega a mochila, já põe os brinquedinhos ali… E, detalhe: Ele não pode levar, por exemplo… Ele tem lá um carro de bombeiros que tem um ursinho e o carro de bombeiros faz barulho, ele ama o carro de bombeiros com o ursinho, mas ele não pode levar pra casa do pai porque ele não pode levar nenhum brinquedo que faz barulho e praticamente todo brinquedo faz barulho, né?']",0.24231664700435665,0.6666666666666666,0.3333333333333333,0.8811360450719045,0.47028401126797614
48,"No episódio 'misto', quem estava namorando a Silvana?",O Dennis estava namorando a Silvana.,Dennis,"['A Silvana e o Dennis ele estavam namorando aí há uns dois anos — na época — e era um sábado à noite, eles estavam na casa da Silvana, a Silvana morando com a mãe, ali os três vendo TV e, num determinado momento, bateu uma fominha e Silvana falou ali pra mãe, pro Dennis: “Vamos pedir aí um lanche, um sanduíche, alguma coisa?”, e aí todo mundo concordou… Só que ali o delivery tava meio caro e tal, eles estavam meio apertados de grana e resolveram que o casal, Silvana e Dennis, eles iam até uma lanchonete pedir aí três misto quente. — Então, aqui a gente tem que falar um pouco do misto quente, que é um sanduíche aí muito aclamado, que seria: pão, presunto e queijo na chapa, quente. Se for frio, pão, presunto, queijo, é misto frio e, se tiver tomate o um lanche, tomate e orégano, vira bauru. Pelo menos aqui em São Paulo, né?'
 'Lá foram eles para esse terreno, porque eles estavam ali só com o dinheiro do misto quente, né? Já tinham deixado tudo pago e iam pegar dali meia hora. Os dois cheios de hormônio, muito tesão e nã nã nã, começou aquele esfrega, aquele rala e rola, tira a roupa daqui, tira a roupa dali. Silvana foi e sentou em Dennis e começou a cavalgar… Cavalga daqui, cavalga dali e vai, vai, vai, aquela coisa louca… Só que, de repente, no meio daquele terreno baldio escuro — e pra sorte deles, porque podia ser bem pior, podia ser um criminoso —, luzes vermelhas começaram a girar… — E a gente aqui a gente já sabe quem é… — [efeito sonoro de sirenes policiais] A polícia. A polícia tinha acabado de chegar ali no terreno baldio e deu aquele, sabe?'
 'Ê, Silvana, ê, Dennis… — Então vamos lá, vamos de história.'
 'Fica aqui até o final do episódio que tem cupom de desconto, pantynova.com, já vai entrando no site… — Acompanha a história e vai aí navegando no site da Pantynova. — E hoje eu vou contar para vocês a história da Silvana e do Dennis. — Ê, Silvana, ê, Dennis… — Então vamos lá, vamos de história.']",0.39391368602454263,1.0,0.23076923076923078,0.5146303110209558,0.878657577755239
49,"No episódio 'misto', o que Silvana e Dennis faziam no carro no terreno baldio?","No episódio 'misto', Silvana e Dennis faziam sexo no carro no terreno baldio.",Transavam,"['Por mais tesão que tenha, enfim… — E aí a ideia foi essa: “Vamos transar no carro”… Porque, assim, a Silvana mora com a mãe e o Dennis divide o quarto dele com irmãos, então nunca que eles conseguiam transar em casa. Então, ou eles iam no motel e, quando eles não tinham grana para o motel — veja bem —, eles iam pra um terreno baldio, botava o carro lá e transavam no carro, nesse terreno baldio. — Olha o perigo… —'
 'Lá foram eles para esse terreno, porque eles estavam ali só com o dinheiro do misto quente, né? Já tinham deixado tudo pago e iam pegar dali meia hora. Os dois cheios de hormônio, muito tesão e nã nã nã, começou aquele esfrega, aquele rala e rola, tira a roupa daqui, tira a roupa dali. Silvana foi e sentou em Dennis e começou a cavalgar… Cavalga daqui, cavalga dali e vai, vai, vai, aquela coisa louca… Só que, de repente, no meio daquele terreno baldio escuro — e pra sorte deles, porque podia ser bem pior, podia ser um criminoso —, luzes vermelhas começaram a girar… — E a gente aqui a gente já sabe quem é… — [efeito sonoro de sirenes policiais] A polícia. A polícia tinha acabado de chegar ali no terreno baldio e deu aquele, sabe?'
 'Silvana e Dennis com muito tesão — Eles tinham ido de carro até a lanchonete… — falaram: “Bom, em meia hora dá pra gente dar aí uma rapidinha, né?”, olha que coisa boa…, e aí eles tiveram uma ideia que, assim… — Eu não sei se porque eu sou uma pessoa muito, assim, com medo de ser assassinada, sei lá… Como uma pessoa acha uma boa ideia transar no carro, assim, ao perigo? Por mais tesão que tenha, enfim… — E aí a ideia foi essa: “Vamos transar no carro”… Porque, assim, a Silvana mora com a mãe e o Dennis divide o quarto dele com irmãos, então nunca que eles conseguiam transar em casa. Então, ou eles iam no motel e, quando eles não tinham grana para o motel — veja bem —, eles iam pra um terreno baldio, botava o carro lá e transavam no carro, nesse terreno baldio. — Olha o perigo… —'
 'Os dois cheios de hormônio, muito tesão e nã nã nã, começou aquele esfrega, aquele rala e rola, tira a roupa daqui, tira a roupa dali. Silvana foi e sentou em Dennis e começou a cavalgar… Cavalga daqui, cavalga dali e vai, vai, vai, aquela coisa louca… Só que, de repente, no meio daquele terreno baldio escuro — e pra sorte deles, porque podia ser bem pior, podia ser um criminoso —, luzes vermelhas começaram a girar… — E a gente aqui a gente já sabe quem é… — [efeito sonoro de sirenes policiais] A polícia. A polícia tinha acabado de chegar ali no terreno baldio e deu aquele, sabe? Só aquele toquinho na sirene que faz [barulho com a boca], que é para dizer um: “se liga, estou aqui, estou te vendo”. A polícia deu um desse e já foi chegando no carro…']",0.42937051020816225,1.0,0.29411764705882354,0.0792708933405277,0.319817723335132
50,"No episódio 'misto', o que a polícia fez com a amiga da Déia que estava transando no carro?",A polícia ficou esperando que eles saíssem do terreno.,Fez ela rezar um Pai-Nosso,"['Porque ela falou: “Déia, depois no final que eu rezei o Pai Nosso até me senti bem, me senti purificada”. [ risos] Enfim, voltando aqui a Silvana e o Dennis… Eles daquele jeito… A polícia ficou ali esperando que eles saíssem do terreno, e aí nesse ponto você já está tão ali, “puta merda, a polícia me pegou aqui transando e tal?”, que eles tinham meio que dado uma esquecida do lanche, né? Do misto quente. E aí era hora de voltar para pegar um misto quente, já tinha passado da hora, estava muito atrasado… Aí eles voltaram lá, o misto quente já estava, obviamente, frio, né?'
 'Assinante 2: Oi, Déia, oi, pessoal, meu nome é André… Eu prefiro não dizer de onde eu sou, mas eu amei a história da Silvana e do Dennis, principalmente porque eu me identifiquei. Eu também já transei no carro uma vez, [risos] eu acredito que eu foi até mais ousado porque eu e o carinha a gente tava com carro com as portas abertas e a gente só percebeu que a gente estava em frente a um batalhão do exército quando a gente ligou o carro para ir embora, a gente tava literalmente em frente… A gente acendeu o farol e tava lá a fachada do exército aqui da cidade e foi, assim, terrível ter percebido o risco que a gente correu ali. Então, talvez poderia ter sido pior do que a polícia, né? Enfim… Felicidades ao casal e tudo de bom pra vocês. Se cuidem, tomem cuidado na rua.'
 'Ê, Silvana… Ê, Dennis… — Mas, ó, fica aqui o alerta para vocês, que quando vem a polícia, tá no lucro, né? Podia ser pior, podia ser um assaltante, podia ser uma vizinha revoltada que vai lá com uma mangueira, um balde d’água… [risos] Então, por favor, fiquem espertos, transem, transem muito, mas vamos aí prestar atenção nas coisinhas. Pra mim, essa história só ficaria melhor se eles já tivessem com o misto quente no carro e a polícia tivesse levado o misto quente deles. [ risos] — Aí pra mim era catástrofe… Perdeu o lanche, perdeu tudo. [ risos] —'
 'Provavelmente sim… — Né, Silvana? Né, Dennis? Ê, Silvana… Ê, Dennis… — Mas, ó, fica aqui o alerta para vocês, que quando vem a polícia, tá no lucro, né? Podia ser pior, podia ser um assaltante, podia ser uma vizinha revoltada que vai lá com uma mangueira, um balde d’água… [risos] Então, por favor, fiquem espertos, transem, transem muito, mas vamos aí prestar atenção nas coisinhas. Pra mim, essa história só ficaria melhor se eles já tivessem com o misto quente no carro e a polícia tivesse levado o misto quente deles. [']",0.16430906389879882,1.0,0.05,0.31587633889668165,0.07896908472417041
51,"No episódio 'espremedor de laranja', quem é a personagem principal da história?",O personagem principal da história é o Renato.,Safira,"['Porque, gente, o cara é um espremedor de laranja… Daquele automático que você liga e ele não para… [risos] —'
 'Parar. — Só que o Renato ele não parava, parecia que ele tava ali… Que ele era um espremedor de laranja. [ risos] Ligou e não para mais… E ele não parava de chupar a Safira…'
 'Foi bom? Foi bom… Só que Safira já tava toda assada. — Porque, gente, o cara é um espremedor de laranja… Daquele automático que você liga e ele não para… [risos] —'
 'Assinante 2: Oi, gente… Aqui é o Vinícius, eu falo de Belo Horizonte. [ risos] Essa história do espremedor de laranja eu dei risada, porque é aquela coisa, né? O organismo masculino às vezes não funciona tão bem como a gente gostaria, enfim, como diz a Déia mesmo, broxar é coisa da vida. Broxar e ser corno é coisa da vida, é coisa que vai acontecer. Agora, o menino aí antes dos 30 anos ficar tomando muito remédio pode ser uma coisa prejudicial mesmo.']",0.26187776324738105,1.0,0.25,0.07468397602810502,0.018670994007026254
52,"No episódio 'espremedor de laranja', qual é o problema de Renato?","O problema de Renato é que ele não para de chupar e é muito insistente, como um espremedor de laranja.",Ele precisa de remédio para ter ereção,"['Parar. — Só que o Renato ele não parava, parecia que ele tava ali… Que ele era um espremedor de laranja. [ risos] Ligou e não para mais… E ele não parava de chupar a Safira…'
 'tava já pensando coisa da marmita dela… Quando, de repente, gente… Pau de Renato deu as caras… O menino pau começou a ficar mais firminho, mais firminho, mais firminho e subiu… Duas horas de chupação… — Eu não aguento, gente… Duas horas… Duas horas de chupação e pau de Renato subiu, ficou firmão, durão. Renato, sem pensar muito ali, pegou a camisinha, botou e eles transaram. — Foi bom? Foi bom… Só que Safira já tava toda assada. — Porque, gente, o cara é um espremedor de laranja… Daquele automático que você liga e ele não para… [risos] —'
 'e começou um oral maravilhoso na Safira… Uma chupação, uma lambeção… E, assim, ele sabia mesmo o que ele estava fazendo… E Safira gozou, gozou bastante… — Só que, assim, né? Safira gozou, então Renato tinha que fazer o que? Parar. — Só que o Renato ele não parava, parecia que ele tava ali… Que ele era um espremedor de laranja. [ risos] Ligou e não para mais… E ele não parava de chupar a Safira…'
 'Só depois que Renato conseguiu transar e ele foi embora e aí a Safira, assim, agora: “O Renato é um cara legal, bonito, ele tem a mesma energia que eu, ele quer me ver de novo, mas eu estou meio assim”. — Principalmente por causa dessa questão do pau de Renato não funcionar com tanta força assim, né? Sozinho… Com a força da natureza. E se ele quiser agora entrar nessa de chupação de duas horas? Mas aí Safira, acho que você tem que falar pra ele, falar: “Ó, bonito, já está me assando, né?']",0.450110806498137,1.0,0.2222222222222222,0.4296046184382851,0.10740115460957128
53,"No episódio 'espremedor de laranja', por que Safira não quer continuar com Renato?","Safira não quer continuar com Renato porque ele não parava de chupá-la, era como um espremedor de laranja, e ela não aguentava mais. Além disso, ela também mencionou que o pau de Renato não funcionava com tanta força assim, o que a fez perder o interesse.",Ela não quer ficar assada com o oral de duas horas e tem dúvidas sobre a idade de Renato,"['e começou um oral maravilhoso na Safira… Uma chupação, uma lambeção… E, assim, ele sabia mesmo o que ele estava fazendo… E Safira gozou, gozou bastante… — Só que, assim, né? Safira gozou, então Renato tinha que fazer o que? Parar. — Só que o Renato ele não parava, parecia que ele tava ali… Que ele era um espremedor de laranja. [ risos] Ligou e não para mais… E ele não parava de chupar a Safira…'
 'Parar. — Só que o Renato ele não parava, parecia que ele tava ali… Que ele era um espremedor de laranja. [ risos] Ligou e não para mais… E ele não parava de chupar a Safira…'
 'Só depois que Renato conseguiu transar e ele foi embora e aí a Safira, assim, agora: “O Renato é um cara legal, bonito, ele tem a mesma energia que eu, ele quer me ver de novo, mas eu estou meio assim”. — Principalmente por causa dessa questão do pau de Renato não funcionar com tanta força assim, né? Sozinho… Com a força da natureza. E se ele quiser agora entrar nessa de chupação de duas horas? Mas aí Safira, acho que você tem que falar pra ele, falar: “Ó, bonito, já está me assando, né?'
 'tava já pensando coisa da marmita dela… Quando, de repente, gente… Pau de Renato deu as caras… O menino pau começou a ficar mais firminho, mais firminho, mais firminho e subiu… Duas horas de chupação… — Eu não aguento, gente… Duas horas… Duas horas de chupação e pau de Renato subiu, ficou firmão, durão. Renato, sem pensar muito ali, pegou a camisinha, botou e eles transaram. — Foi bom? Foi bom… Só que Safira já tava toda assada. — Porque, gente, o cara é um espremedor de laranja… Daquele automático que você liga e ele não para… [risos] —']",0.33401199054060077,0.8,0.2777777777777778,0.5797252330393576,
54,"No episódio 'jantares', quem é a personagem principal da história?",A personagem principal da história é Tatiane.,Tatiane,"['Olha isso, gente firmíssimos aí Renato e Tatiane. Amo… — O jantar que foi romântico e um pouquinho mais elaborado, deu errado… O jantar com marmitex foi aí jantar da vida de Tatiane. Legal, né? Eu amei.'
 'Assinante 2: Oi, Déia, Oi, Não Inviabilizers, aqui é a Mari, de Fortaleza. E, olha, falando enquanto uma pessoa que integra um casal formado pelo Tinder, diretamente do Tinder, eu posso dizer que eu entendo a Tati perfeitamente. E eu tenho duas eleições que adquiri, tanto ouvindo esse episódio quanto na minha vida mesmo, que a primeira é: Não interessa quão bom seja um jantar, uma péssima companhia nunca vai deixar de ser chata. E o segundo ensinamento é que: Quando você encontra o seu amor, é uma coisa que é realmente muito difícil de fugir. Eu entrei nesse mesmo plano da Tati de sair por aí vadiando e aqui estou, há dois anos bem apaixonada pela minha namorada.'
 'Tatiane falou: “Tá bom, vem aqui então”.'
 'Dos 18 aos 29 anos a Tatiane tinha passado num relacionamento sério, casada e tal, então ela quase não tinha saído com ninguém. Então, era a oportunidade dela ir dar uma passada de rodo gostosa, boa. [ risos] —']",0.21316942212452628,1.0,0.3076923076923077,0.44030679094148467,0.8600766977353712
55,"No episódio 'jantares', quais eram os objetivos da Tatiane ao usar o aplicativo de namoro Tinder?","Os objetivos da Tatiane ao usar o aplicativo de namoro Tinder eram se sentir melhor, mais bonita e desejada, após sair de um divórcio e ter a autoestima baixa.",Se sentir melhor e mais desejada,"['Em 2017, a Tatiane estava saindo de um divórcio, estava péssima ali, era um casamento de 11 anos, então, né? Estava com a autoestima, assim, meio lá em baixo… E aí ela falou: “Bom, vou entrar no Tinder, vou trocar uns matchs pra me sentir melhor, mais bonita, desejada…”, e ela foi lá e começou a curtir ali uns perfis e deu match com um cara lindo, lindo, lindo, lindo, inteligente, que gostava das mesmas músicas que ela. E aí a Tatiane ficou toda empolgada. — Na época, a Tatiane tinha 29 anos e esse cara tinha ali 31. — Eles conversaram ali pelo aplicativo e resolveram se encontrar.'
 'Assinante 2: Oi, Déia, Oi, Não Inviabilizers, aqui é a Mari, de Fortaleza. E, olha, falando enquanto uma pessoa que integra um casal formado pelo Tinder, diretamente do Tinder, eu posso dizer que eu entendo a Tati perfeitamente. E eu tenho duas eleições que adquiri, tanto ouvindo esse episódio quanto na minha vida mesmo, que a primeira é: Não interessa quão bom seja um jantar, uma péssima companhia nunca vai deixar de ser chata. E o segundo ensinamento é que: Quando você encontra o seu amor, é uma coisa que é realmente muito difícil de fugir. Eu entrei nesse mesmo plano da Tati de sair por aí vadiando e aqui estou, há dois anos bem apaixonada pela minha namorada.'
 'Estou me amando, estou me sentindo bem… Então, quer saber? Eu vou piranhar, [risos] vou aqui dar match, mais matchs no Tinder, vou sair com uma galera, vou aí fazer uma listagem… [risos] Quero piranhar”. — Dos 18 aos 29 anos a Tatiane tinha passado num relacionamento sério, casada e tal, então ela quase não tinha saído com ninguém. Então, era a oportunidade dela ir dar uma passada de rodo gostosa, boa. [ risos] —'
 'Déia Freitas: Conhecer novas pessoas no Tinder é sempre uma aventura de possibilidades. E, assim como Tatiane, a gente pode procurar encontrar pessoas no Tinder com os mais diversos interesses. E a seção “Explorar” do aplicativo te ajuda aí a se conectar a essas pessoas. Nesse espaço, Explorar, você pode descobrir um match que compartilha paixões, interesses e preferências semelhantes às suas. E dá até para conhecer aí outras funcionalidades do Tinder, como o modo Música. —']",0.5115426286575802,1.0,0.19047619047619047,0.3490438675297842,0.5158323954538746
56,"No episódio 'jantares', o que foi o ponto de partida para a Tatiane encontrar o amor após seu divórcio?","O ponto de partida para a Tatiane encontrar o amor após seu divórcio foi ela entrar no Tinder e dar match com um cara lindo, inteligente, que gostava das mesmas músicas que ela.",Um Picolé de Limão,"['Em 2017, a Tatiane estava saindo de um divórcio, estava péssima ali, era um casamento de 11 anos, então, né? Estava com a autoestima, assim, meio lá em baixo… E aí ela falou: “Bom, vou entrar no Tinder, vou trocar uns matchs pra me sentir melhor, mais bonita, desejada…”, e ela foi lá e começou a curtir ali uns perfis e deu match com um cara lindo, lindo, lindo, lindo, inteligente, que gostava das mesmas músicas que ela. E aí a Tatiane ficou toda empolgada. — Na época, a Tatiane tinha 29 anos e esse cara tinha ali 31. — Eles conversaram ali pelo aplicativo e resolveram se encontrar.'
 'E eu tenho duas eleições que adquiri, tanto ouvindo esse episódio quanto na minha vida mesmo, que a primeira é: Não interessa quão bom seja um jantar, uma péssima companhia nunca vai deixar de ser chata. E o segundo ensinamento é que: Quando você encontra o seu amor, é uma coisa que é realmente muito difícil de fugir. Eu entrei nesse mesmo plano da Tati de sair por aí vadiando e aqui estou, há dois anos bem apaixonada pela minha namorada. E seguiremos assim. Um beijo.'
 'risos] E Tatiane disse que ali foi o primeiro sinal, assim, foi muito estranho a dinâmica, sabe? — Esse cara ainda morava com os pais e, aí, um belo dia, ele convidou a Tatiane pra jantar. — Olha que máximo… — Um jantarzinho na casa dele. Ele falou: ” Meus pais não vão estar aqui, então vai ser aí um encontro a sós, um jantar romântico e nã nã nã”. E aí a Tatiane falou: “Ah, eu vou levar um vinho, né?”'
 'Assinante 2: Oi, Déia, Oi, Não Inviabilizers, aqui é a Mari, de Fortaleza. E, olha, falando enquanto uma pessoa que integra um casal formado pelo Tinder, diretamente do Tinder, eu posso dizer que eu entendo a Tati perfeitamente. E eu tenho duas eleições que adquiri, tanto ouvindo esse episódio quanto na minha vida mesmo, que a primeira é: Não interessa quão bom seja um jantar, uma péssima companhia nunca vai deixar de ser chata. E o segundo ensinamento é que: Quando você encontra o seu amor, é uma coisa que é realmente muito difícil de fugir. Eu entrei nesse mesmo plano da Tati de sair por aí vadiando e aqui estou, há dois anos bem apaixonada pela minha namorada.']",0.35223220490031126,1.0,0.3,0.32346213473197716,0.08086553368299429
57,"No episódio 'roupas', quem era a Dona Nice?","Dona Nice era a protagonista da história contada no episódio ""roupas"".",Dona Nice era uma jovem que viveu em uma casa mal-assombrada com sua família.,"['E aí que ela ficou sabendo que eles tinham sido atormentados também pelos fantasmas e por tudo ali que acontecia naquela casa, que com eles tinha sido pior até, que eles eram bem machucados assim… — Por esses espíritos que estavam nessa casa. — Dona Nice hoje uma idosinha muito fofa, maravilhosa, disse que nunca mais ela deixou roupa largada na cadeira e nada… E que até hoje ela lembra da visão, assim, das roupas flutuando, girando em torno dela e passando por ela, encostando nela com o formato mesmo dos corpos dentro da roupa. — Não era roupa, assim, sabe? Sem nada, só voando, não, era como se as pessoas tivessem vestido as roupas ali da Nice. —'
 'Eu vou deixar o link certinho aqui na descrição do episódio. E, olha, eu tenho que dizer que essa história me assustou além da parte sobrenatural, assim… O que aconteceu com Dona Nice foi muito sério. Eu vou contar hoje para vocês a história da Dona Nice quando ela era jovem e o que aconteceu quando ela mudou de casa junto com a família. Então vamos lá, vamos de história.'
 'Não era roupa, assim, sabe? Sem nada, só voando, não, era como se as pessoas tivessem vestido as roupas ali da Nice. —'
 'E aí o pai chegou, ninguém comentava desses assuntos com o pai… A mãe voltou da igreja, não tocou no assunto, falou que aquilo era uma besteira da Nice, né? E todos foram dormir. Nice não conseguia dormir e ela ficou sentada na cama, rezando… E rezando pedindo a Deus que ela não visse mais nada. Só que conforme ela estava ali rezando, umas roupas que estavam numa cadeira no quarto [efeito sonoro de suspense] começaram a levantar e tomar forma, como se aquelas roupas fossem colocadas em pessoas, assim. — Sabe quando você vai botar um vestido que você levanta os braços e aí o vestido desce e aí já fica marcado no seu corpo? —']",0.09438469955819102,1.0,0.2222222222222222,0.5931927243659716,0.523298181091493
58,"No episódio 'roupas', o que aconteceu com a família de Dona Nice após a mãe dela não ter ido à igreja?","A família de Dona Nice acreditou que ela estava tendo alucinações e, com a ordem da mãe, dois homens vestidos de branco levaram Dona Nice internada para um hospital psiquiátrico.",A família de Dona Nice começou a ver as roupas flutuando em casa e foi atacada pelos espíritos.,"['E a Nice gritando muito, gritando muito e aquilo passou a acontecer frequentemente… Só a Nice via aquelas roupas flutuando. E aí um dia — era uma manhã — a mãe da Nice não tinha ido pra igreja… Ela sempre ia, aquele dia ela não foi e chegaram dois homens vestidos de branco na casa da Nice, pegaram a Nice com força, na frente da mãe dela, com ordem da mãe dela e levaram a Nice internada para um hospital psiquiátrico.'
 'Gritando… — E, conforme ela saiu do quarto gritando, aquelas roupas foram atrás dela, do corredor até a sala, e aí acordou os pais e acordou o irmão e eles saíram do quarto e viram o quê? Aquelas roupas no chão. E a Nice gritando muito, gritando muito e aquilo passou a acontecer frequentemente… Só a Nice via aquelas roupas flutuando. E aí um dia — era uma manhã — a mãe da Nice não tinha ido pra igreja… Ela sempre ia, aquele dia ela não foi e chegaram dois homens vestidos de branco na casa da Nice, pegaram a Nice com força, na frente da mãe dela, com ordem da mãe dela e levaram a Nice internada para um hospital psiquiátrico.'
 'E aí Nice saiu correndo de casa e foi pra igreja, porque a mãe dela tava lá na igreja… — Igreja Católica. — E aí chegou na igreja esbaforida e pedindo para falar com a mãe, a mãe foi e ela falou baixinho, que ela não conhecia ninguém na cidade… A mãe tava enturmada, mas ela com aquelas senhoras não, né?'
 'E aí o pai chegou, ninguém comentava desses assuntos com o pai… A mãe voltou da igreja, não tocou no assunto, falou que aquilo era uma besteira da Nice, né? E todos foram dormir. Nice não conseguia dormir e ela ficou sentada na cama, rezando… E rezando pedindo a Deus que ela não visse mais nada. Só que conforme ela estava ali rezando, umas roupas que estavam numa cadeira no quarto [efeito sonoro de suspense] começaram a levantar e tomar forma, como se aquelas roupas fossem colocadas em pessoas, assim. — Sabe quando você vai botar um vestido que você levanta os braços e aí o vestido desce e aí já fica marcado no seu corpo? —']",0.27910031737973157,0.75,0.21428571428571427,0.7970300088585598,0.19925750221463995
59,"No episódio 'roupas', por que Dona Nice foi internada num hospital psiquiátrico?","Dona Nice foi internada num hospital psiquiátrico porque seus pais e irmão fizeram um acordo sem ela saber e acreditavam que ela estava possuída por espíritos, devido aos eventos estranhos que ocorriam em casa, como roupas flutuando.",Dona Nice foi internada num hospital psiquiátrico porque seus pais e irmão achavam que ela estava louca.,"['Por que eles tiraram a Nice do hospital psiquiátrico? Porque depois de uns 20 dias que a Nice estava internada, os pais e o irmão começaram a ver as roupas flutuando em casa. E eles também eram atacados pelas roupas, que provavelmente seriam espíritos vestindo as roupas. — Eu não sei dizer o que era isso… — Enquanto isso, a Nice estava lá, sofrendo muito, muito, sendo torturada no hospital psiquiátrico. Esses espíritos que estavam nessa casa, com a Nice eles parecia que eles zombavam, eles giravam em torno da Nice… — Não sei… —'
 'Tinha sido um acordo entre os pais e o irmão — fizeram ali sem a Nice saber — internaram a Nice num hospital psiquiátrico… — E, assim, foi uma passagem da vida da Nice, assim, muito, muito, muito horrível e que a gente não vai tocar aqui. — Ela ficou internada um mês nesse hospital psiquiátrico e ela acha que os pais e o irmão, por eles, deixariam ela lá a vida toda. Por que eles tiraram a Nice do hospital psiquiátrico? Porque depois de uns 20 dias que a Nice estava internada, os pais e o irmão começaram a ver as roupas flutuando em casa. E eles também eram atacados pelas roupas, que provavelmente seriam espíritos vestindo as roupas. —'
 'Então, essa é a história da Nice… Me assustou mais a parte onde ela não foi compreendida e foi jogada num hospital psiquiátrico, né? E depois foi jogada na rua e a família realmente virou as costas pra ela, do nada. Assim, porque ela gritou, que ela ficou assombrada… Então, isso me assustou mais do que os vestidos e as roupas todas flutuando, mas confesso para vocês que pensar em estar assim aqui, ó, agora parada, e uma roupa minha subir flutuando e tomar corpo, já me apavora…'
 'E eles também eram atacados pelas roupas, que provavelmente seriam espíritos vestindo as roupas. — Eu não sei dizer o que era isso… — Enquanto isso, a Nice estava lá, sofrendo muito, muito, sendo torturada no hospital psiquiátrico. Esses espíritos que estavam nessa casa, com a Nice eles parecia que eles zombavam, eles giravam em torno da Nice… — Não sei… —']",0.3243514854920029,1.0,0.17647058823529413,0.88235174312311,
60,"No episódio 'entidade', quem é o Edson?","O Edson é o protagonista da história contada no episódio ""entidade"" do podcast Não Inviabilize.",Um homem que usa aplicativos de pegação e viaja a trabalho.,"['Déia Freitas: Comentem lá no nosso grupo do Telegram, sejam gentis aí com o Edson. — Vocês acham que era realmente o Exu que a Diana mandou? Ou sei lá, Exu não faz isso? Eu estou falando aqui sem saber, tá? — Comentem lá vocês que entendem, que são da religião e tal.'
 'Conforme o Edson estava andando do lado desse cara, ele não sabe explicar direito como isso aconteceu, mas ele sentiu uma mão no ombro dele. — Assim, atrás… — Ele não conseguia ver quem era, mas ao mesmo tempo que ele não conseguia ver quem era, ele via que quem botou a mão no ombro dele foi um homem, negro, muito alto, vestido com um terno branco e um sapato muito brilhante. Conforme este homem botou a mão no ombro dele, o Edson falou: “Andréia, eu juro pela minha mãe… Eu vi esse rapaz que estava comigo cavando um buraco num quintal onde tinha uns bancos assim branquinhos e arrastando o meu corpo. Eu via o meu tênis…” — e ele estava com um tênis caro, um tênis diferente — “Eu via ele me arrastando pelos pés e eu via o meu tênis e ele me jogando no buraco”… Foi isso que o Edson viu assim que este homem colocou a mão no ombro dele. Ao mesmo tempo que ele via isso, ele estava andando, gente…'
 'Eu fiquei chocada… — Se realmente algo fosse acontecer, essa entidade que apareceu e que pegou no ombro do Edson, salvou ele da morte. — Salvou ele da morte. — E aí eu fico pensando: Mas por outro lado, não dizem que a nossa hora da morte já está escrita? Não era hora então do Edson? E é por isso que ele conseguiu se livrar?'
 'Déia Freitas: Oi, gente… Cheguei. Cheguei pra um Luz Acesa. E hoje eu vou contar pra vocês a história do Edson. Então vamos lá, vamos de história.']",0.37710887280690275,0.0,0.3333333333333333,0.391670694891837,0.09791767372295924
61,"No episódio 'entidade', o que o Edson viu quando o homem colocou a mão no seu ombro?","Quando o homem colocou a mão no ombro do Edson, ele viu um homem negro, muito alto, vestido com um terno branco e um sapato muito brilhante, que o arrastava pelo quintal e o jogava num buraco.",Uma cena em que ele estava sendo jogado num buraco num quintal.,"['Conforme este homem botou a mão no ombro dele, o Edson falou: “Andréia, eu juro pela minha mãe… Eu vi esse rapaz que estava comigo cavando um buraco num quintal onde tinha uns bancos assim branquinhos e arrastando o meu corpo. Eu via o meu tênis…” — e ele estava com um tênis caro, um tênis diferente — “Eu via ele me arrastando pelos pés e eu via o meu tênis e ele me jogando no buraco”… Foi isso que o Edson viu assim que este homem colocou a mão no ombro dele. Ao mesmo tempo que ele via isso, ele estava andando, gente…'
 'Conforme o Edson estava andando do lado desse cara, ele não sabe explicar direito como isso aconteceu, mas ele sentiu uma mão no ombro dele. — Assim, atrás… — Ele não conseguia ver quem era, mas ao mesmo tempo que ele não conseguia ver quem era, ele via que quem botou a mão no ombro dele foi um homem, negro, muito alto, vestido com um terno branco e um sapato muito brilhante. Conforme este homem botou a mão no ombro dele, o Edson falou: “Andréia, eu juro pela minha mãe… Eu vi esse rapaz que estava comigo cavando um buraco num quintal onde tinha uns bancos assim branquinhos e arrastando o meu corpo. Eu via o meu tênis…” — e ele estava com um tênis caro, um tênis diferente — “Eu via ele me arrastando pelos pés e eu via o meu tênis e ele me jogando no buraco”… Foi isso que o Edson viu assim que este homem colocou a mão no ombro dele. Ao mesmo tempo que ele via isso, ele estava andando, gente…'
 'E aí eles começaram a andar lado a lado e, a partir do momento que eles estavam andando lado a lado, o cara parou de falar e começou a olhar muito pros lados, assim… — Gente, parece uma armadilha, né? Uma cilada. — Conforme o Edson estava andando do lado desse cara, ele não sabe explicar direito como isso aconteceu, mas ele sentiu uma mão no ombro dele. — Assim, atrás… — Ele não conseguia ver quem era, mas ao mesmo tempo que ele não conseguia ver quem era, ele via que quem botou a mão no ombro dele foi um homem, negro, muito alto, vestido com um terno branco e um sapato muito brilhante. Conforme este homem botou a mão no ombro dele, o Edson falou: “Andréia, eu juro pela minha mãe… Eu vi esse rapaz que estava comigo cavando um buraco num quintal onde tinha uns bancos assim branquinhos e arrastando o meu corpo.'
 'Até hoje o Edson não acredita 100%, assim, ele acha que que pode ser uma grande coincidência, sei lá. Mas se a mãe dele não contou o sonho pra ele, não tinha como ele ver essa imagem, né, gente? Tinha? Não tinha para ser uma coisa, assim, uma coincidência… Eu sou muito cismada também, então, assim… Mas se uma entidade, se alguém botar a mão no meu ombro e fala: “Faz isso”, eu faço gente, ainda mais me mostrando que eu vou ser botada num buraco… Ele deu até um tempo dos aplicativos e tal, e quando ele vai pra fora, para lugares que ele não conhece, ele não liga mais o aplicativo… Deixa pra usar só aqui mesmo, que é onde ele conhece, que ele sabe onde ele pode ir e tal, com caras que ele já saiu e tal. — Eu fiquei chocada… — Se realmente algo fosse acontecer, essa entidade que apareceu e que pegou no ombro do Edson, salvou ele da morte. —']",0.3513707154899966,0.6666666666666666,0.23529411764705882,0.4809685226223086,0.30774213065557715
62,"No episódio 'entidade', quem pode ter sido o homem que apareceu e pegou no ombro do Edson?","O homem que apareceu e pegou no ombro do Edson foi um homem, negro, muito alto, vestido com um terno branco e um sapato muito brilhante.","O Exu da irmã do Edson, Diana.","['Conforme o Edson estava andando do lado desse cara, ele não sabe explicar direito como isso aconteceu, mas ele sentiu uma mão no ombro dele. — Assim, atrás… — Ele não conseguia ver quem era, mas ao mesmo tempo que ele não conseguia ver quem era, ele via que quem botou a mão no ombro dele foi um homem, negro, muito alto, vestido com um terno branco e um sapato muito brilhante. Conforme este homem botou a mão no ombro dele, o Edson falou: “Andréia, eu juro pela minha mãe… Eu vi esse rapaz que estava comigo cavando um buraco num quintal onde tinha uns bancos assim branquinhos e arrastando o meu corpo. Eu via o meu tênis…” — e ele estava com um tênis caro, um tênis diferente — “Eu via ele me arrastando pelos pés e eu via o meu tênis e ele me jogando no buraco”… Foi isso que o Edson viu assim que este homem colocou a mão no ombro dele. Ao mesmo tempo que ele via isso, ele estava andando, gente…'
 'Conforme este homem botou a mão no ombro dele, o Edson falou: “Andréia, eu juro pela minha mãe… Eu vi esse rapaz que estava comigo cavando um buraco num quintal onde tinha uns bancos assim branquinhos e arrastando o meu corpo. Eu via o meu tênis…” — e ele estava com um tênis caro, um tênis diferente — “Eu via ele me arrastando pelos pés e eu via o meu tênis e ele me jogando no buraco”… Foi isso que o Edson viu assim que este homem colocou a mão no ombro dele. Ao mesmo tempo que ele via isso, ele estava andando, gente…'
 'Eu fiquei chocada… — Se realmente algo fosse acontecer, essa entidade que apareceu e que pegou no ombro do Edson, salvou ele da morte. — Salvou ele da morte. — E aí eu fico pensando: Mas por outro lado, não dizem que a nossa hora da morte já está escrita? Não era hora então do Edson? E é por isso que ele conseguiu se livrar?'
 'E aí eles começaram a andar lado a lado e, a partir do momento que eles estavam andando lado a lado, o cara parou de falar e começou a olhar muito pros lados, assim… — Gente, parece uma armadilha, né? Uma cilada. — Conforme o Edson estava andando do lado desse cara, ele não sabe explicar direito como isso aconteceu, mas ele sentiu uma mão no ombro dele. — Assim, atrás… — Ele não conseguia ver quem era, mas ao mesmo tempo que ele não conseguia ver quem era, ele via que quem botou a mão no ombro dele foi um homem, negro, muito alto, vestido com um terno branco e um sapato muito brilhante. Conforme este homem botou a mão no ombro dele, o Edson falou: “Andréia, eu juro pela minha mãe… Eu vi esse rapaz que estava comigo cavando um buraco num quintal onde tinha uns bancos assim branquinhos e arrastando o meu corpo.']",0.3297156365889433,1.0,0.1875,0.4198286247047358,0.10495715617618395
63,"No episódio 'biologico', quem é a mãe de Rúbia?",A mãe de Rúbia é dona Mirtes.,"A mãe de Rúbia é dona Mirtes, que já faleceu.","['A mãe dela, já falecida, — que a gente pode, sei lá, chamar de dona Mirtes — dona Mirtes não tem como falar nada, não tem como se defender, enfim, já morreu… Mas o fato é que Rúbia não é filha biológica do pai dela e o pai dela acha que é, enfim, todo mundo… — A família inteira. — Agora só ela e a tia sabem que ela não pode ser filha do pai, né? Por essa questão até aí sanguínea e tal.'
 'Quer saber mais da vida dela e agora do irmão, mas ela acha que o irmão vai acabar contando pro pai, porque o irmão é meio boca aberta, sabe? Então ela tem esse medo também de, de repente, revelar para o irmão e ele contar pro pai. A mãe dela, já falecida, — que a gente pode, sei lá, chamar de dona Mirtes — dona Mirtes não tem como falar nada, não tem como se defender, enfim, já morreu… Mas o fato é que Rúbia não é filha biológica do pai dela e o pai dela acha que é, enfim, todo mundo… — A família inteira. — Agora só ela e a tia sabem que ela não pode ser filha do pai, né? Por essa questão até aí sanguínea e tal.'
 'Desse pai que a criou, que é pai dela. — E aí a Rúbia tá na dúvida se ela chama o irmão pra conversar e contar tudo e pedir pra ele fazer também o teste de DNA, porque ela quer saber mais, enfim, né? Quer saber mais da vida dela e agora do irmão, mas ela acha que o irmão vai acabar contando pro pai, porque o irmão é meio boca aberta, sabe? Então ela tem esse medo também de, de repente, revelar para o irmão e ele contar pro pai. A mãe dela, já falecida, — que a gente pode, sei lá, chamar de dona Mirtes — dona Mirtes não tem como falar nada, não tem como se defender, enfim, já morreu… Mas o fato é que Rúbia não é filha biológica do pai dela e o pai dela acha que é, enfim, todo mundo… — A família inteira. —'
 'Aí foram lá, fizeram o exame e ela realmente é filha da mãe dela. Então a mãe dela teve um relacionamento, — extraconjugal — engravidou e teve a Rúbia. E a tia ficou apavorada… — Porque, por mais que a tia soubesse rumores que talvez a mãe da Rúbia tivesse sido infiel. — Ela não sabia de nada, não sabia quem poderia ser o pai da Rúbia. E aí a Rúbia, acessando assim memórias antigas de quando ela era criança, ela lembra da mãe, tipo, ela num parquinho com a mãe e um outro rapaz… Mas o rapaz não estava abraçado, beijando a mãe, nada… Mas o rapaz estava ali olhando ela, brincou um pouco com ela… E agora, a Rúbia acha que este rapaz que a mãe encontrava às vezes com ela no parquinho, pode ser o pai dela. —']",0.39309033735626736,1.0,0.25,0.9258032983959146,0.7314508245989786
64,"No episódio 'biologico', por que Rúbia descobriu que não pode ser filha do pai dela?","Rúbia descobriu que não pode ser filha do pai dela porque, quando toda a família foi doar sangue para o pai, ela descobriu que seu tipo sanguíneo é AB, e como a mãe era tipo A e o pai era tipo O, ela não poderia ser filha biológica do pai.",Rúbia descobriu que não pode ser filha do pai dela porque seu tipo sanguíneo é AB e os pais têm tipos sanguíneos A e O.,"['A mãe dela, já falecida, — que a gente pode, sei lá, chamar de dona Mirtes — dona Mirtes não tem como falar nada, não tem como se defender, enfim, já morreu… Mas o fato é que Rúbia não é filha biológica do pai dela e o pai dela acha que é, enfim, todo mundo… — A família inteira. — Agora só ela e a tia sabem que ela não pode ser filha do pai, né? Por essa questão até aí sanguínea e tal.'
 'Quer saber mais da vida dela e agora do irmão, mas ela acha que o irmão vai acabar contando pro pai, porque o irmão é meio boca aberta, sabe? Então ela tem esse medo também de, de repente, revelar para o irmão e ele contar pro pai. A mãe dela, já falecida, — que a gente pode, sei lá, chamar de dona Mirtes — dona Mirtes não tem como falar nada, não tem como se defender, enfim, já morreu… Mas o fato é que Rúbia não é filha biológica do pai dela e o pai dela acha que é, enfim, todo mundo… — A família inteira. — Agora só ela e a tia sabem que ela não pode ser filha do pai, né? Por essa questão até aí sanguínea e tal.'
 'E aí, beleza… Todo mundo foi lá doar sangue e nã nã nã e foi a primeira vez que a Rúbia teve acesso ao seu tipo sanguíneo. E ela aprendendo ali algumas coisas da época da escola, ela acabou percebendo que ela não poderia ser filha do pai dela. [ efeito sonoro de suspense] Então, assim, a mãe da Rúbia era sangue tipo A e o pai da Rúbia sangue tipo O. Então a Rúbia só poderia ser A ou O e a Rúbia era AB. [ efeito sonoro de tensão]'
 'A Rúbia ela tem um irmão, — mais velho — a mãe dela faleceu há alguns anos… E o pai dela, há um tempo atrás, estava precisando fazer uma cirurgia…  De fígado, vai… — Não é de fígado, mas digamos que seja. — E pra isso o hospital pediu ali a doação de sangue de todo mundo, da família. E aí, beleza… Todo mundo foi lá doar sangue e nã nã nã e foi a primeira vez que a Rúbia teve acesso ao seu tipo sanguíneo. E ela aprendendo ali algumas coisas da época da escola, ela acabou percebendo que ela não poderia ser filha do pai dela. [ efeito sonoro de suspense] Então, assim, a mãe da Rúbia era sangue tipo A e o pai da Rúbia sangue tipo O. Então a Rúbia só poderia ser A ou O e a Rúbia era AB. [']",0.35134357303037217,1.0,0.3333333333333333,0.7846679746642182,0.44616699366605456
65,"No episódio 'biologico', o que Rúbia quer descobrir sobre sua vida e família?","Rúbia quer descobrir quem é o pai biológico dela e se o irmão é realmente filho do pai que a criou. Além disso, ela também quer saber mais sobre a vida da mãe e como ela conheceu o pai biológico.",Rúbia quer descobrir quem é o pai biológico dela e como sua mãe conheceu essa pessoa durante o casamento.,"['Quer saber mais da vida dela e agora do irmão, mas ela acha que o irmão vai acabar contando pro pai, porque o irmão é meio boca aberta, sabe? Então ela tem esse medo também de, de repente, revelar para o irmão e ele contar pro pai. A mãe dela, já falecida, — que a gente pode, sei lá, chamar de dona Mirtes — dona Mirtes não tem como falar nada, não tem como se defender, enfim, já morreu… Mas o fato é que Rúbia não é filha biológica do pai dela e o pai dela acha que é, enfim, todo mundo… — A família inteira. — Agora só ela e a tia sabem que ela não pode ser filha do pai, né? Por essa questão até aí sanguínea e tal.'
 'E aí agora, gente, a Rúbia ela não quer contar para o pai dela, o pai dela já tem uma saúde frágil e tal, então ela não quer causar esse sofrimento, de agora, de repente, o pai descobrir que que a mãe dela foi infiel e tal, né? Mas ela queria descobrir quem era o pai dela e ela também queria descobrir se o irmão dela é realmente filho do pai dela. — Desse pai que a criou, que é pai dela. — E aí a Rúbia tá na dúvida se ela chama o irmão pra conversar e contar tudo e pedir pra ele fazer também o teste de DNA, porque ela quer saber mais, enfim, né? Quer saber mais da vida dela e agora do irmão, mas ela acha que o irmão vai acabar contando pro pai, porque o irmão é meio boca aberta, sabe?'
 'Desse pai que a criou, que é pai dela. — E aí a Rúbia tá na dúvida se ela chama o irmão pra conversar e contar tudo e pedir pra ele fazer também o teste de DNA, porque ela quer saber mais, enfim, né? Quer saber mais da vida dela e agora do irmão, mas ela acha que o irmão vai acabar contando pro pai, porque o irmão é meio boca aberta, sabe? Então ela tem esse medo também de, de repente, revelar para o irmão e ele contar pro pai. A mãe dela, já falecida, — que a gente pode, sei lá, chamar de dona Mirtes — dona Mirtes não tem como falar nada, não tem como se defender, enfim, já morreu… Mas o fato é que Rúbia não é filha biológica do pai dela e o pai dela acha que é, enfim, todo mundo… — A família inteira. —'
 'A Rúbia disse que despertou nela uma curiosidade de saber quem é o pai dela e saber como que aconteceu isso, como a mãe dela conheceu outra pessoa no meio do casamento e saiu com essa pessoa, engravidou, enfim… Queria ouvir isso do cara… — Que seria o pai biológico dela. — Só que ela não quer magoar o pai dela, que sempre foi muito presente, muito bacana, né? A família dela sempre foi muito unida e agora o pai dela está adoentado… Então, não sei… Acho que não agora não é o momento mesmo, né? De sentar com o pai dele e falar isso. Vocês acham que ela deve contar a verdade para o pai?']",0.33899272292324373,0.75,0.23809523809523808,0.9136679374693865,0.6569884129387752
66,"No episódio 'desmazelado', quem era o cara que Gabriela conheceu na van?","O cara que Gabriela conheceu na van era um cara meio desmazelado, sem meio largado, com a roupa meio amassada, meio puída assim, meio estranho.","Um cara bonitinho, interessante, mas desmazelado.","['E aí esse cara era meio desmazelado assim, sem meio largado, com a roupa meio amassada, meio puída assim, meio estranho. Mas Gabriela gostou, fez um charminho, desceu… No outro dia, encontrou o mesmo cara. Ele também já no interesse, desceu junto com Gabriela. Trocaram telefone, começaram a se falar… Só que o cara andava mesmo mal arrumado, não ligava para nada e tal, cabelo até meio ensebado. — Ô, Gabriela… Ô, Gabriela, aí também já é demais, né?'
 'A Gabriela todo dia ela pegava uma van para ir pro trabalho. Então, assim, o bairro que ela morava não tinha muito ônibus de linha e tinha aí umas vans meio duvidosas, mas que funcionava até onde ela precisava ir e ela pegava essas vans… Um dia, — Na van. — ela viu um cara… Cara bonitinho, interessante… Então ela estava lá no fundo da van, porque ela pegava primeiro que o cara, né? E sentava lá no fundo. Ela estava lá no fundo da van, ele entrou sentou, mas ela só viu quando ele já estava sentado.'
 'Mais um tempo se passou, Gabriela estava no trabalho, quando ela recebeu um print de um telefone que ela não conhecia. — Um número desconhecido. — E neste print lá estava o nosso amigo desmazelado, — Ex desmazelado, que teve aí toda uma curadoria fashion de Gabriela. — com uma moça num shopping. Então, imagina assim… — Que nem aqui, vou falar da minha cidade… Aqui em Santo André tem três shoppings, então eu vou no intermediário.'
 'E neste print lá estava o nosso amigo desmazelado, — Ex desmazelado, que teve aí toda uma curadoria fashion de Gabriela. — com uma moça num shopping. Então, imagina assim… — Que nem aqui, vou falar da minha cidade… Aqui em Santo André tem três shoppings, então eu vou no intermediário. Tem o mais pop, o intermediário e o mais top. Eu vou no intermediário que é mais perto da minha casa, enfim, raramente você vai me ver no mais top… Porque, enfim, é mais caro, tem um pessoal mais fresco… —']",0.42478088525759955,0.0,0.25,0.659100854569678,0.3790609279281338
67,"No episódio 'desmazelado', o que Gabriela fez com o cara desmazelado?","Gabriela deu um verniz no cara desmazelado, arrumou o visual dele e ele ficou bonitão.","Ela deu um verniz no rapaz, arrumando o visual dele e incentivando ele a se vestir melhor.","['E foi o que Gabriela fez. — Ela deu um verniz no rapaz ali. — Foi arrumando o visual dele e ele ficou bonitão. Ele já era bonito, mas ele era muito mal arrumado, muito desleixado, assim, largado. — Acho que a palavra é largado. —'
 'E aí esse cara era meio desmazelado assim, sem meio largado, com a roupa meio amassada, meio puída assim, meio estranho. Mas Gabriela gostou, fez um charminho, desceu… No outro dia, encontrou o mesmo cara. Ele também já no interesse, desceu junto com Gabriela. Trocaram telefone, começaram a se falar… Só que o cara andava mesmo mal arrumado, não ligava para nada e tal, cabelo até meio ensebado. — Ô, Gabriela… Ô, Gabriela, aí também já é demais, né?'
 'O que ele fez com as coisas? Vendeu? Sei lá, usou até gastar? — E aí ela virou as costas, saiu andando, falou um palavrão e nunca mais encontrou esse cara. [ efeito sonoro fogos de artifício] Mas assim, eu recebo muitos e-mails com histórias assim, tanto de mulheres novas como a Gabriela, que é uma jovem, mocinha, né?'
 'E neste print lá estava o nosso amigo desmazelado, — Ex desmazelado, que teve aí toda uma curadoria fashion de Gabriela. — com uma moça num shopping. Então, imagina assim… — Que nem aqui, vou falar da minha cidade… Aqui em Santo André tem três shoppings, então eu vou no intermediário. Tem o mais pop, o intermediário e o mais top. Eu vou no intermediário que é mais perto da minha casa, enfim, raramente você vai me ver no mais top… Porque, enfim, é mais caro, tem um pessoal mais fresco… —']",0.36737183534475065,1.0,0.3333333333333333,0.7144435575715411,0.4786108893928853
68,"No episódio 'desmazelado', por que o cara terminou o relacionamento com Gabriela?","Ele terminou o relacionamento com Gabriela porque estava apaixonado por outra moça e queria terminar com Gabriela após ela receber prints. Além disso, ele foi muito cruel ao terminar, dizendo que merecia mais.",Ele disse que merecia mais e estava apaixonado por outra moça.,"['e que ele estava apaixonado por essa moça, e que foi bom até que ela recebeu esses prints, porque agora ele queria terminar. Gabriela ficou em choque, porque eles estavam bem, sabe? Não tinha acontecido nada assim, né? Só que ele foi muito cruel terminando, falando que ele merecia mais… — Guardem essa frase… Ele merecia mais, ele achava que ele merecia mais. — E aí Gabriela chorou, ficou mal, mudou de van… — Para não encontrar o traste. —'
 'E aí esse cara era meio desmazelado assim, sem meio largado, com a roupa meio amassada, meio puída assim, meio estranho. Mas Gabriela gostou, fez um charminho, desceu… No outro dia, encontrou o mesmo cara. Ele também já no interesse, desceu junto com Gabriela. Trocaram telefone, começaram a se falar… Só que o cara andava mesmo mal arrumado, não ligava para nada e tal, cabelo até meio ensebado. — Ô, Gabriela… Ô, Gabriela, aí também já é demais, né?'
 'E aí ela fez isso, ele foi na casa dela à noite, ela mostrou os prints e ele começou a gaguejar. E aí ele disse que tinha conhecido essa moça, [música de tensão] — Perto do trabalho dele. — e que ele estava apaixonado por essa moça, e que foi bom até que ela recebeu esses prints, porque agora ele queria terminar. Gabriela ficou em choque, porque eles estavam bem, sabe? Não tinha acontecido nada assim, né?'
 'Não tinha acontecido nada assim, né? Só que ele foi muito cruel terminando, falando que ele merecia mais… — Guardem essa frase… Ele merecia mais, ele achava que ele merecia mais. — E aí Gabriela chorou, ficou mal, mudou de van… — Para não encontrar o traste. — Passaram-se ali quase, cinco meses, ela voltou para a van que ela pegava. — Porque ela tinha que fazer outro trajeto, demorava… —']",0.6524125808593756,0.5,0.19047619047619047,0.4674565567053486,0.36686413917633715
69,"No episódio '50 reais', quem era a pessoa que a Kátia estava apaixonada?",A pessoa que a Kátia estava apaixonada era a Flávia.,Flávia,"['A Kátia Flávia ficaram mais algumas vezes e a Kátia, como uma boa sapatão, ficou apaixonada pela Flávia. [ música animada] Kátia queria o quê? Kátia queria casamento. [ risos] Flávia estava mais na dela, curtindo a vida. Então, assim, elas não tinham nada, elas ficaram… — Apenas isso… — Aí um dia a Kátia tá lá na faculdade quando aparece o nome da Flávia na tela… O coração da Kátia já ficou, assim, acelerado, batendo forte… E a Flávia estava ligando pra fazer um convite pra Kátia.'
 'risos] Achei ótimo. [ risos] Na época, a Kátia, que se botou nessa enrascada porque estava apaixonada, né? Ficou com muita raiva da Flávia, por tudo que ela fez… Ainda vender a amiga por 50 reais, gente? Sério… A Kátia ficou muito p da vida. E, assim, ela participou de uma prostituição involuntária, [risos] né?'
 'Menina, foi uma luta pra Flávia fazer o pau desse homem subir, então assim, ele é um bosta”. E aí a Kátia foi falando de como que foi a noite péssima e acabou que a menina caiu na risada. [ risos] Achei ótimo. [ risos] Na época, a Kátia, que se botou nessa enrascada porque estava apaixonada, né? Ficou com muita raiva da Flávia, por tudo que ela fez… Ainda vender a amiga por 50 reais, gente?'
 'Assinante 1: Olá, Não Inviabilizers, aqui é a Raquel que fala de Portugal. Ê, Kátia… Você foi vendida sem saber. É um pouco preocupante a história, porque você foi para o motel com uma pessoa desconhecida, numa cidade desconhecida e eu entendo, você estava apaixonada e amor de sapatão é assim mesmo… A gente move Deus e o mundo, mas na hora que você fosse falar com ele, da cobrança, eu cobraria muito mais caro… Total, assim… [risos] Falava: “Não, não, 100 reais, não… 300, meu filho… Mas só eu, tá? A Flávia você cobra a ela, a parte dela”. Cara, que horror… Ele ainda gravou vocês… Isso eu acho que antigamente não tinha uma lei e agora tem, agora é um ato criminoso.']",0.32349316835663194,1.0,0.21052631578947367,0.5907056840560683,0.8976764210140171
70,"No episódio '50 reais', o que a Flávia queria que a Kátia fizesse com o cara?",A Flávia queria que a Kátia transasse com o cara.,Fazer sexo com o cara,"['A indignação da Kátia era: “Pô, eu estou valendo só 50 reais?”. E aí a Kátia falou: “Menos mal que eu não encostei no cara, né? 50 reais?”. [ risos] Ela ficou muito chocada… [risos] — Pô, 50 reais, gente… É foda, né? 50 reais… [risos] — O tempo passou, Kátia não falou nunca mais com Flávia e nem com o cara.'
 'e o cara falando: [efeito de voz grossa] “Sim, eu combinei com a Flávia, né? Ela falou que por 100 reais ela levava uma amiga ainda. Eu posso pagar para você?”. E aí a Kátia já com muita raiva, falou: “Não… Isso aí você resolve com ela depois”. E aí a Kátia saiu ali p da vida do carro e nunca mais falou com a Flávia.'
 'É meio como pular corda, né? — Então, quando as duas estavam quase lá, assim, quase gozando, elas queriam já botar o cara. — Não tanto a Kátia, mas a Flávia. Porque a Kátia em nenhum momento ela pensou em transar com o cara, mas ela ia ficar ali enquanto a Flávia transava com o cara, né? — E aí elas olharam em volta… Cadê o cara?'
 'risos] E a Kátia completamente surpresa, assim, só ficava ouvindo o cara falar… [efeito de voz grossa] “100 reais… Eu pago pra você os 100 reais?”. E aí a Kátia: “100 reais? Nós duas por 100 reais? Quê?” e o cara falando: [efeito de voz grossa] “Sim, eu combinei com a Flávia, né?']",0.3926455814051162,0.0,0.2857142857142857,0.6461274922677811,0.9115318730669453
71,"No episódio '50 reais', quanto a Flávia receives para levar a Kátia junto?",A Flávia recebe 100 reais para levar a Kátia junto.,100 reais,"['e o cara falando: [efeito de voz grossa] “Sim, eu combinei com a Flávia, né? Ela falou que por 100 reais ela levava uma amiga ainda. Eu posso pagar para você?”. E aí a Kátia já com muita raiva, falou: “Não… Isso aí você resolve com ela depois”. E aí a Kátia saiu ali p da vida do carro e nunca mais falou com a Flávia.'
 'Pagar o quê?”, aí o cara respondeu: [efeito de voz grossa] “É, o programa… A Flávia falou que vocês duas juntas custava 100 reais a noite”. [ risos] E a Kátia completamente surpresa, assim, só ficava ouvindo o cara falar… [efeito de voz grossa] “100 reais… Eu pago pra você os 100 reais?”. E aí a Kátia: “100 reais? Nós duas por 100 reais?'
 'E a Kátia: “Oi? Pagar? Pagar o quê?”, aí o cara respondeu: [efeito de voz grossa] “É, o programa… A Flávia falou que vocês duas juntas custava 100 reais a noite”. [ risos] E a Kátia completamente surpresa, assim, só ficava ouvindo o cara falar… [efeito de voz grossa] “100 reais… Eu pago pra você os 100 reais?”.'
 'Assinante 1: Olá, Não Inviabilizers, aqui é a Raquel que fala de Portugal. Ê, Kátia… Você foi vendida sem saber. É um pouco preocupante a história, porque você foi para o motel com uma pessoa desconhecida, numa cidade desconhecida e eu entendo, você estava apaixonada e amor de sapatão é assim mesmo… A gente move Deus e o mundo, mas na hora que você fosse falar com ele, da cobrança, eu cobraria muito mais caro… Total, assim… [risos] Falava: “Não, não, 100 reais, não… 300, meu filho… Mas só eu, tá? A Flávia você cobra a ela, a parte dela”. Cara, que horror… Ele ainda gravou vocês… Isso eu acho que antigamente não tinha uma lei e agora tem, agora é um ato criminoso.']",0.46109592382413056,0.0,0.2857142857142857,0.5390298619582738,0.6347574654895685
72,"No episódio 'barcos', quem era o parceiro da Joelma?","O parceiro da Joelma era um senhor, dono de um iate ou barcão.",Um cara que ela conheceu em 2010 e com quem ela se casou e teve dois filhos.,"['E aí depois de uma semana e meia o cara marcou com ela, — foi até rápido — ela foi no escritório lá do detetive e ele entregou para ela um envelope… — Com várias fotos… — [efeito sonoro de papel sendo rasgado] E aí Joelma quase caiu de costas… Realmente tinha alguém bancando o marido dela, só que esse alguém não era uma senhora bancando ele, uma mulher, era o cara da lancha, o véio da lancha, o senhor… Ele estava namorando um senhor, — tipo, um véio da lancha. [ risos] Não é lancha, era um iate, um barcão assim, né? — E aí tinham várias fotos dele beijando o cara, tinha até foto deles dois, assim, nus no barco. — Como que o detetive conseguiu isso? Mas conseguiu assim… Os dois ali e pegou tudo, gente… Pegou toda a cena. —'
 'Então, o que ela combinou? Ela falou: “Olha, eu vou pagar mais um mês então, e aí se não tiver nada no segundo mês aí eu não tenho mais condição de pagar”, e o cara falou: “Não, tudo bem, eu acho que mais umas duas semanas eu já consigo te entregar alguma coisa”. E aí depois de uma semana e meia o cara marcou com ela, — foi até rápido — ela foi no escritório lá do detetive e ele entregou para ela um envelope… — Com várias fotos… — [efeito sonoro de papel sendo rasgado] E aí Joelma quase caiu de costas… Realmente tinha alguém bancando o marido dela, só que esse alguém não era uma senhora bancando ele, uma mulher, era o cara da lancha, o véio da lancha, o senhor… Ele estava namorando um senhor, — tipo, um véio da lancha. [ risos] Não é lancha, era um iate, um barcão assim, né? — E aí tinham várias fotos dele beijando o cara, tinha até foto deles dois, assim, nus no barco. —'
 'Então ele dava essa desculpa de que ele acompanhava ali a venda, né? Fazia tipo um pós venda. Então, o Instagram do marido da Joelma tinha muita foto de barco e ele nos barcos, né? Porque às vezes, sei lá, a pessoa te convida… Você vendeu o barco pra ela e ela te convida. — Acho estranho, mas era ali o contexto das fotos dele. —'
 'E aí depois de um tempo o senhor lá — do barco, né? que eu gosto de chamar do véio da lancha —faleceu…— E, conforme esse senhor faleceu, no dia seguinte do falecimento desse senhor, os filhos dele, — os filhos que já eram adultos, casados e tal, colocaram esse ex—marido da Joelma pra fora. — Tipo, no dia seguinte… Com uma mão na frente e outra atrás. —']",0.33390435733406615,0.5,0.22727272727272727,0.41217886839414364,0.10304471709853591
73,"No episódio 'barcos', o que o detetive descobriu sobre o marido da Joelma?","O detetive descobriu que o marido da Joelma estava namorando um senhor, que era o dono de um iate, e não uma mulher.",Que ele estava namorando um homem rico e que fazia negócios suspeitos.,"['E aí depois de uma semana e meia o cara marcou com ela, — foi até rápido — ela foi no escritório lá do detetive e ele entregou para ela um envelope… — Com várias fotos… — [efeito sonoro de papel sendo rasgado] E aí Joelma quase caiu de costas… Realmente tinha alguém bancando o marido dela, só que esse alguém não era uma senhora bancando ele, uma mulher, era o cara da lancha, o véio da lancha, o senhor… Ele estava namorando um senhor, — tipo, um véio da lancha. [ risos] Não é lancha, era um iate, um barcão assim, né? — E aí tinham várias fotos dele beijando o cara, tinha até foto deles dois, assim, nus no barco. — Como que o detetive conseguiu isso? Mas conseguiu assim… Os dois ali e pegou tudo, gente… Pegou toda a cena. —'
 'Joelma resolveu fazer isso, contratar um detetive — para seguir o marido — e assim foi feito. A primeira coisa que ela teve que fazer foi passar a rotina, — do que ela sabia para esse detetive — ele explicou como que trabalhava, era ele e mais dois. — Eles usam muita moto, né? E filmam tudo, enfim… — E aí no primeiro mês o cara meio que fez um apanhado da rotina, né? Então conseguiu passar pra ela onde ele ia, os lugares que ele frequentava quando ele estava no litoral e nã nã nã, mas não pegou nada.'
 'Então, o Instagram do marido da Joelma tinha muita foto de barco e ele nos barcos, né? Porque às vezes, sei lá, a pessoa te convida… Você vendeu o barco pra ela e ela te convida. — Acho estranho, mas era ali o contexto das fotos dele. — E a Joelma começou a reparar uma coisa que, assim, muitas fotos do marido dela tinha um senhor nas fotos, assim… Estava sempre ali. E aí ela ficou pensando, falou: “Engraçado, será que ele vende vários barcos pra esse senhor, né?”,'
 'Então, o que ela combinou? Ela falou: “Olha, eu vou pagar mais um mês então, e aí se não tiver nada no segundo mês aí eu não tenho mais condição de pagar”, e o cara falou: “Não, tudo bem, eu acho que mais umas duas semanas eu já consigo te entregar alguma coisa”. E aí depois de uma semana e meia o cara marcou com ela, — foi até rápido — ela foi no escritório lá do detetive e ele entregou para ela um envelope… — Com várias fotos… — [efeito sonoro de papel sendo rasgado] E aí Joelma quase caiu de costas… Realmente tinha alguém bancando o marido dela, só que esse alguém não era uma senhora bancando ele, uma mulher, era o cara da lancha, o véio da lancha, o senhor… Ele estava namorando um senhor, — tipo, um véio da lancha. [ risos] Não é lancha, era um iate, um barcão assim, né? — E aí tinham várias fotos dele beijando o cara, tinha até foto deles dois, assim, nus no barco. —']",0.3387884575986317,0.6666666666666666,0.18181818181818182,0.5024170200225428,
74,"No episódio 'barcos', qual foi o destino final do marido da Joelma?","O destino final do marido da Joelma foi que os filhos do senhor que faleceu o colocaram pra fora, no dia seguinte do falecimento do senhor.","Ele tentou voltar com a Joelma após a morte do homem rico, mas foi rejeitado e hoje vive no interior e não vê os filhos.","['E aí depois de um tempo o senhor lá — do barco, né? que eu gosto de chamar do véio da lancha —faleceu…— E, conforme esse senhor faleceu, no dia seguinte do falecimento desse senhor, os filhos dele, — os filhos que já eram adultos, casados e tal, colocaram esse ex—marido da Joelma pra fora. — Tipo, no dia seguinte… Com uma mão na frente e outra atrás. —'
 'Foi uma confusão… E ela com um advogado mais, assim, pop, né? E ele como um puta advogado… Então foi pauleira. E aí depois de um tempo o senhor lá — do barco, né? que eu gosto de chamar do véio da lancha —faleceu…— E, conforme esse senhor faleceu, no dia seguinte do falecimento desse senhor, os filhos dele, — os filhos que já eram adultos, casados e tal, colocaram esse ex—marido da Joelma pra fora. — Tipo, no dia seguinte… Com uma mão na frente e outra atrás. —'
 'O marido dela estava abrindo mão de tudo, inclusive do apartamento para ela e que ele só queria o divórcio… E aí eles se divorciaram, ficaram um bom tempo sem se falar, decidiram essa coisa da visita dos filhos ali. Aí entrou na parada uma irmã da Joelma e tal pra fazer a conciliação de quando ele buscava as crianças, enfim… E esse marido dela deu um puta trabalho, porque depois tentou tirar a guarda das crianças dela. Foi uma confusão… E ela com um advogado mais, assim, pop, né? E ele como um puta advogado… Então foi pauleira. E aí depois de um tempo o senhor lá — do barco, né?'
 'E aí Joelma resolveu que ela ia seguir o marido. — Só que não é fácil você seguir um marido que você não sabe muito para onde vai, porque, ah, ele vai, sei lá, entregar um barco… A não ser que o barco esteja, [risos] assim, no meio da pista sendo rebocado, você não tem muito como seguir seu marido. — E aí ela tentou, mas ela conseguiu seguir.']",0.33631945387705203,1.0,0.2222222222222222,0.5565624842282111,0.13914062105705277
75,"No episódio 'alexandra', quem é a protagonista da história contada?","A protagonista da história contada no episódio 'alexandra' é Alexandra Mendes Leite, liderança do povo Chiquitano.",Alexandra Mendes Leite,"['Déia Freitas: Bom, essa foi a história da Alexandra. Eu tenho mais duas histórias ainda para contar para vocês. Eu vou deixar aqui na descrição do episódio o link para o site do Fundo Brasil de Direitos Humanos, tamo junto e eu volto em breve.'
 'Déia Freitas: Agora a gente vai ouvir a Juliane Yamakawa, que é a assessora de projetos do Fundo Brasil e responsável pelo fundo emergencial S.O.S Amazônia e, na sequência, ouviremos a maravilhosa Alexandra.'
 'Hoje eu vou contar para vocês a história de Alexandra Mendes Leite, liderança do povo Chiquitano. Ela vive na aldeia Acorizal e essa aldeia fica na Terra Indígena Portal do Encantado, localizada no município de Porto Esperidião, no Mato Grosso. Então vamos lá, vamos de história.'
 'E, para comemorar, eu estou aqui para contar quatro histórias de pessoas e projetos que tiveram o apoio do fundo. Eu vou deixar o link do fundo do Brasil aqui na descrição e você pode voltar o feed e ouvir a primeira história que eu já contei, a história da Lília. Hoje eu vou contar para vocês a história de Alexandra Mendes Leite, liderança do povo Chiquitano. Ela vive na aldeia Acorizal e essa aldeia fica na Terra Indígena Portal do Encantado, localizada no município de Porto Esperidião, no Mato Grosso. Então vamos lá, vamos de história.']",0.66418502040955,1.0,0.3333333333333333,0.5866260965063064,0.6466565241265766
76,"No episódio 'alexandra', o que happeniu com a aldeia Acorizal em 2019?","Em 2019, a aldeia Acorizal sofreu uma devastação na natureza, no território, com 80% do território queimado, perdendo tudo praticamente, incluindo sementes, roças e casas.",Um grande incêndio que destruiu grande parte da floresta e dos recursos da aldeia,"['O projeto foi aprovado e eu me lembro das conversas que eu tive com a Alexandra nessa época, dela me relatando que em 2020 ainda não tinha fogo no território, mas que eles estavam cobertos pela fumaça dos arredores. Então, mesmo sem o histórico de execução de muitos projetos, porque esse não era o foco da sucessão até 2019, eles conseguiram executar as atividades, realizaram essa abertura em volta do território e agora a comunidade tem uma segurança a mais, para o que aconteceu em 2019 não se repita. O que eu acho importante frisar, é a relevância de apoiar iniciativas de lideranças indígenas como Alexandra. Diretamente, a comunidade, o povo não foi beneficiado e está mais fortalecido por causa desse apoio, mas indiretamente, os benefícios são muito maiores, né? Vários estudos comprovam que a Amazônia tem muito menos desmatamento nas terras indígenas… E aí é muito pelo trabalho dos indígenas que se desdobram para realizar a proteção de seus territórios ancestrais.'
 'Alexandra Melo: De 2019 para cá, assim não de 2019, mas dos 20 anos para cá, depois da minha infância e que entrei para a fase adulta, muita coisa mudou. Em 2019 eu já estou na política, no movimento indígena, movimento quilombolas, movimentos da política social, então, começou as coisas mudarem. Em 2019 a gente sofreu uma devastação na nossa natureza, no nosso território muito grande. Foi um desespero, foi um sofrimento que o meu povo passou e, assim, 80% do meu território foi queimado, a gente perdeu tudo praticamente, a gente perdeu nossas sementes, queimou a nossa roça, chegou a queimar a casa…'
 'A Alexandra passou a infância na aldeia Acorizal, ela nasceu e cresceu na aldeia. E a infância dela foi muito tranquila, com bastante liberdade, era a mãe dela que era responsável pela educação da Alexandra. — E ela me disse que as crianças eram educadas de uma maneira diferente assim na aldeia, os ensinamentos eram transmitidos de uma maneira muito acolhedora, muito próxima, sabe assim? Os pais com os filhos. — Na época que Alexandre era criança, a aldeia tinha pouquíssimo contato com as pessoas de fora.'
 'Nesse ano de 2019. — Foi a área que mais teve focos de calor, de incêndio, foi ali o Mato Grosso… Mas não tinha para onde correr, eles tinham que se organizar e retomar ali, fazer o possível para reerguer a aldeia.']",0.3867532556133382,1.0,0.25,0.36226140694834785,0.5191367803085155
77,"No episódio 'alexandra', como a comunidade Chiquitana conseguiu se reerguer após a queimada?","A comunidade Chiquitana conseguiu se reerguer após a queimada inserindo no currículo do ensino médio da escola deles uma grade curricular diferenciada, recuperando práticas perdidas, como ter aula da língua materna, e capacitando as pessoas da aldeia para outros trabalhos. Além disso, eles também executaram atividades de abertura em volta do território, garantindo uma segurança a mais para que o que aconteceu em 2019 não se repita.",Através do apoio do Fundo Brasil e da capacitação das mulheres em reciclagem e produção de artesanatos,"['Vocês lembram que eu falei que a Alexandra teve que sair da aldeia para fazer o ensino médio? — Que foi péssimo, que ela sofreu horrores? — Então, a partir de 2005 — O povo Chiquitano teve uma conquista muito bacana. — eles conseguiram inserir no currículo do ensino médio da escola deles, — Que agora já tinham uma escola na aldeia. — eles conseguiram introduzir uma grade curricular diferenciada, então aí eles conseguiram recuperar algumas práticas que eles tinham perdido, como ter ali aula da língua materna. —'
 'E eu quero que Alexandra fale agora nas palavras dela como foi essa reestruturação e essa capacitação das pessoas da aldeia para outros trabalhos, porque ali, naquele momento, não tinha o que fazer, né? — Na aldeia. — Então, como foi essa articulação e como eles conseguiram aí reerguer a terra deles. — E eu gosto muito de falar isso. A terra deles, que é deles.'
 'O projeto foi aprovado e eu me lembro das conversas que eu tive com a Alexandra nessa época, dela me relatando que em 2020 ainda não tinha fogo no território, mas que eles estavam cobertos pela fumaça dos arredores. Então, mesmo sem o histórico de execução de muitos projetos, porque esse não era o foco da sucessão até 2019, eles conseguiram executar as atividades, realizaram essa abertura em volta do território e agora a comunidade tem uma segurança a mais, para o que aconteceu em 2019 não se repita. O que eu acho importante frisar, é a relevância de apoiar iniciativas de lideranças indígenas como Alexandra. Diretamente, a comunidade, o povo não foi beneficiado e está mais fortalecido por causa desse apoio, mas indiretamente, os benefícios são muito maiores, né? Vários estudos comprovam que a Amazônia tem muito menos desmatamento nas terras indígenas… E aí é muito pelo trabalho dos indígenas que se desdobram para realizar a proteção de seus territórios ancestrais.'
 'O povo Chiquitano travou uma luta contra o fogo de dois dias e uma noite, sem parar, mas a maioria se foi no fogo.']",0.3044780729863567,0.8,0.058823529411764705,0.4247756235471146,0.10619390588677866
78,"No episódio 'biquíni', quem é o homem que namora com a Priscila?",Não há informação suficiente no episódio para saber o nome do homem que namora com a Priscila.,Um homem que fez cirurgia bariátrica e se tornou gordofóbico.,"['A Priscila conheceu esse cara há cinco anos, eles estão juntos há cinco anos. — Vou falar desde o começo do relacionamento deles. — A Priscila uma moça gordo, esse cara um moço gordo, e tudo bem. Eles namorando, feliz da vida e nã nã nã. Até que esse cara resolve fazer a cirurgia bariátrica.'
 'Déia Freitas: Oi, gente… Voltei pra mais um Picolé de Limão do nosso especial de férias, história bem desagradável. A história que eu vou contar pra vocês hoje é a história da Priscila e do cara ai que ela namora, e vamos que vamos, vamos de história.'
 'A Priscila uma moça gordo, esse cara um moço gordo, e tudo bem. Eles namorando, feliz da vida e nã nã nã. Até que esse cara resolve fazer a cirurgia bariátrica. É importante dizer aqui, ambos assim com os exames todos ok, até hoje a Priscila com colesterol ok. — É importante falar, porque muita gente acha que só porque a pessoa é gorda ela não é saudável, e isso é um erro, isso é uma mentira, isso é gordofobia. —'
 'Mas ela fez isso, então eles conversavam por mensagem, ele mandava às vezes foto da balada que ele tava, às vezes ele estava com alguma menina… E ela gostando dele ainda aceitou continuar essa amizade. — Que eu não acho que seja uma amizade, mas tudo bem. — E aí a Priscila ficou feliz e voltou com esse cara, e esse cara falando que tinha mudado. Que tinha mudado, porque nã nã nã aceitação do corpo feminino, porque agora ele entendia e nã nã nã. Aí durante a pandemia, para não ficar indo e voltando e, de repente, colocar os pais da Priscila em risco, ela foi morar com ele.']",0.0,1.0,0.3333333333333333,0.47920923144646527,0.11980230786161632
79,"No episódio 'biquíni', por que o homem começou a tratar a Priscila de forma cruel?","Ele começou a tratar a Priscila de forma cruel porque ele tem traumas de quando ele era gordo e queria que ela fosse terapeuta dele, cuidasse dele e fizesse tudo do jeito que ele queria.",Ele começou a tratar a Priscila de forma cruel porque ele tem traumas de quando ele era gordo.,"['Ela não foi na piscina nenhuma vez. O dia que ela pôs short, ele falou pra ela colocar uma legging. E aí… — Agora é que vem o pior para mim. Por que eu falo sempre que a gente não pode ser ONG de macho? — Ele diz que ele trata a Priscila assim porque ele tem traumas de quando ele era gordo. —'
 'E esse cara surtou. Surtou porque a Priscila estava de biquíni e ele falou: “onde já se viu? Como você tem coragem com um corpo desse colocar biquíni? Eu vim pra piscina seis horas da manhã porque eu ia ficar até às oito e voltar enquanto você estava dormindo, porque não tem condição de você ficar na piscina desse jeito”. Nessas palavras… — Palavras desse cara. —'
 'Ele diz que ele trata a Priscila assim porque ele tem traumas de quando ele era gordo. — Só que eu vou retomar pra vocês aqui um pensamento que é meu, tá? Sobre ser ONG de macho. Nem sempre a ONG de macho é referente a algo financeiro, sabe? O cara ali tá querendo que ela seja terapeuta dele, que ela seja a mãe dele pra cuidar dele, porque tem isso também… Agora ele tem uma alimentação diferente, nesses oito meses ela fazia comidas, sei lá, saudáveis pra ele e tinha que ser tudo do jeito que ele queria… A empregada dele, porque é ela que limpava a casa e fazia tudo.'
 'E aí a Priscila chorou, porque assim, no final do relacionamento, mesmo ela continuando amiga desse… — Desse cidadão aí. — Ele foi muito cruel com ela e ele estava sendo cruel igual. E aí ela chorou muito nesse dia. Aí ele saiu, mas não tinha pra onde ir, porque era tudo ali dentro, tipo, do resort, dos chalés ali. — Não tinha pra onde ele ir. —']",0.2617813718885695,1.0,0.2857142857142857,0.917649452504693,0.5294123631261733
80,"No episódio 'biquíni', por que a Priscila acha que o homem mudou?","A Priscila acha que o homem mudou porque ele começou a entender e aceitar o corpo feminino, e também porque ele mudou seu comportamento em relação a ela, tornando-se mais gentil e cuidadoso.",Ela acha que ele mudou porque ele é gentil com ela quando estão isolados.,"['É aí é que está, a Priscila ela acha que ele gosta dela. — Vendo de fora, eu acho que não, mas eu estou de fora, entendeu? — E acha que aos poucos ele está mudando, mas eu acho que esse cara não vai mudar. Ele é gentil com ela quando eles estão isolados, quando eles estão, sei lá, com mais três pessoas, que seja, no mesmo ambiente, ele sempre é cruel, ele sempre assim, não deixa ela comer as coisas. Mesmo que seja, tá todo mundo comendo batata, e aí ela não pode comer batata, sabe?'
 'E aí a Priscila ficou feliz e voltou com esse cara, e esse cara falando que tinha mudado. Que tinha mudado, porque nã nã nã aceitação do corpo feminino, porque agora ele entendia e nã nã nã. Aí durante a pandemia, para não ficar indo e voltando e, de repente, colocar os pais da Priscila em risco, ela foi morar com ele. E foi perfeito, gente, perfeito. A pandemia, até o final do ano agora, o período todo, a Priscila falou que foi como uma lua de mel assim.'
 'Mas ela fez isso, então eles conversavam por mensagem, ele mandava às vezes foto da balada que ele tava, às vezes ele estava com alguma menina… E ela gostando dele ainda aceitou continuar essa amizade. — Que eu não acho que seja uma amizade, mas tudo bem. — E aí a Priscila ficou feliz e voltou com esse cara, e esse cara falando que tinha mudado. Que tinha mudado, porque nã nã nã aceitação do corpo feminino, porque agora ele entendia e nã nã nã. Aí durante a pandemia, para não ficar indo e voltando e, de repente, colocar os pais da Priscila em risco, ela foi morar com ele.'
 'Ele diz que ele trata a Priscila assim porque ele tem traumas de quando ele era gordo. — Só que eu vou retomar pra vocês aqui um pensamento que é meu, tá? Sobre ser ONG de macho. Nem sempre a ONG de macho é referente a algo financeiro, sabe? O cara ali tá querendo que ela seja terapeuta dele, que ela seja a mãe dele pra cuidar dele, porque tem isso também… Agora ele tem uma alimentação diferente, nesses oito meses ela fazia comidas, sei lá, saudáveis pra ele e tinha que ser tudo do jeito que ele queria… A empregada dele, porque é ela que limpava a casa e fazia tudo.']",0.1690178440574035,0.0,0.25,0.5199920263786931,0.3799980065946733
81,"No episódio 'urgente', quem era a Débora antes da pandemia?","Antes da pandemia, a Débora era dona de um pequeno salão de beleza junto com o marido.",Uma dona de um pequeno salão de beleza.,"['Antes da pandemia a Débora e marido eles tinham um pequeno salão de beleza. E os dois ali faziam cabelo e barba e tal, e tinha mais uma moça que era manicure. Um salão pequeno mesmo, mas que dava ali para eles tirarem o sustento deles. Aí veio a pandemia e a coisa apertou, e eles como o bebê ali de dois anos. E aí o aluguel foi vencendo e eles não tinham como dar conta mais… Aí o pai da Débora, o seu Valter — Um cara muito bacana, e a mãe da Débora também muito bacana. —'
 'E hoje eu vou contar para vocês uma história mais urgente, uma história que está acontecendo agora, e é a história da Débora. Então vamos lá, vamos de história.'
 'Déia Freitas: Oi, gente… Cheguei. Cheguei pra mais um Picolé de Limão. E hoje eu vou contar para vocês uma história mais urgente, uma história que está acontecendo agora, e é a história da Débora. Então vamos lá, vamos de história.'
 'Assinante 1: Oi, gente, aqui quem está falando é Priscila Armani aqui de Belo Horizonte. E a minha opinião sobre esse caso urgente é que é urgente que a Débora se separe e saia dessa situação, e eu consideraria, inclusive, dela sair da casa dos pais dela agora que a situação financeira está um pouco melhor. Ela pegar o filho dela e ir para um outro lugar que seja melhor, porque não vai dar para continuar morando ali e eu acho que para a segurança dela vai ser melhor. Outra coisa que eu queria sugerir é que você converse com a sua irmã Débora, e a sua mãe é que tem que assumir esse B.O, porque no fim das contas não é responsabilidade sua lidar com as atitudes do seu marido. É isso.']",0.3011321689206336,1.0,0.23529411764705882,0.7397838382175256,0.6849459595543814
82,"No episódio 'urgente', o que a Débora encontrou seu marido fazendo na cozinha?",A Débora encontrou seu marido se beijando e se esfregando com a mãe dela na cozinha.,Se beijando e se esfregando com sua mãe.,"['No que a Débora vira pra ir pra cozinha, ela vê o marido dela com a mãe dela encostado na pia assim… Tipo, eles não estavam transando, mas eles estavam se beijando e se esfregando de uma maneira assim como se fosse começar transar. A Débora ficou tão, tão, tão em choque que uma parte do rosto dela — Sem brincadeira. — Paralisou. Tipo caiu a boca assim. — E ela achou que ela estava tendo um derrame.'
 'Ai agora, sei lá, em fevereiro, a Débora começou a considerar a possibilidade de voltar a ter um salãozinho. E o que eles fizeram com as coisas do salão? Eles colocaram em um depósito, desses que você paga por mês, sabe? Na esperança, lógico, de voltar a reabrir. Só que o marido dela está muito bem vendendo empada assim, tá muito empolgada na coisa da empada. —'
 'Gente, deu tudo certo. Ali, pro meio do ano passado, o marido da Débora e a mãe da Débora criaram um negócio de empada que deu muito certo. — Gente, quem não gosta de empada? Empada, olha… [risos] Eu sou viciada em empada. Amo. —'
 'Antes da pandemia a Débora e marido eles tinham um pequeno salão de beleza. E os dois ali faziam cabelo e barba e tal, e tinha mais uma moça que era manicure. Um salão pequeno mesmo, mas que dava ali para eles tirarem o sustento deles. Aí veio a pandemia e a coisa apertou, e eles como o bebê ali de dois anos. E aí o aluguel foi vencendo e eles não tinham como dar conta mais… Aí o pai da Débora, o seu Valter — Um cara muito bacana, e a mãe da Débora também muito bacana. —']",0.27100112886356625,1.0,0.13043478260869565,0.6665327982436484,0.1666331995609121
83,"No episódio 'urgente', o que a Débora acha que vai acontecer se ela contar para seu pai sobre o marido e a mãe dela?","A Débora acha que, se contar para seu pai sobre o marido e a mãe dela, pode haver um escândalo e não há garantia de que seu pai vá ficar do seu lado.",O pai dela vai morrer de desgosto.,"['Assinante 1: Oi, gente, aqui quem está falando é Priscila Armani aqui de Belo Horizonte. E a minha opinião sobre esse caso urgente é que é urgente que a Débora se separe e saia dessa situação, e eu consideraria, inclusive, dela sair da casa dos pais dela agora que a situação financeira está um pouco melhor. Ela pegar o filho dela e ir para um outro lugar que seja melhor, porque não vai dar para continuar morando ali e eu acho que para a segurança dela vai ser melhor. Outra coisa que eu queria sugerir é que você converse com a sua irmã Débora, e a sua mãe é que tem que assumir esse B.O, porque no fim das contas não é responsabilidade sua lidar com as atitudes do seu marido. É isso.'
 'Eu acho que eu ia fazer escândalo na hora, mas já que você esperou, não sei, talvez conversar com a sua mãe, falar que você sabe. Primeiro com sua mãe pra saber o que ela pensa em relação a seu pai. Porque, assim, fatalmente você não vai conseguir manter seu pai e sua mãe juntos se sua mãe quiser ir embora com seu marido. E aí é outro ponto que a Débora tá pensando também é no escândalo que vai ser tudo. E aí, Débora, eu acho que a gente não tem controle disso, né?'
 'Porque, assim, fatalmente você não vai conseguir manter seu pai e sua mãe juntos se sua mãe quiser ir embora com seu marido. E aí é outro ponto que a Débora tá pensando também é no escândalo que vai ser tudo. E aí, Débora, eu acho que a gente não tem controle disso, né? Você não tem controle disso, você não faz nada… Você não fez nada de errado.'
 'A primeira coisa, Débora: Sinto muito por você. Segunda coisa: Que bom que você já se decidiu sobre que rumo dar a sua vida. Eu acho que você não deve contar para seu pai, porque você não sabe como ele vai reagir e você não sabe se ele vai, no final das contas, ficar do seu lado, do lado da sua mãe ou qualquer outra coisa. Acho que você deve conversar com sua mãe para que ela tome uma atitude e decida o que vai fazer da vida. E conversar com o marido para você informar ele que você não quer mais continuar nessa situação.']",0.15582271339383136,1.0,0.3157894736842105,0.5973396999559659,0.14933492498899148
84,"No episódio 'presentes', quem era o verdadeiro destinatário dos presentes dados pelo marido da Ângela?",A verdadeira destinatária dos presentes dados pelo marido da Ângela era a vizinha.,O marido da vizinha,"['Aí um dia, o marido de Ângela chegou em casa com um perfume pra ela, um kit, que tinha perfume e hidratante, e a Ângela ficou super feliz, porque assim, não era comum ele dar presente pra ela assim, a não ser em datas especiais, o aniversário dela, Natal, Dia dos Namorados ele até dava, mas assim um presente aleatório não. E aí ela adorou esse kit, era super cheiroso tal, ela resolveu [trilha musical inicia] fazer um jantar ali especial pra comemorar o presente que ela ganhou, e ela passou o perfume, passou o creme, eles jantaram, foi bem legal assim o jantar, mas não rolou mais nada, [trilha musical termina/game over] ela pensou que fosse rolar um sexo ali, mas não rolou, ele dormiu. — Comeu pra caramba e dormiu. —'
 'E hoje eu vou contar pra vocês a história da Ângela. A Ângela estava casada há doze anos e, assim, tinha um relacionamento super de boa com o marido, eles se davam super bem, não tinha assim lá um “Uau, romance”, né? Era mais aquela coisa do dia a dia mesmo, né? Que um vai acostumando com o outro, mas a vida deles era boa assim, Ângela considerava um relacionamento super ok. Aí um dia, o marido de Ângela chegou em casa com um perfume pra ela, um kit, que tinha perfume e hidratante, e a Ângela ficou super feliz, porque assim, não era comum ele dar presente pra ela assim, a não ser em datas especiais, o aniversário dela, Natal, Dia dos Namorados ele até dava, mas assim um presente aleatório não.'
 'Era mais aquela coisa do dia a dia mesmo, né? Que um vai acostumando com o outro, mas a vida deles era boa assim, Ângela considerava um relacionamento super ok. Aí um dia, o marido de Ângela chegou em casa com um perfume pra ela, um kit, que tinha perfume e hidratante, e a Ângela ficou super feliz, porque assim, não era comum ele dar presente pra ela assim, a não ser em datas especiais, o aniversário dela, Natal, Dia dos Namorados ele até dava, mas assim um presente aleatório não. E aí ela adorou esse kit, era super cheiroso tal, ela resolveu [trilha musical inicia] fazer um jantar ali especial pra comemorar o presente que ela ganhou, e ela passou o perfume, passou o creme, eles jantaram, foi bem legal assim o jantar, mas não rolou mais nada, [trilha musical termina/game over] ela pensou que fosse rolar um sexo ali, mas não rolou, ele dormiu. — Comeu pra caramba e dormiu. —'
 'Pra comprar um perfume e tal, né?”, e aí o marido dela já ficou super bravo, tipo, “Poxa, tô te dando um presente você ainda tá reclamando, né?”, isso despertou sim uma pulga atrás da orelha da Ângela, e aí ela falou: “Gente, a vizinha ela nunca nem fala “oi” pro meu marido, como que ela vendeu um perfume pra ele?”, e aí pronto, a cisma estava instalada ali na cabeça da Ângela.']",0.40603592744061884,0.0,0.05555555555555555,0.6574601153467448,0.1643650288366862
85,"No episódio 'presentes', o que o detetive encontrou quando investigou o marido da Ângela?","O detetive encontrou fotos do marido da Ângela entrando e saindo do motel, mas sozinho no carro, e outro carro entrando e saindo ao mesmo tempo.",O marido da Ângela entrando e saindo do motel com outro homem,"['E aí ela ficou super apreensiva, mas aí o detetive não procurou por ela nos próximos três dias. No final ali, gente, tipo no oitavo, nono dia, o cara marcou um horário com ela, falou: “Olha, você pode vir até o escritório aqui que eu já tenho algumas coisas pra te passar”, e aí ela super nervosa pegou uma amiga dela lá do trabalho e foi pra saber o que estava acontecendo. Ele tinha umas fotos, tinha um relatório e mostrou pra ela o marido dela entrando e saindo do motel, mas sozinho no carro, só que na mesma hora que o carro dele entrou, um outro carro entrou também, e no mesmo horário que o carro dele saiu, um outro carro saiu também. Ele não tinha entrado no motel, né? Porque assim, se ela quisesse uma investigação mais profunda ela teria que fazer um novo pagamento, ele ia passar ali só as coisas que ele tinha encontrado, né?'
 'E aí a Ângela não tinha quase contato com essa vizinha também, quase nada, então ela sabia muito pouco também e a Ângela resolveu contratar um detetive. — Gente, parece coisa de filme, né? Mas ela resolveu contratar um detetive, e aí eu fiquei super curiosa pra saber como funciona isso, ela falou: “Então, se você entrar na internet e digitar “detetive particular” vai aparecer um monte, aí ela falou lá um site que ela entrou pra você checar referências também, né? E aí ela chegou até um cara que era detetive particular e ele falou como ele trabalhava, era ele e mais um cara de moto, falou quanto custava por dia, que ela teria que pagar por dia, o tempo que ele ficaria, pediu os horários, ela teve que preencher um super questionário, de tudo que o marido dela fazia e os horários. E aí depois que ela fechou isso, ela meio que se arrependeu e o detetive falou pra ela que era comum isso acontecer, tanto com homens quanto com mulheres, as pessoas fecharem o pacote, pagarem e se arrependerem, então o que ele fazia?'
 'Pra comprar um perfume e tal, né?”, e aí o marido dela já ficou super bravo, tipo, “Poxa, tô te dando um presente você ainda tá reclamando, né?”, isso despertou sim uma pulga atrás da orelha da Ângela, e aí ela falou: “Gente, a vizinha ela nunca nem fala “oi” pro meu marido, como que ela vendeu um perfume pra ele?”, e aí pronto, a cisma estava instalada ali na cabeça da Ângela.'
 'Ela ficou com isso na cabeça e aí passou o expediente dela, ela foi pra casa. E aí assim, na hora do jantar como quem não quer nada, mas assim sem nenhuma assim neura, nada, perguntou pra ele, falou: “Mas escuta, como que você encontrou a vizinha, né? Pra comprar um perfume e tal, né?”, e aí o marido dela já ficou super bravo, tipo, “Poxa, tô te dando um presente você ainda tá reclamando, né?”, isso despertou sim uma pulga atrás da orelha da Ângela, e aí ela falou: “Gente, a vizinha ela nunca nem fala “oi” pro meu marido, como que ela vendeu um perfume pra ele?”,']",0.33456164724019516,0.6,0.1875,0.6507690308651575,0.5376922577162894
86,"No episódio 'presentes', o que a Ângela descobriu sobre o marido da vizinha e seu ex-marido?",A Ângela descobriu que o marido da vizinha estava tendo um caso com o seu ex-marido.,O marido da vizinha e seu ex-marido tinham um caso,"['Não tinha como ela não pensar que o marido dela estava tendo um caso com o marido da vizinha e dito e feito, ela foi falar com o marido dela, pegou ele tão surpresa que ele acabou confessando, a vizinha realmente vende os produtos aí de uma marca e era o marido dela que pegava os produtos e dava pra ele, e ele dava de presente pra ela. E aí ela descobriu esse caso do marido com o vizinho, o marido acabou contando pra ela que “Ah, isso nunca tinha acontecido”, e que ele estava confuso, nã nã nã, e eles se separaram. E… Tudo bem, ela separou e, assim, já era um casamento meio longo, então já tinha outras coisas desgastando, ela me disse, né? Só que o vizinho não separou, então o marido dela foi morar em outro lugar e ela continuou ali onde ela estava, e tinha a vizinha e o vizinho, o vizinho continuou casado, mas também não era um problema dela.'
 'Ela reconheceu o carro na hora, reconheceu a pessoa na hora, não era a vizinha, era o marido da vizinha. — Era o marido da vizinha. — Não tinha como ela não pensar que o marido dela estava tendo um caso com o marido da vizinha e dito e feito, ela foi falar com o marido dela, pegou ele tão surpresa que ele acabou confessando, a vizinha realmente vende os produtos aí de uma marca e era o marido dela que pegava os produtos e dava pra ele, e ele dava de presente pra ela. E aí ela descobriu esse caso do marido com o vizinho, o marido acabou contando pra ela que “Ah, isso nunca tinha acontecido”, e que ele estava confuso, nã nã nã, e eles se separaram. E… Tudo bem, ela separou e, assim, já era um casamento meio longo, então já tinha outras coisas desgastando, ela me disse, né?'
 'E aí agora na pandemia, a vizinha lá intensificou a venda de produtos, né? E ela acabou ficando mais próxima dessa vizinha e aí assim, ela tá muito próxima dessa vizinha, essa vizinha tipo idolatra o marido, só que ela sabe, — A Ângela sabe — que o ex-marido dela continua saindo com esse vizinho. E aí agora ela tá num puta dilema porque ela tá querendo contar pra vizinha que o marido dela, né? Da vizinha, sai com o ex-marido da Ângela. Eu sinceramente acho que não deve contar, não deve contar, a gente não conhece bem as pessoas, isso pode virar uma tragédia, sei lá, eu não contaria.'
 'E aí agora ela tá num puta dilema porque ela tá querendo contar pra vizinha que o marido dela, né? Da vizinha, sai com o ex-marido da Ângela. Eu sinceramente acho que não deve contar, não deve contar, a gente não conhece bem as pessoas, isso pode virar uma tragédia, sei lá, eu não contaria. Mesmo porque ela tá com uma proximidade agora com a vizinha, mas eu falei: “Mas vocês são o quê? Amigas?']",0.3238674743085757,1.0,0.3157894736842105,0.91251894162243,0.9781297354056075
87,"No episódio 'picolé', quem conheceu quem no Instagram?",O Hudson conheceu a Diana no Instagram.,O Hudson conheceu a Diana no Instagram.,"['O Hudson conheceu a Diana no Instagram por meio de uma amiga. — Ele viu ali que eles tinham uma amiga em comum, né? Com a Diana. — E ele resolveu chamar a Diana ali no direct, eles começaram a conversar, a Diana gostou dele também e, de cara, o Hudson já falou pra Diana: “Olha, eu sou uma pessoa com deficiência… Eu perdi parte da perna num acidente. Eu mantenho a articulação do joelho.'
 'Picolé de Limão é mais um quadro do canal Não Inviabilize. [ vinheta]'
 '[vinheta] Quer a sua história contada aqui? Escreva para naoinviabilize@gmail.com. Picolé de Limão é mais um quadro do canal Não Inviabilize. [ vinheta]'
 'É o Hudson que me escreve, então a gente sabe aqui o lado que ele está contando da história. — [ efeito sonoro de suspiros ao fundo] E aí ele tirou a prótese e a Diana já falou pra ele: “Olha, já bota ali… Bota ali no armário”. E ele falou: “Não, vem cá e nã nã nã” e continuou. E ela avisou de novo: “Hudson, bota ali no armário” e ele falou: “Ah, deixa de ser boba, o Picolé tá dormindo e nã nã nã” e ficaram ali beijando no sofá e dali eles foram pra cama. — E ele não colocou a prótese no armário… —']",0.008987390380038936,1.0,0.1875,1.0000000000000002,1.0
88,"No episódio 'picolé', qual é o nome do cachorro da Diana?",O nome do cachorro da Diana é Picolé.,O nome do cachorro da Diana é Picolé.,"['E aí o Picolé, ele é um cachorro bem arteiro, assim, cachorro que gosta de roer coisa… — Picolé é ativo. E como é a casa da Diana? — A Diana mora numa kitnet, então é cozinha, sala e quarto, tudo integrado. E o banheiro é o único lugar que tem porta.'
 'E eles continuaram conversando, a conversa esquentou e eles resolveram que iam dar ali o próximo passo, né? — Os dois ali muito fogosos e nã nã nã… — “E como é que vamos fazer?”, porque o Hudson ele mora ainda com os pais… — O Hudson tem 25 anos, tá ainda estudando e tal, normal ainda morar com os pais… — E a Diana já mora sozinha. Só que ela mora com o cachorrinho dela, que chama “Picolé”. E aí o Picolé, ele é um cachorro bem arteiro, assim, cachorro que gosta de roer coisa… — Picolé é ativo.'
 'porque o Hudson ele mora ainda com os pais… — O Hudson tem 25 anos, tá ainda estudando e tal, normal ainda morar com os pais… — E a Diana já mora sozinha. Só que ela mora com o cachorrinho dela, que chama “Picolé”. E aí o Picolé, ele é um cachorro bem arteiro, assim, cachorro que gosta de roer coisa… — Picolé é ativo. E como é a casa da Diana? — A Diana mora numa kitnet, então é cozinha, sala e quarto, tudo integrado.'
 'A Diana, comentando ali com o Hudson… — O Picolé tá lá, o Picolé mora na casa, é a casa do picolé, concorda? — Então, assim, ela não prende o Picolé… — Se ela leva algum cara pra lá, se ela vai transar… — Mas o Picolé ele é obediente nessa parte, ele fica lá pro lado do sofá e da cozinha, ele não vai pra onde tem a cama e tal, nada… E aí eles marcaram na casa da Diana, já era mesmo pro vamos ver ali, o rala e rola… E a coisa começou, nã nã nã… Foi esquentando… E o Hudson comentou com a Diana, falou: “Olha, eu me sinto mais confortável se eu puder tirar a minha prótese”, porque ele usa uma prótese na perna, né? Que encaixa ali um pouco abaixo do joelho e tem a articulação do pé e o pé na prótese e tal, que ele bota o sapato na prótese. Normal. E aí a Diana falou: “Fica à vontade, né?”']",0.39471461630489174,1.0,0.2777777777777778,1.0000000000000002,1.0
89,"No episódio 'picolé', o que o Picolé fez com a prótese do Hudson?",O Picolé roeu o sapato que estava preso na prótese do Hudson.,O Picolé roeu a prótese do Hudson.,"['No meio do ato a Diana disse de novo: “Hudson, tô achando Picolé muito quieto… Sua prótese”. E o Hudson falou: “Ele tá quieto porque ele tá dormindo, deixa de ser boba e nã nã nã”. Enfim, transaram… Quando eles terminaram e tal, que o Hudson foi até o sofá onde ele tinha deixado a prótese, adivinha? [ efeito sonoro de tensão] O Picolé que estava dormindo na outra ponta do sofá já tinha acordado, já tinha arrastado a prótese do Hudson lá pra perto do balcão da cozinha e tinha roído ali o sapato, né? Que estava preso na prótese e articulação do pé ali, da prótese… — Roeu bem… — Picolé roeu… Ele teve tempo… Ele roeu, roeu, roeu com carinho, roeu… E aí o Hudson ficou desesperado e bravo. —'
 'Enfim, transaram… Quando eles terminaram e tal, que o Hudson foi até o sofá onde ele tinha deixado a prótese, adivinha? [ efeito sonoro de tensão] O Picolé que estava dormindo na outra ponta do sofá já tinha acordado, já tinha arrastado a prótese do Hudson lá pra perto do balcão da cozinha e tinha roído ali o sapato, né? Que estava preso na prótese e articulação do pé ali, da prótese… — Roeu bem… — Picolé roeu… Ele teve tempo… Ele roeu, roeu, roeu com carinho, roeu… E aí o Hudson ficou desesperado e bravo. — Bravo com o Picolé, bravo com Diana… —'
 'E aí a Diana foi pra pegar na prótese dele… E o Hudson avisou a Diana… — E eu acho que isso é uma coisa importante também, que isso vale pra todos nós… Quando você encontrar uma pessoa com deficiência e você quiser ajudar de alguma forma, pergunte como você pode ajudar. Nesse caso, a Diana foi pegar na prótese dele e ele falou: “Olha, por favor, eu não gosto que pegue na minha prótese. Pode deixar que eu mesmo pego”. — E aí ele já tem uma certa facilidade para andar com uma perna só, assim, alguns passos e ele fez isso… Botou dentro do armário da Diana e o sexo rolou maravilhosamente bem. — Foi lindo… — Numa segunda vez, ele foi lá, o Picolé ficou na dele e tal, o Picolé muito fofo, só que rói tudo.'
 'Mais uma vez, a hora que eles deitaram na cama, a Diana disse: “Hudson, bota sua prótese no armário, por favor”. E ele falou: “Deixa de ser boba, o Picolé nem vai acordar, vem cá e nã nã nã”. No meio do ato a Diana disse de novo: “Hudson, tô achando Picolé muito quieto… Sua prótese”. E o Hudson falou: “Ele tá quieto porque ele tá dormindo, deixa de ser boba e nã nã nã”. Enfim, transaram… Quando eles terminaram e tal, que o Hudson foi até o sofá onde ele tinha deixado a prótese, adivinha? [']",0.6153814785326921,1.0,0.25,0.8164571597698054,0.5041142899424513
90,"No episódio 'riquinho', quem era o pai de Valéria?",O pai de Valéria é o seu Getúlio.,Seu Getúlio,"['E aí um dia a Valéria chamou o pai para conversar e o pai falou para a Valéria: “Olha, eu acho que eu estou ficando louco, por isso que eu estou mais quieto”. E aí a Valéria falou: “Mas pai, como assim você está ficando louco? O que está acontecendo?”. A partir do segundo dia do acidente, o rapaz do carro que estava… Foi constatado que ele estava bêbado e estava em excesso de velocidade, tipo, se a pista ali era 80, ele tava tipo a 200.'
 'Mas poxa, ele sofreu um acidente traumático, né? — Só que ele foi cada vez mais, o seu Getúlio, ficando quieto… E ele nunca foi um cara quieto, sempre foi um cara brincalhão e tal. E aí um dia a Valéria chamou o pai para conversar e o pai falou para a Valéria: “Olha, eu acho que eu estou ficando louco, por isso que eu estou mais quieto”. E aí a Valéria falou: “Mas pai, como assim você está ficando louco? O que está acontecendo?”.'
 'E aí ele pegou uma nova van e ainda conseguiu um acordo com a família pra esses dias que ele ficou parado, então não precisou entrar com processo, nada… — Seu Getúlio seguiu a vida. — E, assim, vez ou outra o seu Getúlio ficava parado, estranho assim e a Valéria não conseguia entender o que estava acontecendo com o pai dela. — Mas poxa, ele sofreu um acidente traumático, né? — Só que ele foi cada vez mais, o seu Getúlio, ficando quieto… E ele nunca foi um cara quieto, sempre foi um cara brincalhão e tal. E aí um dia a Valéria chamou o pai para conversar e o pai falou para a Valéria: “Olha, eu acho que eu estou ficando louco, por isso que eu estou mais quieto”.'
 'Déia Freitas: Oi, gente… Cheguei. Cheguei para um Luz Acesa. E hoje eu vou contar para vocês a história do seu Getúlio. — Quem me escreve é sua filha Valéria. — Então vamos lá, vamos de história.']",0.4147085808399442,1.0,0.23529411764705882,0.6704242048013553,0.7676060512003389
91,"No episódio 'riquinho', o que aconteceu com o dono do carro de luxo?","O dono do carro de luxo morreu na hora do acidente e ficou preso nas ferragens, tendo perdido as duas pernas.",Ele morreu na hora do acidente,"['Seu Getúlio e mais um passageiro da van teve ferimentos leves e o dono desse carro de luxo morreu na hora. Como foi um acidente grave envolvendo pessoas ricas, — uma pessoa rica — a perícia foi chamada, enfim, tudo foi feito ali… — E aqui eu vou ter que dar um detalhe gráfico do acidente, então se você tem mais sensibilidade aí fica atento que agora eu tenho que falar essa parte gráfica. — Este rapaz que estava no carro de luxo, ele morreu na hora e ele ficou preso nas ferragens e quando tiraram o corpo dele do carro, ele tinha perdido as duas pernas. Quando ele foi retirado do carro, o seu Getúlio ainda estava lá e a família dele, ele já tinha ligado para família, já tinha falado que tinha sofrido um acidente, um cunhado dele estava lá também, enfim, tinha uma galera lá e todo mundo viu essa cena.'
 'efeito sonoro de carro freando bruscamente e colidindo] Só que como o carro era mais baixo, ele bateu de frente e meio que levantou a van do seu Getúlio e ficou preso nas ferragens ali embaixo. — Mas bateu, foi uma batida muito violenta. — Seu Getúlio e mais um passageiro da van teve ferimentos leves e o dono desse carro de luxo morreu na hora. Como foi um acidente grave envolvendo pessoas ricas, — uma pessoa rica — a perícia foi chamada, enfim, tudo foi feito ali… — E aqui eu vou ter que dar um detalhe gráfico do acidente, então se você tem mais sensibilidade aí fica atento que agora eu tenho que falar essa parte gráfica. — Este rapaz que estava no carro de luxo, ele morreu na hora e ele ficou preso nas ferragens e quando tiraram o corpo dele do carro, ele tinha perdido as duas pernas.'
 'Quando, do nada, na pista contrária vinha vindo um carro — era um carro de luxo desses… Pra mim Porsche, esse tipo de carro, assim… Eu nem acho bonito, mas tipo, carro de milhões, que realmente custa milhões. — e esse carro bateu de frente com a van do seu Getúlio. [ efeito sonoro de carro freando bruscamente e colidindo] Só que como o carro era mais baixo, ele bateu de frente e meio que levantou a van do seu Getúlio e ficou preso nas ferragens ali embaixo. — Mas bateu, foi uma batida muito violenta. — Seu Getúlio e mais um passageiro da van teve ferimentos leves e o dono desse carro de luxo morreu na hora.'
 'Sei lá… Mas foi tudo muito traumático, a seguradora foi acionada — do carro do cara, do carro de luxo — e ele acabou ganhando uma nova van, porque foi tão grande o estrago que não deu para salvar ali, tinha muita coisa… Não valia a pena fazer aquela parte da frente da van.']",0.15138016489553915,1.0,0.26666666666666666,0.5871712335151025,0.5217928083787756
92,"No episódio 'riquinho', o que a Dona Mirian acredita que matou o seu Getúlio?","De acordo com o episódio, Dona Mirian acredita que o rapaz rico sem pernas, o ""riquinho"", matou o seu Getúlio.",O fantasma do rapaz rico sem pernas,"['Assinante 2: Olá, aqui é a Aline de Vila Velha, no Espírito Santo. Dona Mirian, Valéria, eu sinto muito por toda a carga emocional que vocês tiveram que passar durante todos esses anos e, principalmente, pela perda do seu Getúlio. Eu não acredito que o riquinho tenha matado seu Getúlio, mas acredito firmemente que todos os traumas, essas visões e essas recordações ruins tenham levado sim a uma situação de estresse que tenha colaborado para um infarto, uma vez que ele já tinha uma pré-disposição. Acredito que se há um plano ou uma vida após a morte, agora o Riquinho e Seu Getúlio estão no mesmo lugar de fala. Então talvez o Seu Getúlio vai conseguir ajudar o riquinho a encontrar a paz que durante a vida dele toda, talvez ele não teve.'
 'E aí foi deu lá que tinha sido um infarto fulminante, mas Dona Mirian acha que foi o rapaz que matou o seu Getúlio. Mas foi constatado que tinha sido um infarto, então foi um infarto… — De repente foi o susto? Não saberemos, né? — Dona Mirian e Valéria seguiram sem Seu Getúlio e nunca mais o rapaz apareceu… Ou o Seu Getúlio apareceu para elas. E o medo da Dona Mirian… Porque Dona Mirian ela acredita numa vida após a morte, né?'
 'Essa é a história do seu Getúlio e Dona Mirian tem certeza que ele morreu e quem matou o seu Getúlio — apesar do laudo do IML ter dado um infarto fulminante — ela acha que foi o cara rico sem pernas, esse fantasma…'
 'Então, ela tem medo que, de repente, esse rapaz está grudado no espírito do Seu Getúlio. Eu não acredito nisso, mas enfim, as pessoas acreditam, né? — Essa é a história do seu Getúlio e Dona Mirian tem certeza que ele morreu e quem matou o seu Getúlio — apesar do laudo do IML ter dado um infarto fulminante — ela acha que foi o cara rico sem pernas, esse fantasma…']",0.5000412880068175,1.0,0.2857142857142857,0.6213442196394898,0.6553360549098725
93,"No episódio 'poneisaki ninja', quem é a personagem principal da história?",A personagem principal da história é Vitória.,Vitória,"['A diarista da casa do cara, — que também é da casa dos pais do cara — fez amizade com a Vitória quando a Vitória frequentava a casa do cara. Então, a diarista comenta as coisas, só que é tudo muito em off, assim, ninguém pode saber que ela comentou. E ele tinha postado uma foto em cima de uma moto. — Ele nunca escreve assim: “Ah, comprei”, nada… — Mas ele postou uma foto em cima de uma moto, — que a gente vai chamar aqui de Pôneisaki Ninja. — e aí essa moça que trabalha na casa desse cara, falou pra Vitória que ele tinha acabado de comprar, — que ele falou isso na mesa do café da manhã — “acabei de comprar uma moto de 140 mil reais”. ['
 'Assinante 2: Oi, Déia, oi, Não Inviabilizers… Já tô aqui revoltadíssima com essa história Pôneisaki Ninja, porque eu me identifico muito, né? Em relação a minha história com meu pai biológico, por mais que eu tenha o nome dele na minha certidão, ele sempre fez muito esforço pra não pagar pensão, pra não estar presente, pra que minha mãe não fosse atrás dele nem na Justiça. Ele sempre aprontou bastante, né? Judicialmente… E ele tinha condições, é vereador da cidade, sempre trabalhou na mídia… Então, realmente é uma história muito revoltante e tenho certeza que não sou a única assim como nessa história… Milhares de brasileiros não tem o pai e que um dia esse karma volte pra ele, né? Pra eles… [risos] Não que a gente deseje o ruim, mas quem sabe a vida ensine, né?'
 'Na mesma semana que a menininha precisou do procedimento cirúrgico, que era simples, não era nada grave, mas que custou uma grana, ele comprou uma Pôneisaki Ninja, sabe? Não tem como, não tem como, não aceito…'
 'E ele tinha postado uma foto em cima de uma moto. — Ele nunca escreve assim: “Ah, comprei”, nada… — Mas ele postou uma foto em cima de uma moto, — que a gente vai chamar aqui de Pôneisaki Ninja. — e aí essa moça que trabalha na casa desse cara, falou pra Vitória que ele tinha acabado de comprar, — que ele falou isso na mesa do café da manhã — “acabei de comprar uma moto de 140 mil reais”. [ efeito sonoro de caixa registradora] — Gente, uma moto custa tudo isso? 140 mil reais numa moto? —']",0.2449354618622932,0.0,0.2631578947368421,0.558921100487774,0.6397302751219435
94,"No episódio 'poneisaki ninja', por que o pai da menina não quer pagar mais de 530 reais de pensão?","O pai da menina não quer pagar mais de 530 reais de pensão porque ele não quer ajudar financeiramente e não quer contato com a filha. Ele tem condições de pagar, pois é vereador da cidade e trabalha na mídia, mas prefere não colaborar.",Porque ele tirou os bens do seu nome e mente sobre sua renda,"['Assinante 2: Oi, Déia, oi, Não Inviabilizers… Já tô aqui revoltadíssima com essa história Pôneisaki Ninja, porque eu me identifico muito, né? Em relação a minha história com meu pai biológico, por mais que eu tenha o nome dele na minha certidão, ele sempre fez muito esforço pra não pagar pensão, pra não estar presente, pra que minha mãe não fosse atrás dele nem na Justiça. Ele sempre aprontou bastante, né? Judicialmente… E ele tinha condições, é vereador da cidade, sempre trabalhou na mídia… Então, realmente é uma história muito revoltante e tenho certeza que não sou a única assim como nessa história… Milhares de brasileiros não tem o pai e que um dia esse karma volte pra ele, né? Pra eles… [risos] Não que a gente deseje o ruim, mas quem sabe a vida ensine, né?'
 'Nem um carro de aplicativo pra levar a criança ele paga e está aí andando pra baixo e pra cima de Pôneisaki Ninja que, segundo a diarista ali, foi ele mesmo que comprou, e falou na mesa do café da manhã que ele pagou 140 mil reais. Agora, ele deve ter colocado ou no nome do irmão ou no nome do pai… — Como a família aceita isso? Eu não aceitaria. Falava: “Meu, você tá querendo botar os seus bens no meu nome pra você não pagar pensão direito?”. Eu não aceitaria de parente nenhum. —'
 'Na mesma semana que a menininha precisou do procedimento cirúrgico, que era simples, não era nada grave, mas que custou uma grana, ele comprou uma Pôneisaki Ninja, sabe? Não tem como, não tem como, não aceito…'
 'Não chegava a dois salários. — E foi estipulado ali que o valor de pensão que ele ia pagar pelo salário que ele tinha, sendo que antes ele era o dono da empresa, enfim, ele foi tirando as coisas do nome, era de 530 reais… — De pensão para o bebezinho. — E aí, assim, a Vitória não passa necessidade nenhuma, porque ela tem os pais que complementam as coisas, mas o bebezinho foi crescendo e foi precisando de mais coisas. E esse pai, além de não visitar a criança, de não querer contato, porque essa é real, ele não quer contato com a própria filha, ele também foi deixando de ajudar em outras coisas.']",0.26443549052949267,0.8571428571428571,0.29411764705882354,0.42257824581424974,0.25564456145356246
95,"No episódio 'poneisaki ninja', o que o pai da menina comprou recentemente?","O pai da menina comprou recentemente uma Pôneisaki Ninja, que é uma moto de 140 mil reais.",Uma moto Pôneisaki Ninja de 140 mil reais,"['Na mesma semana que a menininha precisou do procedimento cirúrgico, que era simples, não era nada grave, mas que custou uma grana, ele comprou uma Pôneisaki Ninja, sabe? Não tem como, não tem como, não aceito…'
 'Nem um carro de aplicativo pra levar a criança ele paga e está aí andando pra baixo e pra cima de Pôneisaki Ninja que, segundo a diarista ali, foi ele mesmo que comprou, e falou na mesa do café da manhã que ele pagou 140 mil reais. Agora, ele deve ter colocado ou no nome do irmão ou no nome do pai… — Como a família aceita isso? Eu não aceitaria. Falava: “Meu, você tá querendo botar os seus bens no meu nome pra você não pagar pensão direito?”. Eu não aceitaria de parente nenhum. —'
 'Assim, ela tem um bom advogado, o advogado tenta, sabe? Mas o cara é muito esperto. Na mesma semana que a menininha precisou do procedimento cirúrgico, que era simples, não era nada grave, mas que custou uma grana, ele comprou uma Pôneisaki Ninja, sabe? Não tem como, não tem como, não aceito…'
 'A diarista da casa do cara, — que também é da casa dos pais do cara — fez amizade com a Vitória quando a Vitória frequentava a casa do cara. Então, a diarista comenta as coisas, só que é tudo muito em off, assim, ninguém pode saber que ela comentou. E ele tinha postado uma foto em cima de uma moto. — Ele nunca escreve assim: “Ah, comprei”, nada… — Mas ele postou uma foto em cima de uma moto, — que a gente vai chamar aqui de Pôneisaki Ninja. — e aí essa moça que trabalha na casa desse cara, falou pra Vitória que ele tinha acabado de comprar, — que ele falou isso na mesa do café da manhã — “acabei de comprar uma moto de 140 mil reais”. [']",0.12158664414786587,0.6666666666666666,0.2777777777777778,0.8230968957250561,
96,"No episódio 'massas', quem é a pessoa que conta histórias de golpe na Netflix?","A pessoa que conta histórias de golpe na Netflix é a própria Déia, apresentadora do podcast Não Inviabilize.",Déia Freitas,"['A Netflix me convidou para contar aqui histórias de golpe — Escolhidas por mim. — pra gente comemorar a estreia da minissérie Inventando Anna da Shonda Rhimes, que estreia dia 11 de fevereiro. A série é baseada na história real da golpista Anna Delvey. E, além de contar aqui oito histórias de golpe, eu vou contar dia 14 às 20 horas — Anotem aí. — no Spaces lá da Netflix, lá no Twitter, a história da vida e a prisão da Anna Delvey.'
 'A série é baseada na história real da golpista Anna Delvey. E, além de contar aqui oito histórias de golpe, eu vou contar dia 14 às 20 horas — Anotem aí. — no Spaces lá da Netflix, lá no Twitter, a história da vida e a prisão da Anna Delvey.'
 'som de abertura da Netflix] E, gente, a Netflix está comigo o mês todo de fevereiro. — Olha que chique. — A Netflix me convidou para contar aqui histórias de golpe — Escolhidas por mim. — pra gente comemorar a estreia da minissérie Inventando Anna da Shonda Rhimes, que estreia dia 11 de fevereiro. A série é baseada na história real da golpista Anna Delvey.'
 'Assinante 2: Oi, Déia, oi, Não Inviabilizers, aqui é Adriana de Campo Largo, Paraná. E, menina, mas que história essa… Coitada, fiquei até com um pouco de pena, né? Mas quando o cara é mau atendente, abre um negócio pra trabalhar com o público e não sabe trabalhar com público… Bom, não pode dizer que mereceu ser vítima, né? Ninguém merece ser vítima de um golpista. Ela deve ter dado uma mordida na carteira dele, mas que bafo, gente… Eu estou amando essa série dos golpes, porque nunca é demais a gente aprender quantos golpes que a natureza humana tá inventando por aí.']",0.25240451869635616,0.5,0.2777777777777778,0.10768293907198057,0.40192073476799517
97,"No episódio 'massas', que tipo de produtos a Elisângela comprou da loja de massas artesanais?",Elisângela comprou massas e vinho da loja de massas artesanais.,"Massas, vinhos e pratos prontos","['Elisângela ficou louca. [ risos] — Taurina como eu. — Comprou praticamente a loja toda de massa, de vinho, enfim… Fez aquela compra… Ela pagou via transferência no nome ali da empresa e deu tudo certo. Quando ela recebeu a compra, veio junto — Não sabia se era um brinde ou não. — um vinho que ela tinha visto ali pelos preços, que era um vinho caro.'
 'No final ali de 2020, uma amiga da Elisângela comentou com ela que tinha encontrado uma loja de massas artesanais. — Ai que delícia. — E que, assim, tinham pratos maravilhosos, né? Tinham massas maravilhosas, pré cozidas e tal, para você fazer em casa ou comprar algum prato pronto e tal… E a Elisângela ficou super animada, pegou o contato e entrou em contato ali por WhatsApp, né? — Pra pegar um cardápio, ver o que tinha e nã nã nã. —'
 'E aí a Elisângela entrou em contato com a loja, foi atendida extremamente bem por uma moça muito educada, e aí essa moça explicou tudo sobre as massas, os recheios… Meu, a moça sabia de tudo… Lá também vendia uns vinhos para acompanhar, enfim.'
 'Quem lembra? [ risos] Saudades. — E aí a Elisângela entrou em contato com a loja, foi atendida extremamente bem por uma moça muito educada, e aí essa moça explicou tudo sobre as massas, os recheios… Meu, a moça sabia de tudo… Lá também vendia uns vinhos para acompanhar, enfim.']",0.31945821433032917,0.5,0.26666666666666666,0.5047806900616729,0.12619517251541823
98,"No episódio 'massas', por que a Elisângela foi tratada como VIP pela moça da loja?",A Elisângela foi tratada como VIP pela moça da loja porque ela fazia transferência para a conta da moça.,Porque ela fazia transferências para a conta pessoal da moça,"['E aí a Elisângela lembrou que, na época, ela era super bem atendida, né? — Tipo, coisa, assim… Muito mimada… — E ela acabou indicando a loja para outras pessoas e algumas dessas pessoas falavam: “Nossa, mas o atendimento é péssimo, né?” e a Elisângela não entendia como que com ela o atendimento era maravilhoso e, com algumas pessoas, o atendimento era péssimo. E agora depois de saber desse golpe, ela deduziu que ela era bem tratada porque ela fazia transferência para a conta da moça. Então a moça tratava ela muito bem, tipo, ela era VIP. ['
 'e a Elisângela não entendia como que com ela o atendimento era maravilhoso e, com algumas pessoas, o atendimento era péssimo. E agora depois de saber desse golpe, ela deduziu que ela era bem tratada porque ela fazia transferência para a conta da moça. Então a moça tratava ela muito bem, tipo, ela era VIP. [ risos].'
 'E aí a Elisângela entrou em contato com a loja, foi atendida extremamente bem por uma moça muito educada, e aí essa moça explicou tudo sobre as massas, os recheios… Meu, a moça sabia de tudo… Lá também vendia uns vinhos para acompanhar, enfim.'
 'Quem lembra? [ risos] Saudades. — E aí a Elisângela entrou em contato com a loja, foi atendida extremamente bem por uma moça muito educada, e aí essa moça explicou tudo sobre as massas, os recheios… Meu, a moça sabia de tudo… Lá também vendia uns vinhos para acompanhar, enfim.']",0.3215581319071601,1.0,0.3076923076923077,0.7866832771356673,0.6966708192839168
99,"No episódio 'chinelos', quem foi que o Wagner foi visitar em Goiânia?",A tia da Milla.,"A mãe da amiga do Wagner, que estava com os gatos no apartamento","['E aí fizeram um combinado e tal, a senhora foi com os gatos para casa da amiga do Wagner e o Wagner foi para Goiânia ficar aí nesse apartamento dessa senhora. Primeira semana, tudo beleza, ele tinha só que tirar um pó também, né? — Não vai bagunçar a casa dos outros. — Então o Wagner mantinha tudo assim arrumado.'
 'E o Wagner falou: “Gente, vai ser demais, porque eu vou conhecer um outro estado, eu não vou pagar aluguel e eu vou estar sozinho no apartamento… Eu topo”. — E topou. — E aí fizeram um combinado e tal, a senhora foi com os gatos para casa da amiga do Wagner e o Wagner foi para Goiânia ficar aí nesse apartamento dessa senhora. Primeira semana, tudo beleza, ele tinha só que tirar um pó também, né? — Não vai bagunçar a casa dos outros. —'
 'A primeira vez que ele ouviu o chinelo tinha sido a hora que a tia da Milla, irmã da mãe dela, tinha morrido. A tia da Mila estava internada — Com Covid. — há um certo tempo, então assim, melhorava depois ficava ruim, melhorava, ficava ruim… E ela faleceu nesse primeiro dia que o Wagner ouviu os chinelos, e as duas eram muito unidas. E aí ninguém estava com coragem de contar para a mãe da Mila. E aí foram contar só depois de três dias ali.'
 'E o Wagner até então pensou sempre em bandido, não pensou em fantasma, nada. — Ele foi lá, devagar e, com ela na linha, abriu a porta e nada. — Tinha nada. — Estava tudo intacto. E aí ele passou o dia ali meio agoniado, meio sem entender, porque ele falou: “eu não estava dormindo, eu ouvi os passos e a pessoa me respondeu”.']",0.42669642260286994,0.0,0.15,0.4209569951559976,0.1052392487889994
100,"No episódio 'chinelos', o que o Wagner ouviu na primeira noite em que ele dormiu no apartamento da mãe da Mila?","No episódio 'chinelos', o Wagner ouviu a tia da Mila, irmã da mãe dela, que havia falecido naquele dia.",Passos de chinelo arrastando pelo chão,"['há um certo tempo, então assim, melhorava depois ficava ruim, melhorava, ficava ruim… E ela faleceu nesse primeiro dia que o Wagner ouviu os chinelos, e as duas eram muito unidas. E aí ninguém estava com coragem de contar para a mãe da Mila. E aí foram contar só depois de três dias ali. E aí a Mila sacou na hora, falou: “Meu Deus, deve ser a minha tia que está lá no apartamento, porque elas eram muito unidas”.'
 'A primeira vez que ele ouviu o chinelo tinha sido a hora que a tia da Milla, irmã da mãe dela, tinha morrido. A tia da Mila estava internada — Com Covid. — há um certo tempo, então assim, melhorava depois ficava ruim, melhorava, ficava ruim… E ela faleceu nesse primeiro dia que o Wagner ouviu os chinelos, e as duas eram muito unidas. E aí ninguém estava com coragem de contar para a mãe da Mila. E aí foram contar só depois de três dias ali.'
 'Quando ele acordou tinham alguns recados da Mila no celular dele. — O que tinha acontecido, gente? — A primeira vez que ele ouviu o chinelo tinha sido a hora que a tia da Milla, irmã da mãe dela, tinha morrido. A tia da Mila estava internada — Com Covid. — há um certo tempo, então assim, melhorava depois ficava ruim, melhorava, ficava ruim… E ela faleceu nesse primeiro dia que o Wagner ouviu os chinelos, e as duas eram muito unidas.'
 'Ele falou “oi, Mila, eu falei muito alto com a sua mãe ontem, depois você pede desculpas, ela não acordou ainda… “Aí a amiga do Wagner respondeu pra ele: “Você tá louco? Minha mãe está aqui comigo te mandando um beijo”. — E mandou áudio da mãe dela e tal. — E aí o Wagner já falou: “Meu Deus”, mandou o áudio para elas falando “então tem alguém no quarto da sua mãe… Tinha alguém aqui a noite, tem alguém no quarto da sua mãe. Eu vou chamar a polícia.']",0.5005603374949582,1.0,0.2222222222222222,0.5107742852970931,0.12769357132427328
101,"No episódio 'chinelos', quem era a mulher que o Wagner viu no apartamento da mãe da Mila?","A mulher que o Wagner viu no apartamento da mãe da Mila era a tia da Mila, irmã da mãe dela.","A tia da Mila, que estava internada com Covid e havia falecido","['há um certo tempo, então assim, melhorava depois ficava ruim, melhorava, ficava ruim… E ela faleceu nesse primeiro dia que o Wagner ouviu os chinelos, e as duas eram muito unidas. E aí ninguém estava com coragem de contar para a mãe da Mila. E aí foram contar só depois de três dias ali. E aí a Mila sacou na hora, falou: “Meu Deus, deve ser a minha tia que está lá no apartamento, porque elas eram muito unidas”.'
 'A primeira vez que ele ouviu o chinelo tinha sido a hora que a tia da Milla, irmã da mãe dela, tinha morrido. A tia da Mila estava internada — Com Covid. — há um certo tempo, então assim, melhorava depois ficava ruim, melhorava, ficava ruim… E ela faleceu nesse primeiro dia que o Wagner ouviu os chinelos, e as duas eram muito unidas. E aí ninguém estava com coragem de contar para a mãe da Mila. E aí foram contar só depois de três dias ali.'
 'E aí o Wagner todo trêmulo falou: “por favor, me manda uma foto da sua tia”. E aí quando mandou a foto era foto que estava às três. — Uma foto bonita assim. — Era ela… — Era a tia da Milla. — Que estava na casa e que, provavelmente, assustou de ver um homem na casa, de ver um estranho… — Que ele era um completo estranho. —'
 'Pensa, já mandou rezar missa para essa mulher, para essa tia da Mila, mas ele ainda lembra da imagem, lembre dela aparecendo na sala às seis horas da tarde com tudo claro, gente. Como pode? Eu também, eu custo a acreditar, mas aí quando eu pego uma pessoa assim que também não acredita e aconteceu com ela, eu já fico cabreira, entendeu? O que essa senhora estava procurando a irmã, queria se despedir… Aí, lógico, que a mãe da Mila ficou mal, e aí queria voltar para encontrar a irmã fantasma, enfim… Mas seguraram ela lá, porque também não tem o que fazer, né? Mas engraçado, ela nunca apareceu para a irmã e apareceu lá no apartamento para o Wagner que não conhecia ninguém assim, que não era da família.']",0.3911957804879433,1.0,0.35,0.5906841411575048,0.6476710352893762
102,"No episódio 'vizinho', quem era o paquera da Milena no bairro?","O paquera da Milena no bairro era o cara que ela encontrava frequentemente quando saía para trabalhar ou fazer compras, e que finalmente se aproximou dela no mercado e pediu seu telefone.",O Cláudio,"['A Milena, antes de começar essa coisa da pandemia e tal, ela tinha uma paquera no bairro dela, então ela saía para trabalhar, às vezes passava de carro e ele estava passeando com o cachorro e eles se olhavam. Às vezes, ela ia a pé até a padaria, quando ela estava voltando ele estava fazendo caminhada, essas coisas. Eles se encontravam pelo bairro sempre, se cumprimentavam e ficava aquele clima assim, uma troca de olhares, sabe? Bem, troquinha de olhares. Aí um dia, antes da pandemia, janeiro, ela tá saindo pra ir, não era nem na padaria, ela ia na rua de cima, ia no mercado, algum lugar, com a sacolinha dela, eco bag, [risos] — eco bag dela — e ela encontrou esse cara que vinha descendo, não sabe de onde que ele estava vindo, o quê que estava acontecendo, nada.'
 'O cara foi até a casa dele, deixou tipo a pasta do trabalho e voltou atrás dela no mercado, e aí ele foi direto, ele falou: “Olha, eu te acho muito bonita, faz tempo que eu te olho, posso te dar meu telefone?” e ela também já paquerava ele, falou: “Lógico, pode sim” e eles trocaram telefone e, assim, super vizinhos, né? Super perto um do outro. Já no dia seguinte, ele chamou a Milena no WhatsApp e eles começaram a conversar, ele falou: “Não, eu quero muito sentar com você em algum lugar, tomar uma cerveja, vamos?”, e era tipo uma quarta-feira, aí ela falou: “Ah, na sexta, pode ser?”,'
 'Aí ela tá lá no mercado, fazendo as comprinhas dela, né, pegando uma coisinha ou outra, quando ela olha quem que tá lá? Ele. O cara foi até a casa dele, deixou tipo a pasta do trabalho e voltou atrás dela no mercado, e aí ele foi direto, ele falou: “Olha, eu te acho muito bonita, faz tempo que eu te olho, posso te dar meu telefone?” e ela também já paquerava ele, falou: “Lógico, pode sim” e eles trocaram telefone e, assim, super vizinhos, né? Super perto um do outro.'
 'Super perto um do outro. Já no dia seguinte, ele chamou a Milena no WhatsApp e eles começaram a conversar, ele falou: “Não, eu quero muito sentar com você em algum lugar, tomar uma cerveja, vamos?”, e era tipo uma quarta-feira, aí ela falou: “Ah, na sexta, pode ser?”, já sai do trabalho, um happy hour, ele falou: “Nossa, perfeito, vamos”.']",0.23916676823791796,1.0,0.42857142857142855,0.2769653685196849,0.06924134212992122
103,"No episódio 'vizinho', o que o Cláudio prometeu à Milena antes da quarentena?","O Cláudio prometeu à Milena sentar com ela em algum lugar, tomar uma cerveja.",Mil coisas,"['O cara foi até a casa dele, deixou tipo a pasta do trabalho e voltou atrás dela no mercado, e aí ele foi direto, ele falou: “Olha, eu te acho muito bonita, faz tempo que eu te olho, posso te dar meu telefone?” e ela também já paquerava ele, falou: “Lógico, pode sim” e eles trocaram telefone e, assim, super vizinhos, né? Super perto um do outro. Já no dia seguinte, ele chamou a Milena no WhatsApp e eles começaram a conversar, ele falou: “Não, eu quero muito sentar com você em algum lugar, tomar uma cerveja, vamos?”, e era tipo uma quarta-feira, aí ela falou: “Ah, na sexta, pode ser?”,'
 'Déia Freitas: Oi, gente… Hoje eu vou contar pra vocês a história da Milena e do Cláudio, e também tem a ver agora com a quarentena, eu adoro história de quarentena, então se vocês tiverem histórias aí de quarentena me escrevam um e-mail: naoinviabilize@gmail.com. Então vamos lá.'
 'Super perto um do outro. Já no dia seguinte, ele chamou a Milena no WhatsApp e eles começaram a conversar, ele falou: “Não, eu quero muito sentar com você em algum lugar, tomar uma cerveja, vamos?”, e era tipo uma quarta-feira, aí ela falou: “Ah, na sexta, pode ser?”, já sai do trabalho, um happy hour, ele falou: “Nossa, perfeito, vamos”.'
 'A Milena, antes de começar essa coisa da pandemia e tal, ela tinha uma paquera no bairro dela, então ela saía para trabalhar, às vezes passava de carro e ele estava passeando com o cachorro e eles se olhavam. Às vezes, ela ia a pé até a padaria, quando ela estava voltando ele estava fazendo caminhada, essas coisas. Eles se encontravam pelo bairro sempre, se cumprimentavam e ficava aquele clima assim, uma troca de olhares, sabe? Bem, troquinha de olhares. Aí um dia, antes da pandemia, janeiro, ela tá saindo pra ir, não era nem na padaria, ela ia na rua de cima, ia no mercado, algum lugar, com a sacolinha dela, eco bag, [risos] — eco bag dela — e ela encontrou esse cara que vinha descendo, não sabe de onde que ele estava vindo, o quê que estava acontecendo, nada.']",0.5214372079817221,1.0,0.3333333333333333,0.20936202936282466,0.052340507340706166
104,"No episódio 'vizinho', por que o Cláudio não terminou com a mulher dele?",Ele não terminou com a mulher dele porque tem uma criança e não quer deixá-la.,Por causa da criança,"['O cara mentiu, mentiu muito e ainda quer agora aí na sua casa se aliviar… — Porque não vai terminar com a mulher dele agora, né? Olha… Enfim… — É isso que eu acho, não tem condição, Milena. Gente, um beijo e até amanhã com mais história, beijo.'
 'Então vamos ver se as meninas, os meninos lá do grupo, te dão uma luz. Porque eu acho tudo errado, acho que tem que deixar como tá, bloqueia esse cara e acabou. O cara mentiu, mentiu muito e ainda quer agora aí na sua casa se aliviar… — Porque não vai terminar com a mulher dele agora, né? Olha… Enfim… — É isso que eu acho, não tem condição, Milena. Gente, um beijo e até amanhã com mais história, beijo.'
 'E ela descobriu dessa forma que o cara é casado. E agora ele fica mandando mensagem pra ela pedindo desculpa, falando que só não termina com a mulher por causa da criança, falei: “Meu, Milena, primeiro você não acreditou, né? Segundo, você não vai embarcar nessa, né? Que agora você tem todas as informações, é só você sair fora, ou melhor, você nem precisa sair fora, deixa como tá, ele lá, você aqui”, “Ah, mas eu gosto dele, ele mora no meu bairro, vou ver sempre”, falei: “Tá, então você vai ser o quê? Vai ser amante?'
 'E ela acenou de volta, e aí, era um determinado horário de manhã, e agora todo dia eles saem, acho que pra dar uma volta com o cachorro, né? E com a criança pra gastar um pouco de energia, ela falou que é uma criança pequena. E ela descobriu dessa forma que o cara é casado. E agora ele fica mandando mensagem pra ela pedindo desculpa, falando que só não termina com a mulher por causa da criança, falei: “Meu, Milena, primeiro você não acreditou, né? Segundo, você não vai embarcar nessa, né?']",0.05908741744337786,0.6666666666666666,0.25,0.49766366090866077,0.7244159152271653
105,"No episódio 'caso de verão', quem era a amiga de Leandra que estava muito estressada e precisava de férias?",A amiga de Leandra que estava muito estressada e precisava de férias é Flávia.,Flávia,"['E os dias foram passando, acabou férias… Voltaram. Flávia radiante, feliz, descansada. E agora Leandra tinha aí uma questão: conta ou não conta para a melhor amiga que o cara teve um caso ali na praia, né? — Um caso de verão que fosse, mas teve. — Leandra, enfim, depois de conversar com a mãe, com a própria mãe ali, com a irmã… A mãe e a irmã de Leandra e elas falaram: “Você tem que contar, filha, é sua melhor amiga… Ela vai casar com esse cara que arrumou uma mulher na praia, nas férias da Flávia”.'
 'Muito estressada, numa estafa assim, terrível. — Bem mal mesmo. — Flávia com um noivo… Flávia ali num relacionamento longo com seu noivo e, finalmente, Flávia teria férias. — O que os amigos combinaram? — Um pequeno grupo de amigos, entre esses amigos: Leandra, — que é melhor amiga de Flávia — resolveram alugar uma casa na praia.'
 'E agora Leandra tinha aí uma questão: conta ou não conta para a melhor amiga que o cara teve um caso ali na praia, né? — Um caso de verão que fosse, mas teve. — Leandra, enfim, depois de conversar com a mãe, com a própria mãe ali, com a irmã… A mãe e a irmã de Leandra e elas falaram: “Você tem que contar, filha, é sua melhor amiga… Ela vai casar com esse cara que arrumou uma mulher na praia, nas férias da Flávia”. A Leandra chamou ali a Flávia na casa dela e contou… Mostrou as fotos… E aí a Flávia no primeiro, assim, num impulso ficou P da vida com a Leandra, porque a Leandra não contou lá na hora, pra ela desmascarar, enfim, fazer o que tinha que ser feito. E Flávia acabou brigando com Leandra, rompeu com Leandra porque Leandra não contou na praia.'
 'Déia Freitas: Oi, gente… Cheguei. Cheguei pra mais uma história do nosso Especial de Férias. E hoje eu vou contar para vocês a história da Leandra e sua amiga, Flávia. Então vamos lá, vamos de história.']",0.3880396193430739,1.0,0.42105263157894735,0.323451749784779,0.8308629374461948
106,"No episódio 'caso de verão', o que Leandra viu o noivo de Flávia fazendo durante as férias?",Leandra viu o noivo de Flávia beijando uma moça em um quiosque às seis horas da manhã.,Beijando uma moça em um quiosque,"['E numa dessas corridas que Leandra fez, Leandra viu — lá pelo quarto dia de viagem — o noivo de Flávia beijando uma moça seis horas da manhã ali num quiosque que nem estava aberto. — Sabe quando você está dando uns amassos? — E ela ainda passou, olhou, olhou, olhou e era ele. Não tinha como não ser ele. Ela nem fez a corrida, ficou por ali e ele deixou a moça ali. —'
 'No primeiro dia que eu cheguei aqui, eu já conheci um rapaz”. — Então, quer dizer, ela tinha conhecido o noivo da Flávia na praia. — Dito isso, investigação feita, Leandra foi embora… E aí ela estava convicta mesmo de realmente não contar. — Porque se fosse uma amante que ele tivesse levado para a praia, talvez ela contaria… — Mas como ela viu que era um caso de verão, ela falou: “Bom, eu não vou contar, não vou estragar as férias da minha amiga”. E o tempo passou, os dias foram passando, a Flávia estava muito, muito descansada e muito, muito feliz.'
 'Dito isso, investigação feita, Leandra foi embora… E aí ela estava convicta mesmo de realmente não contar. — Porque se fosse uma amante que ele tivesse levado para a praia, talvez ela contaria… — Mas como ela viu que era um caso de verão, ela falou: “Bom, eu não vou contar, não vou estragar as férias da minha amiga”. E o tempo passou, os dias foram passando, a Flávia estava muito, muito descansada e muito, muito feliz. Leandra resolveu nos dias seguintes enquanto corria e o cara se encontrava sempre esse horário com a moça. Então, ela não sabia também se a moça sabia que ele estava noivo ou não sabia, o que ele inventava… — Ela não sabia desses detalhes. —'
 'E Leandra ficou olhando bem pra a cara do noivo de Flávia, mas não falou nada também. E passou esse dia. E o dia seguinte Leandra viu ali o noivo de novo com aquela moça. E aí ela ficou intrigada se aquela moça tinha vindo com ele ou se ele tinha conhecido na praia. — E aí, gente… — Leandra tomou uma decisão… Em vez de seguir o noivo ali da Flávia, ela seguiu a moça e viu ali a casa que a moça entrou a tal e resolveu ficar na praia perto dali daquela casa, para ver quem saía e quem entrava.']",0.4116834016177667,1.0,0.18181818181818182,0.5978806300414942,0.7494701575103736
107,"No episódio 'caso de verão', por que Leandra não contou para Flávia o que viu no início?",Leandra não contou para Flávia o que viu no início porque achou que era um caso de verão e não queria estragar as férias da amiga.,Porque não queria estragar as férias da amiga,"['Dito isso, investigação feita, Leandra foi embora… E aí ela estava convicta mesmo de realmente não contar. — Porque se fosse uma amante que ele tivesse levado para a praia, talvez ela contaria… — Mas como ela viu que era um caso de verão, ela falou: “Bom, eu não vou contar, não vou estragar as férias da minha amiga”. E o tempo passou, os dias foram passando, a Flávia estava muito, muito descansada e muito, muito feliz. Leandra resolveu nos dias seguintes enquanto corria e o cara se encontrava sempre esse horário com a moça. Então, ela não sabia também se a moça sabia que ele estava noivo ou não sabia, o que ele inventava… — Ela não sabia desses detalhes. —'
 'No primeiro dia que eu cheguei aqui, eu já conheci um rapaz”. — Então, quer dizer, ela tinha conhecido o noivo da Flávia na praia. — Dito isso, investigação feita, Leandra foi embora… E aí ela estava convicta mesmo de realmente não contar. — Porque se fosse uma amante que ele tivesse levado para a praia, talvez ela contaria… — Mas como ela viu que era um caso de verão, ela falou: “Bom, eu não vou contar, não vou estragar as férias da minha amiga”. E o tempo passou, os dias foram passando, a Flávia estava muito, muito descansada e muito, muito feliz.'
 'E agora Leandra tinha aí uma questão: conta ou não conta para a melhor amiga que o cara teve um caso ali na praia, né? — Um caso de verão que fosse, mas teve. — Leandra, enfim, depois de conversar com a mãe, com a própria mãe ali, com a irmã… A mãe e a irmã de Leandra e elas falaram: “Você tem que contar, filha, é sua melhor amiga… Ela vai casar com esse cara que arrumou uma mulher na praia, nas férias da Flávia”. A Leandra chamou ali a Flávia na casa dela e contou… Mostrou as fotos… E aí a Flávia no primeiro, assim, num impulso ficou P da vida com a Leandra, porque a Leandra não contou lá na hora, pra ela desmascarar, enfim, fazer o que tinha que ser feito. E Flávia acabou brigando com Leandra, rompeu com Leandra porque Leandra não contou na praia.'
 'E os dias foram passando, acabou férias… Voltaram. Flávia radiante, feliz, descansada. E agora Leandra tinha aí uma questão: conta ou não conta para a melhor amiga que o cara teve um caso ali na praia, né? — Um caso de verão que fosse, mas teve. — Leandra, enfim, depois de conversar com a mãe, com a própria mãe ali, com a irmã… A mãe e a irmã de Leandra e elas falaram: “Você tem que contar, filha, é sua melhor amiga… Ela vai casar com esse cara que arrumou uma mulher na praia, nas férias da Flávia”.']",0.43101885591836825,1.0,0.19047619047619047,0.7426810509002283,0.560670262725057
108,"No episódio 'personal', quem foi o responsável pela traição em seu relacionamento com a Camila?",O responsável pela traição em seu relacionamento com a Camila foi o Jorge.,O Jorge,"['Mas será que só por ele ser insuportável e desonesto… Ah, tem um detalhe… Sabe por que que ele gastou o dinheiro da Camila na praia? Porque o Matheus contou pra ela que ele estava cheio de aluno também, os alunos que ele tinha de personal ele não perdeu nenhum, ele nunca ficou devendo conta em casa, é isso, então além de ser traidor, de colocar a Camila pra baixo por inveja, ele ainda era desonesto.'
 'Se o Jorge fosse um cara bacana, eu ia tá aqui falando “Poxa, Camila, pisou na bola”, mas o Jorge também vamos combinar, né? Tem nada de legal. Mas será que só por ele ser insuportável e desonesto… Ah, tem um detalhe… Sabe por que que ele gastou o dinheiro da Camila na praia? Porque o Matheus contou pra ela que ele estava cheio de aluno também, os alunos que ele tinha de personal ele não perdeu nenhum, ele nunca ficou devendo conta em casa, é isso, então além de ser traidor, de colocar a Camila pra baixo por inveja, ele ainda era desonesto.'
 'Matheus se declarando pra Camila. Porque quando a Camila conheceu o Jorge, estava o Jorge e o Matheus, e o Matheus disse que quem estava combinado de chegar na Camila era ele, que ele que se interessou pela Camila e Jorge passou na frente e tal, e aí ela começou a namorar o Jorge e ele ficou na dele, só que agora ele estava vendo o que estava acontecendo e achou que seria o momento de se declarar. E a Camila — Não sei se por carência ou sei lá, né? — ficou balançada e eles começaram a conversar. Começaram a conversar, começaram a conversar, o Jorge voltou da praia, respondeu o e-mail dela pedindo pra conversar, ela respondeu pra ele que não, que ela tinha visto as fotos, que isso, que aquilo, e a menina pôs um cadeado lá no Instagram, aí ela não conseguia mais acompanhar e ela falou: “Fica com a menina lá, não sei o quê” e não contou que ela estava conversando com o Matheus — Lógico, né? —'
 'Quando ela terminou, mandou o e-mail né, isso já na segunda-feira, ela estava ali pensando assim nas coisas, meio mal, chega uma mensagem pra ela, e era uma mensagem gigante, gente, de quem? Do Matheus. Matheus se declarando pra Camila. Porque quando a Camila conheceu o Jorge, estava o Jorge e o Matheus, e o Matheus disse que quem estava combinado de chegar na Camila era ele, que ele que se interessou pela Camila e Jorge passou na frente e tal, e aí ela começou a namorar o Jorge e ele ficou na dele, só que agora ele estava vendo o que estava acontecendo e achou que seria o momento de se declarar. E a Camila — Não sei se por carência ou sei lá, né? —']",0.3383408646204055,1.0,0.1111111111111111,0.47938636557763553,0.8698465913944089
109,"No episódio 'personal', o que o Jorge fez com o dinheiro que a Camila lhe deu?",Ele gastou o dinheiro da Camila na praia.,Foi para a praia com uma moça,"['Se o Jorge fosse um cara bacana, eu ia tá aqui falando “Poxa, Camila, pisou na bola”, mas o Jorge também vamos combinar, né? Tem nada de legal. Mas será que só por ele ser insuportável e desonesto… Ah, tem um detalhe… Sabe por que que ele gastou o dinheiro da Camila na praia? Porque o Matheus contou pra ela que ele estava cheio de aluno também, os alunos que ele tinha de personal ele não perdeu nenhum, ele nunca ficou devendo conta em casa, é isso, então além de ser traidor, de colocar a Camila pra baixo por inveja, ele ainda era desonesto.'
 'Só que uma hora o dinheiro acaba. — Quando o dinheiro do Jorge começou acabar, o que ele queria fazer? Ele queria que Camila passasse para ele alguns alunos dela, tipo assim, do nada, de graça, ele falou: “Olha, eu sei que você tem bastante alunos, você podia dividir esses alunos comigo”, e aí ela falou pra ele, falou: “Olha, eu tô conseguindo me virar aqui com o que eu tenho de aluno, pagando as minhas contas e sobra um pouquinho, mas bem pouquinho, que eu vou até dar uma juntada, eu posso de repente te emprestar, a gente tá junto aí pra tudo. Mas por enquanto não tenho nada, tipo não tá sobrando cem reais, nada, mas se tudo der certo meu Instagram tá indo muito bem, eu posso até te emprestar um dinheiro, mas não tem lógica eu te passar meus alunos, né? Mesmo porque são meus alunos, né?”'
 'E aí falou, falou, falou, pediu perdão, Camila perdoou e ele já emendou que ele estava sofrendo porque ele estava precisando de dinheiro, [risos] e aí a Camila pegou o que ela tinha juntado a mais que tinha sobrado desses meses de quarentena, tinha conseguido juntar dois mil reais, pegou os dois mil reais e deu pra Jorge. —'
 'em você, porque a gente ia se encontrar, que isso, que aquilo”. A Camila que não é uma pessoa ciumenta, mas também não é otária chamou o Jorge na chincha, falou: “Ô, quê que é isso?”, aí Jorge começou a chorar que ele estava se sentindo mal, que ele estava sentindo diminuído, e que isso tinha sido só uma forma dele se autoafirmar. — Uma conversinha. E aí falou, falou, falou, pediu perdão, Camila perdoou e ele já emendou que ele estava sofrendo porque ele estava precisando de dinheiro, [risos] e aí a Camila pegou o que ela tinha juntado a mais que tinha sobrado desses meses de quarentena, tinha conseguido juntar dois mil reais, pegou os dois mil reais e deu pra Jorge. —']",0.48240329315462854,0.5,0.2857142857142857,0.5576182842478463,0.4394045710619616
110,"No episódio 'personal', quem se declarou para a Camila após a separação com o Jorge?",O Matheus se declarou para a Camila após a separação com o Jorge.,O Matheus,"['Quando ela terminou, mandou o e-mail né, isso já na segunda-feira, ela estava ali pensando assim nas coisas, meio mal, chega uma mensagem pra ela, e era uma mensagem gigante, gente, de quem? Do Matheus. Matheus se declarando pra Camila. Porque quando a Camila conheceu o Jorge, estava o Jorge e o Matheus, e o Matheus disse que quem estava combinado de chegar na Camila era ele, que ele que se interessou pela Camila e Jorge passou na frente e tal, e aí ela começou a namorar o Jorge e ele ficou na dele, só que agora ele estava vendo o que estava acontecendo e achou que seria o momento de se declarar. E a Camila — Não sei se por carência ou sei lá, né? —'
 'Matheus se declarando pra Camila. Porque quando a Camila conheceu o Jorge, estava o Jorge e o Matheus, e o Matheus disse que quem estava combinado de chegar na Camila era ele, que ele que se interessou pela Camila e Jorge passou na frente e tal, e aí ela começou a namorar o Jorge e ele ficou na dele, só que agora ele estava vendo o que estava acontecendo e achou que seria o momento de se declarar. E a Camila — Não sei se por carência ou sei lá, né? — ficou balançada e eles começaram a conversar. Começaram a conversar, começaram a conversar, o Jorge voltou da praia, respondeu o e-mail dela pedindo pra conversar, ela respondeu pra ele que não, que ela tinha visto as fotos, que isso, que aquilo, e a menina pôs um cadeado lá no Instagram, aí ela não conseguia mais acompanhar e ela falou: “Fica com a menina lá, não sei o quê” e não contou que ela estava conversando com o Matheus — Lógico, né? —'
 'em você, porque a gente ia se encontrar, que isso, que aquilo”. A Camila que não é uma pessoa ciumenta, mas também não é otária chamou o Jorge na chincha, falou: “Ô, quê que é isso?”, aí Jorge começou a chorar que ele estava se sentindo mal, que ele estava sentindo diminuído, e que isso tinha sido só uma forma dele se autoafirmar. — Uma conversinha. E aí falou, falou, falou, pediu perdão, Camila perdoou e ele já emendou que ele estava sofrendo porque ele estava precisando de dinheiro, [risos] e aí a Camila pegou o que ela tinha juntado a mais que tinha sobrado desses meses de quarentena, tinha conseguido juntar dois mil reais, pegou os dois mil reais e deu pra Jorge. —'
 'aí Jorge começou a chorar que ele estava se sentindo mal, que ele estava sentindo diminuído, e que isso tinha sido só uma forma dele se autoafirmar. — Uma conversinha. E aí falou, falou, falou, pediu perdão, Camila perdoou e ele já emendou que ele estava sofrendo porque ele estava precisando de dinheiro, [risos] e aí a Camila pegou o que ela tinha juntado a mais que tinha sobrado desses meses de quarentena, tinha conseguido juntar dois mil reais, pegou os dois mil reais e deu pra Jorge. —']",0.37146348979340554,0.0,0.19047619047619047,0.5134743726022939,0.8783685931505735
111,"No episódio 'dúvida', quem casa com quem no início da história?","No início da história, o João casa com o Marcelo.",O João e o Marcelo casam no início da história,"['Aí o João, óbvio, falou para ele: “Não, Marcelo, imagina, eu te amo, a gente tá junto, vem morar comigo” e o João morava sozinho, uma vida totalmente organizada, tudo certo. E aí o Marcelo foi morar na casa, nossa, para o João estava ótimo, ele apaixonadíssimo, felicíssimo. E o João trabalha com T.I. aí então ele não tem muito horário, às vezes sai de manhã dá um problema em alguma empresa aí, fica o dia inteiro até varar à noite, tem que resolver.'
 'O João conheceu o Marcelo numa balada, tem uns três anos e eles começaram a ficar, e foi tudo bem, ficavam, nã nã nã, tudo certo. Até que o Marcelo falou pra ele que estava sem lugar para ficar, porque ele morava com um amigo e se o relacionamento deles não fosse ficar um pouco mais sério ele ia voltar para o Espírito Santo que é onde mora a família dele. Aí o João, óbvio, falou para ele: “Não, Marcelo, imagina, eu te amo, a gente tá junto, vem morar comigo” e o João morava sozinho, uma vida totalmente organizada, tudo certo. E aí o Marcelo foi morar na casa, nossa, para o João estava ótimo, ele apaixonadíssimo, felicíssimo. E o João trabalha com T.I. aí então ele não tem muito horário, às vezes sai de manhã dá um problema em alguma empresa aí, fica o dia inteiro até varar à noite, tem que resolver.'
 'E aí um dia ele chegou em casa era quase meia-noite e tinha uma festa no apartamento dele, uma festa, com pessoas que nunca tinha visto na vida, amigos do Marcelo, casa lotada, coisa dele quebrada pelo chão, gente bêbada e coisa que sumiu da casa. E ele teve ali um chilique e botou todo mundo para fora. — Eu faria a mesma coisa e colocaria o Marcelo para fora junto, mas ele não pôs o Marcelo para fora junto. — Porque o Marcelo trabalhava numa loja de sapato como gerente, aí o Marcelo disse que aquela festa era uma festa de despedida porque ele tinha pedido as contas. — Como assim pediu as contas? —'
 'E aí agora o João tá nesse impasse porque ele considera a irmã do Marcelo uma pessoa correta e ela quer pagar, mas é tipo coisa de, sei lá, vinte mil, entendeu? Se for devolver todas as coisas que ele pegou, que levou embora, levou até a batedeira, o João tinha uma batedeira daquelas batedeiras de mil reais, sabe? Daquela marca famosa que tem as batedeiras coloridas? Até isso ele levou.']",0.29204730156520564,0.0,0.2222222222222222,0.923887030011235,0.23097175750280874
112,"No episódio 'dúvida', quais são os sonhos do Marcelo?",O sonho do Marcelo é ser ator.,O Marcelo sonha em ser ator e ter um podcast,"['Mas ele falou: “Bom, eu amo o Marcelo, o Marcelo quer ser ator, então vou dar essa força para ele”. Beleza, durou uns seis meses isso dele querer ser ator, aí ele desistiu de ser ator, e nisso, nesses seis meses ele queria fazer um curso que ele não tinha todo o dinheiro para fazer o curso, então o João deu uma parte do dinheiro pra ele do curso e colocava crédito no Bilhete Único pra ele ir e voltar de metrô, e tinha dia que ele ainda usava o Uber no cartão do João porque ele não queria voltar de metrô porque estava cansado.'
 'Pô, você tá morando na casa do cara você vai comprar filme? Essas pequenas coisinhas, sabe? Mas ele falou: “Bom, eu amo o Marcelo, o Marcelo quer ser ator, então vou dar essa força para ele”. Beleza, durou uns seis meses isso dele querer ser ator, aí ele desistiu de ser ator, e nisso, nesses seis meses ele queria fazer um curso que ele não tinha todo o dinheiro para fazer o curso, então o João deu uma parte do dinheiro pra ele do curso e colocava crédito no Bilhete Único pra ele ir e voltar de metrô, e tinha dia que ele ainda usava o Uber no cartão do João porque ele não queria voltar de metrô porque estava cansado.'
 'Eu faria a mesma coisa e colocaria o Marcelo para fora junto, mas ele não pôs o Marcelo para fora junto. — Porque o Marcelo trabalhava numa loja de sapato como gerente, aí o Marcelo disse que aquela festa era uma festa de despedida porque ele tinha pedido as contas. — Como assim pediu as contas? — Porque ele pediu as contas porque agora ele ia correr atrás do sonho dele de ser ator. [ riso irônico] Mas uma coisa é: Você fez um pé-de-meia?'
 'Aí o João, óbvio, falou para ele: “Não, Marcelo, imagina, eu te amo, a gente tá junto, vem morar comigo” e o João morava sozinho, uma vida totalmente organizada, tudo certo. E aí o Marcelo foi morar na casa, nossa, para o João estava ótimo, ele apaixonadíssimo, felicíssimo. E o João trabalha com T.I. aí então ele não tem muito horário, às vezes sai de manhã dá um problema em alguma empresa aí, fica o dia inteiro até varar à noite, tem que resolver.']",0.4728098737996496,1.0,0.2857142857142857,0.7470934967617398,0.6867733741904349
113,"No episódio 'dúvida', por que o Marcelo sai da casa do João?",O Marcelo sai da casa do João porque o João o pegou com outro cara na cama deles.,O Marcelo sai da casa do João porque pega as coisas do João e some,"['O João conheceu o Marcelo numa balada, tem uns três anos e eles começaram a ficar, e foi tudo bem, ficavam, nã nã nã, tudo certo. Até que o Marcelo falou pra ele que estava sem lugar para ficar, porque ele morava com um amigo e se o relacionamento deles não fosse ficar um pouco mais sério ele ia voltar para o Espírito Santo que é onde mora a família dele. Aí o João, óbvio, falou para ele: “Não, Marcelo, imagina, eu te amo, a gente tá junto, vem morar comigo” e o João morava sozinho, uma vida totalmente organizada, tudo certo. E aí o Marcelo foi morar na casa, nossa, para o João estava ótimo, ele apaixonadíssimo, felicíssimo. E o João trabalha com T.I. aí então ele não tem muito horário, às vezes sai de manhã dá um problema em alguma empresa aí, fica o dia inteiro até varar à noite, tem que resolver.'
 'Aí o João, óbvio, falou para ele: “Não, Marcelo, imagina, eu te amo, a gente tá junto, vem morar comigo” e o João morava sozinho, uma vida totalmente organizada, tudo certo. E aí o Marcelo foi morar na casa, nossa, para o João estava ótimo, ele apaixonadíssimo, felicíssimo. E o João trabalha com T.I. aí então ele não tem muito horário, às vezes sai de manhã dá um problema em alguma empresa aí, fica o dia inteiro até varar à noite, tem que resolver.'
 'E um dia, como eu disse para vocês, o João em T.I. ele não tem horário, e ele foi pra um negócio que ele achou que ia ser muito complicado, avisou o Marcelo, falou: “Eu acho que eu só volto de madrugada, porque se for o que eles estão me falando aqui, vai ser complicado”. E chegou lá alguém tinha desligado uma parte do servidor, foi tipo só ligar na tomada, e aí ele voltou pra casa, no que ele voltou pra casa o quê que ele pegou, gente? Pegou o Marcelo com um outro cara na cama deles. — Pensa. — Ele ficou em choque, passado, não conseguiu falar nada, não conseguiu brigar, nada.'
 'E o Marcelo sumiu, realmente sumiu, nunca mais falou com ele, do nada assim, quer dizer, do nada não, né? Depois da traição, tudo, roubou e sumiu. O que vocês acham? Falem aí pro João se ele deve aceitar que a irmã pague, mesmo que seja aos pouquinhos ou se ele faz o B.O. e suja o nome desse cara. Então, é isso, daqui a pouco eu volto de novo.']",0.5272697580894449,1.0,0.2222222222222222,0.8719285019804042,0.21798212549510104
114,"No episódio 'cordão', quem era o namorado de Kimberly?",Não há informação suficiente no episódio para saber o nome do namorado de Kimberly.,Um rapaz rico,"['A Kimberly conheceu um rapaz aí e ela começou a namorar esse rapaz… E eles estudavam na mesma universidade. Então, enquanto eles estavam ali durante o curso, os dois já estavam no último ano, tudo funcionou muito bem. Acontece que depois que acabou o curso, esse rapaz voltou para assumir os negócios da família… — família rica. — E Kimberly ali, classe C, foi atrás de um trabalho na área em que ela se formou. Então, já começa por aí… — Eu sempre falo que eu acho um pouco problemático relacionamentos, assim, entre classes sociais que tenham muita diferença… Acaba dando uma pesada, assim, pra quem é mais da classe C, né?'
 'Não fez feio, Kimberly não fez feio. — E, assim, toda hora o namorado dela vinha, ela circulava, tava bem… Ela percebeu ali que ela não era do meio, todo mundo percebeu que ela não era do meio, mas Kimberly estava bem, né? — E um detalhe: Kimberly falou que todas as pessoas eram brancas ali. Kimberly também branca, tá? —'
 'Começou a acontecer com a Kimberly… ela ainda não tinha conhecido a família do namorado, mas já as vezes eles estavam juntos na kitnet da Kimberly e ele fazia FaceTime e a mãe do cara sempre assim, com aquela cara de nojo, sabe? — Pra mim já não dá… — o tempo passou mais um pouco e o cara falou: “Olha…” — ele já deu aquela adiantada, né? Porque sabia que podia dar problema. — “ Minha família não é tão legal, mas eu acho que você precisa conhece-los e nã nã nã… Eu vou marcar um almoço na casa da minha mãe, super informal”. — Pra vocês terem uma ideia… — A casa do cara tem quadra de tênis… — Então você tira por aí, né?'
 'Ela já está bem com essa história, se não eu não estava rindo aqui. — E aí, gente, para mais sorte da Kimberly, ela estava com o celular… Quando ela entrou no banheiro, ela botou o celular ali em cima da piazona bonitona ali do lavabo e se cagou. E aí ela teve que ligar para o namorado e chamar o namorado para dentro do lavabo, um lavabo grande… Só que nessa altura, a merda de Kimberly já tinha até entrado toda dentro do tênis… E o cheiro tava insuportável. Aí ela chamou o cara, o cara veio, o cara ficou horrorizado… — A palavra é: horror. [ risos] — E aí ele não sabia como resolver.']",0.0,1.0,0.3,0.3181976732171049,0.07954941830427623
115,"No episódio 'cordão', o que aconteceu com Kimberly no banheiro?","Kimberly se cagou no banheiro da casa da mãe do namorado, a merda subiu até a cintura, e ela teve que ligar para o namorado para chamar ajuda.",Ela não conseguiu desamarrar o cordão da calça e cagou dentro dela,"['E foi isso que foi acontecendo com Kimberly. — Conforme ela entrou no banheiro e travou a porta do lavabo. Um lavabo chique… A Kimberly não sabe identificar se aquilo era um mármore, mas branco de fora a fora, com umas manchinhas, assim… O chão também… — Mármore, vamos pôr aí que é mármore. — E aí, conforme Kimberly travou a porta do banheiro, que ela olhou para o vaso, ela falou: “Puta, aí o organismo já falando pra você, “agora eu vou, agora eu vou”.'
 'Sentou, foi. [ risos] Alívio. E foi isso que foi acontecendo com Kimberly. — Conforme ela entrou no banheiro e travou a porta do lavabo. Um lavabo chique… A Kimberly não sabe identificar se aquilo era um mármore, mas branco de fora a fora, com umas manchinhas, assim… O chão também… — Mármore, vamos pôr aí que é mármore. —'
 'Assinante 2: Olá, todo mundo… Olá, aqui é a Ana, eu falo do Rio de Janeiro. Kimberly, traída pelo próprio cordão da calça… [riso] Realmente, né? A gente só conhece a pessoa na hora do aperto… Porque era pra essa situação ser cômica, mas o cara resolveu ser um belíssimo de um babaca em vez de mostrar que gostava mesmo de você ali, dando uma assistência, porque a situação foi braba. [ risos] Mas foi livramento, cara, ele ter saído da sua vida… O banheiro sujo foi merecido sim. Ainda bem que essa coisa toda pelo saiu uma situação engraçada.'
 'E aí Kimberly estava no banheiro da casa da mãe do cara toda cagada… — Toda cagada… — E o tênis cagado, a meia cagada, calça cagada… Segundo Kimberly, a merda subiu até a cintura. [ risos] — Desculpa, Kimberly… [risos] Olha, eu ri com Kimberly, tá? Ela já está bem com essa história, se não eu não estava rindo aqui. — E aí, gente, para mais sorte da Kimberly, ela estava com o celular… Quando ela entrou no banheiro, ela botou o celular ali em cima da piazona bonitona ali do lavabo e se cagou. E aí ela teve que ligar para o namorado e chamar o namorado para dentro do lavabo, um lavabo grande… Só que nessa altura, a merda de Kimberly já tinha até entrado toda dentro do tênis… E o cheiro tava insuportável.']",0.23747525133039515,1.0,0.2,0.5186369306884784,0.1296592326721196
116,"No episódio 'cordão', por que Kimberly saiu da casa da mãe do namorado com uma calça de uniforme e Havaianas?","Kimberly saiu da casa da mãe do namorado com uma calça de uniforme e Havaianas porque o namorado pegou um uniforme de funcionário e uma Havaianas para ela usar, pois ela não tinha roupa para sair do banheiro.",Porque o namorado a humilhou e lhe deu roupa para ela sair,"['Ficou. Porque Kimberley falou: “Eu não vou… Eu não tenho nem como lavar esse banheiro, o banheiro vai ficar aí”. Ela o tanto que tinha lá de papel, teve que lavar a bunda praticamente na pia… [risos] — Ê, Kimberly… — Pra sair minimamente, assim, aceitável, mas ainda com aquela Havaianas e com aquela calça totalmente destoando de todo mundo que estava ali. Então, assim eu achei que ele podia ser mais delicado e ter dado uma roupa pra Kimberly mais discreta, pra que ela não se sentisse como ela se sentiu, humilhada. Não por ser uma calça de uniforme e uma Havaianas, porque isso a gente usa, mas por ser naquela situação, né?'
 'Ele ficou com aquela ânsia e ele saiu do banheiro, ele falou: “Kimberly, vou te telefonar, não consigo ficar aqui dentro”. E aí ligou pra dentro do banheiro pra falar com Kimberly, porque não estava dando… [risos] Deve ter se afastado do lavabo, ido lá fora tomar um ar. [ risos] E aí ele foi lá e pegou um uniforme, provavelmente de algum funcionário, de alguma funcionária de lá, uma calça dessas de uniforme mesmo, sabe? De funcionário e uma Havaianas. — Ele não poderia, sei lá, pegar uma calça da mãe dele e um sapato, sabe?'
 'E aí Kimberly saiu na frente de todo mundo — e essa a parte que eu acho mais problemática — com aquela calça claramente de uniforme e havaianas. Todo mundo ficou em choque…'
 'Quando você tem o seu melhor tênis, você mesmo que ele esteja cagado, você não vai jogar ele no lixo, você vai querer limpar. E aí, Kimberly falou: “Bom, agora eu já estou toda fodida mesmo” e pegou e botou, tirou o tênis e tal, sujou todo o chão de bosta… Uma coisa louca, e a Kimberly começou a lavar o tênis dentro da pia do lavabo. [ risos] A pessoa pobre também é foda. [ risos] Aí tirou o tanto de merda que deu ali do tênis… A meia ela falou: “Bom, eu vou passar uma água em tudo aqui, boto dentro do saco e vou levar pra minha casa”. E aí Kimberly saiu na frente de todo mundo — e essa a parte que eu acho mais problemática — com aquela calça claramente de uniforme e havaianas.']",0.3278717913797518,0.6666666666666666,0.29411764705882354,0.5674190162629404,
117,"No episódio 'ovo de páscoa', quem foram as duas personagens principais da história?",As duas personagens principais da história são a Júlia e a Telma.,Telma e Júlia,"['A Júlia terminou com a Telma por causa da situação do ovo de Páscoa.'
 'E aí você vê, né? Duas histórias que são bem semelhantes assim, a diferença é que eu falei na hora que eu não ia comer aquele ovo, que eu queria um ovo, que ele ia ter que trocar aquele ovo porque eu queria comer um chocolate, e ele teve que me falar que ele que abriu, que tinha coisa dentro, sabe? E aí resolveu, porque ali teve uma comunicação a mais, no caso da Júlia e da Telma, a Telma resolveu não falar nada e aí a Júlia se ofendeu, enfim… E a história foi ladeira abaixo. E aí até hoje, é uma história já um pouco antiga, até hoje a Telma lamenta assim, que não tenha dado certo, né? Por causa de um ovo de Páscoa.'
 'E aí resolveu, porque ali teve uma comunicação a mais, no caso da Júlia e da Telma, a Telma resolveu não falar nada e aí a Júlia se ofendeu, enfim… E a história foi ladeira abaixo. E aí até hoje, é uma história já um pouco antiga, até hoje a Telma lamenta assim, que não tenha dado certo, né? Por causa de um ovo de Páscoa. Até falei pra ela, falei: “Sei lá, de repente, né? Se você ainda gosta dela, já passou alguns anos, as pessoas amadurecem também, né?”'
 'Déia Freitas: Oi, gente… Cheguei, pra mais uma história do nosso Picolé de Limão de Páscoa, [risos] e hoje eu vou contar pra vocês a história da Telma e da Júlia, quem me escreveu foi a Telma. Então vamos lá, vamos de história. [ riso]']",0.1367723761253074,1.0,0.23076923076923078,0.6834218757253525,0.9208554689313382
118,"No episódio 'ovo de páscoa', o que Telma não gosta de comer?",Telma não gosta de comer chocolate.,Chocolate,"['Aí a Telma teve que abrir o jogo, falou: “Olha, não como chocolate, eu dei o ovo, você devia ter me falado que tinha uma surpresa dentro do ovo, pelo menos isso”, só que aí a Júlia não encarou bem… — Como o meu ex-namorado que até hoje é meu amigo encarou, entendeu? — E aí a Júlia ficou muito ofendida da Telma ter dado embora o ovo de Páscoa… — Mesmo vai, que ela gostasse de ovo e, sei lá, achasse muito grande, sei lá, não quisesse comer, deu pra alguém que vai comer, pra uma criança de uma ONG, sabe? E aí não tinha como achar esse anel de volta, a sorte que não era assim, uma joia, né? Uma coisa cara, era um anel de compromisso. E aí a Telma foi lá e comprou o anel de compromisso pra Júlia, né?'
 'Eu acho uma bobagem você mentir uma coisa dessas, podia falar: “Eu não gosto de chocolate”, sei lá, mas ela não falou nada. — Domingo de Páscoa, a Júlia toda emocionada falou: “Bom, já que você abriu o ovo, comeu um pedaço, você viu os bombons?”, ai a Telma falou: “Vi, vi sim, né? Comi”, falou: “Então, um dos bombons são as nossas alianças”. [ risos]'
 'Chegou no sábado ali de Páscoa, imagina assim, ó, a Telma ajuda aí uma ONG em várias coisas, e aí ela resolveu dar aquele ovo na ONG, a ONG estava juntando ovos pra distribuir pra pessoas aleatórias ali que recebem coisas da ONG e a Telma foi lá e doou o ovo pra ONG, pensando no quê? A hora que a Júlia perguntar falar: “Comi o ovo”. — Comi, né? — E assunto resolvido, e aí ela teria ali mais um ano, talvez pra ir falando: “Olha, ai, não sei, chocolate me fez mal, acho que eu não gosto mais”. — Eu acho uma bobagem você mentir uma coisa dessas, podia falar: “Eu não gosto de chocolate”, sei lá, mas ela não falou nada. —'
 'Comi, né? — E assunto resolvido, e aí ela teria ali mais um ano, talvez pra ir falando: “Olha, ai, não sei, chocolate me fez mal, acho que eu não gosto mais”. — Eu acho uma bobagem você mentir uma coisa dessas, podia falar: “Eu não gosto de chocolate”, sei lá, mas ela não falou nada. — Domingo de Páscoa, a Júlia toda emocionada falou: “Bom, já que você abriu o ovo, comeu um pedaço, você viu os bombons?”, ai a Telma falou: “Vi, vi sim, né?']",0.2982380570278173,1.0,0.2222222222222222,0.5148396407566518,0.8787099101891629
119,"No episódio 'ovo de páscoa', por que Júlia terminou o relacionamento com Telma?",A Júlia terminou com a Telma por causa da situação do ovo de Páscoa.,Porque Telma deu embora o ovo de Páscoa que Júlia havia lhe dado,"['A Júlia terminou com a Telma por causa da situação do ovo de Páscoa.'
 'E aí a Telma foi lá e comprou o anel de compromisso pra Júlia, né? Tipo, “Olha, o seu, sei lá, tá na ONG, foi embora, mas eu comprei aqui pra gente e tal”, só que aí a Júlia não aceitou, a Júlia ficou muito ofendida, não conseguiu superar essa história e aí uns três meses depois elas terminaram. A Júlia terminou com a Telma por causa da situação do ovo de Páscoa.'
 'Por causa de um ovo de Páscoa. Até falei pra ela, falei: “Sei lá, de repente, né? Se você ainda gosta dela, já passou alguns anos, as pessoas amadurecem também, né?” Porque é uma bobagem você terminar um relacionamento por causa de um ovo de Páscoa, eu sei que não é só um ovo de Páscoa, tem toda a questão de que “Ah, a Telma pegou um presente que a Júlia deu e deu embora”, mas era um ovo de Páscoa, né? — Era um ovo de Páscoa.'
 'Se você ainda gosta dela, já passou alguns anos, as pessoas amadurecem também, né?” Porque é uma bobagem você terminar um relacionamento por causa de um ovo de Páscoa, eu sei que não é só um ovo de Páscoa, tem toda a questão de que “Ah, a Telma pegou um presente que a Júlia deu e deu embora”, mas era um ovo de Páscoa, né? — Era um ovo de Páscoa.']",0.5485863737278849,1.0,0.45454545454545453,0.8865360644206688,0.5966340161051672
120,"No episódio 'genrão', quem é o namorado da Vani?",Não há informação suficiente no episódio para saber o nome do namorado da Vani.,Um professor universitário que conheceu na universidade,"['E Dona Lourdes com medo disso, Vani também, pediram ajuda ali para o mocinho, o namorado aí de Vani. E o cara é um cara excelente, o cara maravilhoso… Ele falou: “Olha, eu vou fazer uma coisa que eu não faria pra ninguém, mas eu vou fazer porque é a senhora Dona Lourdes”. Dona Lourdes falou: “Ai meu Deus, meu filho, o que você vai fazer?”, ele falou: “Olha, eu vou vender o meu carro pra senhora”, “Mentira…”, “Vou vender… Olha, vou vender sim”. E aí Dona Lourdes combinou ali, Vani quis ficar um pouco de fora e falou: “Ah, é minha mãe com o meu futuro marido… Ai, que bonitinho, os dois negociando e tal” e foi feita aí a venda desse carro, do cara para Dona Lourdes.'
 'Eles continuam aí nesse namoro firme rumo ao matrimônio, mas a Vani falou: “Poxa, eu tenho, assim… Tem hora que eu acho que ele enganou minha mãe, tem hora que eu acho que ele tem um ponto”. — Que ponto, Vani? Ê, Vani… Que ponto? Esse cara enganou a Dona Lourdes e enganou você, né? De quebra… Que são as duas ali juntas e tal.'
 'E estamos nessa… Isso já tem uns meses. A Vani não consegue engolir essa história. Eles continuam aí nesse namoro firme rumo ao matrimônio, mas a Vani falou: “Poxa, eu tenho, assim… Tem hora que eu acho que ele enganou minha mãe, tem hora que eu acho que ele tem um ponto”. — Que ponto, Vani? Ê, Vani… Que ponto?'
 'E o carrinho ali de Dona Lourdes estava bem mais ou menos… Vani namorando esse cara já há quase um ano… Dona Lourdes começou um movimento de procurar um carro usado pra comprar. E procura daqui, procura dali… — Precisa ter muito cuidado para não cair em golpe, né? O certo é, sei lá, você ir numa concessionária mesmo, de carro usado, e ainda assim você pode correr algum risco, mas não tem outro jeito, né? O que não dá é você, sei lá, comprar na internet assim, sem saber direito o site. —']",0.0,0.0,0.2631578947368421,0.26889885349345494,0.06722471337336373
121,"No episódio 'genrão', por que a Vani queria se casar?","A Vani queria se casar porque era uma meta de vida para ela, e ela encontrou um cara que era perfeito e falava em casamento.",Era seu sonho de vida,"['Porque ela queria muito também que a Vani se casasse. —'
 'E a Vani ela tinha uma questão… Vani, agora com 42 anos, na época com 41, queria muito se casar. — Tem gente que tem esse sonho aí… Eu não entendo muito bem, mas tem gente que tem isso como uma meta de vida, né? E a meta de vida da Vani era aí se casar. — E esse cara era perfeito e ele falava em casamento… Então, Vani ficou animada, Dona Lourdes ficou animada, né? — Porque ela queria muito também que a Vani se casasse. —'
 'E a meta de vida da Vani era aí se casar. — E esse cara era perfeito e ele falava em casamento… Então, Vani ficou animada, Dona Lourdes ficou animada, né? — Porque ela queria muito também que a Vani se casasse. —'
 'A Vani conheceu um cara excelente… — olha, um cara maravilhoso… — A Vani, professora universitária, o cara professor universitário também, eles se conheceram na universidade — no começo do ano passado — e tudo foi perfeito… O cara um cavalheiro, muito amável assim com todo mundo, inclusive com a mãe da Vani. — Que a gente pode chamar aqui de Dona Lourdes. — E a Vani ela tinha uma questão… Vani, agora com 42 anos, na época com 41, queria muito se casar. — Tem gente que tem esse sonho aí… Eu não entendo muito bem, mas tem gente que tem isso como uma meta de vida, né? E a meta de vida da Vani era aí se casar. —']",0.05930314251438092,1.0,0.2777777777777778,0.48432567965736256,0.6210814199143406
122,"No episódio 'genrão', por que o namorado da Vani cobrou 12 mil a mais do valor de mercado do carro?","O namorado da Vani cobrou 12 mil a mais do valor de mercado do carro porque ele alegou que o carro tinha um valor sentimental para ele, e ele achava que o carro valia mais do que o valor de mercado.",Porque ele achava que era o valor que o carro vale para ele,"['E aí ele fez que fez e a Vani ainda não contou pra Dona Lourdes que ela pagou 12 mil a mais e Vani ainda tá com ele… Porque ela falou que ela fica muito confusa quando ele coloca os argumentos de que é o valor de estimação do carro, é o valor que ele merecia do carro… Gente, não existe isso, é um bem de mercado, é um carro… “Ah, mas tem valor sentimental pra mim”, não é nem um carro antigo, sei lá, não, é um carro… — Eu não sei, vocês acham que tem essa coisa de quanto vale e quanto eu peço? “ Paga quem quiser dar”. Mas ele não devia então falar para Dona Lourdes assim: “Olha, esse carro aqui vale X, mas eu estou cobrando Y, que é 12 mil a mais, porque é o valor que eu acho que ele vale para mim… Tudo bem pra senhora?”, ele não tinha que ter sido honesto nesse tanto? Eu acho. —'
 'Ê, Vani… Que ponto? Esse cara enganou a Dona Lourdes e enganou você, né? De quebra… Que são as duas ali juntas e tal. Gente, ele cobrou 12 mil a mais do valor de mercado, sendo que ele já tinha oferecido o carro já para o Valter no preço de mercado. —'
 'Por que você tem que falar com sua mãe?”, ela falou: “Ué, mas porque foi ela que pagou 12 mil a mais, eu quero que ela saiba disso, né?”. E aí ele fez que fez e a Vani ainda não contou pra Dona Lourdes que ela pagou 12 mil a mais e Vani ainda tá com ele… Porque ela falou que ela fica muito confusa quando ele coloca os argumentos de que é o valor de estimação do carro, é o valor que ele merecia do carro… Gente, não existe isso, é um bem de mercado, é um carro… “Ah, mas tem valor sentimental pra mim”, não é nem um carro antigo, sei lá, não, é um carro… — Eu não sei, vocês acham que tem essa coisa de quanto vale e quanto eu peço? “ Paga quem quiser dar”. Mas ele não devia então falar para Dona Lourdes assim: “Olha, esse carro aqui vale X, mas eu estou cobrando Y, que é 12 mil a mais, porque é o valor que eu acho que ele vale para mim… Tudo bem pra senhora?”,'
 'Ele tinha oferecido pra mim 12 mil a menos, que é o valor de mercado… 12 mil a menos. Sua mãe tem certeza que ela pagou esse valor? Porque tá 12 mil a mais do valor de mercado e do valor que ele me ofereceu”. Vani falou: “Não é possível… Então eu devo ter entendido errado o valor”. Na hora ela mandou mensagem para dona Lourdes e dona Lourdes falou: “Não, foi isso mesmo… Eu passei meu carrinho pra frente e tive que fazer um empréstimo lá no banco pra dar o valor todo, né?']",0.19498690335713817,1.0,0.3,0.6677844333316479,0.541946108332912
123,"No episódio 'fibras', quem é o Jefferson?","O Jefferson é um cara super do esporte, atlético, que come direitinho e é uma pessoa saúde.",Um cara atlético que come direitinho e é saudável.,"['E aí ele começou a ir ao banheiro e a cagar [risos] de maneira diferenciada. Então ele falou: “Pô, Jeff, eu tô cagando fedido pra caramba”, [risos] aí o Jefferson falou pra ele: “Bom, eu acho que é a verdura e tal, né? Agora você tá começando… Você não foi um cara de comer verdura”, e aí o Rogério começou a gostar de comer uma granola… Um negócio com mais fibras…'
 'O Jefferson ele é um cara super, assim, do esporte… Sabe aquele cara atlético? Aquele cara que come direitinho, um cara saúde. [ risos] Já o Rogério, ele é adepto ali de um Cebolitos, [risos] um salgado… Então, é um casal que tem, assim, uma alimentação diferente uma da outra. Quando a pessoa ela é geração saúde e ela vai morar com a pessoa do salgado e Cebolitos, ela vai, obviamente, impactar na alimentação da pessoa que come mal… — Porque aí você chega naquela casa, agora você encontra uma fruta, um legume… Se você quiser fazer ali uma vitamina, você consegue fazer uma vitamina, entendeu? Antes não tinha isso. —'
 'risos] Essa é a história de Rogério e Jefferson. Comentem lá no nosso grupo do Telegram, sejam gentis. Um beijo e eu volto em breve.'
 'Déia Freitas: Ele contando, ele falou: “Andréia, toda vez que eu conto, eu sinto meu rosto queimar de vergonha, né? E foi aí o mico da minha vida”. [ risos] Essa é a história de Rogério e Jefferson. Comentem lá no nosso grupo do Telegram, sejam gentis. Um beijo e eu volto em breve.']",0.5234494359551787,1.0,0.26666666666666666,0.6356029359700255,
124,"No episódio 'fibras', o que aconteceu com o Rogério no banheiro dos pais do Jefferson?","No banheiro dos pais do Jefferson, o Rogério teve um problema de saúde relacionado a sua alimentação, pois começou a comer mais fibras e legumes, o que mudou a consistência de suas fezes, tornando-as mais duras. Ele sentou no banheiro e não conseguiu evacuar, o que causou um problema. Seu João e Dona Matilde vieram ajudá-lo e riram da situação.",Ele teve um probleminha de intestino e cagou pedras duras no vaso sanitário.,"['Bom, lá foi o Rogério… Entrou no quarto dos pais de Jefferson, foi até o banheiro e sentou. Conforme ele sentou… — Como é que agora eu vou dizer isso? [ risos] — Você que tem intestino preso… Eu não sei o nome, sei lá, médico para isso… Mas sabe quando o seu cocô sai duro como pedra? Eu já tive isso ao longo da minha vida inteira umas três vezes, mas foram três vezes que eu jamais esqueci na vida. E é duro como pedra, pedra, pedra, pedra… Não tem outra palavra.'
 'Ah, um dia tive diarreia, outro dia fiquei dois dias sem ir no banheiro, enfim”, era uma coisa normal de quem se alimenta mal, né? E ele não estava tomando nenhum suplemento, nada… A questão é: Ele agora estava fazendo as refeições corretamente, comendo legume, comendo verdura, comendo fruta, então o corpo do Rogério começou a mudar. E aí ele começou a ir ao banheiro e a cagar [risos] de maneira diferenciada. Então ele falou: “Pô, Jeff, eu tô cagando fedido pra caramba”, [risos] aí o Jefferson falou pra ele: “Bom, eu acho que é a verdura e tal, né? Agora você tá começando… Você não foi um cara de comer verdura”, e aí o Rogério começou a gostar de comer uma granola… Um negócio com mais fibras…'
 'E aí ele começou a ir ao banheiro e a cagar [risos] de maneira diferenciada. Então ele falou: “Pô, Jeff, eu tô cagando fedido pra caramba”, [risos] aí o Jefferson falou pra ele: “Bom, eu acho que é a verdura e tal, né? Agora você tá começando… Você não foi um cara de comer verdura”, e aí o Rogério começou a gostar de comer uma granola… Um negócio com mais fibras…'
 'O Rogério olhou para o Jefferson: “Pai, vem cá”? Eu já estou aqui pagando um mico e você vai chamar seu pai?” e ele rindo… E aí o seu João veio e ele falou: “Pai, olha isso…”, seu João olhou no vaso e começou a rir também… Seu João gritou: “Matilde” [risos] Dona Matilde veio correndo e, quando ela viu, ela deu uma risadinha e falou: “Ah, meu filho… Quando é assim, não tem jeito, você vai ter que pegar com a sacola”. [ risos] Dona Matilde saiu do banheiro — como uma mãe, naturalmente, que já viu de tudo, né? —, foi lá até a área de serviço, pegou umas quatro sacolas, Seu João e Jefferson estavam se acabando de rir, ela tirou os dois do banheiro e falou: “Toma aqui, filho, você vai pôr… Ó, já pus uma sacolinha aqui dentro da outra, agora outra sacolinha você enfia na sua mão… Você põe tudo aqui na sacola, amarra e depois você põe lá na lixeira da rua, tá bom?”. —']",0.3372292523718208,0.6666666666666666,0.4117647058823529,0.5504702880228098,0.13761757200570246
125,"No episódio 'fibras', como foi a reação da família do Jefferson ao ver a situação do Rogério?",A reação da família do Jefferson foi de riso e surpresa. Seu João e Dona Matilde riram e ajudaram o Jefferson a lidar com a situação do Rogério.,Eles riram muito da situação e ajudaram o Rogério a resolver o problema.,"['O Rogério olhou para o Jefferson: “Pai, vem cá”? Eu já estou aqui pagando um mico e você vai chamar seu pai?” e ele rindo… E aí o seu João veio e ele falou: “Pai, olha isso…”, seu João olhou no vaso e começou a rir também… Seu João gritou: “Matilde” [risos] Dona Matilde veio correndo e, quando ela viu, ela deu uma risadinha e falou: “Ah, meu filho… Quando é assim, não tem jeito, você vai ter que pegar com a sacola”. [ risos] Dona Matilde saiu do banheiro — como uma mãe, naturalmente, que já viu de tudo, né? —, foi lá até a área de serviço, pegou umas quatro sacolas, Seu João e Jefferson estavam se acabando de rir, ela tirou os dois do banheiro e falou: “Toma aqui, filho, você vai pôr… Ó, já pus uma sacolinha aqui dentro da outra, agora outra sacolinha você enfia na sua mão… Você põe tudo aqui na sacola, amarra e depois você põe lá na lixeira da rua, tá bom?”. —'
 'O Jefferson na hora foi lá, mas não pensando em nada… Ele falou: “Socorro, o que que eu faço?”. Quando o Jefferson viu, ele assim… Ele ficou olhando… Ele falou: “Mas que que é isso? Isso é merda? Mas tá duro, tá estranho” e ele começou a rir… [risos] Ele começou a rir e fez uma coisa que o Rogério falou que essa frase ficou ecoando na cabeça dele por semanas. [ risos] Ele, rindo muito, gritou: “Pai, vem cá…”. ['
 'Ah, um dia tive diarreia, outro dia fiquei dois dias sem ir no banheiro, enfim”, era uma coisa normal de quem se alimenta mal, né? E ele não estava tomando nenhum suplemento, nada… A questão é: Ele agora estava fazendo as refeições corretamente, comendo legume, comendo verdura, comendo fruta, então o corpo do Rogério começou a mudar. E aí ele começou a ir ao banheiro e a cagar [risos] de maneira diferenciada. Então ele falou: “Pô, Jeff, eu tô cagando fedido pra caramba”, [risos] aí o Jefferson falou pra ele: “Bom, eu acho que é a verdura e tal, né? Agora você tá começando… Você não foi um cara de comer verdura”, e aí o Rogério começou a gostar de comer uma granola… Um negócio com mais fibras…'
 'E aí ele começou a ir ao banheiro e a cagar [risos] de maneira diferenciada. Então ele falou: “Pô, Jeff, eu tô cagando fedido pra caramba”, [risos] aí o Jefferson falou pra ele: “Bom, eu acho que é a verdura e tal, né? Agora você tá começando… Você não foi um cara de comer verdura”, e aí o Rogério começou a gostar de comer uma granola… Um negócio com mais fibras…']",0.6346638543682862,0.8,0.25,0.49970429547761297,0.806744255687585
126,"No episódio 'setealém', o que aconteceu com o irmão de Mirela, Jeferson, quando ele seguiu pela avenida?","Quando o Jeferson seguiu pela avenida, ele sumiu da visão da Mirela e ela não sabia o que havia acontecido com ele. Depois de 40 dias, ele voltou.","Ele pegou um ônibus e foi parar em outro lugar, onde foi dito para ele que nunca mais voltasse.","['Ah, gente, não consigo… Não sei, mas enfim… — Se você jogar… Eu fiz isso, eu joguei “Setealém” no Google, tem relatos, tem histórias, tem até gente tentando ligar Setealém a Bíblia, mas não me convenceu. Apesar de eu ter passado por isso, eu botei na conta mais do estresse mesmo e de tudo que eu estava vivendo na época… E pode ser que também o Jeferson estivesse numa fase ruim, mas e a Mirela que foi pra lá e foi avisada que não era pra ela continuar? E deu um aviso pro irmão que não era pra ele continuar e ele continuou aí ele ficou perdido e voltou 40 dias depois? — Não sei, gente… Ele pode ter tido uma coisa e ter… Esses dias mesmo eu vi um senhor… De novo aqui, [risos] no Cidade Alerta, que ele trabalha numa universidade, acho que na USP, um senhor, gente… E ele deixou a esposa e a filha no trabalho e seguiu de carro para o trabalho, só que ele não chegou no trabalho… E aí acharam o carro dele incendiado. O que você pensa? “'
 'E quando a pessoa falou: “Por favor, volta” a Mirela ficou na dúvida, porque o irmão dela estava seguindo. Era o bairro dela, era a praça dela, mas tava tudo muito velho, muito em ruínas. E aí ela ficou com um pouco de medo porque o irmão dela sumiu da visão dela, e aí ela olhou para essa mulher, essa mulher parecia humana, mas ela tinha algo nela que era estranho e ela ficou com mais medo ainda e ela voltou… No que ela virou de costas para voltar, ela já conseguia ver o outro lado da rua… Pra frente ela olhava em ruínas e, para trás, para onde ela tinha que voltar, ela via tudo normal. Então, ela começou a voltar pro lado que era tudo normal e quando ela saiu da praça em ruínas que ela pisou na rua que estava normal, ela acordou. Ela acordou e viu que o Jeferson não estava na cama.'
 'Um tempo depois ele entrou pra igreja, conheceu uma moça, casou, teve filhos com a moça… E ai agora um tempo atrás, numa comunidade do Orkut, ele viu relatos parecidos com o relato dele e ele mostrou pra Mirela. E aí alguém nomeou, isso eu não entendi porque também não fui muito atrás, esse lugar onde ele esteve como “Setealém”. Então, o Jeferson… Tanto o Jeferson quanto a Mirella estiveram em Setealém, que seria uma outra dimensão do nosso próprio mundo e que existem por aí e pode ser que tenha na sua casa, no seu jardim, na sua rua, portais que podem te levar para Setealém. — Isso pode acontecer de várias formas, segundo a Mirela me explicou, assim, não tem um ritual, uma coisa que você faça que você vá parar em Setealém… Pode acontecer como aconteceu comigo, você está andando na rua e, de repente, tudo mudou… Você continua naquela rua, mas você já está em outra dimensão. Então, isso realmente aconteceu comigo, mas eu ainda acho que foi uma coisa da minha cabeça, de tudo que eu estava passando.'
 'Que ela estava num lugar, uma praça perto da casa dela, mas essa praça estava totalmente diferente. Ela estava em ruínas… E ela tentava atravessar essa praça — do outro lado da praça tinha a rua que dava para uma avenida — e ela via o Jeferson seguindo pela avenida e, conforme ela tentava alcançar o Jeferson, o Jeferson chamando a Mirela para ir, apareceu uma pessoa que ela não sabe quem é e falou para Mirela: “Mirela, volta… Daqui para frente é melhor você não seguir” e a Mirela falou: “Por quê?”, e aí essa pessoa, que era uma mulher, falou para ela assim: “Se você seguir o seu irmão, você não vai saber voltar. Ele está sabendo voltar, mas do jeito que ele está indo, ele também vai se perder e eu estou querendo te poupar disso. Então, por favor, volta”.']",0.0,0.6666666666666666,0.2222222222222222,0.46405983477656443,0.11601495869414111
127,"No episódio 'setealém', o que Mirela disse que aconteceu com ela quando ela sonhou e foi parar na praça em ruínas?","Quando Mirela sonhou, ela estava em uma praça perto da casa dela, mas essa praça estava em ruínas. Ela tentava atravessar essa praça e viu o Jeferson seguindo pela avenida. Uma pessoa desconhecida apareceu e disse para Mirela: ""Mirela, volta… Daqui para frente é melhor você não seguir"".","Ela sonhou que estava em uma praça em ruínas e um homem estranho aconselhou-a a voltar, caso contrário, ela não saberia mais voltar.","['Assinante 1: Oi, Déia, oi, Não Inviabilize, aqui é a Raquel que fala de Portugal. Olha, eu nunca chamaria isso de “SetealÉm”, mas uma vez eu tive um sonho em que eu fui parar numa cidade cheia de ruínas e lá tinha um monte de caras maus, fedendo, mal vestidos, com malícia no rosto, sabe? E aí eu estava vagando por essa cidade, subi no alto de um prédio, só vi ruínas, ruínas, estava me sentindo super perdida, até que veio um cara que falou assim: “Vai embora, aqui não é seu lugar”, e aí eu perguntava: “Mas como que eu vim parar aqui?”, aí ele falava: “Não interessa, só vai embora”, e aí eu acordei… E eu também tinha sonhado depois de estar muito estressada. [ risos] Não sei se Setealém existe ou não, mas eu acredito que não estamos sozinhos no mundo, acredito que tenham outras dimensões.'
 'É isso, essa é a história, esse foi o aviso que Mirela recebeu de “Não permaneça em Setealém. Vire as costas e não volte mais aqui” e, quando ela pisou na rua que estava normal, assim como eu, tudo desapareceu.'
 'E a Mirela ficou meio sem entender porque, assim, já estava quase na hora de dormir e ela ia trocar de roupa para sair com ele para ver esse lugar, mas ele falou que não precisava e eles foram dormir. Mirela sonhou… — Então, aqui a gente tá no campo do sonho, tá? — Que ela estava num lugar, uma praça perto da casa dela, mas essa praça estava totalmente diferente. Ela estava em ruínas… E ela tentava atravessar essa praça — do outro lado da praça tinha a rua que dava para uma avenida — e ela via o Jeferson seguindo pela avenida e, conforme ela tentava alcançar o Jeferson, o Jeferson chamando a Mirela para ir, apareceu uma pessoa que ela não sabe quem é e falou para Mirela: “Mirela, volta… Daqui para frente é melhor você não seguir” e a Mirela falou: “Por quê?”, e aí essa pessoa, que era uma mulher, falou para ela assim: “Se você seguir o seu irmão, você não vai saber voltar.'
 'Então, o Jeferson… Tanto o Jeferson quanto a Mirella estiveram em Setealém, que seria uma outra dimensão do nosso próprio mundo e que existem por aí e pode ser que tenha na sua casa, no seu jardim, na sua rua, portais que podem te levar para Setealém. — Isso pode acontecer de várias formas, segundo a Mirela me explicou, assim, não tem um ritual, uma coisa que você faça que você vá parar em Setealém… Pode acontecer como aconteceu comigo, você está andando na rua e, de repente, tudo mudou… Você continua naquela rua, mas você já está em outra dimensão. Então, isso realmente aconteceu comigo, mas eu ainda acho que foi uma coisa da minha cabeça, de tudo que eu estava passando. Não sei se aquela destruição toda de repente estava dentro de mim… Eu fui mais para um lado psicológico da coisa, não sobrenatural… —']",0.26991456701681865,1.0,0.46153846153846156,0.6367769769956706,0.6207327057873793
128,"No episódio 'setealém', o que Déia Freitas acredita que pode ter acontecido com o Jeferson e com ela mesma quando tiveram essas experiências estranhas?","Segundo Déia Freitas, ela acredita que Jeferson e ela mesma podem ter ido para uma outra dimensão do nosso próprio mundo, chamada Setealém, que pode ser acessada por portais em qualquer lugar, como em sua casa, jardim ou rua, e que pode acontecer de várias formas, sem um ritual específico.","Ela acredita que peuvent ter sido efeitos do estresse e da tristeza, e não uma outra dimensão.","['Um tempo depois ele entrou pra igreja, conheceu uma moça, casou, teve filhos com a moça… E ai agora um tempo atrás, numa comunidade do Orkut, ele viu relatos parecidos com o relato dele e ele mostrou pra Mirela. E aí alguém nomeou, isso eu não entendi porque também não fui muito atrás, esse lugar onde ele esteve como “Setealém”. Então, o Jeferson… Tanto o Jeferson quanto a Mirella estiveram em Setealém, que seria uma outra dimensão do nosso próprio mundo e que existem por aí e pode ser que tenha na sua casa, no seu jardim, na sua rua, portais que podem te levar para Setealém. — Isso pode acontecer de várias formas, segundo a Mirela me explicou, assim, não tem um ritual, uma coisa que você faça que você vá parar em Setealém… Pode acontecer como aconteceu comigo, você está andando na rua e, de repente, tudo mudou… Você continua naquela rua, mas você já está em outra dimensão. Então, isso realmente aconteceu comigo, mas eu ainda acho que foi uma coisa da minha cabeça, de tudo que eu estava passando.'
 'Mas, segundo a Mirela, que acredita, e o Jeferson — até virar uma pessoa da igreja — também acreditava, eles acreditam que eles estiveram em Setealém, que é o nosso próprio mundo, porém numa outra dimensão, que seria uma dimensão ruim. — Seria algo ruim, assim, não é nada bom… Então é isso, se eu tivesse continuado andando na rua da Liliane, eu ia desaparecer? Ah, gente, não consigo… Não sei, mas enfim… — Se você jogar… Eu fiz isso, eu joguei “Setealém” no Google, tem relatos, tem histórias, tem até gente tentando ligar Setealém a Bíblia, mas não me convenceu. Apesar de eu ter passado por isso, eu botei na conta mais do estresse mesmo e de tudo que eu estava vivendo na época… E pode ser que também o Jeferson estivesse numa fase ruim, mas e a Mirela que foi pra lá e foi avisada que não era pra ela continuar? E deu um aviso pro irmão que não era pra ele continuar e ele continuou aí ele ficou perdido e voltou 40 dias depois? —'
 'Déia Freitas: Comentem lá no nosso grupo do Telegram, sejam gentis com Mirela, com o Jefferson… — Mas eu ainda boto isso na conta de coisas que aconteceram, de fatos, assim… Não de algo sobrenatural, sabe? — Então, comentem lá, não sei se vocês conhecem esse Setealém. Eu fiquei conhecendo só agora, mesmo estando na internet a vida toda, nunca tinha ouvido falar de Setealém e é isso, se vocês tiverem outros relatos, quiserem me mandar para a gente fazer um “Especial Setealém”. Se você joga no Google, realmente tem muita coisa, então por que tanta coisa também, né? Então é isso, gente, Deus me livre… Ainda bem que eu voltei da rua da Liliane, porque eu não acredito, mas e se eu não tivesse voltado, já pensou?'
 'Então, o Jeferson… Tanto o Jeferson quanto a Mirella estiveram em Setealém, que seria uma outra dimensão do nosso próprio mundo e que existem por aí e pode ser que tenha na sua casa, no seu jardim, na sua rua, portais que podem te levar para Setealém. — Isso pode acontecer de várias formas, segundo a Mirela me explicou, assim, não tem um ritual, uma coisa que você faça que você vá parar em Setealém… Pode acontecer como aconteceu comigo, você está andando na rua e, de repente, tudo mudou… Você continua naquela rua, mas você já está em outra dimensão. Então, isso realmente aconteceu comigo, mas eu ainda acho que foi uma coisa da minha cabeça, de tudo que eu estava passando. Não sei se aquela destruição toda de repente estava dentro de mim… Eu fui mais para um lado psicológico da coisa, não sobrenatural… —']",0.49561320427020766,1.0,0.2,0.5255687421570862,0.13139218553927154
129,"No episódio 'aplicativo de namoro', quem foi a pessoa que o Mário conheceu no aplicativo de namoro?",A pessoa que o Mário conheceu no aplicativo de namoro foi a Milena.,Um cara que criou um perfil falso de uma mulher chamada Milena,"['O Mário conheceu a Milena num aplicativo de namoro, eles começaram a conversar. Conversaram por quatro meses sem se conhecer pessoalmente, até que resolveram marcar um jantar. — Não acho que comer é a primeira coisa que a gente deve marcar, sei lá, um café eu acho melhor do que um jantar, mas eles marcaram um jantar num restaurante conhecido. Eu sempre fico nervosa com essa coisa de primeiro encontro, o que falar, o que conversar. Acho muito complicado. —'
 'Ele falou para Mário que aquele perfil do aplicativo de relacionamento lá de namoro não era de Milena nenhuma, não existia Milena nenhuma. Tanto a que foi encontrar com ele, quanto a que fez o Facetime e que mandou mensagem de áudio, eram amigas dele que trabalhavam com ele na loja lá do shopping, a única verdade da história toda é que ele trabalhava no Shopping mesmo e que era ele que gostava do Mario, era ele que mandava mensagem pro Mário, era ele quem recebia os nudes do Mário [risos] e que pegava fotos aleatórias de nudes, de pornografia da internet e mandava para o Mário como se fosse da Milena. Olha a história… O Mário ficou completamente chocado. [ efeito sonoro de desaprovação] Se o Mário fosse como eu fosse e assistisse Catfish da MTV ele ia saber que isso é muito possível de acontecer, mas ele nunca assistiu Catfish…'
 'O Mário com uma sensação estranha, mas sem jeito de falar: “Olha, não foi legal o que você fez”. — Não foi nada legal, né, Milena? — E ficaram conversando ali um tempo, deu ali, sei lá, uma hora, uma hora e pouco, ela virou pra ele e falou: “bom, agora a gente já se conheceu, eu precisei ir embora” — Desse jeito… — “Foi legal te conhecer, tchau”, e deu um beijo no rosto dele e foi embora. Ai o Mário ficou sem entender nada, foi pegar o carro dele para ir embora que estava no estacionamento mais perto do shopping… E no caminho ele recebeu uma mensagem que, assim, era totalmente diferente da Milena pessoalmente. A mensagem falava assim: “amor, adorei te conhecer, estou louca pra te ver mais tarde”. ['
 'E ficaram conversando ali um tempo, deu ali, sei lá, uma hora, uma hora e pouco, ela virou pra ele e falou: “bom, agora a gente já se conheceu, eu precisei ir embora” — Desse jeito… — “Foi legal te conhecer, tchau”, e deu um beijo no rosto dele e foi embora. Ai o Mário ficou sem entender nada, foi pegar o carro dele para ir embora que estava no estacionamento mais perto do shopping… E no caminho ele recebeu uma mensagem que, assim, era totalmente diferente da Milena pessoalmente. A mensagem falava assim: “amor, adorei te conhecer, estou louca pra te ver mais tarde”. [ som de erro no Windows]']",0.35190663602738975,0.5,0.2,0.5446598638461233,0.7361649659615309
130,"No episódio 'aplicativo de namoro', por que a Milena não apareceu no encontro marcado no restaurante?","A Milena não apareceu no encontro marcado no restaurante porque ela não existia, era uma amiga do Mário que trabalhava com ele na loja do shopping que estava mandando mensagens e fazendo tudo para enganar o Mário.",Ela mandou uma mensagem dizendo que não quis ir ao encontro porque não gostou do local escolhido,"['O Mário conheceu a Milena num aplicativo de namoro, eles começaram a conversar. Conversaram por quatro meses sem se conhecer pessoalmente, até que resolveram marcar um jantar. — Não acho que comer é a primeira coisa que a gente deve marcar, sei lá, um café eu acho melhor do que um jantar, mas eles marcaram um jantar num restaurante conhecido. Eu sempre fico nervosa com essa coisa de primeiro encontro, o que falar, o que conversar. Acho muito complicado. —'
 'risos] — Oi? [ risos] Assim, já estava meio óbvio que o Mario deveria esquecer a Milena, né? Porque ele marcou, ela foi, ela podia até esperar ele lá e falar: “ah, não quero entrar aí, vamos tomar um café.” Sei lá, qualquer coisa, mas ela mandou mensagem escrota. Eu achei escrota.'
 'Ele falou para Mário que aquele perfil do aplicativo de relacionamento lá de namoro não era de Milena nenhuma, não existia Milena nenhuma. Tanto a que foi encontrar com ele, quanto a que fez o Facetime e que mandou mensagem de áudio, eram amigas dele que trabalhavam com ele na loja lá do shopping, a única verdade da história toda é que ele trabalhava no Shopping mesmo e que era ele que gostava do Mario, era ele que mandava mensagem pro Mário, era ele quem recebia os nudes do Mário [risos] e que pegava fotos aleatórias de nudes, de pornografia da internet e mandava para o Mário como se fosse da Milena. Olha a história… O Mário ficou completamente chocado. [ efeito sonoro de desaprovação] Se o Mário fosse como eu fosse e assistisse Catfish da MTV ele ia saber que isso é muito possível de acontecer, mas ele nunca assistiu Catfish…'
 'Porque ele marcou, ela foi, ela podia até esperar ele lá e falar: “ah, não quero entrar aí, vamos tomar um café.” Sei lá, qualquer coisa, mas ela mandou mensagem escrota. Eu achei escrota. Sei lá, né, Mario? — Já tava aí a dica… Mas o Mário achou que talvez Milena tivesse razão de ter ido embora, porque era uma cantina meio simples e tal — Ai, Mário… —']",0.4238279014891185,0.75,0.25,0.47309703098801886,0.30577425774700473
131,"No episódio 'aplicativo de namoro', o que o cara confessou ao Mário no final da história?","Ele confessou ao Mário que aquele perfil do aplicativo de relacionamento não era de Milena nenhuma, não existia Milena nenhuma.",Que ele era o responsável por criar o perfil falso e que Milena não existia,"['Ele falou para Mário que aquele perfil do aplicativo de relacionamento lá de namoro não era de Milena nenhuma, não existia Milena nenhuma. Tanto a que foi encontrar com ele, quanto a que fez o Facetime e que mandou mensagem de áudio, eram amigas dele que trabalhavam com ele na loja lá do shopping, a única verdade da história toda é que ele trabalhava no Shopping mesmo e que era ele que gostava do Mario, era ele que mandava mensagem pro Mário, era ele quem recebia os nudes do Mário [risos] e que pegava fotos aleatórias de nudes, de pornografia da internet e mandava para o Mário como se fosse da Milena. Olha a história… O Mário ficou completamente chocado. [ efeito sonoro de desaprovação] Se o Mário fosse como eu fosse e assistisse Catfish da MTV ele ia saber que isso é muito possível de acontecer, mas ele nunca assistiu Catfish…'
 'Então, no final a história nem é de Mario e Milena, porque Milena não existe. É de Mário e esse cara que eu nem vou dar nome, porque não merece, nós sabemos que aqui nas histórias as pessoas que são muito canalhas a gente não dá nome, e eu achei muita canalhice o que esse cara fez. Enganou o Mário… Que também se deixou enganar, né? Porque tinha várias pistas ali… Inclusive, quando ele estava lá no cinema, como que o cara, se fosse um cara aleatório só que foi dar um recado, como aquele cara sabia direitinho quem era ele e foi direto nele? Não ficou procurando… Então, sei lá, eu acho que ele teve vários indícios, o Mário, de que era uma roubada e não quis ver, quis acreditar no lúdico e[risos] — na fantasia — não rolou.'
 'Ai, ai… No caminho, o cara foi conversando com o Mário e tal, ele falando “mas eu estou meio bêbado, será que a irmã da Milena… Como vai ser? Ela não vai gostar, que não sei o que”, e o cara foi mudando o assunto, mudando o assunto e parou o carro em frente a uma padaria, falou: “bom, vou pegar uma água aqui pra mim, uma pra você que sei você tá muito bêbado, não sei o que”, entrou na padaria, pegou uma água e voltou… Quando ele voltou, [música de tensão] ele virou pro Mário e falou assim: “Então, Mário, tenho que te falar a real agora” [risos] e começou a falar… — Olha só o que ele falou para o Mario. —'
 'E o Mario começou a conversar com esse cara, inclusive perguntou pra esse cara quem era a Milena da foto e do Facetime, que não era a Milena que foi encontrar com ele, e aí o cara acabou falando para o Mário que era a irmã da Milena, e a Milena já tinha falado para ele que era a irmã, então ele só confirmou que ela usava o fake, mas que não era tão fake porque era a irmã dela e tal. E eles começaram a conversar assuntos do dia a dia, como se eles fossem amigos, mas eles não se conheciam tanto… — Quer dizer, não se conheciam nada, né, Mário? — Até que esse cara aí chamou o Mario pra jogar bola… — Gente, como que chegou até aí? Porque, assim, acho tudo muito bizarro. —']",0.367924847305725,1.0,0.25,0.6472091546791643,0.16180228866979107
132,"No episódio 'conciliação', quem é o convidado do episódio?","O convidado do episódio não foi mencionado explicitamente, mas podemos inferir que é Dona Josi, pois ela é mencionada várias vezes ao longo da conversa.",Hidrabene,"['Ele quer casar, ele continua fazendo o planejamento junto com a Talula do casamento, mas sem incluir o Leandro. E a Talula nem pra Dona Josi contou… — Eu penso assim: Se é uma coisa que você acha ok e que as pessoas vão achar ok, você comenta, né? A Talula não comentou isso com ninguém. Isso significa o quê? Que ela também acha que é um negócio é errado, né?'
 'Então, Dona Josi foi ajudando Talula a criar Leandro, morando juntas. Quando Leandro estava ali com seus nove anos de idade — e a Talula completando 30 anos —, ela conheceu um cara… Um cara super incrível, super querido, maravilhoso e eles começaram a namorar. O namoro era ótimo, esse cara gostava muito da dona Josi, esse cara estava muito bem com o Leandro e esse namoro ficou sério, eles já pensando em casamento e a Talula querendo casar, casar mesmo, no papel e ter uma cerimônia e nã nã nã…'
 'E o Leandro vai sacar na hora…' 'Pra mim é não.']",0.1152518981926184,1.0,0.4,0.041975558620366324,0.010493889655091581
133,"No episódio 'conciliação', qual é a idade do filho da Talula quando ela conhece o cara incrível?","O filho da Talula, Leandro, tinha 9 anos de idade quando ela conheceu o cara incrível.",9 anos,"['Então, Dona Josi foi ajudando Talula a criar Leandro, morando juntas. Quando Leandro estava ali com seus nove anos de idade — e a Talula completando 30 anos —, ela conheceu um cara… Um cara super incrível, super querido, maravilhoso e eles começaram a namorar. O namoro era ótimo, esse cara gostava muito da dona Josi, esse cara estava muito bem com o Leandro e esse namoro ficou sério, eles já pensando em casamento e a Talula querendo casar, casar mesmo, no papel e ter uma cerimônia e nã nã nã…'
 'E aí a Talula, com a ajuda da mãe, foi criando ali Leandro como mãe solo, mas tendo o apoio ali de sua mãe. — Que a gente pode chamar aqui de Dona Josi. — Então, Dona Josi foi ajudando Talula a criar Leandro, morando juntas. Quando Leandro estava ali com seus nove anos de idade — e a Talula completando 30 anos —, ela conheceu um cara… Um cara super incrível, super querido, maravilhoso e eles começaram a namorar. O namoro era ótimo, esse cara gostava muito da dona Josi, esse cara estava muito bem com o Leandro e esse namoro ficou sério, eles já pensando em casamento e a Talula querendo casar, casar mesmo, no papel e ter uma cerimônia e nã nã nã…'
 'A Talula, quando ela tinha ali seus 20 anos, ela engravidou — de um cara aí — e teve um bebezinho lindo. [ efeito sonoro de bebê chorando] — Que a gente vai chamar aqui de Leandro. — E aí a Talula, com a ajuda da mãe, foi criando ali Leandro como mãe solo, mas tendo o apoio ali de sua mãe. — Que a gente pode chamar aqui de Dona Josi. — Então, Dona Josi foi ajudando Talula a criar Leandro, morando juntas.'
 'A Talula ficou numas de tentar convencer o cara a aceitar o Leandro. — E, assim, gente, se você tem que convencer uma pessoa a aceitar o seu filho, o que você tem que fazer é se afastar dessa pessoa, né? Não tem essa de: “Ah, por favor, aceite meu filho”, a gente, nós como seres humanos, nós somos um combo, um pacote, então você vem ali com todo o seu histórico familiar, o seu trabalho, enfim, ninguém é isolado… E a Talula tem um filho, tem o Leandro. Então, assim, o Leandro faz parte da Talula, né? Não tem como você separar esse pacote.']",0.3027124523789953,1.0,0.16666666666666666,0.08432895811151922,0.5210822395278798
134,"No episódio 'conciliação', qual é a condição do cara para casar com a Talula?",A condição do cara para casar com a Talula é que ele não quer que o Leandro more com eles.,Não levar o Leandro para morar com eles,"['E aí a Talula tá nessa… O cara diz que quer casar com ela, mas quer começar uma família… Então, ou seja, ele não considera o Leandro família? E a Talula acha que isso pode mudar, que ele está um pouco resistente, mas que, sei lá, as coisas podem mudar… — Não vai mudar. Não vai mudar. —'
 'Você não faz, né? Você larga do cara. — E aí a Talula tá nessa… O cara diz que quer casar com ela, mas quer começar uma família… Então, ou seja, ele não considera o Leandro família? E a Talula acha que isso pode mudar, que ele está um pouco resistente, mas que, sei lá, as coisas podem mudar… — Não vai mudar. Não vai mudar. —'
 'Até que eles começaram a falar sério esse papo de casamento e o cara mandou a seguinte pra Talula: “Olha, Talula, eu te amo, te amo demais, gosto muito da Dona Josi, gosto muito do Leandro, mas se a gente for casar, eu gostaria de começar uma vida nós dois”. E a Talula não entendeu, falou: “Mas não vai ser nós dois? Ué… Nós dois. Nosso relacionamento é fechado, monogâmico, vai ser nosso dois”. Aí ele falou: “Não, eu não gostaria que você levasse o Leandro para morar com a gente”. —'
 'Então, quer dizer, você vai casar no papel com um cara que inicialmente não quer seu filho na casa e se ele depois falar: “Olha, eu não quero mesmo, não vai rolar”, o que você vai fazer, né? — A Talula diz que não vai deixar o filho dela para trás assim, mas ela não acredita ainda nessa possibilidade de rompimento total, ela acha que ela vai conseguir dar um jeito e o cara está irredutível.']",0.2660606225263497,1.0,0.3125,0.5589048890511754,0.8897262222627939
135,"No episódio 'zerados', quem se conheceram no Tinder em 2006?",A Jussara e o Rogério se conheceram no Tinder em 2006.,Jussara e Rogério,"['A Jussara ali em 2006 ela já usava o Tinder e pra ela era tudo muito divertido, assim, ela conheceu várias caras, deu vários matches e era sempre leve, divertido e nada sério. Ela não queria nada sério, estava ali, paquerava, ficava e vida que segue. Até que um dia, a Jussara deu match com o Rogério… Era um perfil que ela gostava, eles conversaram muito ali pela plataforma e decidiram marcar um encontro num sábado à noite. Era um final de mês e a Jussara estava totalmente sem dinheiro… Só que, entre ficar em casa e ir pra um encontro, ela falou: [efeito de voz fina] ” Ah, o Tinder sempre foi super divertido pra mim, eu vou nesse encontro”. E aí ela foi pra esse encontro só com os 10 reais da passagem… — Então ela tinha dinheiro pra ir de ônibus e voltar e mais nada… [risos] Olha que loucura… —'
 'E hoje eu vou contar pra vocês [risos] uma história muito engraçada da Jussara e do Rogério. Eles se conheceram no Tinder quando eles estavam praticamente sem grana nenhuma. [ risos] Ê, Jussara, ê, Rogério… [risos] Então vamos lá, vamos de história.'
 'risos] E, apesar de toda a pobreza, os dois zerados aí no primeiro encontro, deu tudo certo e eles se curtiram bastante. E aí eles começaram a se ver todo final de semana… E como a faculdade do Rogério era no caminho da casa da Jussara, eles começaram a se ver também durante a semana. Ele passava lá pra dar um beijo nela e tal e Jussara já estava perdidamente apaixonada, né?'
 'risos] — E quando a Jussara foi vendo que eles estavam indo pra uma rua escura, ela falou: “Pronto, agora eu vou ser morta, né?”, mas não, ele tinha parado longe no valão porque não tinha dinheiro pro flanelinha. [ risos] E, apesar de toda a pobreza, os dois zerados aí no primeiro encontro, deu tudo certo e eles se curtiram bastante. E aí eles começaram a se ver todo final de semana… E como a faculdade do Rogério era no caminho da casa da Jussara, eles começaram a se ver também durante a semana. Ele passava lá pra dar um beijo nela e tal e Jussara já estava perdidamente apaixonada, né?']",0.1545112990017961,1.0,0.26666666666666666,0.6378984231917786,0.9094746057979446
136,"No episódio 'zerados', o que Jussara e Rogério tinham em comum no primeiro encontro?",Ambos estavam em uma situação de pobreza financeira no primeiro encontro.,Estar sem dinheiro,"['risos] E, apesar de toda a pobreza, os dois zerados aí no primeiro encontro, deu tudo certo e eles se curtiram bastante. E aí eles começaram a se ver todo final de semana… E como a faculdade do Rogério era no caminho da casa da Jussara, eles começaram a se ver também durante a semana. Ele passava lá pra dar um beijo nela e tal e Jussara já estava perdidamente apaixonada, né?'
 'risos] — E quando a Jussara foi vendo que eles estavam indo pra uma rua escura, ela falou: “Pronto, agora eu vou ser morta, né?”, mas não, ele tinha parado longe no valão porque não tinha dinheiro pro flanelinha. [ risos] E, apesar de toda a pobreza, os dois zerados aí no primeiro encontro, deu tudo certo e eles se curtiram bastante. E aí eles começaram a se ver todo final de semana… E como a faculdade do Rogério era no caminho da casa da Jussara, eles começaram a se ver também durante a semana. Ele passava lá pra dar um beijo nela e tal e Jussara já estava perdidamente apaixonada, né?'
 'Zerados se tornou uma das minhas favoritas… Eu amei assim a história completa… O Rogério tendo consciência de que ele estando na condição financeira que ele estava, ele não poderia sustentar um relacionamento, porque ambas as partes precisam despender de algum valor pra poder sair, pra fazer qualquer coisa… A gente precisa de dinheiro. Então não seria justo isso ficar tudo nas costas de Jussara. Então, assim, já foi o oposto de qualquer outra história que a gente ouviu de homens forçando mulheres a serem ONG de macho. Como tudo coincidiu, eles ficando amigos, mantendo essa amizade, depois ele conquistando as coisinhas aos poucos… É uma história maravilhosa, que fique de inspiração pra todo mundo, pra saber que mesmo num mundo muito amargo, a gente também tem muito amor pra curtir, pra conhecer e pra desfrutar.'
 'E aí, na hora de ir embora, ele falou pra Jussara: “Eu te dou uma carona até o ponto de ônibus”. — Porque também não tinha combustível pra levar até em casa. [ risos] — E quando a Jussara foi vendo que eles estavam indo pra uma rua escura, ela falou: “Pronto, agora eu vou ser morta, né?”, mas não, ele tinha parado longe no valão porque não tinha dinheiro pro flanelinha. [ risos] E, apesar de toda a pobreza, os dois zerados aí no primeiro encontro, deu tudo certo e eles se curtiram bastante.']",0.018482892025734842,0.5,0.26666666666666666,0.37212905050405665,0.8430322626260142
137,"No episódio 'zerados', como terminou o relacionamento de Jussara e Rogério?",O relacionamento de Jussara e Rogério terminou em casamento.,Eles se casaram e estão muito felizes,"['Zerados se tornou uma das minhas favoritas… Eu amei assim a história completa… O Rogério tendo consciência de que ele estando na condição financeira que ele estava, ele não poderia sustentar um relacionamento, porque ambas as partes precisam despender de algum valor pra poder sair, pra fazer qualquer coisa… A gente precisa de dinheiro. Então não seria justo isso ficar tudo nas costas de Jussara. Então, assim, já foi o oposto de qualquer outra história que a gente ouviu de homens forçando mulheres a serem ONG de macho. Como tudo coincidiu, eles ficando amigos, mantendo essa amizade, depois ele conquistando as coisinhas aos poucos… É uma história maravilhosa, que fique de inspiração pra todo mundo, pra saber que mesmo num mundo muito amargo, a gente também tem muito amor pra curtir, pra conhecer e pra desfrutar.'
 'E aí a Jussara falou com o Rogério, as famílias se falaram e, de repente, “vamos casar”… — “Vamos casar sim”. — As famílias se juntaram, uma família deu uma festa de presente e a outra família deu a lua de mel e foi lindo… E eles se casaram. A Jussara disse que ela nunca imaginou que fosse evoluir assim a relação que começou lá atrás, depois virou uma amizade e agora eles estão casados e muito felizes… — E não estão mais zerados, né? [ risos] — E que bom que ela não perdeu a chance, né? — Porque se fosse eu, por exemplo, com 10 reais eu não ia no encontro.'
 'Então ficou combinado assim, quando desse se encontravam, ficavam, mas eles eram somente amigos. E assim foi por quatro anos… A Jussara conheceu outros caras, quase namorou sério com um… — Mas sabe, não tinha… Faltava alguma coisinha e aí não rolou. — Rogério foi levando a vida dele também… Até que, depois de quatro anos, o Rogério começou a trabalhar e ele acabou mudando um pouco os planos que ele tinha. — Isso nada a ver com Jussara, né? —'
 'Assinante 1: Olá, Não Inviabilizers, aqui é a Pâm de Campinas. E eu queria dizer aos haters de Amor nas Redes que num mundo de Picolé de Limão é sempre um aconchego receber uma história como essa. Zerados se tornou uma das minhas favoritas… Eu amei assim a história completa… O Rogério tendo consciência de que ele estando na condição financeira que ele estava, ele não poderia sustentar um relacionamento, porque ambas as partes precisam despender de algum valor pra poder sair, pra fazer qualquer coisa… A gente precisa de dinheiro. Então não seria justo isso ficar tudo nas costas de Jussara. Então, assim, já foi o oposto de qualquer outra história que a gente ouviu de homens forçando mulheres a serem ONG de macho.']",0.4457430845032155,1.0,0.3157894736842105,0.48997368539324826,0.6224934213483121
138,"No episódio 'panelas', quem é a personagem principal da história?",A personagem principal da história é Dona Marly.,Vanessa e dona Marly,"['E aqui nós temos que fazer uma parada para contar uma história paralela… Mais ou menos há uns oito meses, dona Marly estava um dia — era mais ou menos assim, uma hora da tarde, terminando de lavar a louça ali do almoço — quando alguém tocou a campainha… [efeito sonoro de campainha tocando] Quem tinha tocado a campainha? Um moço… Um moço muito comunicativo, muito alegre, assim, passava uma confiança, uma pessoa muito assim, incrível… E ele estava num carro e no carro tinha um outro rapaz dirigindo. E esse moço estava passando na rua vendendo panelas…Umas panelas realmente ótimas, né? E o preço do jogo de panelas? 120 reais.'
 'Eu vou deixar os links das redes sociais aqui na descrição do episódio, então vamos lá, usem a hashtag Escolha Jogar com Elas. E hoje eu vou contar para vocês a história da Vanessa. Então vamos lá, vamos de história.'
 'Então vamos lá, vamos de história.'
 'O Wellington é filho de Dona Celestina. — Falou: “Olha, não tá…”, “Quando ele chegar, você pede por favor para ele ir lá em casa que eu estou precisando de um favor dele?”. E aí, assim que o Wellington chegou ele foi lá na casa de dona Marly e dona Marly falou: “Você lembra aquelas imagens que você me deu num pen drive? Você pode me mostrar de novo? Pode ser no celular, em qualquer lugar… Você tem aquelas imagens?”.']",0.14153688487639549,0.0,0.25,0.592672063912891,0.6481680159782227
139,"No episódio 'panelas', o que aconteceu com a dona Marly quando ela comprou o jogo de panelas?","Quando dona Marly comprou o jogo de panelas, ela foi enganada por um golpe e cancelou o cartão de crédito para evitar mais problemas.",Ela caiu num golpe e perdeu 1200 reais,"['E esse moço estava passando na rua vendendo panelas…Umas panelas realmente ótimas, né? E o preço do jogo de panelas? 120 reais. E aí dona Marly olhou aquelas panelas, ele falando das panelas e passava a faca no fundo da panela e nada acontecia… E aquela panela maravilhosa, que não sei o que lá… Dona Marly se convenceu a comprar aí o jogo de panelas. Aí ela foi lá dentro, pegou o seu cartão de crédito — que ela mal usava mais, para algumas coisas, assim, mais caras ela usava — para comprar esse jogo de panelas aí de 120 reais.'
 '120 reais. E aí dona Marly olhou aquelas panelas, ele falando das panelas e passava a faca no fundo da panela e nada acontecia… E aquela panela maravilhosa, que não sei o que lá… Dona Marly se convenceu a comprar aí o jogo de panelas. Aí ela foi lá dentro, pegou o seu cartão de crédito — que ela mal usava mais, para algumas coisas, assim, mais caras ela usava — para comprar esse jogo de panelas aí de 120 reais.'
 'A dona Marly assustou e falou: “Não, eu comprei um jogo de panelas de 120 reais”. Então ela viu que ali ela tinha caído num golpe… Então, o que ela fez? Ela pediu para Vanessa levar as coisas no celular para imprimir no dia seguinte que ela ia ter que fazer B.O… Ela cancelou, elas já ligaram no cartão, já cancelaram o cartão, enfim… Mas não tinha mais limite também para usar, mas foi cancelado para pedir outro cartão, enfim… Fizeram tudo e, no dia seguinte, ela foi fazer o B.O.. Chegando na delegacia demorou, mas ela fez o B.O. e o investigador que atendeu ela ali, o escrivão falou pra ela assim: “A senhora não tem câmera em casa, não tem nenhum vizinho que tem as imagens e tal? Que já ajuda a gente mais”. E ela falou: “Minha vizinha tem… Vou falar com Dona Celestina pra ver se eu consigo as imagens”.'
 'Olha que beleza… — E aí ele falou que mandava o comprovante para ela, pegou ali o WhatsApp dela porque ele fez tudo pelo celular, era uma maquininha conectada ao celular, que não sei o que e ele ia mandar o comprovante e nã nã nã, entregou as panelas, entrou no carro e foi embora… Dona Marly pegou as panelas e entrou… Era realmente um jogo de panelas bom, né? E ela ficou cismada, falou: “Por que será que o meu cartão não passou antes? Será que não tinha mais limite? Será que aconteceu alguma coisa?” e ela resolveu esperar aí Vanessinha chegar para pedir para a Vanessinha olhar no computador o extrato lá e tal.']",0.19997742831392562,1.0,0.4,0.3829041272603828,0.0957260318150957
140,"No episódio 'panelas', quem era o namorado da Vanessa e o que ele fazia?","O namorado da Vanessa era o dj que ela conheceu em uma festa na universidade e que mais tarde se revelou ser o ladrão que roubou a mãe dela, Dona Marly.","O dj, que era um bandido que roubava senhoras usando o golpe da panela","['Ela foi lá na papelaria, comprou um pendrive, deu para o Wellington e levou esse pendrive lá na delegacia para anexar lá nas coisas… E tinha morrido aí… Ninguém na polícia procurou ela… Nada foi, assim, feito… Pelo menos não que tivesse chegado em dona Marly. Acontece que o rapaz comunicativo e que deu o golpe em Dona Marly, era nada mais nada menos que o ficante, agora namorado de Vanessa. Sim, ele deu o golpe na dona Marly e não lembrou nem da casa e nem da dona Marly, porque provavelmente ele já tinha dado muitos outros golpes, né? Dona Marly estava incrédula e revoltada… Como assim o bandidinho que tinha roubado ela estava namorando a filha dela? E ela ficou muito, muito, muito puta… E assim que a Vanessa chegou, ela contou tudo para Vanessa e mostrou o vídeo do zap… Ela nem mandou no WhatsApp da Vanessa, só mostrou porque falou: “Vai que ele pega o celular e, sei lá, mata minha filha, né?”'
 'A Vanessa é uma estudante universitária — do primeiro ano — e participando ali daquelas festas na universidade, ela conheceu um rapaz. Esse rapaz estava como dj ali daquela festa, tinha sido contratado ali — uma vaquinha — e ele estava de dj na festa. E aí eles trocaram telefone, começaram a conversar nã nã nã e a vida seguiu… Vanessa depois de mais ou menos um mês conversando com esse dj, ela resolveu conhecer ele melhor… — Marcar um encontro… Eles não tinham nem ficado nessa festa que o cara tava, né? — E aí marcaram um encontro, se entrosaram, deu certo e eles começaram a ficar… Não era um namoro sério, mas ele era um ficante fixo. Em casa, dona Marly, mãe de Vanessa, já estava começando a perguntar: “Filha, e esse rapaz aí?'
 'Mais um tempo se passou e não é que o dj ficante lá pediu Vanessinha em namoro? Vanessa aceitou e um romance começou… O cara tinha família que morava em outro estado, então ele estava ali, ele morava com outros rapazes, uns caras mais velhos e tal e era tipo uma república. Então, a Vanessa nunca ia lá… — Porque ela não se sentia bem, né? Numa casa só de homens e tal. — E ela resolveu apresentar esse rapaz aí para dona Marly.'
 'E aí falou: “Olha, você está namorando um bandido, não sei o que lá, enfim…”. E aí a Vanessa também ficou totalmente chocada com a história e sem acreditar que ela estava namorando, tipo, o cara que roubou a mãe dela. Por esse cara ter dinheiro, a Vanessa achou que era por causa do trabalho de dj, assim… Porque ele sempre tava fazendo festa e tal e achou que ele tinha dinheiro daí. Lá na casa da Vanessa, por exemplo, ele já estava indo e às vezes ele estava deixando coisa com a Vanessa… Então, ele tinha deixado com a Vanessa fechadinho, um tênis que custava 700 reais, outro tênis que custava 1.000 reais e um agasalho daqueles… —Não vou falar marca aqui. — Mas que também custava uns 600 reais.']",0.4072411249114858,1.0,0.2,0.5716388310485896,0.6429097077621474
141,"No episódio 'contrabandistas', quem são as três mulheres que se conheceram no hospital?","As três mulheres que se conheceram no hospital são a narradora, Lívia e Adriana.","Leila, Lívia e Adriana","['hospital. Então a gente criou grupo e nos falávamos todos os dias. Então a gente virou ali as três amigas do hospital, né? Era muito engraçado, né? Porque eu e a Lívia, no caso, ficamos conhecidas como “as contrabandistas de comida mexicana”.'
 'Então a gente virou ali as três amigas do hospital, né? Era muito engraçado, né? Porque eu e a Lívia, no caso, ficamos conhecidas como “as contrabandistas de comida mexicana”. Foi, inclusive, através dessa história que a Adriana ficou conhecendo, sabendo da nossa existência.'
 'Inclusive, elas já se encontraram depois que todas acabaram as internações. Elas já se encontraram num ambiente fora do hospital. Eu recebi a foto aqui, as três belíssimas, felizinhas, se encontrando fora do hospital. E a Leila termina o e-mail dela falando: [efeito de voz fina] “E hoje estamos as três vivas e aproveitando a vida”. É muito legal, né, gente?'
 'Ali na chegada, na entrada e ficar um pouco juntas. — A história da amizade delas e do contrabando de comida mexicana percorreu ali o hospital e as enfermeiras apresentaram ali, pelo WhatsApp, uma outra paciente que estava lá com o mesmo tipo de leucemia, a Adriana.']",0.2524898653307485,1.0,0.3125,0.540320428689417,
142,"No episódio 'contrabandistas', o que elas tinham em comum?",Elas tinham a mesma doença para tratar — em fases diferentes — e isso uniu ali as meninas.,Ela tinham o mesmo tipo de leucemia e estavam passando pelo tratamento oncológico,"['hospital. Então a gente criou grupo e nos falávamos todos os dias. Então a gente virou ali as três amigas do hospital, né? Era muito engraçado, né? Porque eu e a Lívia, no caso, ficamos conhecidas como “as contrabandistas de comida mexicana”.'
 'E aí a Adriana tinha tido também as mesmas intercorrências que elas, ali somada que Adriana teve algumas cirurgias também… E as três foram ficando amigas. Elas tinham a mesma doença para tratar — em fases diferentes — e isso uniu ali as meninas. E aí, numa outra internação da Leila, agora o contrabando de comida acontecia com a Adriana. [ risos] A Lívia já estava fora, né? — Então podia ser a pessoa mandando a comidinha. ['
 'Eu escolhi essa história pra esse mês agora de outubro, acho que tem tudo a ver também. E, poxa, as três ali num momento super complicado da vida encontraram forças pra se unir e uma ajudar a outra. — Olha, quero nem chorar aqui, viu? — E agora a gente vai ouvir essas três divas contrabandistas de comida mexicana [risos] e eu já volto.'
 'Então a gente virou ali as três amigas do hospital, né? Era muito engraçado, né? Porque eu e a Lívia, no caso, ficamos conhecidas como “as contrabandistas de comida mexicana”. Foi, inclusive, através dessa história que a Adriana ficou conhecendo, sabendo da nossa existência.']",0.06973940543512401,1.0,0.21052631578947367,0.5166799922064808,0.3791699980516202
143,"No episódio 'contrabandistas', o que elas fizeram juntas no hospital?","Elas fizeram contrabando de comida mexicana no hospital, marcaram consultas no mesmo dia para se verem fora do quarto e se tornaram amigas.","Ela criaram um grupo de WhatsApp e compartilhavam experiências, além de fazerem contrabando de comida mexicana no hospital","['hospital. Então a gente criou grupo e nos falávamos todos os dias. Então a gente virou ali as três amigas do hospital, né? Era muito engraçado, né? Porque eu e a Lívia, no caso, ficamos conhecidas como “as contrabandistas de comida mexicana”.'
 'Como as duas tinham o mesmo médico, às vezes elas enchiam o saco da equipe médica pedindo comida diferente, porque você está todo dia ali no hospital, comendo só aquela comida… E uma coisinha ou outra elas podiam comer de fora… — Mas, assim, não é a equipe médica que vai buscar e tal, né? — Então, elas começaram a fazer contrabando de comida mexicana no hospital. [ risos] — Amo… — Não era nada, assim, escondido, mas tipo as coisas vinham de fora dentro do que elas podiam comer. E a amizade de Leila e Lívia era tão grande que uma via o relatório da outra. — Sabe aquele relatório diário que sai e tal dos pacientes? —'
 'E aí elas começaram a marcar as consultas no mesmo dia ali no hospital para que elas conseguissem se ver fora do quarto, né? — Porque antes elas só se viam no quarto do hospital, agora elas conseguiram se ver no hospital. Ali na chegada, na entrada e ficar um pouco juntas. — A história da amizade delas e do contrabando de comida mexicana percorreu ali o hospital e as enfermeiras apresentaram ali, pelo WhatsApp, uma outra paciente que estava lá com o mesmo tipo de leucemia, a Adriana.'
 'Ali na chegada, na entrada e ficar um pouco juntas. — A história da amizade delas e do contrabando de comida mexicana percorreu ali o hospital e as enfermeiras apresentaram ali, pelo WhatsApp, uma outra paciente que estava lá com o mesmo tipo de leucemia, a Adriana.']",0.258131947125762,1.0,0.29411764705882354,0.7450745621805525,0.43626864054513814
144,"No episódio 'busca', quem é a personagem principal da história?",A personagem principal da história é a Veridiana.,Veridiana,"['Eu vou deixar o link aqui na descrição do episódio e fica com a gente que tem cupom de desconto aí. — E essa história eu quero que vocês prestem bastante atenção nos detalhes. Hoje eu vou contar para vocês a história da Veridiana. Então vamos lá, vamos de história.'
 'Quando ele viu o perfil, ele começou a chorar… Falou: “É ela mesma, ela mesmo… Ai meu Deus, você achou…” e começou a beijar a Veridiana, beijar a Veridiana… E daí pra frente ele não prestou mais atenção em nada, ele só queria ver ali o perfil. E aí passou um tempo, sei lá, umas duas semanas, eles não tocaram mais nesse assunto… — Porque até então era só um perfil. — A Veridiana falou: “Você quer que eu mande uma mensagem?”, ele falou: “Não, pode deixar que eu mesmo mando”. E aí passaram se ali duas semanas, ele não tocou mais no assunto….'
 'Eles queriam falar com a Veridiana. [ efeito sonoro de tensão]'
 'Um beijo.']",0.23064785331647517,1.0,0.36363636363636365,0.499745456679323,0.8749363641698308
145,"No episódio 'busca', o que o namorado da Veridiana procurava?",Ele procurava pela filha que havia sido engravidada há dez anos.,Uma filha que não existia,"['Ele era um cara muito triste, porque há dez anos ele procurava pela filha… E, nossa, essa história comoveu a Veridiana demais, demais… Porque tudo que ele falava, ele falava: “Eu não sei se a minha filha está comendo, eu não sei se a minha filha passa necessidade, não sei se é minha filha…”, tipo, eles saíam pra ir num parque, tava um vento gelado, ele falava: “Eu não sei se a minha filha está passando frio” e muitas vezes que ele falava isso, ele chorava… E aí a Veridiana foi se comovendo com aquela situação e com aquele cara tão sensível, tão incrível, que queria encontrar a filha e ela falou: “Por que você não bota um detetive e tal?”, ele nunca tinha pensado nisso de detetive, mas ficou por aquilo. E eles, depois de muita conversa, algumas ficadas, começaram a namorar. E o namoro sério, oficial…'
 'Mais duas semanas, deu um mês aí daquele jantarzinho e a Veridiana falou: “Poxa, ele não mandou mensagem? Será que ele tá com medo de perguntar?”. E aí ela, temendo ser invasiva, mas querendo ajudar, resolveu ela mandar uma mensagem para a moça, falando: “Oi, eu sou a Veridiana, eu namoro Fulano… Há dez anos vocês tiveram um relacionamento e você engravidou e o meu namorado ele procura demais por essa filha. Então, eu estou escrevendo para falar que a gente está aqui e tal, caso você queira esse contato e nã nã nã” e mandou essa mensagem no Facebook. — Então, assim, se a moça não acessava mais o Facebook, ia demorar pra ver. —'
 'Então, aniversário de 10 anos, aniversário de 11 anos… A Veridiana, depois de uns três anos de namoro, ela resolveu que, assim: “Poxa, tudo bem, não é a minha história, mas se eu posso ajudar, por que eu não vou ajudar?” e ela já tinha muitas informações da moça, né? Que tinha engravidado aí do namorado dela, um namoro sério, já estavam pensando em morar junto… E aí ela resolveu procurar essa moça de todas as formas… Então no Jusbrasil, no Facebook, jogou no Google, enfim, foi procurando, procurando, procurando… Até que ele encontrou uma moça com o mesmo nome e que batia todas as características e ela falou: “Bom, eu vou fazer um jantar e vou mostrar esse perfil pra ele, né? Será que é ela?”.'
 'E aí ela, temendo ser invasiva, mas querendo ajudar, resolveu ela mandar uma mensagem para a moça, falando: “Oi, eu sou a Veridiana, eu namoro Fulano… Há dez anos vocês tiveram um relacionamento e você engravidou e o meu namorado ele procura demais por essa filha. Então, eu estou escrevendo para falar que a gente está aqui e tal, caso você queira esse contato e nã nã nã” e mandou essa mensagem no Facebook. — Então, assim, se a moça não acessava mais o Facebook, ia demorar pra ver. — Dez minutos depois veio a resposta. Aí a resposta era: “Oi, Veridiana, tudo bem?']",0.023315068710537856,0.5,0.23076923076923078,0.5196798490390854,0.5049199622597713
146,"No episódio 'busca', por que o namorado da Veridiana foi preso?","O namorado da Veridiana foi preso porque era foragido e estava sendo procurado por causa de um processo criminal referente a outra mulher, e não por causa de uma ameaça. Ele já havia agredido a Natália e estava perseguindo ela.",Por um processo criminal contra uma outra mulher,"['A Veridiana ficou em choque… A polícia disse que ele tinha sido preso lá no Mato Grosso, porque ele foi atrás… Enquanto a polícia veio bater aqui na casa dele para ver se prendia ele aqui, ele estava já no Mato Grosso atrás da Natália…'
 'Estava foragido e ele foi preso por causa desse processo que era referente a uma outra mulher, a polícia não falou para Veridiana do que se tratava. — Mas eu penso que para ele ser capturado assim, e preso, é porque é algo grave. Se fosse só uma ameaça, sei lá, a polícia teria esse empenho? Não sei… Pode ser que tenha também, não sei… Mas eu penso para mim que era algo grave. —'
 'E acabou encontrando onde a Natália estava, inclusive onde ela trabalhava. Sobre o processo que ele tem, que agora nem é aberto, né? Estava foragido e ele foi preso por causa desse processo que era referente a uma outra mulher, a polícia não falou para Veridiana do que se tratava. — Mas eu penso que para ele ser capturado assim, e preso, é porque é algo grave. Se fosse só uma ameaça, sei lá, a polícia teria esse empenho?'
 'Esse cara perseguia a Natália… Já tinha agredido a Natália e tinha um processo criminal que não era contra a Natália, mas contra uma outra mulher em aberto. Ele era procurado… E a Natália mudou de estado justamente pra fugir desse cara. A Veridiana ficou em choque… A polícia disse que ele tinha sido preso lá no Mato Grosso, porque ele foi atrás… Enquanto a polícia veio bater aqui na casa dele para ver se prendia ele aqui, ele estava já no Mato Grosso atrás da Natália…']",0.28040917752400374,0.8,0.2857142857142857,0.5994909531992207,0.3641584525855195
147,"No episódio 'decoração', quem eram os principais personagens da história?",Os principais personagens da história são Kátia e Célio.,Kátia e Célio,"['E aí Kátia focou na roupa do Célio e, enfim… — Gente, tudo do jeito que eles queriam assim, pra ser o casamento perfeitinho ali que você só faz uma vez. Depois, se acontecer de divorciar, o segundo você já não faz assim com tanto esmero. [ risos] Não dá essa aprimorada toda. — Grande dia se aproximando, a Kátia e o Célio fazendo todos os pagamentos, né? Como eram esses pagamentos?'
 'Pra não deixar ali a Kátia e o Célio tensos durante a sessão de fotos. Então, quando acabou, ele fez a ligação e passou pra Kátia. As pessoas foram da igreja direto para o salão de festas, né? Enquanto Kátia e Célio estavam lá na sessão de fotos, as pessoas já estavam na festa. Acontece que, eles chegaram no salão, o salão tinha sido pago diretamente pela Kátia, que foi uma das coisas assim que ela pagou, mas a decoração de tudo e a comida, o cardápio, ela pagou pra amiga… Chegou lá, o salão não tinha nada.'
 'Então vamos lá, vamos de história.'
 'Dali eles foram pra tipo um parque tirar umas fotos e depois já ir pra festa. E nem o Célio e nem a Kátia estavam com celular, né? Eles não estavam ali com o celular, estavam tirando as fotos e vivendo aquele momento ali das fotos. Quando foi determinada parte da sessão de fotos, o telefone do fotógrafo tocou… Ele atendeu, falou rapidamente ali e seguiu com as fotos. Kátia pensou: “Sei lá, alguém da família dele ou amigo dele ligou e ele falou rapidinho que não podia falar, conversou tipo dois minutos e desligou”.']",0.13318387500073595,1.0,0.25,0.6241624776873536,0.9060406194218384
148,"No episódio 'decoração', o que foi decidido pela Kátia e pelo Célio em relação ao casamento?","No episódio ""decoração"", foi decidido que o casamento seria planejado para após a pandemia, com um churrasco, mas com uma área mais formal, com pratos servidos e decoração mais elaborada, com flores, arranjos de mesa e música ao vivo, e a Kátia escolheu os detalhes da decoração, como o tipo de flor, a cor das toalhas e das flores, com a ajuda de uma amiga que trabalha no ramo de casamentos.",Um meio termo entre informalidade e formalidade,"['E aí o Célio falou: “Bom, tudo bem, agora na pandemia a gente não consegue, mas vamos planejar para fazer esse casamento então pós pandemia”. Então eles passaram ali aqueles dois anos meio que planejando as coisas que eles queriam no casamento. Então, o Célio só fazia questão que tivesse alguma carne, mas que tivesse um churrasco… Mas a Kátia falou: “Mas eu não quero aquela informalidade do churrasco”. Ele falou: “Não, pode ter uma área…”, como se fosse um rodízio assim, tem os pratos, é servidos os pratos, mas tem ali um churrasco. Ele queria isso aí, queria ter o churrasco.'
 'Só que Kátia ela sempre teve o sonho de casar. — Kátia queria aí se casar. — E aí o Célio falou: “Bom, tudo bem, agora na pandemia a gente não consegue, mas vamos planejar para fazer esse casamento então pós pandemia”. Então eles passaram ali aqueles dois anos meio que planejando as coisas que eles queriam no casamento. Então, o Célio só fazia questão que tivesse alguma carne, mas que tivesse um churrasco… Mas a Kátia falou: “Mas eu não quero aquela informalidade do churrasco”.'
 'A Kátia queria a coisa mais formal, de ter os pratos, de ter os arranjos de mesa, que as pessoas fossem bem arrumadas e nã nã nã… Mandar os convites, falar no convite qual o traje, essas coisas… Então eles foram conversando e chegaram ali num meio termo do que eles queriam para agradar os dois. Oo Célio queria que fosse música ao vivo, enfim… E tudo isso tem um custo, né? E aí a Kátia foi levantando os custos e também perguntando para as amigas, vendo as experiências ali das pessoas e nã nã nã.. Uma amiga da Kátia falou pra ela assim: “Amiga, eu estou nesse ramo agora de casamento, eu posso ver tudo pra você… Te mandar tudo, te mandar orçamento e nã nã nã” e elas começaram a ver juntas isso, porque pra Kátia era uma vantagem, ter uma amiga que ela conhecia bem cuidando das coisas pra ela.'
 'Então, a Kátia escolheu o tipo de flor dos arranjos, a cor das toalhas, a cor das flores, dos arranjos, toda a decoração. A decoração da igreja seria feita por uma pessoa que a Kátia já queria, que era uma moça especialista nisso. E a moça especialista nisso, que faz as flores da igreja, podia também fazer os arranjos da festa. Só que aí, como tinha essa amiga da Kátia, ficou que a moça só ia fazer só as flores da igreja. Então tudo foi combinado… O cardápio que ia ser servido, a banda que ia tocar, as flores, a decoração… Tudo quem decidiu e ajudou a decidir foi a amiga da Kátia, mas a Kátia sempre dando a palavra final.']",0.431210232311739,1.0,0.2,0.31569866182686,0.18606752259957215
149,"No episódio 'decoração', o que aconteceu no dia do casamento em relação à festa?","No dia do casamento, não teve festa, não teve nada. Eles voltaram pra casa, todo mundo muito triste, muito frustrado, chorando.",A festa não ocorreu,"['Mas a Kátia, a última coisa que ela ficou responsável ali no dia do casamento dela, foi ficar atendendo ligação de celular, entendeu? Então passou batido isso… Porque ela tinha uma pessoa que era amiga dela de confiança cuidando, né? E aí o Célio quis fazer um boletim de ocorrência. Não teve festa, não teve nada… Dali eles voltaram pra casa, todo mundo muito triste, muito frustrado, chorando. — Péssimo, gente… Péssimo mesmo, porque foi uma coisa cara e que a festa não aconteceu. —'
 'Porque eles acabaram tendo uma festa de casamento bem depois, né? Mas com todo mundo que tinha ido. O engraçado foi isso, que todo mundo foi realmente nessa festa dois, na festa que realmente existiu. E, no dia, eles tinham sido enganados que eles iam participar do batismo do filho de uma outra amiga da Kátia que ainda não foi batizado, né? Então ela falou para a Kátia: “Olha, a gente combinou, as pessoas que vão no batismo, que as mulheres fossem de branco e os homens fossem de camisa e tal, social, mais arrumado”.'
 'Tudo certinho… Kátia tendo essa amiga para fazer todas as coisas da festa, focou ali no seu vestido, a roupa das madrinhas… Então foi escolhida uma cor para as madrinhas, mas o vestido elas escolheriam, ne? O vestido que elas quisessem.'
 'Então, a Kátia escolheu o tipo de flor dos arranjos, a cor das toalhas, a cor das flores, dos arranjos, toda a decoração. A decoração da igreja seria feita por uma pessoa que a Kátia já queria, que era uma moça especialista nisso. E a moça especialista nisso, que faz as flores da igreja, podia também fazer os arranjos da festa. Só que aí, como tinha essa amiga da Kátia, ficou que a moça só ia fazer só as flores da igreja. Então tudo foi combinado… O cardápio que ia ser servido, a banda que ia tocar, as flores, a decoração… Tudo quem decidiu e ajudou a decidir foi a amiga da Kátia, mas a Kátia sempre dando a palavra final.']",0.15950914134039876,1.0,0.2777777777777778,0.5210326325533565,0.38025815813833913
150,"No episódio 'a chefe', quem é a personagem principal da história?",A personagem principal da história é a Fabiane.,A Fabiane,"['ela liga na empresa do terceirizado e pede para substituir ou mandar embora.'
 'Déia Freitas: Então essa é a história da Fabiane. Que bom, né? Que essa chefe, de uma forma ou de outra, acabou saindo de lá. E, gente, eu falo para Fabiane e falo para vocês que: você não está maluca. Mesmo que você tenha um chefe ou uma chefe que tente te provar ao contrário, por você sentir o que você sente, por você se posicionar, você não está maluca.'
 'E essa chefe não estava lá — No dia. — e não assinou. E como era uma coisa que, assim, os animais eles precisavam daquela ração, senão eles iam começar a passar fome, a Fabiane peitou essa chefe… Aconteceu ali um bate-boca entre elas.'
 'E como era uma coisa que, assim, os animais eles precisavam daquela ração, senão eles iam começar a passar fome, a Fabiane peitou essa chefe… Aconteceu ali um bate-boca entre elas.']",0.23783019690062548,1.0,0.4,0.6184805416604665,0.9046201354151167
151,"No episódio 'a chefe', o que a chefe fazia com os funcionários terceirizados?","A chefe fazia coisas como mandar os funcionários terceirizados fazer supermercado para ela, buscar a filha dela na escola, passear com o cachorro, e outras funções que não tinham a ver com o que aquela pessoa foi contratada para fazer. Além disso, ela ameaçava os terceirizados, dizendo que se eles não faziam as coisas que ela queria, ela ligaria na empresa do terceirizado e pediria para substituir ou mandar embora.",Ameaçava-os e pedia para substituí-los ou demiti-los se não faziam o que ela queria,"['Então ela coloca os funcionários terceirizados para fazer supermercado para ela, pra buscar a filha dela na escola, pRA passear com o cachorro… Funções que não tem a ver com o que aquela pessoa foi contratada para fazer ali dentro, né? Só que essa empresa familiar é aquele tipo de empresa que é muito, muito, muito difícil mandar alguém efetivado embora. Então, ou você pede a conta ou eles tentam resolver… Então ela foi ficando e adquirindo cada vez mais poder ali dentro. — Essa chefe da Fabiane. — E como a Fabiane ela já tinha tido ali algumas rusgas, algumas questões… — Relativas a trabalho. —'
 'Então todo mundo tentava administrar ali os conflitos. — E essa chefe era tão péssima, que quando ela entrava de férias, tinha comemoração. Tanto os terceirizados quanto os efetivados eles faziam uma festa. — Quando ela saía de férias, para a gente ver que tipo de pessoa, né? Pessoa boa… Só que não. —'
 'Só que também não demitia, ela não tinha… Por mais que ela fosse chefe e tivesse muito poder lá dentro, só quem demitia era o dono. E ninguém chegava no dono ali para pedir a demissão de ninguém. — Então todo mundo tentava administrar ali os conflitos. — E essa chefe era tão péssima, que quando ela entrava de férias, tinha comemoração. Tanto os terceirizados quanto os efetivados eles faziam uma festa. —'
 'ela ameaça os terceirizados. Então, se você não faz as coisas que ela quer, — Fora da sua tarefa, além da sua atividade de trabalho. — ela liga na empresa do terceirizado e pede para substituir ou mandar embora.']",0.1981584084679503,1.0,0.2857142857142857,0.4660419411063563,0.4915104852765891
152,"No episódio 'a chefe', qual foi o resultado final para a chefe tóxica?",O resultado final para a chefe tóxica foi a aposentadoria.,Ela foi aposentada,"['desde que a Fabiane tirasse aí o boletim de ameaça. Por fim, elas chegaram ali num acordo. A Fabiane foi até a delegacia falar o que tinha acontecido e sobre esse acordo, e a delegada falou: “Olha, tudo bem então, mas em todo caso você pode voltar e a gente dá sequência aí a sua queixa”. E a empresa resolveu fazer o quê? Aposentar essa chefe.'
 'A Fabiane continua tratando da depressão e depois que a chefe saiu, muita gente veio falar com ela, que não acreditava nas coisas que essa chefe falava… — Mas era todo mundo muito oprimido lá. — E o ambiente melhorou 100%, agora tá todo mundo mais vigilante, né? Começou alguém ali com algum comportamento meio padrão como era dessa chefe, o RH já é notificado e a coisa anda de outra forma.'
 'A Fabiane foi até a delegacia falar o que tinha acontecido e sobre esse acordo, e a delegada falou: “Olha, tudo bem então, mas em todo caso você pode voltar e a gente dá sequência aí a sua queixa”. E a empresa resolveu fazer o quê? Aposentar essa chefe. Então ela foi aposentada e melhorou para todo mundo. — Mas o que eu fico chateada é porque ela não teve nenhuma punição, né?'
 'Essa chefe quando viu que a Fabiane não ia recuar, aí ela mudou o tom… — Mudou o tom. — Foi até o RH disposta a retirar a queixa, — Que ela fez contra a Fabiane. — desde que a Fabiane tirasse aí o boletim de ameaça. Por fim, elas chegaram ali num acordo. A Fabiane foi até a delegacia falar o que tinha acontecido e sobre esse acordo, e a delegada falou: “Olha, tudo bem então, mas em todo caso você pode voltar e a gente dá sequência aí a sua queixa”.']",0.3136973884202203,1.0,0.2777777777777778,0.41574948622881014,0.8539373715572025
153,"No episódio 'balada', quem eram as duas primas que saíam para baladas?",As duas primas que saíam para baladas eram a Sandra e a Valéria.,Sandra e Valéria,"['A Sandra e a Valéria são primas — essa história tem bem uns 30 anos — e elas saíam pra baladinhas, bailinhos, festinhas, enfim… E, numa dessas saídas, a Valéria — prima da Sandra — conheceu um cara… — Que a gente vai chamar aqui de Breno. — E ela e o Breno começaram a namorar. — E, assim, a Sandra e a Valéria elas iam pra bailes com mais amigas. — Então meio que criou uma rotina do Breno, que tinha carro, buscar todas as amigas, aí ia todo mundo para os bailes e aí voltava todo mundo dos bailes no carro do Breno. E sempre foi assim… — E deu certo por uns seis meses… — Até que um dia era feriado — de primeiro de maio — e ia ter um baile à noite numa cidade aí, X, que era coladinha na cidade deles e a Valéria tinha combinado de ir com o Breno — porque ela era namorada do Breno — e as amigas.'
 'Déia Freitas: Então é isso, essa é a história da Valéria e da Sandra, as primas. Comentem lá no nosso grupo do Telegram, deixem suas mensagens. Se você ainda não tá no grupo, é só jogar na busca do Telegram “Não inviabilize” que o nosso grupo aparece. Um beijo, gente, e eu volto em breve.'
 'E, assim, a Sandra e a Valéria elas iam pra bailes com mais amigas. — Então meio que criou uma rotina do Breno, que tinha carro, buscar todas as amigas, aí ia todo mundo para os bailes e aí voltava todo mundo dos bailes no carro do Breno. E sempre foi assim… — E deu certo por uns seis meses… — Até que um dia era feriado — de primeiro de maio — e ia ter um baile à noite numa cidade aí, X, que era coladinha na cidade deles e a Valéria tinha combinado de ir com o Breno — porque ela era namorada do Breno — e as amigas.'
 'Só que a Valéria acordou estranha… [trilha de tensão] Valéria acordou estranha, não querendo ir nesse baile. A Sandra super empolgada pra ir, mas elas tinham um acordo, assim, elas eram muito novas — elas não tinham 18 anos ainda — então, as mães só deixavam que elas saíssem juntas. Então, se a Valéria não fosse, a Sandra, não podia ir. A Valéria estava muito estranha, muito estranha mesmo. E ela falou: “Poxa, não tô a fim de ir, não estou a fim de ir… E vou avisar o Breno que eu não quero ir”.']",0.017398074579506734,1.0,0.17647058823529413,0.5802756045482131,0.14506890113705329
154,"No episódio 'balada', o que aconteceu com o Breno após o baile?","O Breno morreu em um acidente de carro após o baile, quando uma carreta passou por cima do carro em que ele estava.",O Breno morreu em um acidente de carro junto com outras quatro pessoas,"['E aí ligou na casa do Breno, ninguém atendeu e ela ligou na casa de um amigo do Breno e aí ela ficou sabendo que o Breno foi no baile, resolveu dar carona pra umas amigas lá do baile, porque, né? Todo mundo morava na cidade vizinha… E, na volta do baile, uma carreta passou por cima do carro. As cinco pessoas que estavam no carro morreram na hora. [ efeito sonoro de tensão] E aí foi aquela loucura, aquela confusão e tal, o Breno ia ser enterrado de manhã, no dia seguinte. A Sandra não podia ir porque o trabalho dela era um inferno, enfim, ela não podia sair… A Valéria foi, estava completamente passada, assim…'
 'Só a Sandra via ele… E, quando ele percebeu que a Sandra conseguia vê-lo, aí que ele ficava mais desesperado porque, sei lá, será que ele queria falar alguma coisa? E depois de um tempo, uns sete, oito meses, isso cessou, e aí a Sandra nunca mais viu o Breno, nem sonhou com ele… Porque, uma época ela sonhou bastante com ele… E nada, assim, a coisa passou. Mas não é meio bizarro essa sensação que Valéria teve e não foi nesse baile? — Chocada. —'
 'Quando foi a noite, mais ou menos umas dez da noite, — daquele dia seguinte do baile — a Sandra estava no quintal, resolveu ir até ali o portão, a calçada… — Sabe quando você vai dar uma olhada no movimento na rua? — E, quando ela chegou no muro que dava pra a rua, assim, dava pra você ver a calçada e tudo, no que ela olhou assim do muro, ela viu o Breno todo ensanguentado, sentado na guia [efeito sonoro de tensão] ali da casa delas. E aí, na hora, a Sandra começou a gritar. [ efeito sonoro de mulher gritando] Sandra começou a gritar, gritar, gritar, “Socorro”, “Breno, Breno, o Breno está todo ensanguentado aqui”… Ele estava sentado na guia… — Sabe quando você senta meio que agachado, assim com as pernas dobradas? — E ela começou a gritar, todo mundo saiu, principalmente a Valéria, e aí todo mundo correu lá pra frente, no muro e não tinha ninguém…'
 'Que doideira, né? A Sandra viajou e tal”… Mas aí ela estava tão assustada, tão assustada, que a Valéria decidiu ligar pro Breno, pra casa do Breno. E aí ligou na casa do Breno, ninguém atendeu e ela ligou na casa de um amigo do Breno e aí ela ficou sabendo que o Breno foi no baile, resolveu dar carona pra umas amigas lá do baile, porque, né? Todo mundo morava na cidade vizinha… E, na volta do baile, uma carreta passou por cima do carro. As cinco pessoas que estavam no carro morreram na hora. [']",0.374243689349123,1.0,0.19047619047619047,0.8100357685743768,0.5025089421435942
155,"No episódio 'balada', por que o Breno aparecia apenas para a Sandra?","O Breno aparecia apenas para a Sandra porque ela era a única que o via, e quando ele percebeu que ela conseguia vê-lo, ele ficava mais desesperado, como se quisesse falar alguma coisa.","Ele não conseguia entrar em casa, mas estava tentando falar com a Sandra","['Não tinha motivo, ela estava ótima com o Breno, não tinha briga, não tinha nada e ela resolveu não ir. — E depois, por que o Breno ficava indo lá — na casa delas — que é no mesmo quintal as casas e só a Sandra via? Só a Sandra via ele… E, quando ele percebeu que a Sandra conseguia vê-lo, aí que ele ficava mais desesperado porque, sei lá, será que ele queria falar alguma coisa? E depois de um tempo, uns sete, oito meses, isso cessou, e aí a Sandra nunca mais viu o Breno, nem sonhou com ele… Porque, uma época ela sonhou bastante com ele… E nada, assim, a coisa passou. Mas não é meio bizarro essa sensação que Valéria teve e não foi nesse baile? —'
 'Só a Sandra via ele… E, quando ele percebeu que a Sandra conseguia vê-lo, aí que ele ficava mais desesperado porque, sei lá, será que ele queria falar alguma coisa? E depois de um tempo, uns sete, oito meses, isso cessou, e aí a Sandra nunca mais viu o Breno, nem sonhou com ele… Porque, uma época ela sonhou bastante com ele… E nada, assim, a coisa passou. Mas não é meio bizarro essa sensação que Valéria teve e não foi nesse baile? — Chocada. —'
 'Primeira coisa: O que deu na Valéria? — Essa sensação e essa coisa de: “Não vou, não vou”. Não tinha motivo, ela estava ótima com o Breno, não tinha briga, não tinha nada e ela resolveu não ir. — E depois, por que o Breno ficava indo lá — na casa delas — que é no mesmo quintal as casas e só a Sandra via? Só a Sandra via ele… E, quando ele percebeu que a Sandra conseguia vê-lo, aí que ele ficava mais desesperado porque, sei lá, será que ele queria falar alguma coisa?'
 'risos] — Essa parte é meio engraçada, mas enfim… — Que ela achou que também estava vendo o Breno, mas aí era o irmão gêmeo do Breno. E tudo bem, Valéria foi para o velório e ficou mal, enfim… Só que Sandra… A Sandra ficou vendo o Breno ensanguentado e muito machucado durante um tempo ainda. Então, aí a mãe e a tia da Sandra mandaram rezar missa, foram ao cemitério acender vela, enfim, pra ver se o Breno encontrava um caminho, porque ele estava sempre muito assustado e sempre tentando falar com a Sandra.']",0.4698669286163701,1.0,0.21052631578947367,0.6885510812108928,0.4221377703027232
156,"No episódio 'filha', o que era o desejo das duas personagens principais quando decidiram adotar uma criança?","O desejo das duas personagens principais quando decidiram adotar uma criança era ter um filho delas, mas não engravidar.",Ter um filho delas mesma,"['A Fernanda e a Stephanie eram casadas há quatro anos já quando elas decidiram adotar uma criança. Então foi uma coisa muito bem pensada, né? As duas refletiram bastante… A Fernanda é que me escreve. E elas estavam muito empolgadas pra adotar uma criança. É um processo longo, né, você preenche vários questionários, aí fala o perfil da criança que você quer, se pode ser mais velha… Porque se for mais velha é mais fácil, esse tipo de coisa.'
 'As duas refletiram bastante… A Fernanda é que me escreve. E elas estavam muito empolgadas pra adotar uma criança. É um processo longo, né, você preenche vários questionários, aí fala o perfil da criança que você quer, se pode ser mais velha… Porque se for mais velha é mais fácil, esse tipo de coisa. E as duas sempre muito decididas, muito certas assim do que queriam, até que elas foram chamadas pra uma segunda entrevista, ainda não era pra ver nenhuma criança nada.'
 'E nessa segunda entrevista, a Fernanda deu uma titubeada assim, ela, sei lá, achou que não fosse o que ela queria mais, tipo, ter um filho. E elas já tinham concordado que nenhuma das duas queria engravidar, mas elas queriam ter um filho delas e o caminho então seria adoção. Mas nesse dia dessa segunda entrevista, a Fernanda deu uma bobeada assim, de talvez não querer, e aí ela conversou com a Stephanie, a Stephanie ficou muito chateada, a Stephanie queria muito adotar, e aí ficou aquele impasse, né? A Fernanda querendo desistir e a Stephanie querendo adotar, mas elas não mexeram no processo.'
 'Mas nesse dia dessa segunda entrevista, a Fernanda deu uma bobeada assim, de talvez não querer, e aí ela conversou com a Stephanie, a Stephanie ficou muito chateada, a Stephanie queria muito adotar, e aí ficou aquele impasse, né? A Fernanda querendo desistir e a Stephanie querendo adotar, mas elas não mexeram no processo.']",0.043311736958335866,0.5,0.26666666666666666,0.5044306114599113,0.6261076528649778
157,"No episódio 'filha', o que aconteceu na segunda entrevista que mudou a opinião de Fernanda sobre a adoção?","Na segunda entrevista, a Fernanda deu uma titubeada e disse que talvez não quisesse mais adotar, o que mudou sua opinião sobre a adoção e causou um impasse com a Stephanie.",Fernanda começou a ter dúvidas sobre a adoção,"['E nessa segunda entrevista, a Fernanda deu uma titubeada assim, ela, sei lá, achou que não fosse o que ela queria mais, tipo, ter um filho. E elas já tinham concordado que nenhuma das duas queria engravidar, mas elas queriam ter um filho delas e o caminho então seria adoção. Mas nesse dia dessa segunda entrevista, a Fernanda deu uma bobeada assim, de talvez não querer, e aí ela conversou com a Stephanie, a Stephanie ficou muito chateada, a Stephanie queria muito adotar, e aí ficou aquele impasse, né? A Fernanda querendo desistir e a Stephanie querendo adotar, mas elas não mexeram no processo.'
 'Mas nesse dia dessa segunda entrevista, a Fernanda deu uma bobeada assim, de talvez não querer, e aí ela conversou com a Stephanie, a Stephanie ficou muito chateada, a Stephanie queria muito adotar, e aí ficou aquele impasse, né? A Fernanda querendo desistir e a Stephanie querendo adotar, mas elas não mexeram no processo.'
 'As duas refletiram bastante… A Fernanda é que me escreve. E elas estavam muito empolgadas pra adotar uma criança. É um processo longo, né, você preenche vários questionários, aí fala o perfil da criança que você quer, se pode ser mais velha… Porque se for mais velha é mais fácil, esse tipo de coisa. E as duas sempre muito decididas, muito certas assim do que queriam, até que elas foram chamadas pra uma segunda entrevista, ainda não era pra ver nenhuma criança nada.'
 'Aí elas foram chamadas pra uma terceira entrevista dali 8 meses e que já tinha uma criança no perfil e a Fernanda surtou, Fernanda não quis mais, elas brigaram e elas terminaram nessa altura do processo. E aí a Fernanda nunca mais soube da Stephanie por dois anos, até que recentemente por causa da quarentena ela foi dar uma caçada no perfil da Stephanie e viu que a Stephanie tinha continuado com o processo de adoção, adotou uma menina e que tá super bem, tipo, ela e a menina. Ela é mãe solteira da menina que ela adotou.']",0.2989816861172804,0.6666666666666666,0.3076923076923077,0.7449605485519963,0.48624013713799913
158,"No episódio 'filha', o que Stephanie faz hoje em relação à criança que ela adotou?","Hoje em dia, Stephanie tem a guarda sozinha da criança que ela adotou e não abre mão de jeito nenhum de compartilhar a guarda com a Fernanda.",Ela é mãe solteira da menina que ela adotou,"['Agora ela não abre mão de jeito nenhum de ter a guarda sozinha da criança, tipo, ela falou: “A menina é minha filha, independente da gente voltar um dia a ser um casal de novo, ela jamais vai ser sua filha, ela vai ser a minha filha”. E aí agora, a Fernanda tá querendo a opinião da gente sobre como fazer pra convencer a Stephanie a aceitá-la de volta, uma coisa que a Stephanie já tá até meio amolecida assim, mas ela não quer de jeito nenhum que a Fernanda futuramente queira, sei lá, eu nem sei se isso pode também judicialmente, ela querer ser também mãe da criança.'
 'Mas a Stephanie já falou que não, que isso não vai acontecer independente de qualquer coisa e ela fica vendo as fotos da criança, elas já saíram as três, e a Fernanda chora que se arrependeu, que a menina, tipo, era para ser das duas e agora é só da Stephanie… E, ai, gente, eu não sei o que dizer porque eu faria a mesma coisa que a Stephanie fez, Fernanda, desculpa. Eu não compartilharia a guarda da minha filha, da criança que eu adotei sozinha e que é minha filha, eu não abriria mão por mulher nenhuma, por homem nenhum, por ninguém. Então eu acho que a Stephanie tá certa, geralmente as histórias que eu recebo aqui eu sempre, né, fico um pouquinho do lado da pessoa que escreveu, mas dessa vez eu concordo 100% com a Stephanie.'
 'Ela prosseguiu com o processo, teve que refazer toda uma parte pra ver se sozinha ela conseguia adotar a menina e ela conseguiu. A menina é uma menina de 6 anos, então isso tem dois anos, a menina tinha quatro na época, e ela é super feliz, é uma mãe ótima e a filha é dela… Eu acho, Fernanda, que você, sei lá, tem que voltar nesse relacionamento se você quisesse, a Stephanie também quiser, como madrasta mesmo porque “mãe” eu também não compartilharia a guarda não, de jeito nenhum, de jeito nenhum.'
 'A Fernanda e a Stephanie eram casadas há quatro anos já quando elas decidiram adotar uma criança. Então foi uma coisa muito bem pensada, né? As duas refletiram bastante… A Fernanda é que me escreve. E elas estavam muito empolgadas pra adotar uma criança. É um processo longo, né, você preenche vários questionários, aí fala o perfil da criança que você quer, se pode ser mais velha… Porque se for mais velha é mais fácil, esse tipo de coisa.']",0.3386762225289917,1.0,0.3333333333333333,0.4844703685197348,0.1211175921299337
159,"No episódio 'gerson', qual é o nome do convidado da Pantynova?",O nome do convidado da Pantynova é Gerson.,Pantynova,"['Lançamento. — Pantynova, tamo junto… Um beijo, gente, e eu volto em breve.'
 'efeito sonoro de crianças contentes] Quem tá aqui comigo hoje eu quero que vocês adivinhem… — Quem? Quem? Quem? Quem? — Pantynova, nossa amada, idolatrada, salve, salve, Pantynova… A Pantynova é uma marca de bem estar sexual que fala sobre o tema com leveza, humor e informação.'
 'Parabéns, Gerson. Um beijo.'
 'Valéria ficou excitadíssima esperando. [ risos] — E aí a hora que eles ligaram [efeito sonoro de telefone chamando] na recepção a moça atendeu, eles pediram as camisinhas e a moça falou: “Ué, mas de quarto vocês estão falando?”, aí vai: “Ah, estamos aqui no quarto 13”, “Não, mas o 13 está com o telefone quebrado”.[risos] “Estava, meu amor… Antes de conhecer Gerson”.']",0.40423875677751503,1.0,0.3333333333333333,0.5311129472646582,0.13277823681616455
160,"No episódio 'gerson', como era a personalidade do Gerson?","De acordo com o episódio, a personalidade do Gerson era simpática, divertida, e ele era muito habilidoso em tudo o que fazia. Além disso, ele também tinha um lado artístico, fazia pintura e escultura, e era bonitão, alto e charmoso.","divertido, simpático e habilidoso","['Ela ia passar um tempo ali no setor do Gerson e tal, foi apresentada, tinha mais gente trabalhando também. — Depois de um tempinho, a Valéria percebeu que o Gerson morava perto da casa dela, assim, passava pela casa dela… E o Gerson era muito simpático, assim, divertido, tinha uma personalidade que super se dava bem com a Valéria, assim, tirava as dúvidas da Valéria, estava sempre disposto a responder… — Tudo sem segunda intenção nenhuma. Valéria na época namorava, então era um colega. Gerson era um colega de trabalho ali 100%. — E aí, como Gerson passava mesmo pela casa de Valéria, ele começou a dar carona para Valéria. —'
 'E o Gerson ele era um cara de muita habilidade. Tudo o que ele fazia, segundo Valéria, ele era muito bom nas coisas, sabe? Que ele fazia.'
 'E, além de fazer as coisas na firma de uma maneira muito, assim, habilidosa, — acho que essa é a palavra — ele ainda fazia pintura, escultura, tinha todo um lado artístico em Gerson aí que Valéria curtia também. E agora que Valéria estava solteira, ela começou a ver o Gerson de uma outra forma… Ele era bonitão, alto, divertido, bem charmosão assim, com um papo ótimo… E Valéria pensou: “Hum, tem potencial, né?”, até que um dia eles estavam voltando do trabalho, né? E já estava quase perto dela descer, assim, do carro e o Gerson estava comentando de um bar que ele tinha ido que era muito legal e Valéria ali ouvindo… Ela nunca tinha ido nesse bar e tal e olhando ali pra Gerson. — Gente, mais um ano e meio, né?'
 'É Gerson, é natureza de Gerson. — E Valéria nesse ritmo… Dale, dale, dale, dale, pau, pau, pau…']",0.5756366994358075,1.0,0.26666666666666666,0.4064379737591382,0.47660949343978454
161,"No episódio 'gerson', o que Gerson fez quando o telefone do quarto do motel quebrou?",Gerson consertou o telefone do quarto do motel para pedir camisinha para comer Valéria.,Consertou o telefone para pedir camisinha para continuar transando com Valéria,"['e Gerson, de pau duro, consertou o telefone do quarto do motel pra pedir camisinha para comer Valéria. — Muito bem comido, com muita habilidade, ok? — Consegue imaginar a habilidade desse cara? De pau duro ali pronto para ação consertando o telefone? — Valéria ficou excitadíssima esperando. ['
 '. Não vou, né?”, e Gerson, de pau duro, consertou o telefone do quarto do motel pra pedir camisinha para comer Valéria. — Muito bem comido, com muita habilidade, ok? — Consegue imaginar a habilidade desse cara?'
 'Então, Gerson aí, o habilidoso, além de fazer a manutenção de Valéria, [risos] fez ali a manutenção do telefone do motel, né? Podia ganhar aí umas 50 camisinhas. [ risos] Valéria entrou aí nessa firma um pouco antes da pandemia — deixa eu fazer as contas aqui, é, talvez isso — e ela ainda sai com Gerson e agora eles estão pensando em assumir um relacionamento sério. — Eu assumiria e vocês? — Você tem que ter um pique, né, gente?'
 'O quarto 13 o telefone tava quebrado” e o Gerson: “É, não está mais”. [ risos] E aí a moça mandou as camisinhas ali para os dois fogosos.']",0.4523868151566586,1.0,0.2222222222222222,0.7000250291251184,0.47500625728127965
162,"No episódio 'hostel', o que o Rodrigo descobriu sobre a Angélica no Jardim Botânico de São Paulo?","O Rodrigo descobriu que a Angélica estava namorando o dono do hostel, e ele viu isso em fotos que os primos postaram em rede social, onde aparecia a Angélica com o dono do hostel no Jardim Botânico de São Paulo.",Angélica estava namorando o dono do hostel.,"['O Rodrigo chega no Jardim Botânico de São Paulo com os primos, e os primos, assim, eles mal conheceram a Angélica, então jamais reconheceriam, né? Viram só uma vez, então se passassem por ela nem saberiam. — Eu não vou nem fazer suspense quanto a isso, gente, porque não tem o que fazer. — Em uma canga estendida lá, porque assim, muita gente faz piquenique ali no Jardim Botânico e fica ali sentado, namorando. Quem estava namorando o dono do hostel, sentada numa canga com o cara com a cabeça no colo?'
 'A Angélica acabou que ela nem viu ele, ele se afastou, deu uma desculpa lá pros primos, acabou levando para um outro lugar e ele foi embora passado assim, com o coração partido e sem saber o que fazer. Na hora ele não teve coragem nem de falar com ela, nada… — Mas olha como são as coisas… — Os primos estavam enlouquecidos ali no Jardim Botânico, tirando foto, tira foto daqui, tira a foto dali e, em algumas fotos, quem tava na foto? O casalzinho, Angélica e o dono do hostel, o suíço lá. E calhou do Rodrigo ter acesso a essas fotos porque eles postaram em rede social e ele viu lá no fundinho… Só que assim, ele sabia que era Angélica, mas, sei lá, só alguém muito próximo da Angélica saberia. Então, ele tinha esse medo de alguém reconhecer a Angélica, mas também não falou pro primo dele tirar a foto de lá e nada.'
 'E tudo bem, Rodrigo estava muito, muito cismado, mas fazer o quê, né? Não tinha porque desconfiar da Angélica, de nada. Passou mais um dia… Dia vinte seis, dia vinte e sete à tarde, o Rodrigo tinha feito uma ponta programação com Angélica e ele tinha separado vários pontos turísticos que ela ainda não conhecia para levar, né? E aí tinha uns primos dele aqui, e ele falou: “bom, eu vou aproveitar esse roteiro, algumas coisas desse roteiro e vou levar meus primos, já tamo aqui mesmo… Eu já tinha me preparado para isso”. E um desses lugares era o Jardim Botânico de São Paulo, que é ali perto do zoológico, e é um lugar realmente muito bonito, romântico… E ele falou: “vou levar meus primos… Foda-se, né?'
 'O casalzinho, Angélica e o dono do hostel, o suíço lá. E calhou do Rodrigo ter acesso a essas fotos porque eles postaram em rede social e ele viu lá no fundinho… Só que assim, ele sabia que era Angélica, mas, sei lá, só alguém muito próximo da Angélica saberia. Então, ele tinha esse medo de alguém reconhecer a Angélica, mas também não falou pro primo dele tirar a foto de lá e nada.']",0.5541642371298136,0.6666666666666666,0.2222222222222222,0.8499249248149086,0.5874812312037272
163,"No episódio 'hostel', o que o Rodrigo resolveu fazer quando viu as fotos da Angélica com o dono do hostel?",Ele resolveu não fazer nada.,Ele salvou as fotos e as enviou para ela sem falar nada.,"['Ela não foi embora, ela mentiu ela ia embora e ela ficou no hostel com o dono do hostel. Gente, o mundo do Rodrigo caiu. Ele não sabe o que fazer, porque ele tava com os primos e os primos, obviamente, nem reconheceram a Angélica. E ele não sabia se ele fazia escândalo, se ele saía correndo, se ele chorava… E ele resolveu não fazer nada. — Ele não fez nada. —'
 'O casalzinho, Angélica e o dono do hostel, o suíço lá. E calhou do Rodrigo ter acesso a essas fotos porque eles postaram em rede social e ele viu lá no fundinho… Só que assim, ele sabia que era Angélica, mas, sei lá, só alguém muito próximo da Angélica saberia. Então, ele tinha esse medo de alguém reconhecer a Angélica, mas também não falou pro primo dele tirar a foto de lá e nada.'
 'Combina as coisas antes, não aparece sem avisar, porque a surpresa é uma coisa ingrata. — E o Rodrigo resolveu… Ele tinha marcado de pegar a Angélica lá no hostel às 10 da noite pra levar para casa dele, já ia estar perto da meia noite e família dele a ceia é realmente a meia noite e aí ela passa lá com eles.'
 'Quem estava namorando o dono do hostel, sentada numa canga com o cara com a cabeça no colo? Gente, a Angélica. Ela não foi embora, ela mentiu ela ia embora e ela ficou no hostel com o dono do hostel. Gente, o mundo do Rodrigo caiu. Ele não sabe o que fazer, porque ele tava com os primos e os primos, obviamente, nem reconheceram a Angélica.']",0.3782187655459563,1.0,0.3125,0.4943508825201811,0.12358772063004528
164,"No episódio 'hostel', o que a Angélica disse ao Rodrigo quando ele lhe enviou as fotos?",Não há informação suficiente no episódio.,Ela tentou reverter o jogo e disse que ele estava seguindo ela.,"['O casalzinho, Angélica e o dono do hostel, o suíço lá. E calhou do Rodrigo ter acesso a essas fotos porque eles postaram em rede social e ele viu lá no fundinho… Só que assim, ele sabia que era Angélica, mas, sei lá, só alguém muito próximo da Angélica saberia. Então, ele tinha esse medo de alguém reconhecer a Angélica, mas também não falou pro primo dele tirar a foto de lá e nada.'
 'A Angélica acabou que ela nem viu ele, ele se afastou, deu uma desculpa lá pros primos, acabou levando para um outro lugar e ele foi embora passado assim, com o coração partido e sem saber o que fazer. Na hora ele não teve coragem nem de falar com ela, nada… — Mas olha como são as coisas… — Os primos estavam enlouquecidos ali no Jardim Botânico, tirando foto, tira foto daqui, tira a foto dali e, em algumas fotos, quem tava na foto? O casalzinho, Angélica e o dono do hostel, o suíço lá. E calhou do Rodrigo ter acesso a essas fotos porque eles postaram em rede social e ele viu lá no fundinho… Só que assim, ele sabia que era Angélica, mas, sei lá, só alguém muito próximo da Angélica saberia. Então, ele tinha esse medo de alguém reconhecer a Angélica, mas também não falou pro primo dele tirar a foto de lá e nada.'
 'O Rodrigo foi lá buscar a Angélica no hostel pra levar de novo pra casa dele para almoçar, né? Pro almoço de Natal, com vários familiares. — É aquela cosia, a continuação da ceia. — Aí ele chegou lá… Você viu a Angélica? Nem o Rodrigo… A Angélica tinha sumido, não tava lá.'
 'Nem o Rodrigo… A Angélica tinha sumido, não tava lá. E ele ligava no celular, ligava no celular e nada dela atender. Chegou uma hora que só caía na caixa postal, e aí ele ficou um tempo lá no hostel e acabou perguntando pra alguém que estava lá, um funcionário lá do balcão, “cadê o dono daqui?” e “eu não sei onde tá”. E aí aquela pulga que estava atrás da orelha, já foi virando um carrapato gordo. —']",0.0,0.0,0.05555555555555555,0.4050290004285145,0.10125725010712862
165,"No episódio 'filha do meio', quem é a personagem central da história contada no episódio?",A personagem central da história contada no episódio é a filha do meio.,A Cida,"['E essa mais velha, principalmente, acha a filha do meio, a irmã dela, mau caráter real assim, cortou o contato da vida… Inclusive, não deixa nem os próprios filhos, que são os netos da Cida e sobrinhos dessa daí, chegar perto dessa moça aí. A família está mesmo rompida. Então, a Cida queria conselhos… Eu acho que a primeira coisa é terapia, né, Cida? Pra você se entender melhor e entender melhor a sua relação com essa filha, e com as outras duas também, enfim… Eu fico meio sem jeito de dar conselho assim, porque filho é filho…'
 'Então ela escreveu pra gente, porque ela queria conselhos de como lidar com essa filha… Que ela sabe que a filha só procura ela quando precisa de dinheiro, mas antes, sei lá, um tempo atrás, não era assim… Elas eram parceiras e tal, mas a filha mais velha acabou falando pra Cida que essa filha do meio sempre foi assim, é que a Cida nunca foi de olhar as contas direitinho, mas que ela sempre deu pequenos golpes dentro de casa.'
 'Então, assim que ele morreu, foi feito o inventário tudo certinho, cada filha recebeu ali o que que seria de herança do pai, né? E como elas eram menores, isso ficou numa conta delas para que elas pudessem sacar na maioridade e tudo certo. E aí cada filha deu um destino para o dinheiro. Uma filha investiu nos próprios estudos, a outra foi viajar, fez intercâmbio, enfim… — Gastou, assim, conhecendo outros países, estudou também fora, enfim… — E a outra gastou no que ela quis, assim, em balada, roupas caras, maquiagem e tal… Essa que gastou tudo em maquiagem, roupas e tal era a filha do meio e sempre foi a mais apegada a Cida. Então, as duas muito grudadas, muito unidas e a Cida sempre falando para ela: “Não gasta seu dinheiro assim, né?'
 'E aí essa filha do meio aí ela não respondia mais a mãe, né? A Cida ficou desesperada e avisou as outras duas filhas o que tinha acontecido. E aí a mais nova, que não mora no Brasil, conseguiu falar com essa filha do meio aí, com essa irmã dela e ela falou que ela tinha realmente usado o dinheiro da mãe para investir no próprio futuro, que ela estava com um namorado, que ninguém conhecia esse namorado e que esse namorado fazia uns investimentos, umas aplicações e ela foi morar com ele. E aí essa filha mais nova xingou ela de tudo quanto é nome, gritou… — Enfim, né? — A filha mais velha, por outro lado, foi atrás de saber onde era a casa desse cara e conseguiu encontrar a casa desse cara.']",0.2724564695022192,1.0,0.26666666666666666,0.3121344471230592,0.0780336117807648
166,"No episódio 'filha do meio', quem é o responsável pelo golpe contra a Cida?",O responsável pelo golpe contra a Cida é o namorado da filha do meio.,O namorado da filha do meio,"['risos] — Três meses se passaram e o cara realmente deu um golpe nessa filha do meio e sumiu com o dinheiro e botou ela para fora da casa dele ainda, né? — Porque foi ela que quis investir, né? — A Cida não aceitou essa filha de volta em casa, mas não por ela, pela pressão das outras duas filhas que disseram que, se ela aceitasse a menina de volta, as outras duas filhas iam romper com ela. Aí essa filha do meio foi morar com umas amigas, só que a Cida ajuda a bancar… E aí a Cida escreveu pra gente porque as outras duas filhas não… Nem desconfiam que ela que ela banca essa filha do meio e ela tinha dado um cartão e colocado… — Sabe quando você consegue ajustar o limite do cartão no aplicativo? Ela tinha conseguido aprender isso, a Cida… —'
 'Na cabeça dessa filha do meio, ela sabia que era um investimento arriscado, mas ela achava que ela ia conseguir devolver o dinheiro para a mãe em três meses… Que o namorado dela tinha dito que depois de três meses ela ia recuperar esse dinheiro. — Só que, gente, passou aí os três meses, né? [ risos] — Três meses se passaram e o cara realmente deu um golpe nessa filha do meio e sumiu com o dinheiro e botou ela para fora da casa dele ainda, né? — Porque foi ela que quis investir, né? — A Cida não aceitou essa filha de volta em casa, mas não por ela, pela pressão das outras duas filhas que disseram que, se ela aceitasse a menina de volta, as outras duas filhas iam romper com ela.'
 'E as filhas meio que sabiam que já ia dar nisso… Tanto que deu, né? Agora a Cida está sem as economias de uma vida toda e sem crédito na praça, porque sujou o nome dela, agora ela tem que parcelar para conseguir pagar e limpar o nome, né? Então ela escreveu pra gente, porque ela queria conselhos de como lidar com essa filha… Que ela sabe que a filha só procura ela quando precisa de dinheiro, mas antes, sei lá, um tempo atrás, não era assim… Elas eram parceiras e tal, mas a filha mais velha acabou falando pra Cida que essa filha do meio sempre foi assim, é que a Cida nunca foi de olhar as contas direitinho, mas que ela sempre deu pequenos golpes dentro de casa.'
 'Eu acho que a Cida tem que parar de passar a mão na cabeça dessa filha, mas como eu não sou mãe, eu fico meio assim de falar “faz isso, faz aquilo”. Mas também acho que ela tem que abrir o jogo para as outras duas filhas… Até porque eu acho que a Cida precisa sim de alguém falando “olha, não faz”, porque escondido ela faz, né? E as filhas meio que sabiam que já ia dar nisso… Tanto que deu, né? Agora a Cida está sem as economias de uma vida toda e sem crédito na praça, porque sujou o nome dela, agora ela tem que parcelar para conseguir pagar e limpar o nome, né? Então ela escreveu pra gente, porque ela queria conselhos de como lidar com essa filha… Que ela sabe que a filha só procura ela quando precisa de dinheiro, mas antes, sei lá, um tempo atrás, não era assim… Elas eram parceiras e tal, mas a filha mais velha acabou falando pra Cida que essa filha do meio sempre foi assim, é que a Cida nunca foi de olhar as contas direitinho, mas que ela sempre deu pequenos golpes dentro de casa.']",0.3036205089987271,1.0,0.2222222222222222,0.6846935549789832,0.9211733887447457
167,"No episódio 'filha do meio', qual é o conselho dado à Cida para lidar com sua filha do meio?","O conselho dado à Cida para lidar com sua filha do meio é parar de passar a mão na cabeça dela e abrir o jogo para as outras duas filhas, além de buscar terapia para se entender melhor e entender melhor a sua relação com a filha do meio e com as outras duas também.",Terapia,"['E as filhas meio que sabiam que já ia dar nisso… Tanto que deu, né? Agora a Cida está sem as economias de uma vida toda e sem crédito na praça, porque sujou o nome dela, agora ela tem que parcelar para conseguir pagar e limpar o nome, né? Então ela escreveu pra gente, porque ela queria conselhos de como lidar com essa filha… Que ela sabe que a filha só procura ela quando precisa de dinheiro, mas antes, sei lá, um tempo atrás, não era assim… Elas eram parceiras e tal, mas a filha mais velha acabou falando pra Cida que essa filha do meio sempre foi assim, é que a Cida nunca foi de olhar as contas direitinho, mas que ela sempre deu pequenos golpes dentro de casa.'
 'Então ela escreveu pra gente, porque ela queria conselhos de como lidar com essa filha… Que ela sabe que a filha só procura ela quando precisa de dinheiro, mas antes, sei lá, um tempo atrás, não era assim… Elas eram parceiras e tal, mas a filha mais velha acabou falando pra Cida que essa filha do meio sempre foi assim, é que a Cida nunca foi de olhar as contas direitinho, mas que ela sempre deu pequenos golpes dentro de casa.'
 'Eu acho que a Cida tem que parar de passar a mão na cabeça dessa filha, mas como eu não sou mãe, eu fico meio assim de falar “faz isso, faz aquilo”. Mas também acho que ela tem que abrir o jogo para as outras duas filhas… Até porque eu acho que a Cida precisa sim de alguém falando “olha, não faz”, porque escondido ela faz, né? E as filhas meio que sabiam que já ia dar nisso… Tanto que deu, né? Agora a Cida está sem as economias de uma vida toda e sem crédito na praça, porque sujou o nome dela, agora ela tem que parcelar para conseguir pagar e limpar o nome, né? Então ela escreveu pra gente, porque ela queria conselhos de como lidar com essa filha… Que ela sabe que a filha só procura ela quando precisa de dinheiro, mas antes, sei lá, um tempo atrás, não era assim… Elas eram parceiras e tal, mas a filha mais velha acabou falando pra Cida que essa filha do meio sempre foi assim, é que a Cida nunca foi de olhar as contas direitinho, mas que ela sempre deu pequenos golpes dentro de casa.'
 'E essa mais velha, principalmente, acha a filha do meio, a irmã dela, mau caráter real assim, cortou o contato da vida… Inclusive, não deixa nem os próprios filhos, que são os netos da Cida e sobrinhos dessa daí, chegar perto dessa moça aí. A família está mesmo rompida. Então, a Cida queria conselhos… Eu acho que a primeira coisa é terapia, né, Cida? Pra você se entender melhor e entender melhor a sua relação com essa filha, e com as outras duas também, enfim… Eu fico meio sem jeito de dar conselho assim, porque filho é filho…']",0.20294897167368045,1.0,0.38461538461538464,0.17877709712434325,0.2589799885668001
168,"No episódio 'paupel', quem foi o cara que cortou o dedo no papel?",Não há informação suficiente no episódio para saber quem foi o cara que cortou o dedo no papel.,O marido de Joelma,"['E ela deduziu isso… “Poxa, ele cortou o dedo no papel” e ela deu até uma risadinha. — Porque, né? Bem feito. [ risos] — E passou… Depois das crianças, ele já era um cara mais distante, inclusive, da Joelma e não era uma coisa assim que Joelma então fazia tanta questão. Então, eles tinham uma dinâmica de relacionamento, — de casal ali, homem e mulher — muito complicada.'
 'Assinante 1: Oi, Joelma, aqui é a Ludmilla de Brasília. E eu não costumo acreditar em karma, mas não tem como negar que nessa história o karma agiu, né? O cara tava todo errado… Errado por fazer você de empregada, errado por ser tão folgado, errado por privar as crianças do convívio com ele, errado por ter várias namoradas, por falar que era viúvo… Então eu acho que o corte no pau foi o Universo falando assim: “Colega, vamo dar uma pausa aí?”. Como que alguém negligencia uma infecção no próprio pau? Eu não consigo entender, de verdade.'
 'O cara tava todo errado… Errado por fazer você de empregada, errado por ser tão folgado, errado por privar as crianças do convívio com ele, errado por ter várias namoradas, por falar que era viúvo… Então eu acho que o corte no pau foi o Universo falando assim: “Colega, vamo dar uma pausa aí?”. Como que alguém negligencia uma infecção no próprio pau? Eu não consigo entender, de verdade. E me faz lembrar aquelas campanhas que tem, né? De pedir pros homens lavarem o pau.'
 'Assinante 2: Oi, Não Inviabilizers, meu nome é Renata. Eu já ouvi essa história do Paupel umas quatros vezes e eu sempre morro de rir com ela, porque eu fico imaginando porque esse cara não falou que prendeu o pau no zíper, porque esse cara não falou qualquer outra história… Mas ele teve que se humilhar contando esse lixo de pedido de casamento, [risos] ele teve que se humilhar, sabe? Mas que bom, né? Ela se livrou dele. E, assim, outra coisa também que eu fico muito curioso é saber como ele pediu a Joelma em casamento. [']",0.0,0.0,0.047619047619047616,0.4084567805894543,0.10211419514736357
169,"No episódio 'paupel', o que Joelma achou no escritório do marido?","Ela achou um papel escrito ""quer casar comigo?"" que o marido havia escrito para outra moça que ele estava namorando.",Uma folha de papel sulfite com sangue,"['E a Joelma tirava o lixo lá do escritório, mas não ia mexer no lixo, né? Enfim… — Se não ela tinha achado ali o papel escrito “quer casar comigo?” — e ele tinha escrito isso pra uma moça que estava namorando, porque sim, ele falava aí para essa moça que ele era um viúvo… — Um viúvo com dois filhos. Ó que belezinha, pobre viúvo. E a Joelma lá, viva e cuidando desse traste. —'
 'Bom, a Joelma conheceu um cara aí, se apaixonou e casou com esse cara. [ efeito sonoro de sino de igreja] E tudo ia super bem, até que eles tiveram dois filhos e o cara ficou mais distante. Então, como é que era a configuração da casa da Joelma? Era um sobrado, então embaixo tinha a sala, cozinha, banheiro e um escritório. Esse escritório era, exclusivamente, do cara.'
 'E um belo dia a Joelma entra pra limpar o escritório e ela acha uma folha de papel sulfite com sangue. — É uma dor horrível, né, gente? Sabe quando você corta o dedo no papel e sangra? Porque, geralmente, a gente corta o dedo e não chega a sangrar, né? Raramente, mas algumas vezes sangra. —'
 'Esse escritório era, exclusivamente, do cara. Então era tipo um refúgio, um santuário do princeso onde as crianças não podiam entrar, onde a Joelma também só entrava para limpar. — O bonito não limpava nem a própria sujeira e era assim e estava tudo bem pra Joelma. — Tipo, ah, as crianças ficam atormentando ele, então ele fica lá no escritório e nã nã nã. Os anos foram passando, as crianças ali com média de dez… Um dez e o outro doze anos, aí que eles não podiam entrar mesmo no escritório, o pai proibiu, né?']",0.3351999753098402,0.6666666666666666,0.14285714285714285,0.21132177085178888,0.05283044271294722
170,"No episódio 'paupel', por que o marido não queria chamar o SAMU?",O marido não queria chamar o SAMU porque estava com febre muito alta e não queria dizer o que estava acontecendo.,Ele não queria dizer ao SAMU o que estava acontecendo com ele,"['Vou chamar o SAMU”, e ele não queria deixar chamar o SAMU… E ela não dirige, ela falou: “Vou chamar o SAMU sim”, e chamou o SAMU, SAMU demorou duas horas para chegar, mas chegou… E aí ele não queria dizer… Porque ele estava com febre. — Ele estava com uma febre muito alta. — E aí ele não queria dizer pro SAMU o que era, o que era, o que era… E a Joelma ali. E aí uma hora lá o socorrista pediu pra Joelma dar licença e tal e acabou descobrindo, gente, o que esse cara tinha… E vocês não vão acreditar… [risos]'
 'Sei lá, um infarto, né? Vai infartar aqui… O que é? Vou chamar o SAMU”, e ele não queria deixar chamar o SAMU… E ela não dirige, ela falou: “Vou chamar o SAMU sim”, e chamou o SAMU, SAMU demorou duas horas para chegar, mas chegou… E aí ele não queria dizer… Porque ele estava com febre. — Ele estava com uma febre muito alta. — E aí ele não queria dizer pro SAMU o que era, o que era, o que era… E a Joelma ali.'
 'Assinante 2: Oi, Não Inviabilizers, meu nome é Renata. Eu já ouvi essa história do Paupel umas quatros vezes e eu sempre morro de rir com ela, porque eu fico imaginando porque esse cara não falou que prendeu o pau no zíper, porque esse cara não falou qualquer outra história… Mas ele teve que se humilhar contando esse lixo de pedido de casamento, [risos] ele teve que se humilhar, sabe? Mas que bom, né? Ela se livrou dele. E, assim, outra coisa também que eu fico muito curioso é saber como ele pediu a Joelma em casamento. ['
 'E aí ele muito estranho, muito estranho, assim… Agora ele já ficava menos ainda perto da Joelma, se eles transavam ali uma vez por mês, agora eles não transavam nunca. E ele estranho, estranho, estranho… Até que um dia este cara não aguentando mais de dores, — sei lá o que — ele começou a passar mal… Começou a passar mal, Joelma começou a perguntar o que ele tinha, porque pensou, né? “ Sei lá, um infarto, né? Vai infartar aqui… O que é? Vou chamar o SAMU”, e ele não queria deixar chamar o SAMU… E ela não dirige, ela falou: “Vou chamar o SAMU sim”, e chamou o SAMU, SAMU demorou duas horas para chegar, mas chegou… E aí ele não queria dizer… Porque ele estava com febre. —']",0.27295431913973256,1.0,0.21052631578947367,0.6029288747931636,0.45073221869829094
171,"No episódio 'casamentão', quem era o namorado da Karina no início da história?",O namorado da Karina no início da história era um cara que ela conheceu um ano e meio antes da pandemia.,Um homem que não compreendeu a necessidade de Karina cuidar do pai,"['Déia Freitas: Então é isso, gente, essa é a história da Karina, uma história de amor, né? Que começou com outro romance, mas agora a gente tem aí um final feliz. Seu João recuperado da Covid e Karina casada com Doutor Murilo. Então é isso, gente, um beijo e eu volto em breve.'
 'Seu João recuperado da Covid e Karina casada com Doutor Murilo. Então é isso, gente, um beijo e eu volto em breve.'
 'E aí a Karina virou para esse namorado dela e falou: “olha, o meu pai está sozinho lá na cidade dele e eu preciso estar com ele, porque ele está com Covid, eu vou para lá, vou fazer o máximo para não pegar, mas essa não é a minha prioridade assim. Entre ficar afastada, me cuidar e cuidar do meu pai, eu preciso cuidar do meu pai”.'
 'A Karina conheceu um cara antes da pandemia, — Tipo, um ano e meio antes. — e eles começaram a namorar. E o namoro ia muito bem assim, um cara muito bacana real assim… E chegamos à pandemia e esse cara convidou a Karina para morar com ele. Estava dando tudo certo… — A gente sabe que muitos casais se separaram aí na pandemia, né? Pelo excesso de convivência, enfim, várias coisas. —']",0.3761765864413975,1.0,0.38461538461538464,0.5686903870897706,0.4421725967724427
172,"No episódio 'casamentão', quem era o pai da Karina?",O pai da Karina é o seu João.,Seu João,"['A Karina ela foi criada somente pelo pai, então até mais ou menos ela ir para a faculdade, era só ela e o pai e a mãe do pai. E aí quando ela foi para a faculdade, o pai dela casou de novo e com uma mulher muito bacana assim, sabe? Então a Karina sempre se deu bem com a madrasta e sempre esteve por ali com o pai, porque, enfim, ela foi criada só por ele… E aí na pandemia, esse casal, — O pai dela e a madrasta. — foram morar com a mãe do pai dela. — Com a avó da Karina. —'
 'Então a Karina sempre se deu bem com a madrasta e sempre esteve por ali com o pai, porque, enfim, ela foi criada só por ele… E aí na pandemia, esse casal, — O pai dela e a madrasta. — foram morar com a mãe do pai dela. — Com a avó da Karina. — Para ficar todo mundo ali juntinho e passar por esse período aí todo mundo junto.'
 'Um dia a Karina recebe um telefonema do pai dela, dizendo que a madrasta não estava muito bem de saúde, que ela estava meio estranha E tal, E aí a Karina fala: “pai, corre com ela para o hospital que, provavelmente, é Covid”. — Estava bem no auge ali da pandemia. — E ele foi e, realmente, era Covid e ela ficou internada. Três dias depois, a mãe do… — Vamos chamar o pai da Karina de seu João. — A mãe do seu João começou também a passar mal, e também foi internada… E o seu João também com o Covid, ficou em casa. —'
 'E ele foi e, realmente, era Covid e ela ficou internada. Três dias depois, a mãe do… — Vamos chamar o pai da Karina de seu João. — A mãe do seu João começou também a passar mal, e também foi internada… E o seu João também com o Covid, ficou em casa. — Só que agora ele estava sozinho em casa e ele já é um senhor de idade. — E aí a Karina virou para esse namorado dela e falou: “olha, o meu pai está sozinho lá na cidade dele e eu preciso estar com ele, porque ele está com Covid, eu vou para lá, vou fazer o máximo para não pegar, mas essa não é a minha prioridade assim.']",0.45237292428467796,1.0,0.14285714285714285,0.7307937986807002,0.682698449670175
173,"No episódio 'casamentão', quem se tornou o marido da Karina no final da história?","No final da história, Karina se casou com o Doutor Murilo.",Doutor Murilo,"['Déia Freitas: Então é isso, gente, essa é a história da Karina, uma história de amor, né? Que começou com outro romance, mas agora a gente tem aí um final feliz. Seu João recuperado da Covid e Karina casada com Doutor Murilo. Então é isso, gente, um beijo e eu volto em breve.'
 'Seu João recuperado da Covid e Karina casada com Doutor Murilo. Então é isso, gente, um beijo e eu volto em breve.'
 'Assinante 2: Oi, pessoal, oi, Déia, aqui é a Gisele de São Paulo. Ai, achei uma fofura a história da Karina com o Murilo, muito comum, inclusive, né? Os advogados acabarem por conhecer também os seus clientes se envolvendo. E fico muito feliz que tenha dado certo e que ele seja um parceiro aí que respeita e entende a sua dedicação à sua família e a seu pai. E que esse seja o começo de uma vida muito longa e muito feliz juntos, viu?'
 'Que seria a madrasta da Karina. —']",0.4402678477007564,1.0,0.23076923076923078,0.5416583957503267,0.8854145989375817
174,"No episódio 'balão', quem é o personagem principal da história?",O personagem principal da história é a Cíntia.,Cíntia,"['Detalhe: Ele tinha pedido pro cara do balão filmar. Então pensa o show de horror que foi, né? Depois a Cíntia nem sabe se ele pegou a filmagem ou não… Provavelmente nem pegou, né? Então essa é a história de Cíntia, de um pedido de casamento que, no mesmo dia, virou um término… Surreal, né?'
 'Picolé de Limão é mais um quadro do canal Não Inviabilize. [ vinheta]'
 'Então vamos lá, vamos de história.'
 'A Cíntia falou que viu na cara do moço do balão que ele estava querendo dizer: “Larga esse cara”. Eu falei: “Poxa, Cíntia, seria muito legal se você se apaixonasse pelo cara do balão”. [ risos] Mas não é um filme…[risos] Que isso? Um filme? [ risos] Não rolou isso.']",0.33458232176888086,1.0,0.3333333333333333,0.41672277918895156,0.8541806947972379
175,"No episódio 'balão', o que era a surpresa do namorado de Cíntia?",A surpresa do namorado de Cíntia era um passeio de balão que ele já havia pago.,Um passeio de balão em Boituva,"['E aí ela estava toda enjoada ainda… Ela virou para o namorado e falou: “Olha, você, me desculpa, mas eu não tenho coragem de entrar no balão” e toda a surpresa do cara era em torno desse passeio de balão que ele já tinha feito pagamento… — A Cíntia até então não sabia quanto tinha custado, ela só ia saber depois. —'
 'Então, a Cíntia tinha, assim, um namoro ótimo, uma vida ótima, estava tudo ótimo… Até que um dia, o namorado de Cíntia disse que queria fazer uma surpresa pra ela. [ risos] — Aqui já… Como é que eu vou dizer? Se fosse eu, ia falar: “Olha, não, né? Eu não gosto de surpresas, não aceito surpresas. [ risos] Então, o que você tiver que fazer, você me fale pra ver se eu quero, se eu gostaria.'
 'risos] A Cíntia em choque… Ela toda enjoada e ela não mora muito longe de Boituva, então, vai lá, foi o quê? Umas três horas de carro, então eles chegaram lá tipo depois do almoço, assim. E aí ela estava toda enjoada ainda… Ela virou para o namorado e falou: “Olha, você, me desculpa, mas eu não tenho coragem de entrar no balão” e toda a surpresa do cara era em torno desse passeio de balão que ele já tinha feito pagamento… — A Cíntia até então não sabia quanto tinha custado, ela só ia saber depois. —'
 'A Cíntia tinha um namorado ótimo… Cíntia morando sozinha, namorado sempre ficava ali na casa dela, ela só com o cachorro — o Robinho. — e a mãe da Cíntia, morando, tipo, uns três quarteirões ali, no mesmo bairro. Então, a Cíntia tinha, assim, um namoro ótimo, uma vida ótima, estava tudo ótimo… Até que um dia, o namorado de Cíntia disse que queria fazer uma surpresa pra ela. [ risos] — Aqui já… Como é que eu vou dizer? Se fosse eu, ia falar: “Olha, não, né?']",0.2696765842621978,1.0,0.25,0.5248928397657509,0.6312232099414377
176,"No episódio 'balão', como terminou o relacionamento de Cíntia e seu namorado?",O relacionamento de Cíntia e seu namorado terminou após uma briga que começou quando ele tentou fazer uma surpresa de noivado com um balão e ela descobriu que ele havia pedido para filmar o momento. Ela devolveu o anel e pagou mil reais para não ter dor de cabeça.,"Com um término, após uma briga sobre o pagamento dos mil reais","['E aí falou que estava repensando e aí a Cíntia aproveitou e falou: “Olha, repensa mesmo, toma aqui seu anel, porque eu também tô repensando”. E aí eles tiveram uma briga ali e ele só ligou pra pedir os mil reais, dali dois dias, que era metade do negócio do balão. E ela falou: “Andréia, eu paguei pra não ter dor de cabeça”. E aí pagou… E de uma coisa que seria uma surpresa de noivado, virou um término. Terminaram. —'
 'A Cíntia tinha um namorado ótimo… Cíntia morando sozinha, namorado sempre ficava ali na casa dela, ela só com o cachorro — o Robinho. — e a mãe da Cíntia, morando, tipo, uns três quarteirões ali, no mesmo bairro. Então, a Cíntia tinha, assim, um namoro ótimo, uma vida ótima, estava tudo ótimo… Até que um dia, o namorado de Cíntia disse que queria fazer uma surpresa pra ela. [ risos] — Aqui já… Como é que eu vou dizer? Se fosse eu, ia falar: “Olha, não, né?'
 'Detalhe: Ele tinha pedido pro cara do balão filmar. Então pensa o show de horror que foi, né? Depois a Cíntia nem sabe se ele pegou a filmagem ou não… Provavelmente nem pegou, né? Então essa é a história de Cíntia, de um pedido de casamento que, no mesmo dia, virou um término… Surreal, né?'
 'E ela falou: “Andréia, eu paguei pra não ter dor de cabeça”. E aí pagou… E de uma coisa que seria uma surpresa de noivado, virou um término. Terminaram. — E eu achei foi ótimo… — Acho que você se livrou, Cíntia. Porque pensa: O cara que é legal com você enquanto você faz tudo que ele quer e, quando alguma coisa dá errado, ele deixa de ser legal, né?']",0.24499451263708708,1.0,0.25,0.4534273361138359,0.4466901673617923
177,"No episódio 'estava escrito?', quem era o pai do Arthur?",O pai do Arthur era o médico com quem a Soraia se separou.,O médico que casou com a Soraia,"['Porque, assim, a professora Helena ela não tinha tempo e nem grana para fazer uns passeios legais ou pra sair com o Arthur de final de semana… Então ficou combinado que a cada 15 dias ia rolar essa visitação aí, muito a contragosto dessa criatura, que seria o pai aí do Arthur. Na segunda vez, o cara foi junto com a Soraia buscar e estava lá menininho Arthur e menininho Thiago, e professora Helena meio de cara feia com a Soraia, e menininho Thiago triste, muito triste… E a Soraia até brincou com ele e falou: “Você está triste e tal?”, mas ficou por aquilo e foi embora, pegou o Arthur, Arthur se divertiu, enfim… A partir da terceira vez, este cara não quis mais buscar o filho. Ele delegou essa função para a Soraia, mas pra Soraia estava ótimo, porque ela saía do trabalho na sexta—feira final da tarde e já passava lá para pegar o Arthur, de boa… Ela estava tranquila quanto a isso e, na segunda de manhã, antes de ir trabalhar, ela deixava o Arthur na escola.'
 'E aí a Helena falou que o pai do Thiago tinha sumido no mundo, então ele não tinha pai… E quando o Arthur ia para pra casa da Soraia com aquele traste, ele ficava sozinho, ficava triste e tal, né? E aí o Arthur voltava falando dos passeios e tal…  — E aí, gente, eu sou uma pessoa muito mole, porque eu sou igual a Inês Brasil, sabe? Não mexe com criança, não mexe com criança… —'
 'Soraia se separou daquele médico que não estava nem aí para o Arthur, né? — Pai do Arthur. — E continuou pegando as crianças a cada 15 dias. Agora como amiga da Helena somente. Quando ela já estava nessa nova dinâmica há dois anos, sendo que agora a Helena também fazia alguns passeios e tal, a Helena descobriu que estava doente. —'
 'E aí ela correu lá na Helena chorando, a Helena falou: “Calma, imagina… [riso] Você não pega por causa da guarda daquele traste, mas você pode pegar os meninos aqui quando você quiser, né? Até me ajuda”. Soraia se separou daquele médico que não estava nem aí para o Arthur, né? — Pai do Arthur. — E continuou pegando as crianças a cada 15 dias.']",0.4632998816071507,1.0,0.3125,0.6704879518583067,
